Ad_ID,Campaign_Name,Clicks,Impressions,Cost,Leads,Conversions,Conversion_Rate_Original,Sale_Amount,Ad_Date,Location,Device,Keyword,Ad_Date_Parsed,Day,Month,Weekday,Week,CR_Needs_Fix,Conversion_Rate_Fixed,CTR,CPC,Cost_Per_Lead,Lead_Conversion_Rate,Conversion_Per_Impression,Leads_Per_Click,Revenue_Per_Conversion,ROI,Cost_Per_Sale,Campaign_Name_Encoded,Location_Encoded,Device_Encoded,Keyword_Encoded
A1000,data analytics course,104.0,4498.0,231.88,14.0,7.0,0.058,1892.0,2024-11-16,hyderabad,desktop,learn data analytics,2024-11-16,16,11,5,46,False,0.0673,0.023121387283236993,2.2296153846153848,16.562857142857144,0.5,0.0015562472209871053,0.1346153846153846,270.2857142857143,7.159392789373814,0.12255813953488372,0,0,0,4
A1001,data analytics course,173.0,5107.0,216.84,10.0,8.0,0.046,1679.0,20-11-2024,hyderabad,mobile,data analytics course,2024-11-20,20,11,2,47,False,0.0462,0.033875073428627375,1.2534104046242776,21.684,0.8,0.0015664773839827687,0.057803468208092484,209.875,6.743036340158643,0.12914830256104826,0,0,1,1
A1002,data analytics course,90.0,4544.0,203.66,26.0,9.0,0.047,1624.0,2024/11/16,hyderabad,desktop,data analytics online,2024-11-16,16,11,5,46,True,0.1,0.019806338028169015,2.262888888888889,7.833076923076923,0.34615384615384615,0.0019806338028169014,0.28888888888888886,180.44444444444446,6.974074437788471,0.1254064039408867,0,0,0,2
A1003,data analytics course,142.0,3185.0,237.66,17.0,6.0,0.047,1225.0,2024-11-26,hyderabad,tablet,data analytics training,2024-11-26,26,11,1,48,True,0.0423,0.0445839874411303,1.673661971830986,13.98,0.35294117647058826,0.0018838304552590266,0.11971830985915492,204.16666666666666,4.154422283935033,0.19400816326530612,0,0,2,3
A1004,data analytics course,156.0,3361.0,195.9,30.0,8.0,0.047,1091.0,2024-11-22,hyderabad,desktop,online data analytic,2024-11-22,22,11,4,47,True,0.0513,0.046414757512645045,1.2557692307692307,6.53,0.26666666666666666,0.0023802439750074383,0.19230769230769232,136.375,4.569167942827973,0.17956003666361137,0,0,0,5
A1005,data analytics course,195.0,3776.0,243.57,10.0,8.0,0.047,1315.0,16-11-2024,hyderabad,mobile,data analytics training,2024-11-16,16,11,5,46,True,0.041,0.051641949152542374,1.249076923076923,24.357,0.8,0.00211864406779661,0.05128205128205128,164.375,4.3988586443322255,0.18522433460076046,0,0,1,3
A1006,data analytics course,116.0,4480.0,237.79,17.0,5.0,0.043,1640.0,06-11-2024,hyderabad,tablet,data analytics course,2024-06-11,11,6,1,24,False,0.0431,0.025892857142857145,2.0499137931034483,13.987647058823528,0.29411764705882354,0.0011160714285714285,0.14655172413793102,328.0,5.896841751124943,0.14499390243902438,0,0,2,1
A1007,data analytics course,184.0,5060.0,229.61,23.0,3.0,0.016,1509.0,2024/11/24,hyderabad,tablet,analytics for data,2024-11-24,24,11,6,47,False,0.0163,0.03636363636363636,1.2478804347826087,9.98304347826087,0.13043478260869565,0.0005928853754940712,0.125,503.0,5.57201341404991,0.15216037110669317,0,0,2,0
A1008,data analytics course,113.0,5434.0,214.965,27.0,4.0,0.058,1362.0,2024/11/24,hyderabad,tablet,data analytics training,2024-11-24,24,11,6,47,True,0.0354,0.020794994479205006,1.902345132743363,7.961666666666667,0.14814814814814814,0.000736105999263894,0.23893805309734514,340.5,5.335915148977741,0.15783039647577093,0,0,2,3
A1009,data analytics course,166.0,3355.0,186.78,24.0,9.0,0.054,1029.0,2024/11/12,hyderabad,mobile,online data analytic,2024-11-12,12,11,1,46,False,0.0542,0.04947839046199702,1.1251807228915662,7.7825,0.375,0.002682563338301043,0.14457831325301204,114.33333333333333,4.509155155798266,0.18151603498542274,0,0,1,5
A1010,data analytics course,101.0,5399.0,236.79,20.0,6.0,0.059,1900.0,14-11-2024,hyderabad,desktop,learn data analytics,2024-11-14,14,11,3,46,False,0.0594,0.018707167994072977,2.3444554455445545,11.8395,0.3,0.0011113169105389886,0.19801980198019803,316.6666666666667,7.023987499472106,0.12462631578947368,0,0,0,4
A1011,data analytics course,101.0,3613.0,208.12,24.0,5.0,0.05,1130.0,2024/11/22,hyderabad,desktop,online data analytic,2024-11-22,22,11,4,47,False,0.0495,0.027954608358704676,2.0605940594059406,8.671666666666667,0.20833333333333334,0.0013838915029061722,0.2376237623762376,226.0,4.4295598693061695,0.18417699115044248,0,0,0,5
A1012,data analytics course,125.0,3259.0,191.3,18.0,3.0,0.024,1959.0,2024/11/27,hyderabad,desktop,data analytics online,2024-11-27,27,11,2,48,False,0.024,0.03835532371893219,1.5304,10.627777777777778,0.16666666666666666,0.0009205277692543725,0.144,653.0,9.240460010454782,0.09765186319550792,0,0,0,2
A1013,data analytics course,196.0,3742.0,207.46,10.0,7.0,0.038,1623.0,12-11-2024,hyderabad,mobile,data analytics training,2024-12-11,11,12,2,50,False,0.0357,0.052378407268840195,1.0584693877551021,20.746000000000002,0.7,0.0018706574024585784,0.05102040816326531,231.85714285714286,6.8231948327388405,0.12782501540357363,0,0,1,3
A1014,data analytics course,181.0,4311.0,185.09,11.0,9.0,0.05,1538.0,2024-11-04,hyderabad,desktop,data analytics training,2024-11-04,4,11,0,45,False,0.0497,0.041985618186035724,1.022596685082873,16.826363636363638,0.8181818181818182,0.0020876826722338203,0.06077348066298342,170.88888888888889,7.309471068129018,0.12034460338101431,0,0,0,3
A1015,data analytics course,102.0,5461.0,201.69,22.0,8.0,0.078,1755.0,2024-11-29,hyderabad,desktop,data analytics course,2024-11-29,29,11,4,48,False,0.0784,0.01867789782091192,1.9773529411764705,9.167727272727273,0.36363636363636365,0.0014649331624244644,0.21568627450980393,219.375,7.7014725568942435,0.11492307692307692,0,0,0,1
A1016,data analytics course,193.0,5159.0,214.965,15.0,9.0,0.047,1614.0,2024-11-10,hyderabad,mobile,learn data analytics,2024-11-10,10,11,6,45,False,0.0466,0.03741035084318666,1.1138082901554405,14.331,0.6,0.001744524132583834,0.07772020725388601,179.33333333333334,6.508199009141023,0.13318773234200743,0,0,1,4
A1017,data analytics course,149.0,4431.0,207.4,19.0,9.0,0.06,1693.0,12-11-2024,hyderabad,mobile,learn data analytics,2024-12-11,11,12,2,50,False,0.0604,0.0336267208305123,1.3919463087248323,10.91578947368421,0.47368421052631576,0.002031144211238998,0.12751677852348994,188.11111111111111,7.162970106075217,0.12250443000590668,0,0,1,4
A1018,data analytics course,150.0,3113.0,217.41,20.0,5.0,0.047,1785.0,2024/11/07,hyderabad,mobile,analytics for data,2024-11-07,7,11,3,45,True,0.0333,0.04818503051718599,1.4494,10.8705,0.25,0.0016061676839061998,0.13333333333333333,357.0,7.210293914723334,0.1217983193277311,0,0,1,0
A1019,data analytics course,145.0,5278.0,214.965,25.0,6.0,0.041,1516.0,2024-11-05,hyderabad,desktop,data analytics course,2024-11-05,5,11,1,45,False,0.0414,0.027472527472527472,1.4825172413793104,8.5986,0.24,0.0011367942402425162,0.1724137931034483,252.66666666666666,6.052310841299747,0.14179749340369394,0,0,0,1
A1020,data analytics course,184.0,4143.0,223.3,10.0,10.0,0.044,1735.0,2024/11/21,hyderabad,tablet,learn data analytics,2024-11-21,21,11,3,47,True,0.0543,0.044412261646150135,1.2135869565217392,22.330000000000002,1.0,0.0024137098720733766,0.05434782608695652,173.5,6.769816390506046,0.12870317002881845,0,0,2,4
A1021,data analytics course,171.0,4154.0,184.23,30.0,7.0,0.041,1803.0,2024/11/08,hyderabad,tablet,data analytics online,2024-11-08,8,11,4,45,False,0.0409,0.041165142031776604,1.0773684210526315,6.141,0.23333333333333334,0.001685122773230621,0.17543859649122806,257.57142857142856,8.786679693860934,0.10217970049916805,0,0,2,2
A1022,data analytics course,122.0,5187.0,211.24,27.0,6.0,0.049,1322.0,2024-11-20,hyderabad,desktop,online data analytic,2024-11-20,20,11,2,47,False,0.0492,0.023520339309812992,1.7314754098360656,7.823703703703704,0.2222222222222222,0.001156737998843262,0.22131147540983606,220.33333333333334,5.258284415830335,0.15978819969742813,0,0,0,5
A1023,data analytics course,188.0,5798.0,230.17,28.0,5.0,0.047,1452.0,30-11-2024,hyderabad,tablet,data analytics course,2024-11-30,30,11,5,48,True,0.0266,0.032424974129010006,1.2243085106382978,8.220357142857143,0.17857142857142858,0.0008623663332183512,0.14893617021276595,290.4,5.308380762045445,0.15851928374655647,0,0,2,1
A1024,data analytics course,87.0,3718.0,214.965,12.0,3.0,0.034,1652.0,20-11-2024,hyderabad,tablet,learn data analytics,2024-11-20,20,11,2,47,False,0.0345,0.023399677245831092,2.470862068965517,17.91375,0.25,0.0008068854222700376,0.13793103448275862,550.6666666666666,6.684971972181518,0.13012409200968522,0,0,2,4
A1025,data analytics course,88.0,3349.0,181.92,22.0,8.0,0.091,1456.0,2024-11-20,hyderabad,tablet,learn data analytics,2024-11-20,20,11,2,47,False,0.0909,0.026276500447894893,2.067272727272727,8.269090909090908,0.36363636363636365,0.002388772767990445,0.25,182.0,7.003518029903255,0.12494505494505494,0,0,2,4
A1026,data analytics course,119.0,5323.0,205.92,17.0,10.0,0.06,1656.0,2024-11-02,hyderabad,desktop,online data analytic,2024-11-02,2,11,5,44,True,0.084,0.022355814390381364,1.7304201680672269,12.112941176470587,0.5882352941176471,0.0018786398647379298,0.14285714285714285,165.6,7.041958041958042,0.12434782608695652,0,0,0,5
A1027,data analytics course,139.0,5286.0,234.89,22.0,10.0,0.047,1688.0,2024-11-21,hyderabad,desktop,data analytics training,2024-11-21,21,11,3,47,True,0.04665,0.026295875898600076,1.6898561151079137,10.67681818181818,0.45454545454545453,0.0018917896329928112,0.15827338129496402,168.8,6.18634254331815,0.13915284360189573,0,0,0,3
A1028,data analytics course,128.0,5469.0,188.49,16.0,3.0,0.047,1783.0,2024-11-23,hyderabad,mobile,learn data analytics,2024-11-23,23,11,5,47,True,0.0234,0.02340464435911501,1.472578125,11.780625,0.1875,0.0005485463521667581,0.125,594.3333333333334,8.459387765929227,0.10571508693213685,0,0,1,4
A1029,data analytics course,86.0,3351.0,237.75,21.0,9.0,0.105,1975.0,2024/11/13,hyderabad,mobile,analytics for data,2024-11-13,13,11,2,46,False,0.1047,0.025663980901223515,2.76453488372093,11.321428571428571,0.42857142857142855,0.0026857654431512983,0.2441860465116279,219.44444444444446,7.307045215562566,0.12037974683544304,0,0,1,0
A1030,data analytics course,188.0,4834.0,213.58,15.0,4.0,0.021,1590.0,2024-11-08,hyderabad,tablet,online data analytic,2024-11-08,8,11,4,45,False,0.0213,0.03889118742242449,1.136063829787234,14.238666666666667,0.26666666666666666,0.0008274720728175424,0.0797872340425532,397.5,6.444517276898586,0.13432704402515724,0,0,2,5
A1031,data analytics course,113.0,5065.0,212.37,11.0,5.0,0.047,1111.0,22-11-2024,hyderabad,desktop,online data analytic,2024-11-22,22,11,4,47,True,0.0442,0.022309970384995065,1.8793805309734513,19.30636363636364,0.45454545454545453,0.0009871668311944718,0.09734513274336283,222.2,4.231435701841126,0.19115211521152115,0,0,0,5
A1032,data analytics course,139.0,3872.0,244.38,20.0,4.0,0.047,1041.0,12-11-2024,hyderabad,tablet,data analytics online,2024-12-11,11,12,2,50,True,0.04665,0.03589876033057851,1.7581294964028777,12.219,0.2,0.0010330578512396695,0.14388489208633093,260.25,3.2597593911122025,0.2347550432276657,0,0,2,2
A1033,data analytics course,176.0,5509.0,234.59,19.0,7.0,0.054,1710.0,2024/11/03,hyderabad,tablet,data analytics course,2024-11-03,3,11,6,44,True,0.0398,0.03194772190960247,1.3328977272727274,12.346842105263159,0.3684210526315789,0.0012706480304955528,0.10795454545454546,244.28571428571428,6.289313269960356,0.13718713450292397,0,0,2,1
A1034,data analytics course,121.0,5610.0,214.96,23.0,8.0,0.047,1507.0,2024-11-25,hyderabad,mobile,data analytics course,2024-11-25,25,11,0,48,True,0.0661,0.021568627450980392,1.7765289256198349,9.34608695652174,0.34782608695652173,0.00142602495543672,0.19008264462809918,188.375,6.010606624488276,0.1426410086264101,0,0,1,1
A1035,data analytics course,104.0,5275.0,236.48,16.0,9.0,0.031,1824.0,01-11-2024,hyderabad,desktop,data analytics training,2024-01-11,11,1,3,2,True,0.0865,0.019715639810426542,2.273846153846154,14.78,0.5625,0.0017061611374407583,0.15384615384615385,202.66666666666666,6.713125845737483,0.12964912280701754,0,0,0,3
A1036,data analytics course,146.0,5939.0,242.9,11.0,8.0,0.035,1833.0,2024-11-07,hyderabad,desktop,data analytics training,2024-11-07,7,11,3,45,True,0.0548,0.02458326317561879,1.6636986301369863,22.081818181818182,0.7272727272727273,0.0013470281192119885,0.07534246575342465,229.125,6.5463153561136265,0.1325150027277687,0,0,0,3
A1037,data analytics course,123.0,5131.0,214.965,19.0,5.0,0.041,1307.0,09-11-2024,hyderabad,mobile,learn data analytics,2024-09-11,11,9,2,37,False,0.0407,0.02397193529526408,1.7476829268292684,11.313947368421053,0.2631578947368421,0.0009744689144416293,0.15447154471544716,261.4,5.080059544577025,0.16447207345065035,0,0,1,4
A1038,data analytics course,90.0,5786.0,197.55,11.0,6.0,0.043,1704.0,16-11-2024,hyderabad,mobile,online data analytic,2024-11-16,16,11,5,46,True,0.0667,0.015554787417905289,2.1950000000000003,17.95909090909091,0.5454545454545454,0.0010369858278603526,0.12222222222222222,284.0,7.625664388762338,0.11593309859154931,0,0,1,5
A1039,data analytics course,171.0,4304.0,192.61,17.0,10.0,0.058,1427.0,2024-11-26,hyderabad,mobile,learn data analytics,2024-11-26,26,11,1,48,False,0.0585,0.03973048327137547,1.126374269005848,11.33,0.5882352941176471,0.0023234200743494425,0.09941520467836257,142.7,6.408753439592958,0.13497547302032237,0,0,1,4
A1040,data analytics course,94.0,5549.0,231.23,25.0,9.0,0.096,1849.0,2024/11/12,hyderabad,mobile,data analytics training,2024-11-12,12,11,1,46,False,0.0957,0.016939989187240944,2.4598936170212764,9.2492,0.36,0.0016219138583528565,0.26595744680851063,205.44444444444446,6.996367253384077,0.12505678745267712,0,0,1,3
A1041,data analytics course,112.0,4271.0,196.07,27.0,6.0,0.047,1209.0,2024-11-14,hyderabad,desktop,data analytics online,2024-11-14,14,11,3,46,True,0.0536,0.026223366892999297,1.7506249999999999,7.261851851851851,0.2222222222222222,0.0014048232264106766,0.24107142857142858,201.5,5.16616514510124,0.16217535153019022,0,0,0,2
A1042,data analytics course,113.0,4418.0,191.55,27.0,10.0,0.047,1634.0,2024/11/09,hyderabad,mobile,data analytics course,2024-11-09,9,11,5,45,True,0.0885,0.02557718424626528,1.695132743362832,7.094444444444445,0.37037037037037035,0.0022634676324128564,0.23893805309734514,163.4,7.530409814669799,0.11722766217870258,0,0,1,1
A1043,data analytics course,145.0,3721.0,180.95,21.0,7.0,0.048,1960.0,29-11-2024,hyderabad,desktop,data analytics online,2024-11-29,29,11,4,48,False,0.0483,0.038968019349637194,1.2479310344827585,8.616666666666665,0.3333333333333333,0.0018812147272238647,0.14482758620689656,280.0,9.831721470019342,0.09232142857142857,0,0,0,2
A1044,data analytics course,197.0,5783.0,204.46,23.0,6.0,0.047,1729.0,01-11-2024,hyderabad,tablet,data analytics training,2024-01-11,11,1,3,2,True,0.0305,0.03406536399792495,1.0378680203045685,8.889565217391304,0.2608695652173913,0.0010375237765865469,0.116751269035533,288.1666666666667,7.456421793993934,0.11825332562174667,0,0,2,3
A1045,data analytics course,109.0,4866.0,236.78,27.0,5.0,0.047,1585.0,15-11-2024,hyderabad,mobile,online data analytic,2024-11-15,15,11,4,46,True,0.0459,0.02240032881216605,2.1722935779816512,8.76962962962963,0.18518518518518517,0.0010275380189066995,0.24770642201834864,317.0,5.693977531886139,0.14938801261829654,0,0,1,5
A1046,data analytics course,188.0,5857.0,222.98,20.0,4.0,0.048,1303.0,11-11-2024,hyderabad,desktop,data analytics training,2024-11-11,11,11,0,46,True,0.0213,0.032098343862045416,1.186063829787234,11.149,0.2,0.0006829434864264982,0.10638297872340426,325.75,4.843573414656023,0.171128165771297,0,0,0,3
A1047,data analytics course,142.0,5103.0,234.1,24.0,3.0,0.021,1835.0,2024-11-08,hyderabad,mobile,analytics for data,2024-11-08,8,11,4,45,False,0.0211,0.02782676856750931,1.6485915492957746,9.754166666666666,0.125,0.0005878894767783657,0.16901408450704225,611.6666666666666,6.838530542503205,0.127574931880109,0,0,1,0
A1048,data analytics course,168.0,4653.0,240.84,27.0,9.0,0.054,1367.0,2024-11-24,hyderabad,mobile,online data analytic,2024-11-24,24,11,6,47,False,0.0536,0.036105738233397806,1.4335714285714285,8.92,0.3333333333333333,0.0019342359767891683,0.16071428571428573,151.88888888888889,4.675967447267896,0.17618141916605706,0,0,1,5
A1049,data analytics course,110.0,3524.0,248.86,19.0,10.0,0.091,1524.0,21-11-2024,hyderabad,mobile,learn data analytics,2024-11-21,21,11,3,47,False,0.0909,0.031214528944381384,2.2623636363636366,13.097894736842106,0.5263157894736842,0.0028376844494892167,0.17272727272727273,152.4,5.123925098448926,0.1632939632545932,0,0,1,4
A1050,data analytics course,192.0,5938.0,182.84,26.0,5.0,0.039,1080.0,2024/11/12,hyderabad,mobile,analytics for data,2024-11-12,12,11,1,46,True,0.026,0.03233411923206467,0.9522916666666666,7.032307692307692,0.19230769230769232,0.000842034355001684,0.13541666666666666,216.0,4.906803762852767,0.1692962962962963,0,0,1,0
A1051,data analytics course,101.0,3942.0,206.62,16.0,5.0,0.05,1746.0,2024-11-24,hyderabad,tablet,analytics for data,2024-11-24,24,11,6,47,False,0.0495,0.025621511922881784,2.045742574257426,12.91375,0.3125,0.0012683916793505834,0.15841584158415842,349.2,7.4502952279547,0.11833906071019473,0,0,2,0
A1052,data analytics course,157.0,3315.0,189.56,15.0,10.0,0.064,1026.0,2024-11-25,hyderabad,mobile,online data analytic,2024-11-25,25,11,0,48,False,0.0637,0.0473604826546003,1.2073885350318472,12.637333333333334,0.6666666666666666,0.0030165912518853697,0.09554140127388536,102.6,4.412534289934586,0.18475633528265106,0,0,1,5
A1053,data analytics course,113.0,4945.0,187.66,15.0,10.0,0.047,1564.0,2024/11/26,hyderabad,tablet,learn data analytics,2024-11-26,26,11,1,48,True,0.0885,0.022851365015166835,1.66070796460177,12.510666666666667,0.6666666666666666,0.0020222446916076846,0.13274336283185842,156.4,7.334221464350421,0.11998721227621482,0,0,2,4
A1054,data analytics course,96.0,3166.0,196.15,29.0,7.0,0.073,1902.0,26-11-2024,hyderabad,desktop,learn data analytics,2024-11-26,26,11,1,48,False,0.0729,0.030322173089071383,2.043229166666667,6.763793103448276,0.2413793103448276,0.0022109917877447885,0.3020833333333333,271.7142857142857,8.696660718837624,0.10312828601472135,0,0,0,4
A1055,data analytics course,125.0,4223.0,183.68,15.0,6.0,0.047,1267.0,2024-11-05,hyderabad,desktop,data analytics online,2024-11-05,5,11,1,45,True,0.048,0.029599810561212407,1.46944,12.245333333333333,0.4,0.0014207909069381957,0.12,211.16666666666666,5.897865853658536,0.14497237569060775,0,0,0,2
A1056,data analytics course,104.0,4798.0,210.1,18.0,3.0,0.047,1340.0,21-11-2024,hyderabad,desktop,analytics for data,2024-11-21,21,11,3,47,True,0.0288,0.021675698207586493,2.020192307692308,11.672222222222222,0.16666666666666666,0.0006252605252188412,0.17307692307692307,446.6666666666667,5.377915278438839,0.1567910447761194,0,0,0,0
A1057,data analytics course,194.0,5655.0,208.58,13.0,6.0,0.031,1692.0,2024-11-16,hyderabad,mobile,data analytics training,2024-11-16,16,11,5,46,False,0.0309,0.03430592396109638,1.0751546391752578,16.044615384615387,0.46153846153846156,0.0010610079575596816,0.06701030927835051,282.0,7.111995397449419,0.123274231678487,0,0,1,3
A1058,data analytics course,144.0,5140.0,219.48,19.0,8.0,0.047,1054.0,18-11-2024,hyderabad,desktop,data analytics online,2024-11-18,18,11,0,47,False,0.0556,0.02801556420233463,1.5241666666666667,11.551578947368421,0.42105263157894735,0.0015564202334630351,0.13194444444444445,131.75,3.8022598870056497,0.20823529411764705,0,0,0,2
A1059,data analytics course,179.0,3025.0,238.81,17.0,3.0,0.017,1507.0,2024-11-11,hyderabad,mobile,data analytics online,2024-11-11,11,11,0,46,False,0.0168,0.059173553719008266,1.3341340782122906,14.047647058823529,0.17647058823529413,0.0009917355371900827,0.09497206703910614,502.3333333333333,5.310456011054813,0.15846715328467154,0,0,1,2
A1060,data analytics course,166.0,5223.0,189.76,18.0,7.0,0.042,1219.0,16-11-2024,hyderabad,tablet,data analytics course,2024-11-16,16,11,5,46,False,0.0422,0.031782500478652116,1.1431325301204818,10.542222222222222,0.3888888888888889,0.0013402259237985832,0.10843373493975904,174.14285714285714,5.423903878583475,0.15566858080393764,0,0,2,1
A1061,data analytics course,166.0,5089.0,214.965,26.0,7.0,0.042,1946.0,11-11-2024,hyderabad,tablet,analytics for data,2024-11-11,11,11,0,46,False,0.0422,0.03261937512281391,1.2949698795180724,8.267884615384615,0.2692307692307692,0.001375515818431912,0.1566265060240964,278.0,8.052636475705347,0.11046505652620761,0,0,2,0
A1062,data analytics course,118.0,5016.0,204.31,19.0,9.0,0.045,1833.0,2024/11/08,hyderabad,desktop,analytics for data,2024-11-08,8,11,4,45,True,0.0763,0.023524720893141945,1.7314406779661018,10.753157894736843,0.47368421052631576,0.0017942583732057417,0.16101694915254236,203.66666666666666,7.971660711663649,0.1114620840152755,0,0,0,0
A1063,data analytics course,185.0,3617.0,222.32,24.0,7.0,0.038,1963.0,23-11-2024,hyderabad,mobile,data analytics course,2024-11-23,23,11,5,47,False,0.0378,0.05114735969035112,1.2017297297297298,9.263333333333334,0.2916666666666667,0.0019353055017970694,0.12972972972972974,280.42857142857144,7.829614969413458,0.11325522159959246,0,0,1,1
A1064,data analytics course,116.0,3764.0,232.03,28.0,10.0,0.086,1348.0,2024/11/20,hyderabad,tablet,data analytics course,2024-11-20,20,11,2,47,False,0.0862,0.030818278427205102,2.0002586206896553,8.286785714285715,0.35714285714285715,0.002656748140276302,0.2413793103448276,134.8,4.809593587036159,0.17212908011869435,0,0,2,1
A1065,data analytics course,99.0,4489.0,183.73,15.0,6.0,0.061,1264.0,2024-11-05,hyderabad,desktop,online data analytic,2024-11-05,5,11,1,45,False,0.0606,0.022053909556694142,1.8558585858585857,12.248666666666667,0.4,0.0013366005791935842,0.15151515151515152,210.66666666666666,5.879660371196866,0.14535601265822784,0,0,0,5
A1066,data analytics course,172.0,4441.0,221.18,14.0,8.0,0.047,1771.0,27-11-2024,hyderabad,mobile,analytics for data,2024-11-27,27,11,2,48,False,0.0465,0.038730015762215714,1.2859302325581397,15.79857142857143,0.5714285714285714,0.0018013960819635217,0.08139534883720931,221.375,7.007053078940229,0.12488989271597968,0,0,1,0
A1067,data analytics course,138.0,5751.0,199.11,26.0,9.0,0.052,1337.0,2024-11-10,hyderabad,desktop,data analytics online,2024-11-10,10,11,6,45,True,0.0652,0.023995826812728223,1.442826086956522,7.658076923076924,0.34615384615384615,0.001564945226917058,0.18840579710144928,148.55555555555554,5.714881221435387,0.14892296185489903,0,0,0,2
A1068,data analytics course,84.0,4036.0,234.22,23.0,10.0,0.119,1287.0,04-11-2024,hyderabad,desktop,learn data analytics,2024-04-11,11,4,3,15,False,0.119,0.02081268582755203,2.788333333333333,10.183478260869565,0.43478260869565216,0.002477700693756194,0.27380952380952384,128.7,4.494833916830331,0.18198912198912198,0,0,0,4
A1069,data analytics course,124.0,4942.0,240.59,18.0,3.0,0.024,1922.0,2024-11-16,hyderabad,desktop,learn data analytics,2024-11-16,16,11,5,46,False,0.0242,0.02509105625252934,1.940241935483871,13.366111111111111,0.16666666666666666,0.0006070416835289356,0.14516129032258066,640.6666666666666,6.988694459453843,0.12517689906347554,0,0,0,4
A1070,data analytics course,122.0,4989.0,215.48,12.0,5.0,0.041,1975.0,2024/11/06,hyderabad,mobile,data analytics online,2024-11-06,6,11,2,45,False,0.041,0.024453798356384046,1.7662295081967212,17.956666666666667,0.4166666666666667,0.0010022048506714773,0.09836065573770492,395.0,8.165583812882867,0.10910379746835443,0,0,1,2
A1071,data analytics course,180.0,3006.0,228.14,22.0,7.0,0.039,1556.0,2024-11-04,hyderabad,tablet,learn data analytics,2024-11-04,4,11,0,45,False,0.0389,0.059880239520958084,1.2674444444444444,10.37,0.3181818181818182,0.002328675981370592,0.12222222222222222,222.28571428571428,5.820373454896117,0.14661953727506427,0,0,2,4
A1072,data analytics course,133.0,3728.0,199.13,11.0,10.0,0.047,1507.0,2024-11-09,hyderabad,desktop,data analytics online,2024-11-09,9,11,5,45,True,0.0752,0.03567596566523605,1.497218045112782,18.10272727272727,0.9090909090909091,0.002682403433476395,0.08270676691729323,150.7,6.56792045397479,0.13213669542136694,0,0,0,2
A1073,data analytics course,164.0,3734.0,225.39,27.0,8.0,0.04,1728.0,12-11-2024,hyderabad,tablet,learn data analytics,2024-12-11,11,12,2,50,False,0.0488,0.04392072844134976,1.3743292682926829,8.347777777777777,0.2962962962962963,0.0021424745581146223,0.16463414634146342,216.0,6.666711034207375,0.13043402777777777,0,0,2,4
A1074,data analytics course,150.0,4621.0,246.3,15.0,6.0,0.049,1554.0,2024-11-09,hyderabad,desktop,data analytics online,2024-11-09,9,11,5,45,False,0.04,0.032460506383899586,1.6420000000000001,16.42,0.4,0.0012984202553559835,0.1,259.0,5.309378806333739,0.1584942084942085,0,0,0,2
A1075,data analytics course,97.0,3212.0,212.55,27.0,10.0,0.103,1994.0,23-11-2024,hyderabad,desktop,analytics for data,2024-11-23,23,11,5,47,False,0.1031,0.030199252801992527,2.191237113402062,7.872222222222223,0.37037037037037035,0.00311332503113325,0.27835051546391754,199.4,8.381322041872501,0.10659478435305918,0,0,0,0
A1076,data analytics course,128.0,4225.0,228.24,30.0,4.0,0.031,1618.0,2024/11/08,hyderabad,mobile,learn data analytics,2024-11-08,8,11,4,45,False,0.0312,0.03029585798816568,1.783125,7.6080000000000005,0.13333333333333333,0.0009467455621301775,0.234375,404.5,6.089029092183666,0.14106304079110013,0,0,1,4
A1077,data analytics course,99.0,4779.0,233.78,26.0,10.0,0.101,1086.0,2024-11-05,hyderabad,desktop,online data analytic,2024-11-05,5,11,1,45,False,0.101,0.02071563088512241,2.3614141414141416,8.991538461538461,0.38461538461538464,0.002092487968194183,0.26262626262626265,108.6,3.6453931046282833,0.2152670349907919,0,0,0,5
A1078,data analytics course,86.0,5352.0,234.05,11.0,5.0,0.058,1364.0,2024-11-09,hyderabad,tablet,online data analytic,2024-11-09,9,11,5,45,False,0.0581,0.016068759342301942,2.721511627906977,21.277272727272727,0.45454545454545453,0.0009342301943198804,0.12790697674418605,272.8,4.827814569536423,0.1715909090909091,0,0,2,5
A1079,data analytics course,118.0,5405.0,187.28,25.0,7.0,0.058,1836.0,2024-11-05,hyderabad,tablet,analytics for data,2024-11-05,5,11,1,45,False,0.0593,0.02183163737280296,1.5871186440677967,7.4912,0.28,0.0012950971322849213,0.211864406779661,262.2857142857143,8.8035027765912,0.10200435729847494,0,0,2,0
A1080,data analytics course,127.0,5430.0,199.13,14.0,6.0,0.047,1932.0,2024/11/25,hyderabad,mobile,analytics for data,2024-11-25,25,11,0,48,False,0.0472,0.023388581952117862,1.5679527559055118,14.223571428571429,0.42857142857142855,0.0011049723756906078,0.11023622047244094,322.0,8.702204589966353,0.10306935817805382,0,0,1,0
A1081,data analytics course,83.0,4808.0,241.35,20.0,7.0,0.084,1038.0,30-11-2024,hyderabad,mobile,learn data analytics,2024-11-30,30,11,5,48,False,0.0843,0.017262895174708817,2.907831325301205,12.067499999999999,0.35,0.0014559068219633944,0.24096385542168675,148.28571428571428,3.300807955251709,0.23251445086705202,0,0,1,4
A1082,data analytics course,149.0,3587.0,217.53,23.0,8.0,0.047,1507.0,17-11-2024,hyderabad,mobile,data analytics online,2024-11-17,17,11,6,46,True,0.0537,0.04153889043769166,1.4599328859060403,9.457826086956521,0.34782608695652173,0.002230275996654586,0.15436241610738255,188.375,5.927780076311313,0.14434638354346382,0,0,1,2
A1083,data analytics course,168.0,4683.0,215.28,30.0,8.0,0.048,1327.0,2024/11/28,hyderabad,mobile,data analytics online,2024-11-28,28,11,3,48,False,0.0476,0.03587443946188341,1.2814285714285714,7.176,0.26666666666666666,0.001708306641042067,0.17857142857142858,165.875,5.164065403195838,0.1622305953278071,0,0,1,2
A1084,data analytics course,112.0,5814.0,227.38,11.0,8.0,0.071,1467.0,2024-11-03,hyderabad,tablet,analytics for data,2024-11-03,3,11,6,44,False,0.0714,0.019263845889232887,2.0301785714285714,20.670909090909092,0.7272727272727273,0.0013759889920880633,0.09821428571428571,183.375,5.451754771747734,0.15499659168370825,0,0,2,0
A1085,data analytics course,123.0,3292.0,233.2,28.0,6.0,0.049,1174.0,2024-11-19,hyderabad,desktop,data analytics training,2024-11-19,19,11,1,47,False,0.0488,0.037363304981773995,1.8959349593495933,8.328571428571427,0.21428571428571427,0.0018226002430133657,0.22764227642276422,195.66666666666666,4.034305317324185,0.19863713798977853,0,0,0,3
A1086,data analytics course,174.0,4305.0,206.02,20.0,3.0,0.034,1057.0,2024/11/23,hyderabad,desktop,learn data analytics,2024-11-23,23,11,5,47,True,0.0172,0.04041811846689895,1.1840229885057472,10.301,0.15,0.0006968641114982578,0.11494252873563218,352.3333333333333,4.130569847587613,0.1949101229895932,0,0,0,4
A1087,data analytics course,143.0,4368.0,214.965,27.0,7.0,0.049,1199.0,03-11-2024,hyderabad,tablet,analytics for data,2024-03-11,11,3,0,11,False,0.049,0.03273809523809524,1.5032517482517482,7.961666666666667,0.25925925925925924,0.0016025641025641025,0.1888111888111888,171.28571428571428,4.577652175935617,0.17928690575479567,0,0,2,0
A1088,data analytics course,195.0,5935.0,209.68,23.0,9.0,0.046,1966.0,2024-11-07,hyderabad,tablet,online data analytic,2024-11-07,7,11,3,45,False,0.0462,0.03285593934288121,1.0752820512820513,9.116521739130436,0.391304347826087,0.0015164279696714407,0.11794871794871795,218.44444444444446,8.376192293017931,0.1066531027466938,0,0,2,5
A1089,data analytics course,176.0,5847.0,241.04,13.0,6.0,0.034,1194.0,2024-11-02,hyderabad,desktop,online data analytic,2024-11-02,2,11,5,44,False,0.0341,0.030100906447750982,1.3695454545454544,18.54153846153846,0.46153846153846156,0.001026167265264238,0.07386363636363637,199.0,3.9535346830401594,0.20187604690117253,0,0,0,5
A1090,data analytics course,141.0,4851.0,227.39,28.0,5.0,0.047,1821.0,2024/11/15,hyderabad,desktop,analytics for data,2024-11-15,15,11,4,46,True,0.0355,0.02906617192331478,1.6126950354609928,8.121071428571428,0.17857142857142858,0.0010307153164296021,0.19858156028368795,364.2,7.008267733849335,0.12487095002745743,0,0,0,0
A1091,data analytics course,108.0,4710.0,204.16,19.0,10.0,0.093,1731.0,2024/11/20,hyderabad,tablet,data analytics online,2024-11-20,20,11,2,47,False,0.0926,0.022929936305732482,1.8903703703703703,10.745263157894737,0.5263157894736842,0.0021231422505307855,0.17592592592592593,173.1,7.478644200626959,0.11794338532640092,0,0,2,2
A1092,data analytics course,112.0,3345.0,214.965,11.0,6.0,0.047,1859.0,2024-11-23,hyderabad,tablet,analytics for data,2024-11-23,23,11,5,47,False,0.0536,0.03348281016442452,1.9193303571428573,19.542272727272728,0.5454545454545454,0.0017937219730941704,0.09821428571428571,309.8333333333333,7.647919428744214,0.1156347498655191,0,0,2,0
A1093,data analytics course,139.0,5903.0,184.41,23.0,9.0,0.047,1188.0,20-11-2024,hyderabad,tablet,online data analytic,2024-11-20,20,11,2,47,True,0.04665,0.023547348805692023,1.3266906474820144,8.017826086956521,0.391304347826087,0.0015246484838217856,0.16546762589928057,132.0,5.442166910688141,0.1552272727272727,0,0,2,5
A1094,data analytics course,145.0,5004.0,216.45,22.0,5.0,0.034,1496.0,2024-11-01,hyderabad,tablet,data analytics online,2024-11-01,1,11,4,44,False,0.0345,0.02897681854516387,1.492758620689655,9.838636363636363,0.22727272727272727,0.0009992006394884093,0.15172413793103448,299.2,5.911526911526912,0.14468582887700535,0,0,2,2
A1095,data analytics course,183.0,3947.0,197.3,15.0,8.0,0.044,1645.0,2024-11-14,hyderabad,desktop,data analytics training,2024-11-14,14,11,3,46,False,0.0437,0.04636432733721814,1.0781420765027323,13.153333333333334,0.5333333333333333,0.0020268558398783888,0.08196721311475409,205.625,7.3375570197668525,0.11993920972644377,0,0,0,3
A1096,data analytics course,113.0,3690.0,229.42,20.0,5.0,0.044,1915.0,2024-11-28,hyderabad,tablet,learn data analytics,2024-11-28,28,11,3,48,False,0.0442,0.03062330623306233,2.0302654867256638,11.471,0.25,0.0013550135501355014,0.17699115044247787,383.0,7.347136256647198,0.11980156657963446,0,0,2,4
A1097,data analytics course,101.0,5943.0,187.32,27.0,6.0,0.059,1614.0,2024-11-15,hyderabad,tablet,data analytics online,2024-11-15,15,11,4,46,False,0.0594,0.016994783779236074,1.8546534653465345,6.937777777777778,0.2222222222222222,0.0010095911155981827,0.26732673267326734,269.0,7.616271620755926,0.11605947955390335,0,0,2,2
A1098,data analytics course,189.0,5357.0,222.5,24.0,3.0,0.05,1839.0,2024-11-25,hyderabad,tablet,data analytics course,2024-11-25,25,11,0,48,True,0.0159,0.03528094082508867,1.1772486772486772,9.270833333333334,0.125,0.0005600149337315662,0.12698412698412698,613.0,7.265168539325843,0.12098966829798803,0,0,2,1
A1099,data analytics course,154.0,3596.0,236.14,30.0,9.0,0.058,1036.0,2024/11/06,hyderabad,tablet,online data analytic,2024-11-06,6,11,2,45,False,0.0584,0.04282536151279199,1.5333766233766233,7.871333333333333,0.3,0.002502780867630701,0.19480519480519481,115.11111111111111,3.3872279156432628,0.22793436293436292,0,0,2,5
A1100,data analytics course,179.0,5162.0,246.76,16.0,5.0,0.05,1052.0,2024-11-29,hyderabad,desktop,online data analytic,2024-11-29,29,11,4,48,True,0.0279,0.03467648198372724,1.3785474860335194,15.4225,0.3125,0.0009686168151879117,0.0893854748603352,210.4,3.263251742583887,0.23456273764258553,0,0,0,5
A1101,data analytics course,148.0,3747.0,244.41,18.0,8.0,0.054,1092.0,2024/11/17,hyderabad,tablet,learn data analytics,2024-11-17,17,11,6,46,False,0.0541,0.03949826527888978,1.6514189189189188,13.578333333333333,0.4444444444444444,0.0021350413664264745,0.12162162162162163,136.5,3.467902295323432,0.22381868131868132,0,0,2,4
A1102,data analytics course,177.0,4822.0,197.03,26.0,9.0,0.051,1909.0,2024-11-04,hyderabad,mobile,online data analytic,2024-11-04,4,11,0,45,False,0.0508,0.03670676068021568,1.1131638418079095,7.578076923076923,0.34615384615384615,0.0018664454583160513,0.14689265536723164,212.11111111111111,8.688879866010252,0.10321110529072813,0,0,1,5
A1103,data analytics course,119.0,5800.0,221.36,11.0,8.0,0.047,1507.0,29-11-2024,hyderabad,desktop,analytics for data,2024-11-29,29,11,4,48,True,0.0672,0.020517241379310346,1.8601680672268908,20.123636363636365,0.7272727272727273,0.001379310344827586,0.09243697478991597,188.375,5.807914709071195,0.14688785666887857,0,0,0,0
A1104,data analytics course,89.0,3594.0,214.965,14.0,6.0,0.067,1026.0,2024/11/15,hyderabad,tablet,data analytics course,2024-11-15,15,11,4,46,False,0.0674,0.02476349471341124,2.4153370786516852,15.354642857142858,0.42857142857142855,0.001669449081803005,0.15730337078651685,171.0,3.772870002093364,0.20951754385964913,0,0,2,1
A1105,data analytics course,146.0,4765.0,230.22,23.0,5.0,0.034,1944.0,2024/11/28,hyderabad,tablet,analytics for data,2024-11-28,28,11,3,48,False,0.0342,0.030640083945435468,1.5768493150684932,10.009565217391303,0.21739130434782608,0.001049317943336831,0.15753424657534246,388.8,7.444096950742768,0.11842592592592592,0,0,2,0
A1106,data analytics course,109.0,4128.0,183.65,12.0,5.0,0.047,1507.0,2024-11-30,hyderabad,desktop,data analytics online,2024-11-30,30,11,5,48,True,0.0459,0.02640503875968992,1.6848623853211009,15.304166666666667,0.4166666666666667,0.0012112403100775194,0.11009174311926606,301.4,7.205826300027225,0.12186463171864632,0,0,0,2
A1107,data analytics course,159.0,5127.0,197.16,21.0,4.0,0.025,1867.0,2024-11-03,hyderabad,tablet,learn data analytics,2024-11-03,3,11,6,44,False,0.0252,0.0310122878876536,1.24,9.388571428571428,0.19047619047619047,0.0007801833430856252,0.1320754716981132,466.75,8.469466423209576,0.10560257096946973,0,0,2,4
A1108,data analytics course,144.0,5674.0,235.36,12.0,3.0,0.021,1505.0,2024-11-22,hyderabad,desktop,analytics for data,2024-11-22,22,11,4,47,False,0.0208,0.02537892139584068,1.6344444444444446,19.613333333333333,0.25,0.0005287275290800141,0.08333333333333333,501.6666666666667,5.394459551325628,0.15638538205980068,0,0,0,0
A1109,data analytics course,122.0,3793.0,237.22,19.0,8.0,0.066,1842.0,2024-11-20,hyderabad,tablet,online data analytic,2024-11-20,20,11,2,47,False,0.0656,0.03216451357764303,1.9444262295081967,12.485263157894737,0.42105263157894735,0.0021091484313208544,0.1557377049180328,230.25,6.76494393390102,0.12878393051031486,0,0,2,5
A1110,data analytics course,112.0,4315.0,235.33,28.0,9.0,0.08,1116.0,2024/11/08,hyderabad,mobile,data analytics course,2024-11-08,8,11,4,45,False,0.0804,0.025955967555040555,2.1011607142857143,8.404642857142857,0.32142857142857145,0.002085747392815759,0.25,124.0,3.7422768027875746,0.21086917562724014,0,0,1,1
A1111,data analytics course,174.0,4704.0,192.32,21.0,10.0,0.049,1501.0,2024/11/24,hyderabad,mobile,learn data analytics,2024-11-24,24,11,6,47,False,0.0575,0.036989795918367346,1.105287356321839,9.158095238095237,0.47619047619047616,0.0021258503401360546,0.1206896551724138,150.1,6.804700499168054,0.12812791472351764,0,0,1,4
A1112,data analytics course,168.0,3349.0,235.6,23.0,9.0,0.054,1894.0,2024-11-09,hyderabad,mobile,online data analytic,2024-11-09,9,11,5,45,False,0.0536,0.050164228127799346,1.4023809523809523,10.243478260869566,0.391304347826087,0.0026873693639892504,0.13690476190476192,210.44444444444446,7.039049235993209,0.12439281942977824,0,0,1,5
A1113,data analytics course,173.0,3501.0,223.9,28.0,10.0,0.044,1179.0,2024/11/25,hyderabad,mobile,data analytics course,2024-11-25,25,11,0,48,True,0.0578,0.04941445301342474,1.2942196531791907,7.996428571428572,0.35714285714285715,0.0028563267637817767,0.16184971098265896,117.9,4.265743635551585,0.1899067005937235,0,0,1,1
A1114,data analytics course,91.0,4520.0,203.52,20.0,9.0,0.099,1838.0,20-11-2024,hyderabad,desktop,data analytics course,2024-11-20,20,11,2,47,False,0.0989,0.02013274336283186,2.2364835164835166,10.176,0.45,0.001991150442477876,0.21978021978021978,204.22222222222223,8.031053459119496,0.11072905331882482,0,0,0,1
A1115,data analytics course,140.0,5405.0,195.69,21.0,8.0,0.047,1094.0,21-11-2024,hyderabad,desktop,data analytics training,2024-11-21,21,11,3,47,True,0.0571,0.025901942645698426,1.3977857142857142,9.318571428571428,0.38095238095238093,0.0014801110083256244,0.15,136.75,4.590474730441003,0.17887568555758684,0,0,0,3
A1116,data analytics course,93.0,3425.0,229.76,26.0,4.0,0.043,1344.0,24-11-2024,hyderabad,mobile,online data analytic,2024-11-24,24,11,6,47,False,0.043,0.027153284671532846,2.470537634408602,8.836923076923076,0.15384615384615385,0.0011678832116788322,0.27956989247311825,336.0,4.84958217270195,0.17095238095238094,0,0,1,5
A1117,data analytics course,114.0,5263.0,189.13,23.0,5.0,0.044,1434.0,05-11-2024,hyderabad,mobile,data analytics course,2024-05-11,11,5,5,19,False,0.0439,0.021660649819494584,1.6590350877192983,8.22304347826087,0.21739130434782608,0.0009500285008550256,0.20175438596491227,286.8,6.582086395600909,0.13188981868898186,0,0,1,1
A1118,data analytics course,172.0,3889.0,214.965,21.0,10.0,0.047,1766.0,2024-11-16,hyderabad,tablet,online data analytic,2024-11-16,16,11,5,46,True,0.0581,0.04422730779120596,1.249796511627907,10.236428571428572,0.47619047619047616,0.0025713551041398816,0.12209302325581395,176.6,7.215290861303003,0.12172423556058891,0,0,2,5
A1119,data analytics course,188.0,3327.0,193.76,24.0,6.0,0.047,1220.0,03-11-2024,hyderabad,tablet,online data analytic,2024-03-11,11,3,0,11,True,0.0319,0.05650736399158401,1.0306382978723403,8.073333333333332,0.25,0.0018034265103697023,0.1276595744680851,203.33333333333334,5.29644921552436,0.15881967213114753,0,0,2,5
A1120,data analytics course,117.0,4520.0,214.18,29.0,4.0,0.034,1348.0,2024/11/23,hyderabad,mobile,learn data analytics,2024-11-23,23,11,5,47,False,0.0342,0.02588495575221239,1.8305982905982907,7.38551724137931,0.13793103448275862,0.0008849557522123894,0.24786324786324787,337.0,5.293771593986366,0.1588872403560831,0,0,1,4
A1121,data analytics course,113.0,5471.0,215.57,27.0,9.0,0.038,1123.0,2024-11-23,hyderabad,mobile,analytics for data,2024-11-23,23,11,5,47,True,0.0796,0.02065435934929629,1.9076991150442477,7.984074074074074,0.3333333333333333,0.0016450374702979345,0.23893805309734514,124.77777777777777,4.209444727930603,0.19195903829029384,0,0,1,0
A1122,data analytics course,109.0,3550.0,240.33,14.0,8.0,0.073,1982.0,2024-11-24,hyderabad,tablet,learn data analytics,2024-11-24,24,11,6,47,False,0.0734,0.030704225352112677,2.204862385321101,17.166428571428572,0.5714285714285714,0.0022535211267605635,0.12844036697247707,247.75,7.246993716972496,0.12125630676084763,0,0,2,4
A1123,data analytics course,174.0,3178.0,225.67,18.0,10.0,0.057,1140.0,20-11-2024,hyderabad,desktop,data analytics online,2024-11-20,20,11,2,47,False,0.0575,0.05475141598489616,1.2969540229885057,12.537222222222221,0.5555555555555556,0.0031466331025802393,0.10344827586206896,114.0,4.0516240528204905,0.1979561403508772,0,0,0,2
A1124,data analytics course,96.0,4673.0,192.88,24.0,5.0,0.052,1962.0,2024-11-10,hyderabad,mobile,learn data analytics,2024-11-10,10,11,6,45,False,0.0521,0.020543548041943076,2.0091666666666668,8.036666666666667,0.20833333333333334,0.0010699764605178687,0.25,392.4,9.17212774782248,0.0983078491335372,0,0,1,4
A1125,data analytics course,110.0,4254.0,187.87,11.0,4.0,0.047,1172.0,2024-11-04,hyderabad,mobile,data analytics training,2024-11-04,4,11,0,45,True,0.0364,0.025858015984955338,1.707909090909091,17.079090909090908,0.36363636363636365,0.0009402914903620122,0.1,293.0,5.23835631021451,0.1602986348122867,0,0,1,3
A1126,data analytics course,163.0,3658.0,237.63,23.0,7.0,0.043,1699.0,2024-11-23,hyderabad,tablet,online data analytic,2024-11-23,23,11,5,47,False,0.0429,0.04455986878075451,1.4578527607361962,10.331739130434782,0.30434782608695654,0.0019136139967195188,0.1411042944785276,242.71428571428572,6.149770651853721,0.13986462625073573,0,0,2,5
A1127,data analytics course,161.0,5319.0,235.98,13.0,4.0,0.025,1423.0,2024-11-18,hyderabad,mobile,learn data analytics,2024-11-18,18,11,0,47,False,0.0248,0.030268847527730777,1.4657142857142857,18.15230769230769,0.3076923076923077,0.0007520210565895845,0.08074534161490683,355.75,5.0301720484786845,0.16583274771609274,0,0,1,4
A1128,data analytics course,195.0,5278.0,193.49,30.0,7.0,0.047,1456.0,2024/11/04,hyderabad,mobile,data analytics course,2024-11-04,4,11,0,45,True,0.0359,0.03694581280788178,0.9922564102564103,6.449666666666667,0.23333333333333334,0.001326259946949602,0.15384615384615385,208.0,6.524936689234585,0.13289148351648353,0,0,1,1
A1129,data analytics course,84.0,3755.0,218.88,14.0,9.0,0.047,1299.0,2024/11/05,hyderabad,tablet,analytics for data,2024-11-05,5,11,1,45,True,0.1071,0.02237017310252996,2.605714285714286,15.634285714285713,0.6428571428571429,0.002396804260985353,0.16666666666666666,144.33333333333334,4.9347587719298245,0.16849884526558892,0,0,2,0
A1130,data analytics course,113.0,4580.0,194.82,11.0,6.0,0.059,1248.0,2024/11/28,hyderabad,tablet,data analytics course,2024-11-28,28,11,3,48,False,0.0531,0.024672489082969432,1.724070796460177,17.71090909090909,0.5454545454545454,0.0013100436681222707,0.09734513274336283,208.0,5.405913150600555,0.15610576923076921,0,0,2,1
A1131,data analytics course,117.0,3809.0,225.14,12.0,5.0,0.032,1495.0,2024-11-09,hyderabad,desktop,data analytics training,2024-11-09,9,11,5,45,True,0.0427,0.030716723549488054,1.9242735042735042,18.761666666666667,0.4166666666666667,0.0013126804935678655,0.10256410256410256,299.0,5.640312694323533,0.1505953177257525,0,0,0,3
A1132,data analytics course,135.0,5118.0,219.99,27.0,6.0,0.044,1089.0,2024-11-20,hyderabad,mobile,online data analytic,2024-11-20,20,11,2,47,False,0.0444,0.02637749120750293,1.6295555555555556,8.147777777777778,0.2222222222222222,0.0011723329425556857,0.2,181.5,3.9502250102277374,0.20201101928374657,0,0,1,5
A1133,data analytics course,92.0,5766.0,186.14,28.0,7.0,0.076,1013.0,27-11-2024,hyderabad,tablet,data analytics training,2024-11-27,27,11,2,48,False,0.0761,0.015955601803676726,2.0232608695652172,6.647857142857142,0.25,0.0012140131807145335,0.30434782608695654,144.71428571428572,4.442140324486946,0.18375123395853898,0,0,2,3
A1134,data analytics course,188.0,3934.0,206.21,16.0,9.0,0.048,1507.0,04-11-2024,hyderabad,desktop,data analytics course,2024-04-11,11,4,3,15,False,0.0479,0.04778851042196238,1.0968617021276597,12.888125,0.5625,0.002287747839349263,0.0851063829787234,167.44444444444446,6.308083992046942,0.1368347710683477,0,0,0,1
A1135,data analytics course,101.0,4724.0,228.38,13.0,7.0,0.034,1243.0,2024-11-20,hyderabad,desktop,learn data analytics,2024-11-20,20,11,2,47,True,0.0693,0.021380186282811176,2.261188118811881,17.567692307692308,0.5384615384615384,0.0014817950889077054,0.12871287128712872,177.57142857142858,4.442683247219547,0.1837329042638777,0,0,0,4
A1136,data analytics course,111.0,5895.0,205.25,29.0,4.0,0.036,1693.0,2024-11-04,hyderabad,mobile,data analytics course,2024-11-04,4,11,0,45,False,0.036,0.018829516539440202,1.8490990990990992,7.077586206896552,0.13793103448275862,0.0006785411365564037,0.26126126126126126,423.25,7.248477466504263,0.12123449497932665,0,0,1,1
A1137,data analytics course,122.0,4048.0,202.23,28.0,10.0,0.082,1507.0,26-11-2024,hyderabad,mobile,online data analytic,2024-11-26,26,11,1,48,False,0.082,0.030138339920948616,1.657622950819672,7.222499999999999,0.35714285714285715,0.0024703557312252965,0.22950819672131148,150.7,6.451911190228947,0.13419376244193762,0,0,1,5
A1138,data analytics course,99.0,3169.0,237.68,21.0,6.0,0.047,1509.0,2024-11-22,hyderabad,mobile,online data analytic,2024-11-22,22,11,4,47,True,0.0606,0.031240138845061535,2.4008080808080807,11.318095238095239,0.2857142857142857,0.0018933417481855476,0.21212121212121213,251.5,5.348872433524066,0.15750828363154407,0,0,1,5
A1139,data analytics course,154.0,4535.0,229.29,11.0,3.0,0.019,1434.0,2024/11/01,hyderabad,tablet,data analytics training,2024-11-01,1,11,4,44,False,0.0195,0.033958103638368244,1.488896103896104,20.844545454545454,0.2727272727272727,0.000661521499448732,0.07142857142857142,478.0,5.254088708622269,0.15989539748953974,0,0,2,3
A1140,data analytics course,129.0,3849.0,249.29,22.0,10.0,0.078,1767.0,2024/11/11,hyderabad,desktop,analytics for data,2024-11-11,11,11,0,46,False,0.0775,0.03351519875292284,1.9324806201550386,11.331363636363635,0.45454545454545453,0.002598077422707197,0.17054263565891473,176.7,6.088130290023668,0.14108092812676853,0,0,0,0
A1141,data analytics course,139.0,4259.0,182.98,10.0,10.0,0.031,1048.0,16-11-2024,hyderabad,mobile,analytics for data,2024-11-16,16,11,5,46,True,0.04665,0.03263676919464663,1.3164028776978416,18.298,1.0,0.0023479690068091102,0.07194244604316546,104.8,4.727401901847196,0.17459923664122137,0,0,1,0
A1142,data analytics course,143.0,3628.0,214.965,18.0,9.0,0.063,1566.0,17-11-2024,hyderabad,tablet,data analytics course,2024-11-17,17,11,6,46,False,0.0629,0.039415656008820285,1.5032517482517482,11.9425,0.5,0.0024807056229327455,0.1258741258741259,174.0,6.284906845300398,0.13727011494252875,0,0,2,1
A1143,data analytics course,80.0,3269.0,214.965,12.0,4.0,0.05,1753.0,23-11-2024,hyderabad,desktop,data analytics online,2024-11-23,23,11,5,47,False,0.05,0.024472315692872438,2.6870625,17.91375,0.3333333333333333,0.001223615784643622,0.15,438.25,7.154815900262833,0.12262692527096407,0,0,0,2
A1144,data analytics course,134.0,3724.0,188.02,26.0,9.0,0.047,1891.0,2024/11/07,hyderabad,desktop,online data analytic,2024-11-07,7,11,3,45,True,0.0672,0.0359828141783029,1.403134328358209,7.231538461538462,0.34615384615384615,0.0024167561761546724,0.19402985074626866,210.11111111111111,9.057440697798107,0.09942887361184559,0,0,0,5
A1145,data analytics course,174.0,4838.0,242.35,21.0,3.0,0.017,1599.0,2024-11-22,hyderabad,desktop,data analytics online,2024-11-22,22,11,4,47,False,0.0172,0.03596527490698636,1.392816091954023,11.54047619047619,0.14285714285714285,0.0006200909466721786,0.1206896551724138,533.0,5.597895605529194,0.15156347717323326,0,0,0,2
A1146,data analytics course,196.0,4524.0,192.01,15.0,8.0,0.041,1048.0,2024-11-13,hyderabad,desktop,data analytics course,2024-11-13,13,11,2,46,False,0.0408,0.04332449160035367,0.9796428571428571,12.800666666666666,0.5333333333333333,0.0017683465959328027,0.07653061224489796,131.0,4.458049059944795,0.18321564885496183,0,0,0,1
A1147,data analytics course,194.0,4694.0,228.15,17.0,7.0,0.036,1874.0,2024-11-14,hyderabad,tablet,learn data analytics,2024-11-14,14,11,3,46,False,0.0361,0.04132935662547933,1.1760309278350516,13.420588235294119,0.4117647058823529,0.0014912654452492544,0.08762886597938144,267.7142857142857,7.213894367740521,0.12174493062966917,0,0,2,4
A1148,data analytics course,180.0,4326.0,221.67,13.0,7.0,0.047,1427.0,06-11-2024,hyderabad,tablet,online data analytic,2024-06-11,11,6,1,24,True,0.04665,0.04160887656033287,1.2315,17.05153846153846,0.5384615384615384,0.0016181229773462784,0.07222222222222222,203.85714285714286,5.437497180493526,0.15533987386124737,0,0,2,5
A1149,data analytics course,100.0,4235.0,222.61,10.0,8.0,0.051,1814.0,01-11-2024,hyderabad,desktop,data analytics training,2024-01-11,11,1,3,2,True,0.08,0.023612750885478158,2.2261,22.261000000000003,0.8,0.0018890200708382527,0.1,226.75,7.14878037823997,0.12271775082690188,0,0,0,3
A1150,data analytics course,153.0,4367.0,184.51,29.0,9.0,0.059,1507.0,2024-11-13,hyderabad,mobile,analytics for data,2024-11-13,13,11,2,46,False,0.0588,0.03503549347378063,1.2059477124183007,6.362413793103448,0.3103448275862069,0.002060911380810625,0.1895424836601307,167.44444444444446,7.16757899300851,0.12243530192435301,0,0,1,0
A1151,data analytics course,110.0,3748.0,198.68,24.0,9.0,0.082,1041.0,05-11-2024,hyderabad,tablet,data analytics training,2024-05-11,11,5,5,19,False,0.0818,0.02934898612593383,1.8061818181818183,8.278333333333334,0.375,0.00240128068303095,0.21818181818181817,115.66666666666667,4.239581236158647,0.19085494716618637,0,0,2,3
A1152,data analytics course,116.0,3901.0,214.965,21.0,4.0,0.034,1483.0,2024-11-13,hyderabad,tablet,online data analytic,2024-11-13,13,11,2,46,False,0.0345,0.029735965137144323,1.853146551724138,10.236428571428572,0.19047619047619047,0.0010253781081773904,0.1810344827586207,370.75,5.898797478659317,0.1449527983816588,0,0,2,5
A1153,data analytics course,156.0,3335.0,236.98,29.0,7.0,0.045,1143.0,2024-11-14,hyderabad,desktop,data analytics course,2024-11-14,14,11,3,46,False,0.0449,0.046776611694152925,1.519102564102564,8.171724137931035,0.2413793103448276,0.002098950524737631,0.1858974358974359,163.28571428571428,3.8231918305342223,0.20733158355205597,0,0,0,1
A1154,data analytics course,177.0,5671.0,210.74,19.0,6.0,0.058,1172.0,25-11-2024,hyderabad,tablet,data analytics course,2024-11-25,25,11,0,48,True,0.0339,0.031211426556162936,1.1906214689265537,11.091578947368422,0.3157894736842105,0.0010580144595309468,0.10734463276836158,195.33333333333334,4.561355224447186,0.17981228668941981,0,0,2,1
A1155,data analytics course,89.0,3408.0,214.78,25.0,9.0,0.101,1898.0,2024/11/15,hyderabad,mobile,data analytics course,2024-11-15,15,11,4,46,False,0.1011,0.026115023474178403,2.413258426966292,8.5912,0.36,0.002640845070422535,0.2808988764044944,210.88888888888889,7.836949436632834,0.11316122233930453,0,0,1,1
A1156,data analytics course,155.0,4422.0,183.96,14.0,8.0,0.037,1143.0,2024/11/15,hyderabad,mobile,analytics for data,2024-11-15,15,11,4,46,True,0.0516,0.03505201266395296,1.1868387096774193,13.14,0.5714285714285714,0.0018091361374943465,0.09032258064516129,142.875,5.2133072407045,0.16094488188976377,0,0,1,0
A1157,data analytics course,123.0,3097.0,190.55,20.0,8.0,0.065,1640.0,2024/11/22,hyderabad,tablet,data analytics course,2024-11-22,22,11,4,47,False,0.065,0.03971585405230869,1.5491869918699188,9.5275,0.4,0.002583144979011947,0.16260162601626016,205.0,7.606664917344529,0.11618902439024391,0,0,2,1
A1158,data analytics course,102.0,3621.0,244.82,10.0,5.0,0.049,1375.0,2024/11/12,hyderabad,mobile,learn data analytics,2024-11-12,12,11,1,46,False,0.049,0.028169014084507043,2.4001960784313723,24.482,0.5,0.0013808340237503453,0.09803921568627451,275.0,4.6163712115023285,0.1780509090909091,0,0,1,4
A1159,data analytics course,150.0,4806.0,244.53,15.0,9.0,0.047,1602.0,07-11-2024,hyderabad,mobile,data analytics online,2024-07-11,11,7,3,28,True,0.06,0.031210986267166042,1.6302,16.302,0.6,0.0018726591760299626,0.1,178.0,5.551343393448657,0.15264044943820224,0,0,1,2
A1160,data analytics course,160.0,4520.0,245.87,11.0,6.0,0.037,1507.0,2024-11-05,hyderabad,desktop,analytics for data,2024-11-05,5,11,1,45,False,0.0375,0.035398230088495575,1.5366875,22.35181818181818,0.5454545454545454,0.001327433628318584,0.06875,251.16666666666666,5.1292552975149475,0.16315195753151956,0,0,0,0
A1161,data analytics course,143.0,3901.0,191.38,29.0,4.0,0.053,1786.0,2024-11-24,hyderabad,mobile,learn data analytics,2024-11-24,24,11,6,47,True,0.028,0.036657267367341706,1.3383216783216783,6.599310344827586,0.13793103448275862,0.0010253781081773904,0.20279720279720279,446.5,8.332218622635594,0.10715565509518477,0,0,1,4
A1162,data analytics course,178.0,4673.0,222.46,29.0,6.0,0.051,1219.0,2024/11/04,hyderabad,tablet,online data analytic,2024-11-04,4,11,0,45,True,0.0337,0.03809116199443612,1.2497752808988765,7.671034482758621,0.20689655172413793,0.0012839717526214422,0.16292134831460675,203.16666666666666,4.479636788636159,0.18249384741591468,0,0,2,5
A1163,data analytics course,152.0,3542.0,208.96,13.0,9.0,0.047,1735.0,2024/11/13,hyderabad,desktop,data analytics course,2024-11-13,13,11,2,46,True,0.0592,0.04291360813099943,1.3747368421052633,16.073846153846155,0.6923076923076923,0.002540937323546019,0.08552631578947369,192.77777777777777,7.30302450229709,0.12043804034582133,0,0,0,1
A1164,data analytics course,139.0,4347.0,238.19,26.0,5.0,0.047,1384.0,13-11-2024,hyderabad,tablet,analytics for data,2024-11-13,13,11,2,46,True,0.036,0.031976075454336325,1.7135971223021582,9.161153846153846,0.19230769230769232,0.0011502185415228894,0.18705035971223022,276.8,4.81048742600445,0.17210260115606937,0,0,2,0
A1165,data analytics course,175.0,5014.0,247.24,25.0,7.0,0.04,1499.0,15-11-2024,hyderabad,mobile,learn data analytics,2024-11-15,15,11,4,46,False,0.04,0.03490227363382529,1.4128,9.8896,0.28,0.0013960909453530116,0.14285714285714285,214.14285714285714,5.062934800194143,0.16493662441627752,0,0,1,4
A1166,data analytics course,92.0,4185.0,218.46,21.0,9.0,0.035,1567.0,2024/11/03,hyderabad,mobile,data analytics online,2024-11-03,3,11,6,44,True,0.0978,0.02198327359617682,2.3745652173913046,10.402857142857144,0.42857142857142855,0.002150537634408602,0.22826086956521738,174.11111111111111,6.172937837590405,0.13941289087428207,0,0,1,2
A1167,data analytics course,123.0,5964.0,214.965,17.0,6.0,0.047,1363.0,2024/11/03,hyderabad,desktop,data analytics training,2024-11-03,3,11,6,44,True,0.0488,0.02062374245472837,1.7476829268292684,12.645,0.35294117647058826,0.001006036217303823,0.13821138211382114,227.16666666666666,5.340567069057754,0.15771460014673513,0,0,0,3
A1168,data analytics course,86.0,5124.0,183.71,13.0,10.0,0.116,1137.0,20-11-2024,hyderabad,mobile,data analytics training,2024-11-20,20,11,2,47,False,0.1163,0.01678376268540203,2.1361627906976746,14.131538461538462,0.7692307692307693,0.00195160031225605,0.1511627906976744,113.7,5.189102389635838,0.16157431838170624,0,0,1,3
A1169,data analytics course,117.0,4162.0,238.08,28.0,10.0,0.085,1186.0,2024/11/22,hyderabad,mobile,online data analytic,2024-11-22,22,11,4,47,False,0.0855,0.028111484863046612,2.034871794871795,8.502857142857144,0.35714285714285715,0.002402691013935608,0.23931623931623933,118.6,3.9815188172043006,0.20074198988195616,0,0,1,5
A1170,data analytics course,146.0,4330.0,191.9,20.0,3.0,0.021,1748.0,2024/11/09,hyderabad,mobile,online data analytic,2024-11-09,9,11,5,45,False,0.0205,0.033718244803695153,1.3143835616438357,9.595,0.15,0.0006928406466512702,0.136986301369863,582.6666666666666,8.108910891089108,0.10978260869565218,0,0,1,5
A1171,data analytics course,89.0,3268.0,214.965,17.0,4.0,0.045,1233.0,2024/11/13,hyderabad,desktop,online data analytic,2024-11-13,13,11,2,46,False,0.0449,0.02723378212974296,2.4153370786516852,12.645,0.23529411764705882,0.0012239902080783353,0.19101123595505617,308.25,4.73581745865606,0.17434306569343067,0,0,0,5
A1172,data analytics course,195.0,3483.0,213.99,27.0,7.0,0.036,1796.0,23-11-2024,hyderabad,desktop,learn data analytics,2024-11-23,23,11,5,47,False,0.0359,0.05598621877691645,1.0973846153846154,7.9255555555555555,0.25925925925925924,0.0020097616996841805,0.13846153846153847,256.57142857142856,7.39291555680172,0.11914810690423164,0,0,0,4
A1173,data analytics course,170.0,4519.0,240.63,22.0,7.0,0.041,1012.0,27-11-2024,hyderabad,mobile,analytics for data,2024-11-27,27,11,2,48,False,0.0412,0.03761894224385926,1.415470588235294,10.937727272727273,0.3181818181818182,0.001549015268864793,0.12941176470588237,144.57142857142858,3.2056268960644974,0.23777667984189724,0,0,1,0
A1174,data analytics course,97.0,3605.0,240.29,21.0,7.0,0.045,1682.0,2024-11-10,hyderabad,desktop,data analytics online,2024-11-10,10,11,6,45,True,0.0722,0.026907073509015257,2.4772164948453606,11.442380952380953,0.3333333333333333,0.001941747572815534,0.21649484536082475,240.28571428571428,5.999875150859379,0.14285969084423306,0,0,0,2
A1175,data analytics course,159.0,5076.0,204.97,15.0,10.0,0.063,1638.0,17-11-2024,hyderabad,tablet,data analytics course,2024-11-17,17,11,6,46,False,0.0629,0.031323877068557916,1.2891194968553459,13.664666666666667,0.6666666666666666,0.001970055161544523,0.09433962264150944,163.8,6.991413377567449,0.12513431013431014,0,0,2,1
A1176,data analytics course,131.0,5352.0,225.86,24.0,10.0,0.047,1961.0,2024-11-20,hyderabad,mobile,online data analytic,2024-11-20,20,11,2,47,True,0.0763,0.024476831091180866,1.7241221374045803,9.410833333333334,0.4166666666666667,0.0018684603886397607,0.183206106870229,196.1,7.682369609492605,0.11517593064762877,0,0,1,5
A1177,data analytics course,108.0,5503.0,185.26,11.0,7.0,0.065,1921.0,06-11-2024,hyderabad,mobile,data analytics online,2024-06-11,11,6,1,24,False,0.0648,0.019625658731600944,1.7153703703703702,16.84181818181818,0.6363636363636364,0.0012720334363074686,0.10185185185185185,274.42857142857144,9.369210838821116,0.09643935450286309,0,0,1,2
A1178,data analytics course,93.0,4308.0,209.83,19.0,9.0,0.097,1694.0,2024-11-20,hyderabad,mobile,data analytics course,2024-11-20,20,11,2,47,False,0.0968,0.02158774373259053,2.256236559139785,11.043684210526317,0.47368421052631576,0.0020891364902506965,0.20430107526881722,188.22222222222223,7.073202115998665,0.12386658795749705,0,0,1,1
A1179,data analytics course,137.0,3555.0,213.5,29.0,3.0,0.047,1507.0,2024/11/06,hyderabad,desktop,data analytics course,2024-11-06,6,11,2,45,True,0.0219,0.038537271448663854,1.5583941605839415,7.362068965517241,0.10344827586206896,0.0008438818565400844,0.2116788321167883,502.3333333333333,6.058548009367682,0.14167219641672196,0,0,0,1
A1180,data analytics course,81.0,5615.0,193.14,30.0,6.0,0.074,1255.0,2024/11/28,hyderabad,mobile,analytics for data,2024-11-28,28,11,3,48,False,0.0741,0.014425645592163847,2.384444444444444,6.438,0.2,0.0010685663401602849,0.37037037037037035,209.16666666666666,5.497877187532361,0.15389641434262946,0,0,1,0
A1181,data analytics course,160.0,4743.0,206.22,23.0,10.0,0.062,1825.0,2024/11/20,hyderabad,mobile,learn data analytics,2024-11-20,20,11,2,47,False,0.0625,0.03373392367699768,1.288875,8.966086956521739,0.43478260869565216,0.002108370229812355,0.14375,182.5,7.849772088061294,0.1129972602739726,0,0,1,4
A1182,data analytics course,186.0,3337.0,183.58,16.0,8.0,0.043,1045.0,2024-11-30,hyderabad,desktop,online data analytic,2024-11-30,30,11,5,48,False,0.043,0.05573868744381181,0.986989247311828,11.47375,0.5,0.00239736290080911,0.08602150537634409,130.625,4.692341213639829,0.17567464114832537,0,0,0,5
A1183,data analytics course,105.0,3234.0,238.8,27.0,10.0,0.095,1248.0,2024/11/06,hyderabad,desktop,online data analytic,2024-11-06,6,11,2,45,False,0.0952,0.032467532467532464,2.2742857142857145,8.844444444444445,0.37037037037037035,0.0030921459492888066,0.2571428571428571,124.8,4.226130653266332,0.19134615384615386,0,0,0,5
A1184,data analytics course,131.0,3913.0,203.69,14.0,10.0,0.047,1079.0,2024/11/25,hyderabad,desktop,data analytics training,2024-11-25,25,11,0,48,True,0.0763,0.03347814975721952,1.5548854961832062,14.549285714285714,0.7142857142857143,0.002555583950932788,0.10687022900763359,107.9,4.2972654524031615,0.18877664504170527,0,0,0,3
A1185,data analytics course,129.0,3208.0,204.2,18.0,8.0,0.032,1456.0,2024-11-29,hyderabad,desktop,learn data analytics,2024-11-29,29,11,4,48,True,0.062,0.04021197007481297,1.5829457364341084,11.344444444444443,0.4444444444444444,0.0024937655860349127,0.13953488372093023,182.0,6.13026444662096,0.14024725274725275,0,0,0,4
A1186,data analytics course,187.0,5972.0,220.64,30.0,7.0,0.037,1980.0,2024-11-14,hyderabad,desktop,data analytics course,2024-11-14,14,11,3,46,False,0.0374,0.03131279303415941,1.1798930481283423,7.354666666666666,0.23333333333333334,0.001172136637642331,0.16042780748663102,282.85714285714283,7.973894126178391,0.11143434343434343,0,0,0,1
A1187,data analytics course,167.0,3662.0,235.43,10.0,7.0,0.042,1684.0,2024-11-25,hyderabad,mobile,data analytics training,2024-11-25,25,11,0,48,False,0.0419,0.045603495357728015,1.4097604790419163,23.543,0.7,0.0019115237575095577,0.059880239520958084,240.57142857142858,6.15286921802659,0.1398040380047506,0,0,1,3
A1188,data analytics course,140.0,3359.0,182.13,29.0,7.0,0.045,1973.0,2024/11/28,hyderabad,desktop,data analytics online,2024-11-28,28,11,3,48,False,0.05,0.041679071152128606,1.3009285714285714,6.280344827586207,0.2413793103448276,0.0020839535576064306,0.20714285714285716,281.85714285714283,9.832921539559655,0.0923112012164217,0,0,0,2
A1189,data analytics course,198.0,3700.0,220.67,14.0,5.0,0.047,1531.0,2024/11/10,hyderabad,mobile,analytics for data,2024-11-10,10,11,6,45,True,0.0253,0.053513513513513515,1.1144949494949494,15.762142857142857,0.35714285714285715,0.0013513513513513514,0.0707070707070707,306.2,5.93796166221054,0.14413455258001306,0,0,1,0
A1190,data analytics course,196.0,3835.0,218.07,10.0,9.0,0.041,1871.0,04-11-2024,hyderabad,tablet,online data analytic,2024-04-11,11,4,3,15,False,0.0459,0.05110821382007823,1.1126020408163264,21.807,0.9,0.002346805736636245,0.05102040816326531,207.88888888888889,7.579813821250058,0.11655264564404062,0,0,2,5
A1191,data analytics course,140.0,5638.0,208.02,22.0,5.0,0.047,1652.0,2024-11-18,hyderabad,desktop,data analytics training,2024-11-18,18,11,0,47,True,0.0357,0.024831500532103583,1.485857142857143,9.455454545454545,0.22727272727272727,0.0008868393047179851,0.15714285714285714,330.4,6.941544082299779,0.12592009685230024,0,0,0,3
A1192,data analytics course,157.0,5825.0,230.6,16.0,3.0,0.019,1041.0,2024-11-16,hyderabad,desktop,data analytics training,2024-11-16,16,11,5,46,False,0.0191,0.026952789699570816,1.4687898089171973,14.4125,0.1875,0.0005150214592274678,0.10191082802547771,347.0,3.5143104943625327,0.22151777137367915,0,0,0,3
A1193,data analytics course,91.0,5428.0,248.38,11.0,3.0,0.033,1835.0,22-11-2024,hyderabad,tablet,learn data analytics,2024-11-22,22,11,4,47,False,0.033,0.016764922623434046,2.7294505494505494,22.58,0.2727272727272727,0.000552689756816507,0.12087912087912088,611.6666666666666,6.387873419760044,0.13535694822888283,0,0,2,4
A1194,data analytics course,140.0,3571.0,238.12,21.0,9.0,0.064,1762.0,2024/11/16,hyderabad,desktop,learn data analytics,2024-11-16,16,11,5,46,False,0.0643,0.03920470456454775,1.7008571428571428,11.33904761904762,0.42857142857142855,0.002520302436292355,0.15,195.77777777777777,6.399630438434404,0.13514188422247447,0,0,0,4
A1195,data analytics course,154.0,3638.0,182.17,11.0,8.0,0.056,1413.0,2024-11-04,hyderabad,mobile,online data analytic,2024-11-04,4,11,0,45,False,0.0519,0.04233095107201759,1.182922077922078,16.56090909090909,0.7272727272727273,0.0021990104452996153,0.07142857142857142,176.625,6.756491189548224,0.12892427459306438,0,0,1,5
A1196,data analytics course,133.0,4505.0,200.52,23.0,3.0,0.039,1562.0,26-11-2024,hyderabad,tablet,analytics for data,2024-11-26,26,11,1,48,True,0.0226,0.029522752497225305,1.5076691729323308,8.718260869565217,0.13043478260869565,0.0006659267480577136,0.17293233082706766,520.6666666666666,6.789746658687412,0.12837387964148528,0,0,2,0
A1197,data analytics course,139.0,5016.0,238.59,26.0,9.0,0.047,1620.0,2024-11-20,hyderabad,mobile,data analytics online,2024-11-20,20,11,2,47,True,0.04665,0.027711323763955343,1.7164748201438849,9.176538461538462,0.34615384615384615,0.0017942583732057417,0.18705035971223022,180.0,5.789890607317994,0.14727777777777779,0,0,1,2
A1198,data analytics course,141.0,3071.0,208.2,10.0,6.0,0.043,1647.0,18-11-2024,hyderabad,tablet,data analytics online,2024-11-18,18,11,0,47,False,0.0426,0.045913383262780855,1.476595744680851,20.82,0.6,0.0019537609899055682,0.07092198581560284,274.5,6.910662824207493,0.12641165755919853,0,0,2,2
A1199,data analytics course,135.0,5682.0,214.965,30.0,3.0,0.047,1445.0,2024/11/15,hyderabad,tablet,data analytics training,2024-11-15,15,11,4,46,True,0.0222,0.02375923970432946,1.5923333333333334,7.1655,0.1,0.0005279831045406547,0.2222222222222222,481.6666666666667,5.722024515618822,0.14876470588235294,0,0,2,3
A1200,data analytics course,199.0,5067.0,247.38,24.0,8.0,0.059,1365.0,2024/11/19,hyderabad,mobile,analytics for data,2024-11-19,19,11,1,47,True,0.0402,0.03927373199131636,1.2431155778894472,10.3075,0.3333333333333333,0.0015788434971383462,0.12060301507537688,170.625,4.517826825127334,0.18123076923076922,0,0,1,0
A1201,data analytics course,138.0,3971.0,184.87,28.0,3.0,0.022,1718.0,2024-11-07,hyderabad,tablet,learn data analytics,2024-11-07,7,11,3,45,False,0.0217,0.03475195164945857,1.3396376811594204,6.6025,0.10714285714285714,0.0007554772097708386,0.2028985507246377,572.6666666666666,8.29301671444799,0.10760768335273574,0,0,2,4
A1202,data analytics course,175.0,4481.0,236.38,21.0,10.0,0.057,1257.0,20-11-2024,hyderabad,desktop,data analytics course,2024-11-20,20,11,2,47,False,0.0571,0.03905378263780406,1.350742857142857,11.256190476190476,0.47619047619047616,0.0022316447221602323,0.12,125.7,4.317708774007953,0.18805091487669054,0,0,0,1
A1203,data analytics course,170.0,5476.0,186.29,25.0,4.0,0.024,1731.0,08-11-2024,hyderabad,mobile,analytics for data,2024-08-11,11,8,6,32,False,0.0235,0.0310445580715851,1.0958235294117646,7.4516,0.16,0.0007304601899196494,0.14705882352941177,432.75,8.29196414192925,0.10761987290583477,0,0,1,0
A1204,data analytics course,138.0,4426.0,203.75,24.0,10.0,0.072,1838.0,2024-11-05,hyderabad,mobile,data analytics course,2024-11-05,5,11,1,45,False,0.0725,0.031179394487121554,1.4764492753623188,8.489583333333334,0.4166666666666667,0.0022593764121102574,0.17391304347826086,183.8,8.020858895705521,0.11085418933623503,0,0,1,1
A1205,data analytics course,108.0,4080.0,247.8,18.0,4.0,0.037,1363.0,2024-11-30,hyderabad,tablet,online data analytic,2024-11-30,30,11,5,48,False,0.037,0.026470588235294117,2.2944444444444447,13.766666666666667,0.2222222222222222,0.000980392156862745,0.16666666666666666,340.75,4.500403551251009,0.1818048422597212,0,0,2,5
A1206,data analytics course,150.0,4113.0,219.67,12.0,7.0,0.047,1196.0,2024-11-22,hyderabad,mobile,learn data analytics,2024-11-22,22,11,4,47,False,0.0467,0.03646973012399708,1.4644666666666666,18.305833333333332,0.5833333333333334,0.0017019207391198638,0.08,170.85714285714286,4.444530432011654,0.1836705685618729,0,0,1,4
A1207,data analytics course,90.0,5119.0,226.58,14.0,10.0,0.111,1348.0,2024/11/07,hyderabad,desktop,analytics for data,2024-11-07,7,11,3,45,False,0.1111,0.01758155889822231,2.5175555555555555,16.184285714285714,0.7142857142857143,0.0019535065442469234,0.15555555555555556,134.8,4.949333568717451,0.1680860534124629,0,0,0,0
A1208,data analytics course,98.0,3422.0,223.55,17.0,7.0,0.047,1414.0,2024-11-19,hyderabad,tablet,online data analytic,2024-11-19,19,11,1,47,True,0.0714,0.02863822326125073,2.281122448979592,13.15,0.4117647058823529,0.0020455873758036236,0.17346938775510204,202.0,5.325206888839186,0.15809759547383312,0,0,2,5
A1209,data analytics course,130.0,3327.0,224.83,13.0,3.0,0.023,1668.0,16-11-2024,hyderabad,mobile,online data analytic,2024-11-16,16,11,5,46,False,0.0231,0.03907424105801022,1.7294615384615386,17.294615384615387,0.23076923076923078,0.0009017132551848512,0.1,556.0,6.418938753725037,0.13479016786570744,0,0,1,5
A1210,data analytics course,199.0,4520.0,199.98,15.0,8.0,0.04,1467.0,2024-11-08,hyderabad,tablet,data analytics training,2024-11-08,8,11,4,45,False,0.0402,0.04402654867256637,1.0049246231155777,13.331999999999999,0.5333333333333333,0.0017699115044247787,0.07537688442211055,183.375,6.335733573357336,0.13631901840490798,0,0,2,3
A1211,data analytics course,101.0,3241.0,183.34,24.0,7.0,0.047,1483.0,10-11-2024,hyderabad,tablet,data analytics training,2024-10-11,11,10,4,41,True,0.04665,0.031163221228016045,1.8152475247524753,7.639166666666667,0.2916666666666667,0.0021598272138228943,0.2376237623762376,211.85714285714286,7.088796771026509,0.12362778152393797,0,0,2,3
A1212,data analytics course,118.0,3970.0,214.965,27.0,9.0,0.076,1036.0,2024-11-19,hyderabad,desktop,data analytics course,2024-11-19,19,11,1,47,False,0.0763,0.029722921914357683,1.8217372881355933,7.961666666666667,0.3333333333333333,0.0022670025188916876,0.2288135593220339,115.11111111111111,3.819389202893494,0.20749517374517376,0,0,0,1
A1213,data analytics course,199.0,5734.0,247.99,18.0,7.0,0.047,1455.0,2024/11/11,hyderabad,desktop,data analytics online,2024-11-11,11,11,0,46,True,0.04665,0.03470526682943844,1.246180904522613,13.777222222222223,0.3888888888888889,0.001220788280432508,0.09045226130653267,207.85714285714286,4.867172063389653,0.17043986254295534,0,0,0,2
A1214,data analytics course,183.0,4001.0,237.85,23.0,4.0,0.022,1430.0,2024/11/21,hyderabad,mobile,online data analytic,2024-11-21,21,11,3,47,False,0.0219,0.04573856535866033,1.299726775956284,10.341304347826087,0.17391304347826086,0.000999750062484379,0.12568306010928962,357.5,5.0121925583350855,0.16632867132867132,0,0,1,5
A1215,data analytics course,126.0,4206.0,233.76,29.0,10.0,0.041,1998.0,2024-11-06,hyderabad,tablet,online data analytic,2024-11-06,6,11,2,45,True,0.0794,0.029957203994293864,1.8552380952380951,8.060689655172414,0.3448275862068966,0.0023775558725630053,0.23015873015873015,199.8,7.547227926078029,0.11699699699699699,0,0,2,5
A1216,data analytics course,199.0,4745.0,214.965,13.0,9.0,0.047,1800.0,2024-11-28,hyderabad,tablet,analytics for data,2024-11-28,28,11,3,48,True,0.0452,0.041938883034773444,1.0802261306532663,16.53576923076923,0.6923076923076923,0.0018967334035827187,0.06532663316582915,200.0,7.373456144023446,0.119425,0,0,2,0
A1217,data analytics course,92.0,4042.0,200.75,15.0,7.0,0.076,1234.0,2024-11-24,hyderabad,tablet,learn data analytics,2024-11-24,24,11,6,47,False,0.0761,0.022761009401286492,2.182065217391304,13.383333333333333,0.4666666666666667,0.0017318159327065809,0.16304347826086957,176.28571428571428,5.146948941469489,0.16268233387358186,0,0,2,4
A1218,data analytics course,139.0,4883.0,249.61,10.0,3.0,0.047,1464.0,2024-11-12,hyderabad,tablet,online data analytic,2024-11-12,12,11,1,46,True,0.04665,0.028466106901494984,1.7957553956834533,24.961000000000002,0.3,0.0006143764079459349,0.07194244604316546,488.0,4.865149633428147,0.17049863387978142,0,0,2,5
A1219,data analytics course,92.0,3748.0,208.15,14.0,8.0,0.087,1297.0,2024/11/02,hyderabad,desktop,analytics for data,2024-11-02,2,11,5,44,False,0.087,0.02454642475987193,2.2625,14.867857142857144,0.5714285714285714,0.0021344717182497333,0.15217391304347827,162.125,5.231083353350948,0.16048573631457208,0,0,0,0
A1220,data analytics course,135.0,3480.0,224.94,11.0,4.0,0.03,1398.0,2024-11-23,hyderabad,tablet,data analytics online,2024-11-23,23,11,5,47,False,0.0296,0.03879310344827586,1.6662222222222223,20.44909090909091,0.36363636363636365,0.0011494252873563218,0.08148148148148149,349.5,5.2149906641771135,0.16090128755364808,0,0,2,2
A1221,data analytics course,177.0,3007.0,223.22,30.0,8.0,0.045,1766.0,2024/11/02,hyderabad,mobile,data analytics online,2024-11-02,2,11,5,44,False,0.0452,0.05886265380778184,1.261129943502825,7.440666666666667,0.26666666666666666,0.002660458929165281,0.1694915254237288,220.75,6.911477466176866,0.1263986409966025,0,0,1,2
A1222,data analytics course,117.0,3380.0,186.73,21.0,10.0,0.055,1958.0,2024-11-19,hyderabad,desktop,data analytics training,2024-11-19,19,11,1,47,True,0.0855,0.03461538461538462,1.5959829059829058,8.891904761904762,0.47619047619047616,0.0029585798816568047,0.1794871794871795,195.8,9.485728056552242,0.09536772216547497,0,0,0,3
A1223,data analytics course,127.0,4823.0,194.69,11.0,10.0,0.057,1496.0,15-11-2024,hyderabad,desktop,data analytics course,2024-11-15,15,11,4,46,True,0.0787,0.026332158407630105,1.532992125984252,17.69909090909091,0.9090909090909091,0.0020733982998133943,0.08661417322834646,149.6,6.6840104781961065,0.1301403743315508,0,0,0,1
A1224,data analytics course,132.0,4490.0,202.45,10.0,7.0,0.053,1441.0,2024-11-10,hyderabad,mobile,data analytics online,2024-11-10,10,11,6,45,False,0.053,0.029398663697104678,1.5337121212121212,20.244999999999997,0.7,0.0015590200445434299,0.07575757575757576,205.85714285714286,6.117806865892813,0.14049271339347674,0,0,1,2
A1225,data analytics course,102.0,5149.0,229.48,27.0,9.0,0.088,1137.0,26-11-2024,hyderabad,desktop,learn data analytics,2024-11-26,26,11,1,48,False,0.0882,0.019809671780928337,2.249803921568627,8.49925925925926,0.3333333333333333,0.0017479122159642648,0.2647058823529412,126.33333333333333,3.9546801464179886,0.20182937554969216,0,0,0,4
A1226,data analytics course,91.0,4290.0,213.74,20.0,10.0,0.047,1797.0,2024/11/16,hyderabad,mobile,online data analytic,2024-11-16,16,11,5,46,True,0.1099,0.021212121212121213,2.348791208791209,10.687000000000001,0.5,0.002331002331002331,0.21978021978021978,179.7,7.407410873023299,0.11894268224819143,0,0,1,5
A1227,data analytics course,163.0,5643.0,217.4,30.0,6.0,0.047,1678.0,2024-11-01,hyderabad,desktop,data analytics online,2024-11-01,1,11,4,44,True,0.0368,0.028885344674818358,1.3337423312883436,7.246666666666667,0.2,0.001063264221158958,0.18404907975460122,279.6666666666667,6.718491260349586,0.1295589988081049,0,0,0,2
A1228,data analytics course,92.0,3916.0,188.1,20.0,6.0,0.065,1005.0,2024/11/14,hyderabad,desktop,online data analytic,2024-11-14,14,11,3,46,False,0.0652,0.02349336057201226,2.0445652173913045,9.405,0.3,0.0015321756894790602,0.21739130434782608,167.5,4.342902711323764,0.1871641791044776,0,0,0,5
A1229,data analytics course,165.0,4551.0,185.35,30.0,7.0,0.047,1662.0,2024/11/06,hyderabad,desktop,data analytics online,2024-11-06,6,11,2,45,True,0.04665,0.03625576796308504,1.1233333333333333,6.178333333333333,0.23333333333333334,0.0015381234893430016,0.18181818181818182,237.42857142857142,7.966819530617751,0.1115222623345367,0,0,0,2
A1230,data analytics course,127.0,3344.0,201.7,10.0,8.0,0.047,1190.0,2024/11/11,hyderabad,desktop,analytics for data,2024-11-11,11,11,0,46,True,0.063,0.03797846889952153,1.5881889763779526,20.169999999999998,0.8,0.0023923444976076554,0.07874015748031496,148.75,4.899851264253843,0.16949579831932773,0,0,0,0
A1231,data analytics course,178.0,4441.0,231.97,22.0,4.0,0.022,1886.0,2024/11/24,hyderabad,mobile,analytics for data,2024-11-24,24,11,6,47,False,0.0225,0.04008106282368836,1.3032022471910112,10.54409090909091,0.18181818181818182,0.0009006980409817609,0.12359550561797752,471.5,7.130361684700608,0.12299575821845175,0,0,1,0
A1232,data analytics course,101.0,4520.0,234.17,29.0,5.0,0.05,1568.0,2024-11-27,hyderabad,mobile,data analytics training,2024-11-27,27,11,2,48,False,0.0495,0.022345132743362833,2.3185148514851486,8.074827586206895,0.1724137931034483,0.0011061946902654867,0.2871287128712871,313.6,5.69599009266772,0.14934311224489796,0,0,1,3
A1233,data analytics course,161.0,5977.0,193.27,24.0,7.0,0.047,1366.0,13-11-2024,hyderabad,desktop,online data analytic,2024-11-13,13,11,2,46,True,0.04665,0.02693659026267358,1.2004347826086956,8.052916666666667,0.2916666666666667,0.0011711560983771122,0.14906832298136646,195.14285714285714,6.067832565840534,0.14148609077598828,0,0,0,5
A1234,data analytics course,95.0,4562.0,187.62,24.0,9.0,0.095,1239.0,2024-11-26,hyderabad,desktop,data analytics training,2024-11-26,26,11,1,48,False,0.0947,0.02082419991231916,1.9749473684210528,7.8175,0.375,0.001972818939061815,0.25263157894736843,137.66666666666666,5.603773584905661,0.15142857142857144,0,0,0,3
A1235,data analytics course,85.0,5099.0,232.56,28.0,9.0,0.047,1526.0,02-11-2024,hyderabad,mobile,data analytics training,2024-02-11,11,2,6,6,True,0.1059,0.016669935281427732,2.736,8.305714285714286,0.32142857142857145,0.001765051970974701,0.32941176470588235,169.55555555555554,5.561747506019952,0.1523984272608126,0,0,1,3
A1236,data analytics course,192.0,5852.0,181.05,16.0,8.0,0.042,1600.0,2024-11-21,hyderabad,desktop,analytics for data,2024-11-21,21,11,3,47,False,0.0417,0.032809295967190705,0.94296875,11.315625,0.5,0.001367053998632946,0.08333333333333333,200.0,7.837337752002209,0.11315625000000001,0,0,0,0
A1237,data analytics course,80.0,3823.0,181.57,13.0,4.0,0.047,1564.0,2024/11/13,hyderabad,desktop,online data analytic,2024-11-13,13,11,2,46,True,0.05,0.020925974365681402,2.269625,13.966923076923077,0.3076923076923077,0.00104629871828407,0.1625,391.0,7.613757779368839,0.11609335038363171,0,0,0,5
A1238,data analytics course,191.0,4612.0,238.23,20.0,10.0,0.052,1531.0,01-11-2024,hyderabad,mobile,learn data analytics,2024-01-11,11,1,3,2,False,0.0524,0.04141370338248049,1.2472774869109946,11.9115,0.5,0.002168256721595837,0.10471204188481675,153.1,5.4265625655878775,0.15560418027433048,0,0,1,4
A1239,data analytics course,147.0,5881.0,196.34,23.0,7.0,0.048,1614.0,2024/11/18,hyderabad,desktop,data analytics training,2024-11-18,18,11,0,47,False,0.0476,0.024995749022275124,1.3356462585034015,8.536521739130436,0.30434782608695654,0.001190273762965482,0.1564625850340136,230.57142857142858,7.220433941122542,0.12164807930607187,0,0,0,3
A1240,data analytics course,100.0,5204.0,197.53,26.0,4.0,0.04,1675.0,24-11-2024,hyderabad,tablet,data analytics course,2024-11-24,24,11,6,47,False,0.04,0.01921598770176787,1.9753,7.597307692307693,0.15384615384615385,0.0007686395080707148,0.26,418.75,7.47972459879512,0.11792835820895523,0,0,2,1
A1241,data analytics course,82.0,5130.0,233.75,20.0,9.0,0.11,1507.0,15-11-2024,hyderabad,mobile,data analytics online,2024-11-15,15,11,4,46,False,0.1098,0.015984405458089667,2.850609756097561,11.6875,0.45,0.0017543859649122807,0.24390243902439024,167.44444444444446,5.447058823529412,0.1551094890510949,0,0,1,2
A1242,data analytics course,123.0,5231.0,202.93,30.0,10.0,0.081,1551.0,2024-11-23,hyderabad,desktop,online data analytic,2024-11-23,23,11,5,47,False,0.0813,0.023513668514624355,1.6498373983739838,6.764333333333334,0.3333333333333333,0.0019116803670426305,0.24390243902439024,155.1,6.643029616123786,0.13083816892327532,0,0,0,5
A1243,data analytics course,165.0,5980.0,248.41,17.0,3.0,0.018,1803.0,06-11-2024,hyderabad,tablet,online data analytic,2024-06-11,11,6,1,24,False,0.0182,0.027591973244147156,1.5055151515151515,14.61235294117647,0.17647058823529413,0.0005016722408026755,0.10303030303030303,601.0,6.258161909745985,0.1377759290072102,0,0,2,5
A1244,data analytics course,167.0,3202.0,214.87,26.0,6.0,0.036,1571.0,12-11-2024,hyderabad,desktop,data analytics online,2024-12-11,11,12,2,50,False,0.0359,0.052154903185509055,1.2866467065868263,8.26423076923077,0.23076923076923078,0.0018738288569643974,0.15568862275449102,261.8333333333333,6.311397589240006,0.13677275620623808,0,0,0,2
A1245,data analytics course,111.0,5847.0,196.71,21.0,9.0,0.081,1445.0,2024-11-30,hyderabad,mobile,online data analytic,2024-11-30,30,11,5,48,False,0.0811,0.018984094407388404,1.7721621621621622,9.367142857142857,0.42857142857142855,0.0015392508978963571,0.1891891891891892,160.55555555555554,6.34583905241218,0.13613148788927337,0,0,1,5
A1246,data analytics course,94.0,4359.0,214.965,28.0,5.0,0.045,1920.0,2024/11/07,hyderabad,tablet,learn data analytics,2024-11-07,7,11,3,45,False,0.0532,0.021564579031888048,2.2868617021276596,7.677321428571429,0.17857142857142858,0.0011470520761642578,0.2978723404255319,384.0,7.931686553625009,0.1119609375,0,0,2,4
A1247,data analytics course,179.0,3185.0,236.74,29.0,5.0,0.047,1156.0,2024/11/11,hyderabad,desktop,data analytics course,2024-11-11,11,11,0,46,True,0.0279,0.05620094191522763,1.3225698324022346,8.16344827586207,0.1724137931034483,0.0015698587127158557,0.16201117318435754,231.2,3.8829940018585787,0.2047923875432526,0,0,0,1
A1248,data analytics course,166.0,5592.0,183.03,22.0,4.0,0.024,1636.0,2024-11-22,hyderabad,tablet,online data analytic,2024-11-22,22,11,4,47,False,0.0241,0.029685264663805437,1.102590361445783,8.319545454545455,0.18181818181818182,0.000715307582260372,0.13253012048192772,409.0,7.938425394744031,0.11187652811735942,0,0,2,5
A1249,data analytics course,90.0,5062.0,191.4,23.0,6.0,0.047,1775.0,2024/11/19,hyderabad,tablet,data analytics course,2024-11-19,19,11,1,47,True,0.0667,0.017779533781114184,2.126666666666667,8.321739130434782,0.2608695652173913,0.001185302252074279,0.25555555555555554,295.8333333333333,8.273772204806686,0.10783098591549296,0,0,2,1
A1250,data analytics course,106.0,5830.0,241.9,29.0,10.0,0.035,1897.0,2024/11/02,hyderabad,desktop,data analytics training,2024-11-02,2,11,5,44,True,0.0943,0.01818181818181818,2.2820754716981133,8.341379310344827,0.3448275862068966,0.0017152658662092624,0.27358490566037735,189.7,6.842083505580818,0.1275171323141803,0,0,0,3
A1251,data analytics course,139.0,4629.0,236.96,10.0,6.0,0.047,1183.0,06-11-2024,hyderabad,desktop,data analytics training,2024-06-11,11,6,1,24,True,0.04665,0.030028083819399438,1.704748201438849,23.696,0.6,0.0012961762799740765,0.07194244604316546,197.16666666666666,3.9924037812288993,0.20030431107354185,0,0,0,3
A1252,data analytics course,158.0,4780.0,247.2,23.0,9.0,0.047,1005.0,2024-11-24,hyderabad,desktop,learn data analytics,2024-11-24,24,11,6,47,True,0.057,0.03305439330543933,1.5645569620253164,10.747826086956522,0.391304347826087,0.0018828451882845188,0.14556962025316456,111.66666666666667,3.0655339805825244,0.24597014925373134,0,0,0,4
A1253,data analytics course,187.0,3800.0,241.0,16.0,8.0,0.043,1842.0,2024/11/09,hyderabad,mobile,analytics for data,2024-11-09,9,11,5,45,False,0.0428,0.049210526315789475,1.2887700534759359,15.0625,0.5,0.002105263157894737,0.0855614973262032,230.25,6.643153526970955,0.13083604777415853,0,0,1,0
A1254,data analytics course,95.0,4096.0,242.69,26.0,9.0,0.095,1550.0,22-11-2024,hyderabad,tablet,online data analytic,2024-11-22,22,11,4,47,False,0.0947,0.023193359375,2.5546315789473684,9.33423076923077,0.34615384615384615,0.002197265625,0.2736842105263158,172.22222222222223,5.386748526927356,0.1565741935483871,0,0,2,5
A1255,data analytics course,118.0,3562.0,231.5,12.0,3.0,0.025,1856.0,2024/11/19,hyderabad,desktop,data analytics course,2024-11-19,19,11,1,47,False,0.0254,0.03312745648512072,1.9618644067796611,19.291666666666668,0.25,0.0008422234699606962,0.1016949152542373,618.6666666666666,7.017278617710583,0.12473060344827586,0,0,0,1
A1256,data analytics course,166.0,3910.0,191.32,27.0,7.0,0.042,1507.0,2024/11/15,hyderabad,mobile,analytics for data,2024-11-15,15,11,4,46,False,0.0422,0.04245524296675192,1.1525301204819276,7.085925925925926,0.25925925925925924,0.0017902813299232737,0.16265060240963855,215.28571428571428,6.876855530002091,0.12695421366954213,0,0,1,0
A1257,data analytics course,146.0,5411.0,201.76,28.0,7.0,0.048,1393.0,14-11-2024,hyderabad,desktop,data analytics online,2024-11-14,14,11,3,46,False,0.0479,0.026982073553871742,1.381917808219178,7.2057142857142855,0.25,0.00129366106080207,0.1917808219178082,199.0,5.904242664551943,0.14483847810480976,0,0,0,2
A1258,data analytics course,101.0,4026.0,219.68,22.0,9.0,0.089,1149.0,15-11-2024,hyderabad,desktop,analytics for data,2024-11-15,15,11,4,46,False,0.0891,0.025086934923000497,2.175049504950495,9.985454545454546,0.4090909090909091,0.0022354694485842027,0.21782178217821782,127.66666666666667,4.230335032774945,0.19119234116623152,0,0,0,0
A1259,data analytics course,185.0,3716.0,218.23,27.0,7.0,0.056,1015.0,2024/11/03,hyderabad,desktop,online data analytic,2024-11-03,3,11,6,44,True,0.0378,0.04978471474703983,1.1796216216216215,8.082592592592592,0.25925925925925924,0.001883745963401507,0.14594594594594595,145.0,3.6510562250836274,0.21500492610837438,0,0,0,5
A1260,data analytics course,147.0,5162.0,186.79,30.0,7.0,0.048,1733.0,2024/11/25,hyderabad,desktop,analytics for data,2024-11-25,25,11,0,48,False,0.0476,0.028477334366524602,1.2706802721088435,6.226333333333333,0.23333333333333334,0.0013560635412630763,0.20408163265306123,247.57142857142858,8.27779859735532,0.10778418926716676,0,0,0,0
A1261,data analytics course,188.0,3859.0,211.83,30.0,9.0,0.048,1719.0,2024-11-28,hyderabad,mobile,online data analytic,2024-11-28,28,11,3,48,False,0.0479,0.048717284270536405,1.1267553191489363,7.061000000000001,0.3,0.00233221041720653,0.1595744680851064,191.0,7.114997875655006,0.12322862129144853,0,0,1,5
A1262,data analytics course,122.0,3350.0,225.89,28.0,3.0,0.047,1509.0,2024/11/24,hyderabad,desktop,data analytics online,2024-11-24,24,11,6,47,True,0.0246,0.036417910447761194,1.8515573770491802,8.067499999999999,0.10714285714285714,0.0008955223880597015,0.22950819672131148,503.0,5.680242595953784,0.14969516235917826,0,0,0,2
A1263,data analytics course,143.0,5340.0,214.965,20.0,9.0,0.063,1223.0,2024-11-05,hyderabad,tablet,online data analytic,2024-11-05,5,11,1,45,False,0.0629,0.026779026217228465,1.5032517482517482,10.74825,0.45,0.0016853932584269663,0.13986013986013987,135.88888888888889,4.6892982578559295,0.17576860179885528,0,0,2,5
A1264,data analytics course,170.0,3124.0,234.92,17.0,3.0,0.018,1232.0,2024/11/11,hyderabad,desktop,data analytics training,2024-11-11,11,11,0,46,False,0.0176,0.05441741357234315,1.3818823529411763,13.818823529411764,0.17647058823529413,0.0009603072983354673,0.1,410.6666666666667,4.244338498212158,0.19068181818181817,0,0,0,3
A1265,data analytics course,114.0,5017.0,242.62,11.0,6.0,0.053,1303.0,2024/11/17,hyderabad,mobile,data analytics online,2024-11-17,17,11,6,46,False,0.0526,0.022722742674905323,2.128245614035088,22.05636363636364,0.5454545454545454,0.001195933824995017,0.09649122807017543,217.16666666666666,4.3705382903305585,0.1862010744435917,0,0,1,2
A1266,data analytics course,186.0,3424.0,201.81,27.0,3.0,0.016,1337.0,2024-11-26,hyderabad,desktop,data analytics training,2024-11-26,26,11,1,48,False,0.0161,0.054322429906542055,1.085,7.474444444444445,0.1111111111111111,0.0008761682242990654,0.14516129032258066,445.6666666666667,5.625043357613597,0.15094240837696335,0,0,0,3
A1267,data analytics course,120.0,4060.0,210.95,24.0,9.0,0.075,1376.0,2024-11-05,hyderabad,tablet,data analytics online,2024-11-05,5,11,1,45,False,0.075,0.029556650246305417,1.7579166666666666,8.789583333333333,0.375,0.0022167487684729066,0.2,152.88888888888889,5.522872718653709,0.15330668604651163,0,0,2,2
A1268,data analytics course,130.0,5688.0,212.05,21.0,5.0,0.038,1454.0,17-11-2024,hyderabad,desktop,learn data analytics,2024-11-17,17,11,6,46,False,0.0385,0.022855133614627286,1.6311538461538462,10.097619047619048,0.23809523809523808,0.0008790436005625879,0.16153846153846155,290.8,5.856873378920066,0.14583906464924348,0,0,0,4
A1269,data analytics course,178.0,5029.0,189.79,25.0,8.0,0.045,1510.0,09-11-2024,hyderabad,desktop,data analytics training,2024-09-11,11,9,2,37,False,0.0449,0.03539471067806721,1.0662359550561797,7.5916,0.32,0.0015907735136209981,0.1404494382022472,188.75,6.956162073871122,0.1256887417218543,0,0,0,3
A1270,data analytics course,196.0,5476.0,204.63,19.0,4.0,0.02,1288.0,26-11-2024,hyderabad,desktop,data analytics training,2024-11-26,26,11,1,48,False,0.0204,0.03579254930606282,1.044030612244898,10.77,0.21052631578947367,0.0007304601899196494,0.09693877551020408,322.0,5.294287250158823,0.15887422360248446,0,0,0,3
A1271,data analytics course,110.0,5000.0,197.89,18.0,3.0,0.027,1110.0,2024/11/12,hyderabad,desktop,online data analytic,2024-11-12,12,11,1,46,False,0.0273,0.022,1.799,10.993888888888888,0.16666666666666666,0.0006,0.16363636363636364,370.0,4.609176815402496,0.17827927927927928,0,0,0,5
A1272,data analytics course,95.0,4141.0,207.14,22.0,3.0,0.054,1929.0,2024-11-11,hyderabad,tablet,learn data analytics,2024-11-11,11,11,0,46,True,0.0316,0.02294131852209611,2.1804210526315786,9.415454545454544,0.13636363636363635,0.0007244626901714562,0.23157894736842105,643.0,8.312542241961959,0.10738206324520476,0,0,2,4
A1273,data analytics course,183.0,4791.0,232.97,27.0,5.0,0.047,1476.0,2024-11-21,hyderabad,desktop,data analytics online,2024-11-21,21,11,3,47,True,0.0273,0.038196618659987476,1.2730601092896174,8.628518518518518,0.18518518518518517,0.0010436234606553956,0.14754098360655737,295.2,5.335579688371893,0.15783875338753386,0,0,0,2
A1274,data analytics course,100.0,4168.0,193.6,30.0,3.0,0.03,1692.0,2024/11/25,hyderabad,desktop,online data analytic,2024-11-25,25,11,0,48,False,0.03,0.02399232245681382,1.936,6.453333333333333,0.1,0.0007197696737044146,0.3,564.0,7.739669421487604,0.11442080378250591,0,0,0,5
A1275,data analytics course,187.0,3741.0,226.11,27.0,10.0,0.053,1342.0,14-11-2024,hyderabad,tablet,learn data analytics,2024-11-14,14,11,3,46,False,0.0535,0.0499866345896819,1.209144385026738,8.374444444444444,0.37037037037037035,0.002673082063619353,0.1443850267379679,134.2,4.935164300561673,0.16848733233979138,0,0,2,4
A1276,data analytics course,90.0,3577.0,233.54,24.0,5.0,0.052,1175.0,2024-11-14,hyderabad,tablet,analytics for data,2024-11-14,14,11,3,46,False,0.0556,0.02516074923119933,2.594888888888889,9.730833333333333,0.20833333333333334,0.0013978194017332962,0.26666666666666666,235.0,4.031258028603237,0.19875744680851062,0,0,2,0
A1277,data analytics course,148.0,4469.0,209.76,25.0,8.0,0.054,1507.0,2024-11-25,hyderabad,tablet,data analytics course,2024-11-25,25,11,0,48,False,0.0541,0.0331170284179906,1.4172972972972973,8.3904,0.32,0.0017901096442157081,0.16891891891891891,188.375,6.18440122044241,0.13919044459190444,0,0,2,1
A1278,data analytics course,129.0,3611.0,227.82,11.0,7.0,0.054,1250.0,2024-11-22,hyderabad,tablet,data analytics training,2024-11-22,22,11,4,47,False,0.0543,0.03572417612849626,1.766046511627907,20.71090909090909,0.6363636363636364,0.001938521185267239,0.08527131782945736,178.57142857142858,4.486787814941621,0.182256,0,0,2,3
A1279,data analytics course,120.0,3947.0,193.49,15.0,6.0,0.05,1305.0,2024/11/12,hyderabad,mobile,data analytics training,2024-11-12,12,11,1,46,False,0.05,0.03040283759817583,1.6124166666666668,12.899333333333335,0.4,0.0015201418799087915,0.125,217.5,5.744534601271384,0.14826819923371648,0,0,1,3
A1280,data analytics course,82.0,4239.0,191.75,23.0,8.0,0.047,1062.0,2024-11-22,hyderabad,mobile,learn data analytics,2024-11-22,22,11,4,47,True,0.0976,0.01934418494928049,2.3384146341463414,8.33695652173913,0.34782608695652173,0.001887237556027365,0.2804878048780488,132.75,4.538461538461538,0.18055555555555555,0,0,1,4
A1281,data analytics course,145.0,5973.0,242.16,12.0,7.0,0.048,1508.0,2024-11-14,hyderabad,tablet,online data analytic,2024-11-14,14,11,3,46,False,0.0483,0.024275908253808806,1.6700689655172414,20.18,0.5833333333333334,0.0011719403984597355,0.08275862068965517,215.42857142857142,5.227287743640568,0.16058355437665783,0,0,2,5
A1282,data analytics course,190.0,4525.0,188.85,10.0,5.0,0.026,1875.0,2024/11/01,hyderabad,tablet,data analytics training,2024-11-01,1,11,4,44,False,0.0263,0.041988950276243095,0.9939473684210526,18.884999999999998,0.5,0.0011049723756906078,0.05263157894736842,375.0,8.928514694201748,0.10071999999999999,0,0,2,3
A1283,data analytics course,137.0,4395.0,241.58,24.0,4.0,0.043,1512.0,2024-11-06,hyderabad,desktop,online data analytic,2024-11-06,6,11,2,45,True,0.0292,0.031171786120591582,1.7633576642335766,10.065833333333334,0.16666666666666666,0.0009101251422070534,0.17518248175182483,378.0,5.258796257968375,0.1597751322751323,0,0,0,5
A1284,data analytics course,157.0,3047.0,222.66,19.0,3.0,0.019,1964.0,01-11-2024,hyderabad,mobile,data analytics online,2024-01-11,11,1,3,2,False,0.0191,0.05152609123728257,1.418216560509554,11.718947368421052,0.15789473684210525,0.0009845749917952085,0.12101910828025478,654.6666666666666,7.820623371957244,0.11337067209775967,0,0,1,2
A1285,data analytics course,105.0,5348.0,226.1,27.0,5.0,0.048,1003.0,12-11-2024,hyderabad,tablet,learn data analytics,2024-12-11,11,12,2,50,False,0.0476,0.01963350785340314,2.1533333333333333,8.374074074074073,0.18518518518518517,0.0009349289454001496,0.2571428571428571,200.6,3.43609022556391,0.22542372881355932,0,0,2,4
A1286,data analytics course,149.0,3101.0,231.44,15.0,9.0,0.06,1126.0,2024-11-06,hyderabad,tablet,data analytics training,2024-11-06,6,11,2,45,False,0.0604,0.048049016446307644,1.5532885906040268,15.429333333333334,0.6,0.0029022895840051595,0.10067114093959731,125.11111111111111,3.865191842378154,0.2055417406749556,0,0,2,3
A1287,data analytics course,159.0,3693.0,187.09,24.0,6.0,0.038,1256.0,24-11-2024,hyderabad,desktop,learn data analytics,2024-11-24,24,11,6,47,False,0.0377,0.04305442729488221,1.1766666666666667,7.795416666666667,0.25,0.0016246953696181965,0.1509433962264151,209.33333333333334,5.713346517718746,0.14895700636942674,0,0,0,4
A1288,data analytics course,150.0,5590.0,214.965,20.0,8.0,0.047,1286.0,02-11-2024,hyderabad,mobile,data analytics course,2024-02-11,11,2,6,6,True,0.0533,0.026833631484794274,1.4331,10.74825,0.4,0.0014311270125223613,0.13333333333333333,160.75,4.982369222896751,0.16715785381026438,0,0,1,1
A1289,data analytics course,139.0,5277.0,227.46,10.0,5.0,0.047,1541.0,2024/11/15,hyderabad,tablet,data analytics online,2024-11-15,15,11,4,46,True,0.04665,0.026340723896153117,1.6364028776978419,22.746000000000002,0.5,0.0009475080538184574,0.07194244604316546,308.2,5.774817550338521,0.14760545100584038,0,0,2,2
A1290,data analytics course,98.0,4653.0,205.84,29.0,5.0,0.051,1866.0,02-11-2024,hyderabad,mobile,data analytics online,2024-02-11,11,2,6,6,False,0.051,0.02106168063614872,2.100408163265306,7.097931034482759,0.1724137931034483,0.001074575542660649,0.29591836734693877,373.2,8.065293431791684,0.11031082529474813,0,0,1,2
A1291,data analytics course,86.0,3513.0,211.16,22.0,7.0,0.047,1917.0,10-11-2024,hyderabad,desktop,data analytics course,2024-10-11,11,10,4,41,True,0.0814,0.02448050099629946,2.455348837209302,9.598181818181818,0.3181818181818182,0.0019925989183034445,0.2558139534883721,273.85714285714283,8.078423943928774,0.11015127803860197,0,0,0,1
A1292,data analytics course,128.0,5772.0,235.54,20.0,10.0,0.078,1215.0,04-11-2024,hyderabad,desktop,data analytics training,2024-04-11,11,4,3,15,False,0.0781,0.022176022176022176,1.84015625,11.777,0.5,0.0017325017325017325,0.15625,121.5,4.1583595143075485,0.19386008230452675,0,0,0,3
A1293,data analytics course,105.0,5840.0,236.56,22.0,8.0,0.047,1811.0,24-11-2024,hyderabad,tablet,data analytics course,2024-11-24,24,11,6,47,True,0.0762,0.01797945205479452,2.252952380952381,10.752727272727272,0.36363636363636365,0.0013698630136986301,0.20952380952380953,226.375,6.655563070679743,0.13062396466040863,0,0,2,1
A1294,data analytics course,90.0,4520.0,249.0,21.0,10.0,0.047,1245.0,19-11-2024,hyderabad,mobile,data analytics course,2024-11-19,19,11,1,47,True,0.1111,0.01991150442477876,2.7666666666666666,11.857142857142858,0.47619047619047616,0.0022123893805309734,0.23333333333333334,124.5,4.0,0.2,0,0,1,1
A1295,data analytics course,89.0,5158.0,211.76,20.0,5.0,0.056,1119.0,2024/11/21,hyderabad,desktop,online data analytic,2024-11-21,21,11,3,47,False,0.0562,0.017254749903063204,2.379325842696629,10.588,0.25,0.0009693679720822024,0.2247191011235955,223.8,4.284284095202116,0.1892403932082216,0,0,0,5
A1296,data analytics course,119.0,3489.0,194.36,14.0,3.0,0.055,1633.0,2024/11/10,hyderabad,mobile,data analytics course,2024-11-10,10,11,6,45,True,0.0252,0.03410719403840642,1.63327731092437,13.882857142857144,0.21428571428571427,0.0008598452278589854,0.11764705882352941,544.3333333333334,7.401934554435067,0.11902020820575629,0,0,1,1
A1297,data analytics course,173.0,3977.0,229.82,30.0,5.0,0.037,1584.0,2024-11-22,hyderabad,desktop,learn data analytics,2024-11-22,22,11,4,47,False,0.0289,0.043500125722906714,1.3284393063583815,7.660666666666667,0.16666666666666666,0.001257229067136032,0.17341040462427745,316.8,5.892350535201462,0.14508838383838382,0,0,0,4
A1298,data analytics course,95.0,3397.0,181.89,20.0,7.0,0.074,1560.0,2024/11/27,hyderabad,tablet,data analytics course,2024-11-27,27,11,2,48,False,0.0737,0.027965852222549308,1.9146315789473682,9.0945,0.35,0.0020606417427141595,0.21052631578947367,222.85714285714286,7.576612238165926,0.11659615384615384,0,0,2,1
A1299,data analytics course,112.0,5194.0,245.97,10.0,5.0,0.045,1016.0,21-11-2024,hyderabad,tablet,data analytics training,2024-11-21,21,11,3,47,False,0.0446,0.0215633423180593,2.1961607142857145,24.597,0.5,0.0009626492106276473,0.08928571428571429,203.2,3.1305850306948,0.24209645669291338,0,0,2,3
A1300,data analytics course,134.0,3007.0,217.53,10.0,5.0,0.037,1371.0,30-11-2024,hyderabad,mobile,data analytics training,2024-11-30,30,11,5,48,False,0.0373,0.04456268706351846,1.6233582089552239,21.753,0.5,0.0016627868307283007,0.07462686567164178,274.2,5.302578954626948,0.15866520787746172,0,0,1,3
A1301,data analytics course,113.0,5721.0,216.7,11.0,6.0,0.053,1743.0,2024-11-17,hyderabad,desktop,data analytics training,2024-11-17,17,11,6,46,False,0.0531,0.01975179164481734,1.9176991150442477,19.7,0.5454545454545454,0.001048767697954903,0.09734513274336283,290.5,7.043377941855099,0.12432587492828456,0,0,0,3
A1302,data analytics course,157.0,3546.0,189.11,16.0,5.0,0.032,1333.0,28-11-2024,hyderabad,mobile,data analytics online,2024-11-28,28,11,3,48,False,0.0318,0.04427523970671179,1.2045222929936306,11.819375,0.3125,0.0014100394811054709,0.10191082802547771,266.6,6.04880757231241,0.14186796699174795,0,0,1,2
A1303,data analytics course,105.0,3670.0,245.85,24.0,9.0,0.047,1653.0,2024/11/24,hyderabad,tablet,data analytics course,2024-11-24,24,11,6,47,True,0.0857,0.02861035422343324,2.341428571428571,10.24375,0.375,0.002452316076294278,0.22857142857142856,183.66666666666666,5.723611958511288,0.14872958257713248,0,0,2,1
A1304,data analytics course,162.0,5915.0,211.96,11.0,7.0,0.047,1394.0,2024-11-20,hyderabad,tablet,analytics for data,2024-11-20,20,11,2,47,True,0.04665,0.02738799661876585,1.308395061728395,19.26909090909091,0.6363636363636364,0.001183431952662722,0.06790123456790123,199.14285714285714,5.5767125872806185,0.152051649928264,0,0,2,0
A1305,data analytics course,139.0,4450.0,219.21,16.0,10.0,0.056,1917.0,2024-11-10,hyderabad,mobile,learn data analytics,2024-11-10,10,11,6,45,True,0.04665,0.031235955056179775,1.5770503597122303,13.700625,0.625,0.0022471910112359553,0.11510791366906475,191.7,7.745039003695086,0.11435054773082942,0,0,1,4
A1306,data analytics course,136.0,5782.0,189.65,23.0,6.0,0.044,1951.0,2024-11-11,hyderabad,tablet,data analytics training,2024-11-11,11,11,0,46,False,0.0441,0.02352127291594604,1.394485294117647,8.245652173913044,0.2608695652173913,0.0010377032168799724,0.16911764705882354,325.1666666666667,9.287371473767466,0.09720656073808304,0,0,2,3
A1307,data analytics course,192.0,4339.0,245.57,24.0,8.0,0.047,1284.0,2024-11-18,hyderabad,mobile,learn data analytics,2024-11-18,18,11,0,47,False,0.0417,0.0442498271491127,1.2790104166666667,10.232083333333334,0.3333333333333333,0.0018437427978796957,0.125,160.5,4.228651708270554,0.19125389408099688,0,0,1,4
A1308,data analytics course,147.0,5870.0,214.965,14.0,8.0,0.054,1748.0,2024-11-02,hyderabad,mobile,data analytics training,2024-11-02,2,11,5,44,False,0.0544,0.02504258943781942,1.4623469387755101,15.354642857142858,0.5714285714285714,0.001362862010221465,0.09523809523809523,218.5,7.131556299862769,0.12297768878718536,0,0,1,3
A1309,data analytics course,164.0,5662.0,186.41,11.0,9.0,0.055,1020.0,17-11-2024,hyderabad,tablet,data analytics course,2024-11-17,17,11,6,46,False,0.0549,0.028965030024726245,1.1366463414634147,16.946363636363635,0.8181818181818182,0.0015895443306252208,0.06707317073170732,113.33333333333333,4.471809452282603,0.1827549019607843,0,0,2,1
A1310,data analytics course,192.0,5130.0,184.63,19.0,4.0,0.047,1087.0,2024-11-07,hyderabad,desktop,data analytics course,2024-11-07,7,11,3,45,True,0.0208,0.03742690058479532,0.9616145833333333,9.717368421052631,0.21052631578947367,0.0007797270955165692,0.09895833333333333,271.75,4.887450576829335,0.1698528058877645,0,0,0,1
A1311,data analytics course,139.0,4608.0,224.99,12.0,8.0,0.047,1095.0,2024/11/12,hyderabad,desktop,data analytics training,2024-11-12,12,11,1,46,True,0.0576,0.030164930555555556,1.6186330935251798,18.749166666666667,0.6666666666666666,0.001736111111111111,0.08633093525179857,136.875,3.8668829725765588,0.2054703196347032,0,0,0,3
A1312,data analytics course,199.0,5290.0,218.55,20.0,7.0,0.035,1234.0,2024-11-30,hyderabad,tablet,learn data analytics,2024-11-30,30,11,5,48,False,0.0352,0.03761814744801512,1.0982412060301507,10.9275,0.35,0.0013232514177693763,0.10050251256281408,176.28571428571428,4.6463051933196065,0.17710696920583469,0,0,2,4
A1313,data analytics course,82.0,4961.0,220.29,27.0,7.0,0.059,1149.0,02-11-2024,hyderabad,tablet,data analytics course,2024-02-11,11,2,6,6,True,0.0854,0.01652892561983471,2.6864634146341464,8.158888888888889,0.25925925925925924,0.0014110058455956461,0.32926829268292684,164.14285714285714,4.215851831676427,0.1917232375979112,0,0,2,1
A1314,data analytics course,175.0,4347.0,242.06,17.0,3.0,0.017,1617.0,2024/11/22,hyderabad,desktop,data analytics training,2024-11-22,22,11,4,47,False,0.0171,0.040257648953301126,1.3832,14.238823529411764,0.17647058823529413,0.0006901311249137336,0.09714285714285714,539.0,5.680161943319838,0.1496969696969697,0,0,0,3
A1315,data analytics course,181.0,5664.0,204.74,22.0,5.0,0.028,1719.0,22-11-2024,hyderabad,desktop,data analytics course,2024-11-22,22,11,4,47,False,0.0276,0.03195621468926554,1.131160220994475,9.306363636363637,0.22727272727272727,0.0008827683615819209,0.12154696132596685,343.8,7.396014457360555,0.11910413030831879,0,0,0,1
A1316,data analytics course,146.0,3757.0,192.59,25.0,9.0,0.047,1169.0,2024-11-09,hyderabad,desktop,online data analytic,2024-11-09,9,11,5,45,True,0.0616,0.0388607931860527,1.319109589041096,7.7036,0.36,0.0023955283470854403,0.17123287671232876,129.88888888888889,5.069889402357339,0.16474764756201882,0,0,0,5
A1317,data analytics course,192.0,4225.0,242.0,24.0,6.0,0.031,1032.0,2024-11-01,hyderabad,mobile,data analytics online,2024-11-01,1,11,4,44,False,0.0312,0.04544378698224852,1.2604166666666667,10.083333333333334,0.25,0.0014201183431952662,0.125,172.0,3.2644628099173554,0.23449612403100775,0,0,1,2
A1318,data analytics course,149.0,3410.0,181.12,20.0,4.0,0.033,1806.0,2024-11-17,hyderabad,desktop,learn data analytics,2024-11-17,17,11,6,46,False,0.0268,0.0436950146627566,1.2155704697986578,9.056000000000001,0.2,0.0011730205278592375,0.1342281879194631,451.5,8.971289752650177,0.10028792912513843,0,0,0,4
A1319,data analytics course,93.0,3934.0,226.84,20.0,6.0,0.065,1964.0,2024/11/18,hyderabad,mobile,data analytics online,2024-11-18,18,11,0,47,False,0.0645,0.02364006100660905,2.4391397849462364,11.342,0.3,0.001525165226232842,0.21505376344086022,327.3333333333333,7.65808499382825,0.1154989816700611,0,0,1,2
A1320,data analytics course,182.0,3384.0,187.67,18.0,8.0,0.044,1769.0,2024/11/01,hyderabad,desktop,analytics for data,2024-11-01,1,11,4,44,False,0.044,0.053782505910165486,1.031153846153846,10.42611111111111,0.4444444444444444,0.002364066193853428,0.0989010989010989,221.125,8.426120317578729,0.10608818541548896,0,0,0,0
A1321,data analytics course,99.0,3842.0,246.3,23.0,8.0,0.081,1452.0,10-11-2024,hyderabad,tablet,online data analytic,2024-10-11,11,10,4,41,False,0.0808,0.025767829255596043,2.487878787878788,10.708695652173914,0.34782608695652173,0.002082248828735034,0.23232323232323232,181.5,4.895249695493301,0.16962809917355373,0,0,2,5
A1322,data analytics course,188.0,4022.0,238.61,20.0,8.0,0.043,1507.0,2024/11/06,hyderabad,mobile,data analytics online,2024-11-06,6,11,2,45,False,0.0426,0.046742913973147684,1.2692021276595746,11.9305,0.4,0.001989060169070114,0.10638297872340426,188.375,5.315745358534847,0.1583344392833444,0,0,1,2
A1323,data analytics course,193.0,5786.0,201.51,16.0,10.0,0.052,1617.0,2024/11/05,hyderabad,tablet,data analytics training,2024-11-05,5,11,1,45,False,0.0518,0.03335637746284134,1.0440932642487046,12.594375,0.625,0.0017283097131005876,0.08290155440414508,161.7,7.02441566175376,0.12461966604823747,0,0,2,3
A1324,data analytics course,107.0,4423.0,239.47,25.0,9.0,0.084,1370.0,2024/11/23,hyderabad,desktop,analytics for data,2024-11-23,23,11,5,47,False,0.0841,0.02419172507347954,2.23803738317757,9.5788,0.36,0.0020348179968347276,0.2336448598130841,152.22222222222223,4.720967135758133,0.1747956204379562,0,0,0,0
A1325,data analytics course,131.0,4228.0,230.18,16.0,9.0,0.069,1393.0,2024-11-07,hyderabad,desktop,data analytics training,2024-11-07,7,11,3,45,False,0.0687,0.03098391674550615,1.7570992366412215,14.38625,0.5625,0.0021286660359508044,0.12213740458015267,154.77777777777777,5.051785559127639,0.165240488155061,0,0,0,3
A1326,data analytics course,139.0,5120.0,199.3,24.0,5.0,0.036,1835.0,2024-11-23,hyderabad,mobile,data analytics course,2024-11-23,23,11,5,47,False,0.036,0.0271484375,1.4338129496402878,8.304166666666667,0.20833333333333334,0.0009765625,0.17266187050359713,367.0,8.207225288509784,0.10861035422343325,0,0,1,1
A1327,data analytics course,141.0,3600.0,227.54,20.0,6.0,0.043,1367.0,2024-11-07,hyderabad,desktop,learn data analytics,2024-11-07,7,11,3,45,False,0.0426,0.03916666666666667,1.6137588652482269,11.376999999999999,0.3,0.0016666666666666668,0.14184397163120568,227.83333333333334,5.007734903753186,0.16645208485735186,0,0,0,4
A1328,data analytics course,175.0,5016.0,214.965,16.0,3.0,0.017,1836.0,2024-11-07,hyderabad,tablet,learn data analytics,2024-11-07,7,11,3,45,False,0.0171,0.03488835725677831,1.2283714285714287,13.4353125,0.1875,0.0005980861244019139,0.09142857142857143,612.0,7.540925266903915,0.11708333333333333,0,0,2,4
A1329,data analytics course,96.0,5771.0,213.98,30.0,3.0,0.031,1130.0,30-11-2024,hyderabad,mobile,analytics for data,2024-11-30,30,11,5,48,False,0.0312,0.016634898631086466,2.2289583333333334,7.132666666666666,0.1,0.0005198405822214521,0.3125,376.6666666666667,4.280867370782317,0.18936283185840708,0,0,1,0
A1330,data analytics course,139.0,4615.0,194.89,12.0,6.0,0.047,1923.0,2024/11/25,hyderabad,tablet,data analytics training,2024-11-25,25,11,0,48,True,0.04665,0.030119176598049836,1.4020863309352516,16.24083333333333,0.5,0.0013001083423618636,0.08633093525179857,320.5,8.867104520498744,0.10134685387415496,0,0,2,3
A1331,data analytics course,187.0,3115.0,184.61,12.0,3.0,0.016,1324.0,2024-11-30,hyderabad,mobile,learn data analytics,2024-11-30,30,11,5,48,False,0.016,0.06003210272873194,0.9872192513368985,15.384166666666667,0.25,0.0009630818619582664,0.06417112299465241,441.3333333333333,6.1718758463788514,0.13943353474320241,0,0,1,4
A1332,data analytics course,153.0,5886.0,218.33,29.0,3.0,0.02,1424.0,2024-11-20,hyderabad,mobile,analytics for data,2024-11-20,20,11,2,47,False,0.0196,0.02599388379204893,1.4269934640522877,7.528620689655173,0.10344827586206896,0.0005096839959225281,0.1895424836601307,474.6666666666667,5.522236980717262,0.15332162921348316,0,0,1,0
A1333,data analytics course,122.0,4929.0,192.72,10.0,10.0,0.082,1507.0,2024/11/12,hyderabad,desktop,data analytics training,2024-11-12,12,11,1,46,False,0.082,0.02475147088658957,1.579672131147541,19.272,1.0,0.002028809089064719,0.08196721311475409,150.7,6.819634703196347,0.12788321167883213,0,0,0,3
A1334,data analytics course,151.0,4357.0,238.69,28.0,9.0,0.06,1447.0,2024/11/13,hyderabad,tablet,analytics for data,2024-11-13,13,11,2,46,False,0.0596,0.03465687399586872,1.580728476821192,8.524642857142856,0.32142857142857145,0.0020656414964425065,0.18543046357615894,160.77777777777777,5.062256483304704,0.1649550794747754,0,0,2,0
A1335,data analytics course,116.0,4519.0,184.29,23.0,7.0,0.047,1070.0,2024-11-12,hyderabad,desktop,data analytics training,2024-11-12,12,11,1,46,True,0.0603,0.025669395884045144,1.5887068965517241,8.012608695652174,0.30434782608695654,0.001549015268864793,0.19827586206896552,152.85714285714286,4.806066525584677,0.17223364485981307,0,0,0,3
A1336,data analytics course,145.0,5612.0,207.34,22.0,4.0,0.028,1689.0,12-11-2024,hyderabad,desktop,learn data analytics,2024-12-11,11,12,2,50,False,0.0276,0.025837491090520314,1.4299310344827587,9.424545454545454,0.18181818181818182,0.0007127583749109052,0.15172413793103448,422.25,7.146040320246938,0.12275902901124926,0,0,0,4
A1337,data analytics course,90.0,3251.0,198.69,12.0,7.0,0.078,1044.0,30-11-2024,hyderabad,mobile,learn data analytics,2024-11-30,30,11,5,48,False,0.0778,0.027683789603199015,2.2076666666666664,16.5575,0.5833333333333334,0.002153183635804368,0.13333333333333333,149.14285714285714,4.254416427600785,0.190316091954023,0,0,1,4
A1338,data analytics course,133.0,3360.0,203.78,13.0,9.0,0.068,1654.0,2024/11/14,hyderabad,mobile,online data analytic,2024-11-14,14,11,3,46,False,0.0677,0.03958333333333333,1.5321804511278196,15.675384615384615,0.6923076923076923,0.0026785714285714286,0.09774436090225563,183.77777777777777,7.116596329374816,0.1232043530834341,0,0,1,5
A1339,data analytics course,135.0,5891.0,245.69,21.0,6.0,0.044,1947.0,2024/11/05,hyderabad,mobile,learn data analytics,2024-11-05,5,11,1,45,False,0.0444,0.022916313019860805,1.819925925925926,11.699523809523809,0.2857142857142857,0.0010185028008827025,0.15555555555555556,324.5,6.924620456673043,0.1261890087313816,0,0,1,4
A1340,data analytics course,155.0,5835.0,239.52,10.0,4.0,0.041,1507.0,2024-11-13,hyderabad,mobile,analytics for data,2024-11-13,13,11,2,46,True,0.0258,0.026563838903170524,1.5452903225806451,23.952,0.4,0.0006855184233076263,0.06451612903225806,376.75,5.291750167000668,0.1589382879893829,0,0,1,0
A1341,data analytics course,100.0,4928.0,186.68,22.0,10.0,0.1,1071.0,2024-11-23,hyderabad,mobile,analytics for data,2024-11-23,23,11,5,47,False,0.1,0.020292207792207792,1.8668,8.485454545454546,0.45454545454545453,0.002029220779220779,0.22,107.1,4.7370902078422965,0.1743043884220355,0,0,1,0
A1342,data analytics course,138.0,4049.0,182.66,20.0,7.0,0.051,1292.0,2024/11/20,hyderabad,mobile,online data analytic,2024-11-20,20,11,2,47,False,0.0507,0.03408248950358113,1.3236231884057972,9.133,0.35,0.001728821931341072,0.14492753623188406,184.57142857142858,6.073250848571115,0.14137770897832816,0,0,1,5
A1343,data analytics course,109.0,4114.0,243.33,18.0,6.0,0.044,1456.0,2024/11/25,hyderabad,tablet,learn data analytics,2024-11-25,25,11,0,48,True,0.055,0.026494895478852698,2.2323853211009177,13.518333333333334,0.3333333333333333,0.0014584346135148275,0.1651376146788991,242.66666666666666,4.983643611556323,0.16712225274725276,0,0,2,4
A1344,data analytics course,124.0,3947.0,198.11,11.0,4.0,0.032,1308.0,26-11-2024,hyderabad,mobile,data analytics course,2024-11-26,26,11,1,48,False,0.0323,0.03141626551811502,1.5976612903225809,18.01,0.36363636363636365,0.0010134279199391944,0.08870967741935484,327.0,5.602392610166068,0.15146024464831806,0,0,1,1
A1345,data analytics course,139.0,3705.0,239.26,25.0,7.0,0.047,1506.0,02-11-2024,hyderabad,tablet,online data analytic,2024-02-11,11,2,6,6,True,0.04665,0.03751686909581647,1.721294964028777,9.5704,0.28,0.0018893387314439945,0.17985611510791366,215.14285714285714,5.294407757251526,0.158871181938911,0,0,2,5
A1346,data analytics course,197.0,5365.0,208.86,14.0,4.0,0.031,1106.0,2024-11-01,hyderabad,tablet,data analytics training,2024-11-01,1,11,4,44,True,0.0203,0.03671947809878844,1.0602030456852793,14.918571428571429,0.2857142857142857,0.0007455731593662628,0.07106598984771574,276.5,4.295413195441922,0.18884267631103074,0,0,2,3
A1347,data analytics course,114.0,5213.0,224.65,26.0,4.0,0.035,1218.0,2024/11/29,hyderabad,tablet,online data analytic,2024-11-29,29,11,4,48,False,0.0351,0.021868405908306156,1.9706140350877193,8.640384615384615,0.15384615384615385,0.0007673124880107424,0.22807017543859648,304.5,4.421767193411974,0.1844417077175698,0,0,2,5
A1348,data analytics course,117.0,3951.0,212.02,16.0,5.0,0.052,1949.0,2024-11-10,hyderabad,desktop,data analytics training,2024-11-10,10,11,6,45,False,0.0427,0.029612756264236904,1.8121367521367522,13.25125,0.3125,0.0012655024044545685,0.13675213675213677,389.8,8.19252900669748,0.10878399179066188,0,0,0,3
A1349,data analytics course,198.0,3405.0,224.9,13.0,10.0,0.051,1631.0,2024-11-14,hyderabad,tablet,online data analytic,2024-11-14,14,11,3,46,False,0.0505,0.05814977973568282,1.135858585858586,17.3,0.7692307692307693,0.002936857562408223,0.06565656565656566,163.1,6.25211204979991,0.13789086450030658,0,0,2,5
A1350,data analytics course,160.0,5367.0,208.47,20.0,8.0,0.047,1853.0,15-11-2024,hyderabad,tablet,data analytics course,2024-11-15,15,11,4,46,True,0.05,0.029811812930873857,1.3029375,10.4235,0.4,0.001490590646543693,0.125,231.625,7.8885690986712715,0.11250404749055586,0,0,2,1
A1351,data analytics course,137.0,3602.0,194.55,23.0,5.0,0.036,1580.0,2024-11-02,hyderabad,tablet,data analytics course,2024-11-02,2,11,5,44,False,0.0365,0.038034425319267075,1.42007299270073,8.458695652173914,0.21739130434782608,0.00138811771238201,0.1678832116788321,316.0,7.1213055769725,0.12313291139240506,0,0,2,1
A1352,data analytics course,163.0,3917.0,209.01,10.0,3.0,0.047,1823.0,2024-11-17,hyderabad,tablet,data analytics training,2024-11-17,17,11,6,46,True,0.0184,0.04161347970385499,1.2822699386503067,20.901,0.3,0.0007658922644881287,0.06134969325153374,607.6666666666666,7.722070714319889,0.11465167306637411,0,0,2,3
A1353,data analytics course,138.0,5671.0,244.12,26.0,3.0,0.047,1507.0,13-11-2024,hyderabad,tablet,analytics for data,2024-11-13,13,11,2,46,True,0.0217,0.02433433256921178,1.768985507246377,9.38923076923077,0.11538461538461539,0.0005290072297654734,0.18840579710144928,502.3333333333333,5.173193511387843,0.1619907100199071,0,0,2,0
A1354,data analytics course,194.0,5019.0,227.67,28.0,7.0,0.036,1019.0,22-11-2024,hyderabad,mobile,learn data analytics,2024-11-22,22,11,4,47,False,0.0361,0.0386531181510261,1.1735567010309278,8.131071428571428,0.25,0.001394700139470014,0.14432989690721648,145.57142857142858,3.4757763429525195,0.2234249263984298,0,0,1,4
A1355,data analytics course,177.0,3569.0,190.31,13.0,8.0,0.035,1403.0,2024/11/25,hyderabad,mobile,online data analytic,2024-11-25,25,11,0,48,True,0.0452,0.04959372373213786,1.0751977401129944,14.63923076923077,0.6153846153846154,0.002241524236480807,0.07344632768361582,175.375,6.372182228994798,0.13564504632929436,0,0,1,5
A1356,data analytics course,113.0,3420.0,223.48,22.0,10.0,0.058,1138.0,2024/11/23,hyderabad,mobile,online data analytic,2024-11-23,23,11,5,47,True,0.0885,0.03304093567251462,1.9776991150442478,10.158181818181818,0.45454545454545453,0.0029239766081871343,0.19469026548672566,113.8,4.092178270986218,0.19637961335676624,0,0,1,5
A1357,data analytics course,133.0,3064.0,221.8,22.0,5.0,0.038,1538.0,2024-11-11,hyderabad,mobile,learn data analytics,2024-11-11,11,11,0,46,False,0.0376,0.04340731070496084,1.667669172932331,10.081818181818182,0.22727272727272727,0.0016318537859007832,0.16541353383458646,307.6,5.934174932371506,0.14421326397919376,0,0,1,4
A1358,data analytics course,118.0,3730.0,207.5,25.0,8.0,0.039,1011.0,2024-11-12,hyderabad,mobile,data analytics training,2024-11-12,12,11,1,46,True,0.0678,0.03163538873994638,1.7584745762711864,8.3,0.32,0.0021447721179624667,0.211864406779661,126.375,3.872289156626506,0.205242334322453,0,0,1,3
A1359,data analytics course,109.0,5852.0,235.44,20.0,5.0,0.046,1946.0,14-11-2024,hyderabad,desktop,analytics for data,2024-11-14,14,11,3,46,False,0.0459,0.01862611073137389,2.16,11.772,0.25,0.0008544087491455912,0.1834862385321101,389.2,7.26537546721033,0.12098663926002055,0,0,0,0
A1360,data analytics course,109.0,4011.0,184.51,13.0,6.0,0.053,1375.0,2024/11/23,hyderabad,desktop,data analytics online,2024-11-23,23,11,5,47,False,0.055,0.027175268012964347,1.6927522935779815,14.193076923076923,0.46153846153846156,0.0014958863126402393,0.11926605504587157,229.16666666666666,6.452170614058859,0.1341890909090909,0,0,0,2
A1361,data analytics course,128.0,4636.0,243.83,20.0,10.0,0.059,1941.0,02-11-2024,hyderabad,mobile,data analytics training,2024-02-11,11,2,6,6,True,0.0781,0.027610008628127698,1.904921875,12.191500000000001,0.5,0.0021570319240724763,0.15625,194.1,6.960464257884592,0.12562081401339517,0,0,1,3
A1362,data analytics course,181.0,3087.0,201.29,19.0,10.0,0.047,1507.0,20-11-2024,hyderabad,mobile,data analytics online,2024-11-20,20,11,2,47,True,0.0552,0.05863297700032394,1.1120994475138122,10.59421052631579,0.5263157894736842,0.003239390994493035,0.10497237569060773,150.7,6.486710715882558,0.13357000663570007,0,0,1,2
A1363,data analytics course,89.0,5872.0,198.32,14.0,6.0,0.067,1553.0,2024-11-20,hyderabad,mobile,online data analytic,2024-11-20,20,11,2,47,False,0.0674,0.015156675749318801,2.228314606741573,14.165714285714285,0.42857142857142855,0.0010217983651226157,0.15730337078651685,258.8333333333333,6.830778539733764,0.12770122343850612,0,0,1,5
A1364,data analytics course,157.0,5762.0,248.1,26.0,4.0,0.025,1999.0,2024/11/05,hyderabad,tablet,data analytics online,2024-11-05,5,11,1,45,False,0.0255,0.027247483512669212,1.5802547770700637,9.542307692307691,0.15384615384615385,0.0006942034015966678,0.16560509554140126,499.75,7.057234985892785,0.124112056028014,0,0,2,2
A1365,data analytics course,88.0,3396.0,193.79,19.0,5.0,0.057,1860.0,2024-11-18,hyderabad,mobile,online data analytic,2024-11-18,18,11,0,47,False,0.0568,0.02591283863368669,2.202159090909091,10.199473684210526,0.2631578947368421,0.0014723203769140165,0.2159090909090909,372.0,8.59801847360545,0.10418817204301074,0,0,1,5
A1366,data analytics course,130.0,3092.0,211.39,28.0,7.0,0.054,1031.0,2024/11/24,hyderabad,tablet,data analytics course,2024-11-24,24,11,6,47,False,0.0538,0.04204398447606727,1.626076923076923,7.549642857142857,0.25,0.002263906856403622,0.2153846153846154,147.28571428571428,3.8772411183121247,0.20503394762366633,0,0,2,1
A1367,data analytics course,194.0,4240.0,213.45,18.0,4.0,0.047,1890.0,2024-11-23,hyderabad,tablet,data analytics online,2024-11-23,23,11,5,47,True,0.0206,0.04575471698113207,1.1002577319587628,11.858333333333333,0.2222222222222222,0.0009433962264150943,0.09278350515463918,472.5,7.854532677442024,0.11293650793650793,0,0,2,2
A1368,data analytics course,180.0,4297.0,200.04,24.0,5.0,0.047,1050.0,2024/11/18,hyderabad,mobile,data analytics course,2024-11-18,18,11,0,47,True,0.0278,0.04188969048173144,1.1113333333333333,8.334999999999999,0.20833333333333334,0.0011636025133814289,0.13333333333333333,210.0,4.248950209958009,0.19051428571428572,0,0,1,1
A1369,data analytics course,139.0,5518.0,243.83,15.0,10.0,0.047,1862.0,2024/11/22,hyderabad,mobile,data analytics online,2024-11-22,22,11,4,47,True,0.04665,0.02519028633562885,1.7541726618705036,16.255333333333333,0.6666666666666666,0.001812250815512867,0.1079136690647482,186.2,6.636468031005209,0.13095059076262083,0,0,1,2
A1370,data analytics course,139.0,5039.0,235.44,24.0,7.0,0.047,1839.0,2024/11/08,hyderabad,desktop,data analytics online,2024-11-08,8,11,4,45,True,0.04665,0.027584838261559833,1.6938129496402878,9.81,0.2916666666666667,0.0013891645167692002,0.17266187050359713,262.7142857142857,6.810907237512742,0.12802610114192495,0,0,0,2
A1371,data analytics course,139.0,3596.0,210.31,23.0,9.0,0.047,1269.0,2024/11/01,hyderabad,tablet,online data analytic,2024-11-01,1,11,4,44,True,0.04665,0.038654060066740825,1.513021582733813,9.14391304347826,0.391304347826087,0.002502780867630701,0.16546762589928057,141.0,5.033949883505302,0.16572892040977147,0,0,2,5
A1372,data analytics course,118.0,4845.0,190.25,11.0,3.0,0.046,1446.0,2024/11/18,hyderabad,desktop,analytics for data,2024-11-18,18,11,0,47,True,0.0254,0.02435500515995872,1.6122881355932204,17.295454545454547,0.2727272727272727,0.0006191950464396285,0.09322033898305085,482.0,6.6005256241787125,0.13156984785615491,0,0,0,0
A1373,data analytics course,101.0,4883.0,237.89,11.0,6.0,0.047,1368.0,2024-11-14,hyderabad,desktop,analytics for data,2024-11-14,14,11,3,46,True,0.0594,0.02068400573417981,2.355346534653465,21.626363636363635,0.5454545454545454,0.0012287528158918697,0.10891089108910891,228.0,4.750556980116862,0.17389619883040935,0,0,0,0
A1374,data analytics course,120.0,4618.0,200.91,18.0,7.0,0.058,1775.0,2024-11-02,hyderabad,tablet,data analytics online,2024-11-02,2,11,5,44,False,0.0583,0.0259852750108272,1.67425,11.161666666666667,0.3888888888888889,0.0015158077089649198,0.15,253.57142857142858,7.83480165248121,0.11318873239436619,0,0,2,2
A1375,data analytics course,194.0,3941.0,240.35,27.0,10.0,0.052,1373.0,11-11-2024,hyderabad,desktop,data analytics course,2024-11-11,11,11,0,46,False,0.0515,0.04922608475006344,1.238917525773196,8.901851851851852,0.37037037037037035,0.002537427048972342,0.13917525773195877,137.3,4.712502600374455,0.17505462490895848,0,0,0,1
A1376,data analytics course,135.0,5096.0,230.32,14.0,4.0,0.03,1478.0,2024/11/18,hyderabad,mobile,data analytics training,2024-11-18,18,11,0,47,False,0.0296,0.026491365777080063,1.706074074074074,16.451428571428572,0.2857142857142857,0.0007849293563579278,0.1037037037037037,369.5,5.417158735672109,0.15583220568335587,0,0,1,3
A1377,data analytics course,190.0,5537.0,188.98,20.0,4.0,0.021,1989.0,2024/11/04,hyderabad,tablet,learn data analytics,2024-11-04,4,11,0,45,False,0.0211,0.03431461080007224,0.9946315789473684,9.449,0.2,0.0007224128589488893,0.10526315789473684,497.25,9.524923272303948,0.09501256913021619,0,0,2,4
A1378,data analytics course,198.0,4208.0,180.06,19.0,8.0,0.04,1462.0,2024-11-08,hyderabad,mobile,data analytics training,2024-11-08,8,11,4,45,False,0.0404,0.0470532319391635,0.9093939393939394,9.476842105263158,0.42105263157894735,0.0019011406844106464,0.09595959595959595,182.75,7.119515716983228,0.12316005471956225,0,0,1,3
A1379,data analytics course,87.0,5358.0,236.57,19.0,5.0,0.057,1141.0,2024/11/02,hyderabad,tablet,learn data analytics,2024-11-02,2,11,5,44,False,0.0575,0.016237402015677492,2.7191954022988507,12.451052631578946,0.2631578947368421,0.000933184023889511,0.21839080459770116,228.2,3.8230967578306636,0.20733567046450482,0,0,2,4
A1380,data analytics course,106.0,5583.0,218.81,13.0,3.0,0.028,1049.0,15-11-2024,hyderabad,desktop,data analytics course,2024-11-15,15,11,4,46,False,0.0283,0.018986208131828768,2.064245283018868,16.83153846153846,0.23076923076923078,0.0005373455131649651,0.12264150943396226,349.6666666666667,3.7941136145514376,0.20858913250714967,0,0,0,1
A1381,data analytics course,169.0,3069.0,227.7,12.0,5.0,0.03,1063.0,28-11-2024,hyderabad,mobile,data analytics course,2024-11-28,28,11,3,48,False,0.0296,0.05506679700228087,1.3473372781065087,18.974999999999998,0.4166666666666667,0.0016291951775822744,0.07100591715976332,212.6,3.668423364075538,0.21420507996237065,0,0,1,1
A1382,data analytics course,195.0,3738.0,202.08,18.0,7.0,0.047,1647.0,2024/11/16,hyderabad,tablet,online data analytic,2024-11-16,16,11,5,46,True,0.0359,0.0521669341894061,1.0363076923076924,11.226666666666667,0.3888888888888889,0.0018726591760299626,0.09230769230769231,235.28571428571428,7.1502375296912115,0.12269581056466303,0,0,2,5
A1383,data analytics course,161.0,4852.0,235.1,10.0,8.0,0.05,1738.0,2024-11-24,hyderabad,desktop,online data analytic,2024-11-24,24,11,6,47,False,0.0497,0.03318219291014015,1.4602484472049688,23.509999999999998,0.8,0.0016488046166529267,0.062111801242236024,217.25,6.392598894087623,0.13527042577675488,0,0,0,5
A1384,data analytics course,195.0,5120.0,249.6,26.0,3.0,0.015,1571.0,2024/11/04,hyderabad,mobile,data analytics training,2024-11-04,4,11,0,45,False,0.0154,0.0380859375,1.28,9.6,0.11538461538461539,0.0005859375,0.13333333333333333,523.6666666666666,5.294070512820514,0.15887969446212602,0,0,1,3
A1385,data analytics course,111.0,3550.0,231.81,10.0,9.0,0.081,1462.0,2024/11/26,hyderabad,mobile,data analytics training,2024-11-26,26,11,1,48,False,0.0811,0.03126760563380282,2.0883783783783785,23.181,0.9,0.0025352112676056337,0.09009009009009009,162.44444444444446,5.306889262758293,0.15855677154582765,0,0,1,3
A1386,data analytics course,124.0,5618.0,205.95,25.0,7.0,0.056,1374.0,19-11-2024,hyderabad,mobile,data analytics course,2024-11-19,19,11,1,47,False,0.0565,0.022071911712353152,1.6608870967741935,8.238,0.28,0.001245995016019936,0.20161290322580644,196.28571428571428,5.671522214129643,0.14989082969432313,0,0,1,1
A1387,data analytics course,89.0,4700.0,219.95,28.0,6.0,0.067,1493.0,2024/11/19,hyderabad,mobile,data analytics course,2024-11-19,19,11,1,47,False,0.0674,0.018936170212765956,2.4713483146067414,7.855357142857143,0.21428571428571427,0.001276595744680851,0.3146067415730337,248.83333333333334,5.787906342350534,0.1473208305425318,0,0,1,1
A1388,data analytics course,122.0,5874.0,201.04,10.0,7.0,0.047,1352.0,30-11-2024,hyderabad,desktop,data analytics course,2024-11-30,30,11,5,48,True,0.0574,0.02076949267960504,1.6478688524590164,20.104,0.7,0.001191692202928158,0.08196721311475409,193.14285714285714,5.725029844807004,0.148698224852071,0,0,0,1
A1389,data analytics course,177.0,5965.0,199.7,28.0,3.0,0.017,1090.0,2024-11-13,hyderabad,mobile,data analytics online,2024-11-13,13,11,2,46,False,0.0169,0.02967309304274937,1.1282485875706214,7.132142857142857,0.10714285714285714,0.0005029337803855825,0.15819209039548024,363.3333333333333,4.458187280921382,0.1832110091743119,0,0,1,2
A1390,data analytics course,163.0,5774.0,221.61,29.0,9.0,0.055,1396.0,2024/11/08,hyderabad,desktop,learn data analytics,2024-11-08,8,11,4,45,False,0.0552,0.028229996536196744,1.3595705521472394,7.6417241379310346,0.3103448275862069,0.0015587114651887772,0.17791411042944785,155.11111111111111,5.2993547222598245,0.1587464183381089,0,0,0,4
A1391,data analytics course,124.0,4079.0,189.07,18.0,3.0,0.024,1430.0,2024/11/23,hyderabad,desktop,data analytics course,2024-11-23,23,11,5,47,False,0.0242,0.030399607746996814,1.524758064516129,10.503888888888888,0.16666666666666666,0.0007354743809757293,0.14516129032258066,476.6666666666667,6.563336330459618,0.1322167832167832,0,0,0,1
A1392,data analytics course,105.0,3670.0,218.45,25.0,6.0,0.047,1650.0,2024/11/22,hyderabad,desktop,online data analytic,2024-11-22,22,11,4,47,True,0.0571,0.02861035422343324,2.0804761904761904,8.738,0.24,0.0016348773841961854,0.23809523809523808,275.0,6.553215838864729,0.1323939393939394,0,0,0,5
A1393,data analytics course,122.0,3394.0,214.965,20.0,4.0,0.047,1053.0,2024/11/03,hyderabad,mobile,data analytics online,2024-11-03,3,11,6,44,True,0.0328,0.03594578668238067,1.7620081967213115,10.74825,0.2,0.0011785503830288745,0.16393442622950818,263.25,3.8984718442537156,0.20414529914529914,0,0,1,2
A1394,data analytics course,166.0,5730.0,241.3,16.0,5.0,0.03,1507.0,2024/11/17,hyderabad,mobile,data analytics online,2024-11-17,17,11,6,46,False,0.0301,0.028970331588132635,1.4536144578313255,15.08125,0.3125,0.0008726003490401396,0.0963855421686747,301.4,5.245337753833402,0.16011944260119443,0,0,1,2
A1395,data analytics course,96.0,3761.0,196.45,10.0,5.0,0.035,1518.0,2024-11-30,hyderabad,tablet,online data analytic,2024-11-30,30,11,5,48,True,0.0521,0.02552512629619782,2.0463541666666667,19.645,0.5,0.0013294336612603031,0.10416666666666667,303.6,6.7271570374141,0.12941370223978918,0,0,2,5
A1396,data analytics course,135.0,4505.0,214.64,17.0,9.0,0.047,1500.0,06-11-2024,hyderabad,mobile,online data analytic,2024-06-11,11,6,1,24,True,0.0667,0.029966703662597113,1.5899259259259257,12.625882352941176,0.5294117647058824,0.001997780244173141,0.1259259259259259,166.66666666666666,5.988445769660828,0.14309333333333332,0,0,1,5
A1397,data analytics course,179.0,3975.0,183.25,14.0,3.0,0.017,1507.0,2024-11-06,hyderabad,tablet,data analytics course,2024-11-06,6,11,2,45,False,0.0168,0.0450314465408805,1.0237430167597765,13.089285714285714,0.21428571428571427,0.0007547169811320754,0.0782122905027933,502.3333333333333,7.223738062755798,0.12159920371599203,0,0,2,1
A1398,data analytics course,163.0,4520.0,206.46,14.0,3.0,0.047,1103.0,2024/11/12,hyderabad,tablet,learn data analytics,2024-11-12,12,11,1,46,True,0.0184,0.036061946902654865,1.2666257668711658,14.747142857142858,0.21428571428571427,0.000663716814159292,0.08588957055214724,367.6666666666667,4.342439213406955,0.1871804170444243,0,0,2,4
A1399,data analytics course,198.0,5883.0,214.965,19.0,9.0,0.045,1182.0,27-11-2024,hyderabad,mobile,data analytics online,2024-11-27,27,11,2,48,False,0.0455,0.033656297807241206,1.0856818181818182,11.313947368421053,0.47368421052631576,0.0015298317185109638,0.09595959595959595,131.33333333333334,4.498569534575396,0.18186548223350255,0,0,1,2
A1400,data analytics course,86.0,3555.0,225.23,11.0,6.0,0.035,1193.0,2024/11/11,hyderabad,desktop,data analytics training,2024-11-11,11,11,0,46,True,0.0698,0.02419127988748242,2.618953488372093,20.475454545454543,0.5454545454545454,0.0016877637130801688,0.12790697674418605,198.83333333333334,4.296807707676598,0.1887929589270746,0,0,0,3
A1401,data analytics course,89.0,3760.0,218.69,21.0,9.0,0.101,1474.0,25-11-2024,hyderabad,desktop,learn data analytics,2024-11-25,25,11,0,48,False,0.1011,0.023670212765957446,2.457191011235955,10.413809523809524,0.42857142857142855,0.0023936170212765957,0.23595505617977527,163.77777777777777,5.740134436874114,0.14836499321573948,0,0,0,4
A1402,data analytics course,118.0,3596.0,236.66,29.0,9.0,0.076,1154.0,2024/11/23,hyderabad,tablet,data analytics course,2024-11-23,23,11,5,47,False,0.0763,0.03281423804226919,2.0055932203389832,8.160689655172414,0.3103448275862069,0.002502780867630701,0.2457627118644068,128.22222222222223,3.8761936955970593,0.20507798960138648,0,0,2,1
A1403,data analytics course,139.0,3217.0,232.15,21.0,8.0,0.047,1726.0,21-11-2024,hyderabad,mobile,data analytics training,2024-11-21,21,11,3,47,True,0.04665,0.043207957724588124,1.6701438848920864,11.054761904761905,0.38095238095238093,0.0024867889337892445,0.1510791366906475,215.75,6.434848158518199,0.13450173812282734,0,0,1,3
A1404,data analytics course,95.0,5386.0,184.96,23.0,8.0,0.051,1045.0,20-11-2024,hyderabad,desktop,online data analytic,2024-11-20,20,11,2,47,True,0.0842,0.017638321574452283,1.9469473684210528,8.041739130434783,0.34782608695652173,0.0014853323431117712,0.24210526315789474,130.625,4.649870242214533,0.1769952153110048,0,0,0,5
A1405,data analytics course,144.0,5381.0,199.43,10.0,10.0,0.069,1085.0,2024-11-09,hyderabad,desktop,data analytics training,2024-11-09,9,11,5,45,False,0.0694,0.026760825125441368,1.3849305555555556,19.943,1.0,0.001858390633711206,0.06944444444444445,108.5,4.44050544050544,0.18380645161290324,0,0,0,3
A1406,data analytics course,107.0,5536.0,238.75,15.0,3.0,0.034,1822.0,2024/11/17,hyderabad,mobile,analytics for data,2024-11-17,17,11,6,46,False,0.028,0.019328034682080924,2.2313084112149535,15.916666666666666,0.2,0.000541907514450867,0.14018691588785046,607.3333333333334,6.631413612565445,0.13103732162458837,0,0,1,0
A1407,data analytics course,146.0,3165.0,211.09,16.0,7.0,0.048,1706.0,2024-11-08,hyderabad,mobile,learn data analytics,2024-11-08,8,11,4,45,False,0.0479,0.04612954186413902,1.4458219178082192,13.193125,0.4375,0.0022116903633491313,0.1095890410958904,243.71428571428572,7.081860817660714,0.12373388042203987,0,0,1,4
A1408,data analytics course,114.0,5217.0,247.94,11.0,10.0,0.088,1876.0,2024-11-18,hyderabad,desktop,data analytics online,2024-11-18,18,11,0,47,False,0.0877,0.02185163887291547,2.1749122807017542,22.54,0.9090909090909091,0.0019168104274487254,0.09649122807017543,187.6,6.566346696781479,0.1321641791044776,0,0,0,2
A1409,data analytics course,162.0,4301.0,223.77,21.0,7.0,0.043,1066.0,20-11-2024,hyderabad,mobile,learn data analytics,2024-11-20,20,11,2,47,False,0.0432,0.03766565914903511,1.3812962962962965,10.655714285714286,0.3333333333333333,0.0016275284817484307,0.12962962962962962,152.28571428571428,3.763819993743576,0.20991557223264543,0,0,1,4
A1410,data analytics course,95.0,5971.0,214.57,29.0,10.0,0.047,1539.0,2024-11-16,hyderabad,mobile,analytics for data,2024-11-16,16,11,5,46,True,0.1053,0.015910232791827166,2.2586315789473685,7.398965517241379,0.3448275862068966,0.0016747613465081226,0.30526315789473685,153.9,6.172484503891504,0.13942170240415855,0,0,1,0
A1411,data analytics course,163.0,5160.0,184.84,19.0,4.0,0.041,1773.0,2024/11/23,hyderabad,desktop,data analytics course,2024-11-23,23,11,5,47,True,0.0245,0.0315891472868217,1.1339877300613497,9.72842105263158,0.21052631578947367,0.0007751937984496124,0.1165644171779141,443.25,8.592079636442328,0.1042526790750141,0,0,0,1
A1412,data analytics course,148.0,5947.0,212.38,12.0,4.0,0.047,1294.0,2024/11/24,hyderabad,mobile,online data analytic,2024-11-24,24,11,6,47,True,0.027,0.024886497393643854,1.435,17.698333333333334,0.3333333333333333,0.0006726080376660501,0.08108108108108109,323.5,5.092852434315849,0.16412673879443584,0,0,1,5
A1413,data analytics course,156.0,4150.0,223.17,20.0,10.0,0.064,1940.0,14-11-2024,hyderabad,tablet,learn data analytics,2024-11-14,14,11,3,46,False,0.0641,0.037590361445783135,1.430576923076923,11.1585,0.5,0.0024096385542168677,0.1282051282051282,194.0,7.692924676255769,0.1150360824742268,0,0,2,4
A1414,data analytics course,99.0,4040.0,214.965,13.0,5.0,0.051,1502.0,2024-11-26,hyderabad,tablet,online data analytic,2024-11-26,26,11,1,48,False,0.0505,0.024504950495049506,2.1713636363636364,16.53576923076923,0.38461538461538464,0.0012376237623762376,0.13131313131313133,300.4,5.987183960179564,0.1431191744340879,0,0,2,5
A1415,data analytics course,124.0,5956.0,201.44,12.0,9.0,0.073,1598.0,2024-11-24,hyderabad,tablet,data analytics online,2024-11-24,24,11,6,47,False,0.0726,0.020819341840161182,1.624516129032258,16.786666666666665,0.75,0.0015110812625923438,0.0967741935483871,177.55555555555554,6.932883240667196,0.1260575719649562,0,0,2,2
A1416,data analytics course,138.0,4769.0,229.44,27.0,8.0,0.058,1507.0,19-11-2024,hyderabad,mobile,data analytics training,2024-11-19,19,11,1,47,False,0.058,0.028936884042776265,1.662608695652174,8.497777777777777,0.2962962962962963,0.001677500524218914,0.1956521739130435,188.375,5.568165969316596,0.152249502322495,0,0,1,3
A1417,data analytics course,140.0,3822.0,241.68,30.0,10.0,0.057,1138.0,2024/11/19,hyderabad,tablet,data analytics course,2024-11-19,19,11,1,47,True,0.0714,0.03663003663003663,1.7262857142857144,8.056000000000001,0.3333333333333333,0.0026164311878597592,0.21428571428571427,113.8,3.708705726580602,0.2123725834797891,0,0,2,1
A1418,data analytics course,81.0,3147.0,232.2,30.0,9.0,0.111,1066.0,2024-11-29,hyderabad,mobile,data analytics course,2024-11-29,29,11,4,48,False,0.1111,0.025738798856053385,2.8666666666666667,7.739999999999999,0.3,0.002859866539561487,0.37037037037037035,118.44444444444444,3.590869939707149,0.21782363977485927,0,0,1,1
A1419,data analytics course,165.0,4613.0,246.72,19.0,3.0,0.018,1055.0,2024/11/11,hyderabad,tablet,data analytics training,2024-11-11,11,11,0,46,False,0.0182,0.03576848038153046,1.4952727272727273,12.985263157894737,0.15789473684210525,0.0006503360069369175,0.11515151515151516,351.6666666666667,3.2761024643320362,0.23385781990521326,0,0,2,3
A1420,data analytics course,193.0,4919.0,247.24,19.0,4.0,0.021,1933.0,25-11-2024,hyderabad,desktop,data analytics online,2024-11-25,25,11,0,48,False,0.0207,0.039235616995324255,1.2810362694300519,13.012631578947369,0.21052631578947367,0.0008131734092295182,0.09844559585492228,483.25,6.818314188642614,0.1279048111743404,0,0,0,2
A1421,data analytics course,149.0,5205.0,218.42,20.0,4.0,0.047,1070.0,2024/11/28,hyderabad,mobile,online data analytic,2024-11-28,28,11,3,48,True,0.0268,0.02862632084534102,1.4659060402684563,10.921,0.2,0.0007684918347742555,0.1342281879194631,267.5,3.8988187894881423,0.20413084112149532,0,0,1,5
A1422,data analytics course,81.0,3497.0,226.66,11.0,6.0,0.074,1047.0,2024-11-19,hyderabad,mobile,data analytics online,2024-11-19,19,11,1,47,False,0.0741,0.023162710895052903,2.7982716049382717,20.605454545454545,0.5454545454545454,0.0017157563625965113,0.13580246913580246,174.5,3.6192535074561016,0.2164851957975167,0,0,1,2
A1423,data analytics course,153.0,4057.0,197.54,23.0,5.0,0.047,1926.0,22-11-2024,hyderabad,tablet,data analytics online,2024-11-22,22,11,4,47,True,0.0327,0.03771259551392655,1.291111111111111,8.588695652173913,0.21739130434782608,0.0012324377618930244,0.1503267973856209,385.2,8.749924066011948,0.10256490134994807,0,0,2,2
A1424,data analytics course,127.0,5018.0,194.25,17.0,8.0,0.047,1350.0,2024-11-21,hyderabad,mobile,data analytics online,2024-11-21,21,11,3,47,True,0.063,0.02530888800318852,1.529527559055118,11.426470588235293,0.47058823529411764,0.0015942606616181746,0.13385826771653545,168.75,5.94980694980695,0.1438888888888889,0,0,1,2
A1425,data analytics course,99.0,4012.0,220.76,14.0,4.0,0.04,1698.0,2024/11/12,hyderabad,tablet,data analytics training,2024-11-12,12,11,1,46,False,0.0404,0.024675972083748755,2.22989898989899,15.768571428571429,0.2857142857142857,0.0009970089730807576,0.1414141414141414,424.5,6.6916107990578,0.1300117785630153,0,0,2,3
A1426,data analytics course,104.0,3013.0,204.07,12.0,3.0,0.058,1016.0,2024/11/20,hyderabad,mobile,learn data analytics,2024-11-20,20,11,2,47,True,0.0288,0.0345170925987388,1.9622115384615384,17.00583333333333,0.25,0.0009956853634251576,0.11538461538461539,338.6666666666667,3.978683784975744,0.20085629921259843,0,0,1,4
A1427,data analytics course,118.0,3824.0,184.8,16.0,5.0,0.042,1818.0,2024-11-19,hyderabad,desktop,learn data analytics,2024-11-19,19,11,1,47,False,0.0424,0.03085774058577406,1.5661016949152544,11.55,0.3125,0.001307531380753138,0.13559322033898305,363.6,8.837662337662337,0.10165016501650166,0,0,0,4
A1428,data analytics course,148.0,5000.0,224.41,11.0,3.0,0.047,1491.0,2024/11/30,hyderabad,mobile,online data analytic,2024-11-30,30,11,5,48,True,0.0203,0.0296,1.5162837837837837,20.400909090909092,0.2727272727272727,0.0006,0.07432432432432433,497.0,5.644088944342943,0.15050972501676727,0,0,1,5
A1429,data analytics course,88.0,3804.0,249.2,10.0,8.0,0.038,1044.0,2024/11/09,hyderabad,tablet,data analytics training,2024-11-09,9,11,5,45,True,0.0909,0.023133543638275498,2.8318181818181816,24.919999999999998,0.8,0.002103049421661409,0.11363636363636363,130.5,3.189406099518459,0.23869731800766283,0,0,2,3
A1430,data analytics course,142.0,3791.0,207.86,23.0,4.0,0.028,1073.0,2024-11-20,hyderabad,tablet,data analytics online,2024-11-20,20,11,2,47,False,0.0282,0.03745713532049591,1.4638028169014086,9.037391304347826,0.17391304347826086,0.0010551305724083356,0.1619718309859155,268.25,4.162128355623977,0.19371854613233924,0,0,2,2
A1431,data analytics course,127.0,5198.0,242.56,26.0,6.0,0.047,1872.0,2024-11-16,hyderabad,tablet,learn data analytics,2024-11-16,16,11,5,46,False,0.0472,0.02443247402847249,1.9099212598425197,9.329230769230769,0.23076923076923078,0.0011542901115813775,0.2047244094488189,312.0,6.717678100263853,0.12957264957264958,0,0,2,4
A1432,data analytics course,117.0,5329.0,212.49,14.0,5.0,0.047,1888.0,2024/11/03,hyderabad,mobile,data analytics course,2024-11-03,3,11,6,44,True,0.0427,0.02195533871270407,1.8161538461538462,15.177857142857144,0.35714285714285715,0.0009382623381497466,0.11965811965811966,377.6,7.885124005835569,0.11254766949152543,0,0,1,1
A1433,data analytics course,125.0,5435.0,202.65,25.0,5.0,0.04,1767.0,2024-11-23,hyderabad,desktop,online data analytic,2024-11-23,23,11,5,47,False,0.04,0.022999080036798528,1.6212,8.106,0.2,0.0009199632014719411,0.2,353.4,7.719467061435973,0.11468590831918506,0,0,0,5
A1434,data analytics course,92.0,4977.0,209.78,26.0,3.0,0.047,1834.0,2024/11/12,hyderabad,tablet,learn data analytics,2024-11-12,12,11,1,46,True,0.0326,0.01848503114325899,2.280217391304348,8.068461538461538,0.11538461538461539,0.0006027727546714888,0.2826086956521739,611.3333333333334,7.742492134617218,0.11438386041439477,0,0,2,4
A1435,data analytics course,112.0,3850.0,233.52,14.0,8.0,0.033,1760.0,2024-11-22,hyderabad,desktop,data analytics course,2024-11-22,22,11,4,47,True,0.0714,0.02909090909090909,2.085,16.68,0.5714285714285714,0.002077922077922078,0.125,220.0,6.536827680712572,0.13268181818181818,0,0,0,1
A1436,data analytics course,144.0,5976.0,197.65,13.0,9.0,0.062,1743.0,2024/11/22,hyderabad,mobile,data analytics course,2024-11-22,22,11,4,47,False,0.0625,0.024096385542168676,1.3725694444444445,15.203846153846154,0.6923076923076923,0.0015060240963855422,0.09027777777777778,193.66666666666666,7.818618770554009,0.11339644291451521,0,0,1,1
A1437,data analytics course,103.0,4693.0,218.67,14.0,10.0,0.047,1390.0,2024/11/09,hyderabad,mobile,learn data analytics,2024-11-09,9,11,5,45,True,0.0971,0.021947581504368208,2.123009708737864,15.619285714285713,0.7142857142857143,0.002130833155763904,0.13592233009708737,139.0,5.356610417524123,0.1573165467625899,0,0,1,4
A1438,data analytics course,117.0,4367.0,233.27,24.0,3.0,0.047,1238.0,2024-11-24,hyderabad,tablet,learn data analytics,2024-11-24,24,11,6,47,True,0.0256,0.026791847950538128,1.9937606837606838,9.719583333333334,0.125,0.0006869704602702084,0.20512820512820512,412.6666666666667,4.307154799159772,0.18842487883683362,0,0,2,4
A1439,data analytics course,100.0,5481.0,180.72,14.0,7.0,0.07,1185.0,2024-11-02,hyderabad,desktop,analytics for data,2024-11-02,2,11,5,44,False,0.07,0.01824484583105273,1.8072,12.90857142857143,0.5,0.001277139208173691,0.14,169.28571428571428,5.557104913678619,0.15250632911392406,0,0,0,0
A1440,data analytics course,179.0,4109.0,191.84,19.0,4.0,0.022,1961.0,02-11-2024,hyderabad,tablet,online data analytic,2024-02-11,11,2,6,6,False,0.0223,0.04356291068386469,1.071731843575419,10.096842105263159,0.21052631578947367,0.0009734728644439036,0.10614525139664804,490.25,9.222060050041701,0.09782763895971443,0,0,2,5
A1441,data analytics course,180.0,3887.0,186.26,18.0,6.0,0.033,1048.0,05-11-2024,hyderabad,desktop,data analytics course,2024-05-11,11,5,5,19,False,0.0333,0.0463082068433239,1.0347777777777778,10.347777777777777,0.3333333333333333,0.0015436068947774634,0.1,174.66666666666666,4.626543541286374,0.1777290076335878,0,0,0,1
A1442,data analytics course,146.0,4633.0,186.07,26.0,3.0,0.021,1053.0,2024/11/25,hyderabad,desktop,data analytics training,2024-11-25,25,11,0,48,False,0.0205,0.03151305849341679,1.2744520547945204,7.156538461538461,0.11538461538461539,0.0006475285991797971,0.1780821917808219,351.0,4.659160530982964,0.17670465337132002,0,0,0,3
A1443,data analytics course,124.0,5353.0,239.69,13.0,4.0,0.032,1493.0,2024-11-19,hyderabad,desktop,learn data analytics,2024-11-19,19,11,1,47,False,0.0323,0.023164580609004295,1.9329838709677418,18.43769230769231,0.3076923076923077,0.0007472445357743321,0.10483870967741936,373.25,5.228878968667862,0.1605425318151373,0,0,0,4
A1444,data analytics course,169.0,5380.0,199.66,27.0,6.0,0.036,1059.0,2024/11/03,hyderabad,desktop,data analytics training,2024-11-03,3,11,6,44,False,0.0355,0.03141263940520446,1.1814201183431952,7.394814814814815,0.2222222222222222,0.0011152416356877324,0.15976331360946747,176.5,4.304016828608635,0.18853635505193578,0,0,0,3
A1445,data analytics course,91.0,5104.0,211.85,29.0,9.0,0.047,1309.0,2024-11-16,hyderabad,tablet,data analytics course,2024-11-16,16,11,5,46,True,0.0989,0.017829153605015673,2.3280219780219777,7.305172413793104,0.3103448275862069,0.0017633228840125393,0.31868131868131866,145.44444444444446,5.1789001652112345,0.16184110007639418,0,0,2,1
A1446,data analytics course,145.0,4520.0,236.03,24.0,8.0,0.047,1220.0,17-11-2024,hyderabad,desktop,online data analytic,2024-11-17,17,11,6,46,True,0.0552,0.032079646017699116,1.6277931034482758,9.834583333333333,0.3333333333333333,0.0017699115044247787,0.16551724137931034,152.5,4.168834470194467,0.1934672131147541,0,0,0,5
A1447,data analytics course,115.0,4345.0,229.71,15.0,4.0,0.047,1467.0,2024-11-26,hyderabad,mobile,data analytics course,2024-11-26,26,11,1,48,True,0.0348,0.026467203682393557,1.9974782608695654,15.314,0.26666666666666666,0.0009205983889528193,0.13043478260869565,366.75,5.386313177484654,0.15658486707566463,0,0,1,1
A1448,data analytics course,123.0,3527.0,239.31,21.0,3.0,0.024,1536.0,04-11-2024,hyderabad,tablet,analytics for data,2024-04-11,11,4,3,15,False,0.0244,0.03487383045080805,1.945609756097561,11.395714285714286,0.14285714285714285,0.0008505812305075135,0.17073170731707318,512.0,5.418453052526012,0.15580078125,0,0,2,0
A1449,data analytics course,101.0,3330.0,209.8,19.0,10.0,0.099,1296.0,2024-11-14,hyderabad,mobile,data analytics training,2024-11-14,14,11,3,46,False,0.099,0.03033033033033033,2.0772277227722773,11.042105263157895,0.5263157894736842,0.003003003003003003,0.18811881188118812,129.6,5.177311725452812,0.16188271604938273,0,0,1,3
A1450,data analytics course,141.0,3913.0,245.32,21.0,3.0,0.056,1904.0,2024/11/15,hyderabad,desktop,analytics for data,2024-11-15,15,11,4,46,True,0.0213,0.03603373370815231,1.7398581560283688,11.681904761904761,0.14285714285714285,0.0007666751852798365,0.14893617021276595,634.6666666666666,6.761291374531225,0.12884453781512606,0,0,0,0
A1451,data analytics course,160.0,4597.0,211.88,21.0,4.0,0.025,1507.0,2024/11/21,hyderabad,desktop,data analytics training,2024-11-21,21,11,3,47,False,0.025,0.03480530780944094,1.32425,10.08952380952381,0.19047619047619047,0.0008701326952360235,0.13125,376.75,6.112516518784217,0.14059721300597214,0,0,0,3
A1452,data analytics course,105.0,3008.0,206.91,21.0,4.0,0.038,1009.0,2024-11-10,hyderabad,desktop,online data analytic,2024-11-10,10,11,6,45,False,0.0381,0.03490691489361702,1.9705714285714286,9.852857142857143,0.19047619047619047,0.0013297872340425532,0.2,252.25,3.8765163597699486,0.20506442021803767,0,0,0,5
A1453,data analytics course,178.0,5318.0,207.05,18.0,4.0,0.031,1421.0,2024-11-20,hyderabad,desktop,data analytics online,2024-11-20,20,11,2,47,False,0.0225,0.033471229785633695,1.1632022471910113,11.502777777777778,0.2222222222222222,0.000752162467092892,0.10112359550561797,355.25,5.863076551557595,0.14570724841660804,0,0,0,2
A1454,data analytics course,189.0,5244.0,242.18,29.0,3.0,0.016,1080.0,2024-11-07,hyderabad,mobile,analytics for data,2024-11-07,7,11,3,45,False,0.0159,0.036041189931350116,1.2813756613756615,8.351034482758621,0.10344827586206896,0.0005720823798627002,0.15343915343915343,360.0,3.4594929391361795,0.22424074074074074,0,0,1,0
A1455,data analytics course,114.0,4804.0,249.33,14.0,6.0,0.053,1879.0,05-11-2024,hyderabad,mobile,data analytics course,2024-05-11,11,5,5,19,False,0.0526,0.02373022481265612,2.187105263157895,17.809285714285714,0.42857142857142855,0.0012489592006661116,0.12280701754385964,313.1666666666667,6.53619700798139,0.1326929217668973,0,0,1,1
A1456,data analytics course,160.0,5920.0,201.3,30.0,7.0,0.047,1080.0,2024/11/18,hyderabad,tablet,data analytics course,2024-11-18,18,11,0,47,False,0.0437,0.02702702702702703,1.2581250000000002,6.71,0.23333333333333334,0.0011824324324324325,0.1875,154.28571428571428,4.365126676602086,0.1863888888888889,0,0,2,1
A1457,data analytics course,101.0,5280.0,234.72,18.0,9.0,0.047,1046.0,27-11-2024,hyderabad,tablet,data analytics course,2024-11-27,27,11,2,48,True,0.0891,0.019128787878787877,2.323960396039604,13.04,0.5,0.0017045454545454545,0.1782178217821782,116.22222222222223,3.456373551465576,0.22439770554493307,0,0,2,1
A1458,data analytics course,146.0,3887.0,206.59,26.0,9.0,0.062,1042.0,07-11-2024,hyderabad,desktop,online data analytic,2024-07-11,11,7,3,28,False,0.0616,0.03756110110625161,1.415,7.945769230769231,0.34615384615384615,0.002315410342166195,0.1780821917808219,115.77777777777777,4.043806573406264,0.19826295585412668,0,0,0,5
A1459,data analytics course,128.0,4532.0,183.28,11.0,7.0,0.047,1571.0,25-11-2024,hyderabad,desktop,data analytics training,2024-11-25,25,11,0,48,True,0.04665,0.02824360105913504,1.431875,16.66181818181818,0.6363636363636364,0.0015445719329214476,0.0859375,224.42857142857142,7.57158446093409,0.11666454487587524,0,0,0,3
A1460,data analytics course,163.0,4125.0,246.09,27.0,5.0,0.031,1910.0,2024/11/27,hyderabad,mobile,learn data analytics,2024-11-27,27,11,2,48,False,0.0307,0.03951515151515152,1.5097546012269938,9.114444444444445,0.18518518518518517,0.0012121212121212121,0.1656441717791411,382.0,6.761388110041042,0.12884293193717278,0,0,1,4
A1461,data analytics course,193.0,5571.0,213.5,19.0,8.0,0.059,1754.0,28-11-2024,hyderabad,mobile,analytics for data,2024-11-28,28,11,3,48,True,0.0415,0.03464369054029797,1.1062176165803108,11.236842105263158,0.42105263157894735,0.0014360078980434393,0.09844559585492228,219.25,7.215456674473068,0.1217217787913341,0,0,1,0
A1462,data analytics course,179.0,4309.0,237.62,21.0,7.0,0.039,1719.0,2024/11/14,hyderabad,mobile,data analytics course,2024-11-14,14,11,3,46,False,0.0391,0.041540960779763283,1.327486033519553,11.315238095238096,0.3333333333333333,0.0016245068461359943,0.11731843575418995,245.57142857142858,6.234239542126084,0.13823152995927865,0,0,1,1
A1463,data analytics course,86.0,5538.0,223.13,22.0,7.0,0.037,1544.0,2024/11/30,hyderabad,tablet,data analytics training,2024-11-30,30,11,5,48,True,0.0814,0.015529071867100036,2.59453488372093,10.142272727272728,0.3181818181818182,0.0012639942217407005,0.2558139534883721,220.57142857142858,5.919732891139694,0.1445142487046632,0,0,2,3
A1464,data analytics course,92.0,3162.0,202.76,25.0,5.0,0.047,1577.0,01-11-2024,hyderabad,mobile,data analytics training,2024-01-11,11,1,3,2,True,0.0543,0.0290955091714105,2.2039130434782606,8.1104,0.2,0.0015812776723592662,0.2717391304347826,315.4,6.7776681791280335,0.12857324032974002,0,0,1,3
A1465,data analytics course,125.0,5811.0,194.92,14.0,7.0,0.03,1507.0,2024/11/22,hyderabad,tablet,data analytics training,2024-11-22,22,11,4,47,True,0.04665,0.021510927551196008,1.5593599999999999,13.922857142857142,0.5,0.0012046119428669765,0.112,215.28571428571428,6.7313769751693,0.12934306569343065,0,0,2,3
A1466,data analytics course,147.0,3112.0,206.74,12.0,8.0,0.054,1815.0,18-11-2024,hyderabad,mobile,data analytics course,2024-11-18,18,11,0,47,False,0.0544,0.04723650385604113,1.4063945578231294,17.228333333333335,0.6666666666666666,0.002570694087403599,0.08163265306122448,226.875,7.779142884782819,0.11390633608815427,0,0,1,1
A1467,data analytics course,143.0,4492.0,188.98,13.0,3.0,0.056,1507.0,2024/11/09,hyderabad,mobile,online data analytic,2024-11-09,9,11,5,45,True,0.021,0.031834372217275156,1.3215384615384616,14.536923076923076,0.23076923076923078,0.0006678539626001781,0.09090909090909091,502.3333333333333,6.974388824214203,0.1254014598540146,0,0,1,5
A1468,data analytics course,181.0,4520.0,208.33,22.0,8.0,0.044,1932.0,2024-11-05,hyderabad,tablet,online data analytic,2024-11-05,5,11,1,45,False,0.0442,0.04004424778761062,1.1509944751381216,9.469545454545456,0.36363636363636365,0.0017699115044247787,0.12154696132596685,241.5,8.27374837997408,0.1078312629399586,0,0,2,5
A1469,data analytics course,164.0,3872.0,210.53,12.0,5.0,0.03,1532.0,2024/11/12,hyderabad,tablet,data analytics online,2024-11-12,12,11,1,46,False,0.0305,0.042355371900826444,1.283719512195122,17.544166666666666,0.4166666666666667,0.0012913223140495868,0.07317073170731707,306.4,6.2768726547285425,0.13742167101827676,0,0,2,2
A1470,data analytics course,199.0,4255.0,212.84,14.0,6.0,0.054,1125.0,2024/11/22,hyderabad,desktop,learn data analytics,2024-11-22,22,11,4,47,True,0.0302,0.04676850763807285,1.0695477386934673,15.202857142857143,0.42857142857142855,0.001410105757931845,0.07035175879396985,187.5,4.28566059011464,0.18919111111111112,0,0,0,4
A1471,data analytics course,83.0,4520.0,229.97,12.0,8.0,0.096,2000.0,30-11-2024,hyderabad,desktop,analytics for data,2024-11-30,30,11,5,48,False,0.0964,0.01836283185840708,2.770722891566265,19.164166666666667,0.6666666666666666,0.0017699115044247787,0.14457831325301204,250.0,7.69678653737444,0.114985,0,0,0,0
A1472,data analytics course,150.0,5619.0,191.89,23.0,6.0,0.04,1735.0,2024/11/19,hyderabad,desktop,data analytics training,2024-11-19,19,11,1,47,False,0.04,0.026695141484249868,1.2792666666666666,8.343043478260869,0.2608695652173913,0.0010678056593699946,0.15333333333333332,289.1666666666667,8.041638438688834,0.1105994236311239,0,0,0,3
A1473,data analytics course,171.0,5157.0,183.26,24.0,9.0,0.046,1430.0,09-11-2024,hyderabad,desktop,data analytics online,2024-09-11,11,9,2,37,False,0.0526,0.03315881326352531,1.0716959064327485,7.635833333333333,0.375,0.0017452006980802793,0.14035087719298245,158.88888888888889,6.803121248499401,0.12815384615384615,0,0,0,2
A1474,data analytics course,139.0,4871.0,211.4,25.0,9.0,0.065,1247.0,2024-11-29,hyderabad,mobile,data analytics training,2024-11-29,29,11,4,48,False,0.0647,0.028536234859371793,1.5208633093525181,8.456,0.36,0.0018476698829809075,0.17985611510791366,138.55555555555554,4.898770104068117,0.16952686447473939,0,0,1,3
A1475,data analytics course,117.0,5863.0,224.69,24.0,10.0,0.054,1580.0,16-11-2024,hyderabad,mobile,data analytics online,2024-11-16,16,11,5,46,True,0.0855,0.019955654101995565,1.9204273504273504,9.362083333333333,0.4166666666666667,0.0017056114617090227,0.20512820512820512,158.0,6.031910632426899,0.14220886075949368,0,0,1,2
A1476,data analytics course,196.0,3205.0,188.82,24.0,8.0,0.041,1837.0,24-11-2024,hyderabad,desktop,data analytics course,2024-11-24,24,11,6,47,False,0.0408,0.06115444617784711,0.9633673469387755,7.8675,0.3333333333333333,0.0024960998439937598,0.12244897959183673,229.625,8.728842283656393,0.10278715296679368,0,0,0,1
A1477,data analytics course,184.0,5463.0,224.58,30.0,6.0,0.033,1565.0,2024/11/26,hyderabad,tablet,data analytics training,2024-11-26,26,11,1,48,False,0.0326,0.03368112758557569,1.2205434782608697,7.486000000000001,0.2,0.001098297638660077,0.16304347826086957,260.8333333333333,5.9685635408317745,0.14350159744408947,0,0,2,3
A1478,data analytics course,103.0,5667.0,232.48,26.0,8.0,0.047,1888.0,2024/11/16,hyderabad,tablet,learn data analytics,2024-11-16,16,11,5,46,True,0.0777,0.01817540144697371,2.257087378640777,8.94153846153846,0.3076923076923077,0.0014116816657843657,0.2524271844660194,236.0,7.121128699242946,0.12313559322033897,0,0,2,4
A1479,data analytics course,120.0,4666.0,180.72,30.0,3.0,0.053,1627.0,2024/11/24,hyderabad,mobile,analytics for data,2024-11-24,24,11,6,47,True,0.025,0.02571795970852979,1.506,6.024,0.1,0.0006429489927132448,0.25,542.3333333333334,8.002877379371403,0.11107559926244621,0,0,1,0
A1480,data analytics course,148.0,3632.0,214.46,28.0,10.0,0.047,1589.0,2024/11/18,hyderabad,mobile,data analytics training,2024-11-18,18,11,0,47,True,0.0676,0.040748898678414094,1.4490540540540542,7.659285714285715,0.35714285714285715,0.0027533039647577094,0.1891891891891892,158.9,6.409307096894525,0.13496538703587163,0,0,1,3
A1481,data analytics course,80.0,3834.0,181.22,15.0,3.0,0.037,1270.0,22-11-2024,hyderabad,tablet,learn data analytics,2024-11-22,22,11,4,47,False,0.0375,0.020865936358894107,2.26525,12.081333333333333,0.2,0.000782472613458529,0.1875,423.3333333333333,6.008056505904426,0.14269291338582676,0,0,2,4
A1482,data analytics course,168.0,3934.0,246.09,24.0,6.0,0.041,1592.0,24-11-2024,hyderabad,tablet,data analytics online,2024-11-24,24,11,6,47,False,0.0357,0.042704626334519574,1.4648214285714285,10.25375,0.25,0.001525165226232842,0.14285714285714285,265.3333333333333,5.469177943028973,0.15457914572864323,0,0,2,2
A1483,data analytics course,136.0,5724.0,218.37,25.0,10.0,0.074,1268.0,2024-11-18,hyderabad,desktop,data analytics course,2024-11-18,18,11,0,47,False,0.0735,0.023759608665269043,1.6056617647058824,8.7348,0.4,0.0017470300489168414,0.18382352941176472,126.8,4.8066584237761605,0.17221608832807572,0,0,0,1
A1484,data analytics course,86.0,4763.0,243.78,11.0,8.0,0.093,1770.0,13-11-2024,hyderabad,mobile,learn data analytics,2024-11-13,13,11,2,46,False,0.093,0.018055847155154313,2.834651162790698,22.16181818181818,0.7272727272727273,0.001679613688851564,0.12790697674418605,221.25,6.260644843711543,0.13772881355932204,0,0,1,4
A1485,data analytics course,175.0,3095.0,236.86,22.0,4.0,0.023,1617.0,2024/11/20,hyderabad,mobile,analytics for data,2024-11-20,20,11,2,47,False,0.0229,0.05654281098546042,1.3534857142857144,10.766363636363637,0.18181818181818182,0.0012924071082390954,0.12571428571428572,404.25,5.826817529342226,0.14648113790970935,0,0,1,0
A1486,data analytics course,173.0,5554.0,185.09,22.0,4.0,0.023,1000.0,2024-11-01,hyderabad,desktop,data analytics course,2024-11-01,1,11,4,44,False,0.0231,0.031148721642059778,1.0698843930635837,8.413181818181819,0.18181818181818182,0.0007202016564638099,0.12716763005780346,250.0,4.402777027392079,0.18509,0,0,0,1
A1487,data analytics course,192.0,3407.0,223.29,29.0,9.0,0.047,1538.0,2024/11/25,hyderabad,tablet,data analytics training,2024-11-25,25,11,0,48,False,0.0469,0.05635456413266804,1.1629687499999999,7.6996551724137925,0.3103448275862069,0.0026416201937188143,0.15104166666666666,170.88888888888889,5.887903623091048,0.14518205461638492,0,0,2,3
A1488,data analytics course,190.0,4465.0,241.38,28.0,5.0,0.026,1910.0,2024/11/04,hyderabad,desktop,analytics for data,2024-11-04,4,11,0,45,False,0.0263,0.0425531914893617,1.270421052631579,8.620714285714286,0.17857142857142858,0.0011198208286674132,0.14736842105263157,382.0,6.912834534758471,0.12637696335078533,0,0,0,0
A1489,data analytics course,161.0,3311.0,221.64,16.0,5.0,0.031,1006.0,02-11-2024,hyderabad,tablet,online data analytic,2024-02-11,11,2,6,6,False,0.0311,0.048625792811839326,1.376645962732919,13.8525,0.3125,0.0015101177891875567,0.09937888198757763,201.2,3.5388918967695364,0.22031809145129222,0,0,2,5
A1490,data analytics course,197.0,3265.0,200.4,15.0,3.0,0.015,1882.0,01-11-2024,hyderabad,mobile,learn data analytics,2024-01-11,11,1,3,2,False,0.0152,0.06033690658499234,1.017258883248731,13.360000000000001,0.2,0.0009188361408882082,0.07614213197969544,627.3333333333334,8.391217564870258,0.10648246546227418,0,0,1,4
A1491,data analytics course,80.0,4969.0,210.7,25.0,3.0,0.037,1146.0,2024-11-05,hyderabad,tablet,analytics for data,2024-11-05,5,11,1,45,False,0.0375,0.016099818877037632,2.63375,8.427999999999999,0.12,0.0006037432078889113,0.3125,382.0,4.4390128144280965,0.18385689354275742,0,0,2,0
A1492,data analytics course,145.0,5368.0,200.88,14.0,4.0,0.028,1125.0,2024/11/27,hyderabad,tablet,learn data analytics,2024-11-27,27,11,2,48,False,0.0276,0.027011922503725784,1.3853793103448275,14.348571428571429,0.2857142857142857,0.0007451564828614009,0.09655172413793103,281.25,4.600358422939069,0.17856,0,0,2,4
A1493,data analytics course,90.0,5851.0,232.94,22.0,8.0,0.089,1421.0,2024-11-28,hyderabad,desktop,learn data analytics,2024-11-28,28,11,3,48,False,0.0889,0.015381985985301657,2.588222222222222,10.588181818181818,0.36363636363636365,0.001367287643137925,0.24444444444444444,177.625,5.100283334764317,0.163926812104152,0,0,0,4
A1494,data analytics course,109.0,4884.0,228.13,11.0,8.0,0.047,1680.0,2024/11/15,hyderabad,desktop,data analytics training,2024-11-15,15,11,4,46,True,0.0734,0.02231777231777232,2.092935779816514,20.73909090909091,0.7272727272727273,0.001638001638001638,0.10091743119266056,210.0,6.364222154034979,0.13579166666666667,0,0,0,3
A1495,data analytics course,130.0,5719.0,214.965,10.0,5.0,0.03,1208.0,2024/11/23,hyderabad,desktop,analytics for data,2024-11-23,23,11,5,47,False,0.0385,0.0227312467214548,1.653576923076923,21.4965,0.5,0.0008742787200559538,0.07692307692307693,241.6,4.619519456655734,0.17795115894039734,0,0,0,0
A1496,data analytics course,179.0,5828.0,247.84,15.0,4.0,0.022,1127.0,2024/11/14,hyderabad,mobile,analytics for data,2024-11-14,14,11,3,46,False,0.0223,0.03071379547014413,1.3845810055865921,16.522666666666666,0.26666666666666666,0.0006863417982155113,0.08379888268156424,281.75,3.5472885732730792,0.21991126885536824,0,0,1,0
A1497,data analytics course,181.0,4935.0,239.29,15.0,5.0,0.03,1497.0,09-11-2024,hyderabad,desktop,data analytics training,2024-09-11,11,9,2,37,False,0.0276,0.03667679837892604,1.3220441988950276,15.952666666666666,0.3333333333333333,0.0010131712259371835,0.08287292817679558,299.4,5.256007355092148,0.15984635938543754,0,0,0,3
A1498,data analytics course,188.0,4491.0,201.73,24.0,7.0,0.037,1906.0,2024-11-21,hyderabad,mobile,online data analytic,2024-11-21,21,11,3,47,False,0.0372,0.04186150077933645,1.073031914893617,8.405416666666666,0.2916666666666667,0.0015586729013582722,0.1276595744680851,272.2857142857143,8.448272443364894,0.10583945435466946,0,0,1,5
A1499,data analytics course,139.0,3659.0,189.09,16.0,4.0,0.029,1892.0,2024/11/29,hyderabad,desktop,data analytics training,2024-11-29,29,11,4,48,False,0.0288,0.03798852145394917,1.3603597122302158,11.818125,0.25,0.0010931948619841486,0.11510791366906475,473.0,9.005817335660268,0.09994186046511629,0,0,0,3
A1500,data analytics course,99.0,4809.0,210.6,24.0,8.0,0.081,1507.0,13-11-2024,hyderabad,mobile,data analytics course,2024-11-13,13,11,2,46,False,0.0808,0.020586400499064253,2.1272727272727274,8.775,0.3333333333333333,0.0016635475150758993,0.24242424242424243,188.375,6.155745489078823,0.13974784339747842,0,0,1,1
A1501,data analytics course,95.0,5844.0,211.95,10.0,9.0,0.095,1444.0,2024/11/08,hyderabad,tablet,learn data analytics,2024-11-08,8,11,4,45,False,0.0947,0.01625598904859685,2.2310526315789474,21.195,0.9,0.001540041067761807,0.10526315789473684,160.44444444444446,5.812927577258788,0.1467797783933518,0,0,2,4
A1502,data analytics course,131.0,5559.0,214.965,28.0,5.0,0.035,1604.0,2024/11/29,hyderabad,desktop,analytics for data,2024-11-29,29,11,4,48,False,0.0382,0.02356538945853571,1.6409541984732825,7.677321428571429,0.17857142857142858,0.0008994423457456377,0.21374045801526717,320.8,6.461679808340893,0.13401807980049876,0,0,0,0
A1503,data analytics course,190.0,4630.0,217.6,27.0,4.0,0.047,1900.0,2024/11/23,hyderabad,tablet,data analytics training,2024-11-23,23,11,5,47,True,0.0211,0.04103671706263499,1.1452631578947368,8.059259259259258,0.14814814814814814,0.0008639308855291577,0.14210526315789473,475.0,7.731617647058824,0.11452631578947368,0,0,2,3
A1504,data analytics course,123.0,3340.0,225.16,23.0,8.0,0.047,1563.0,2024-11-26,hyderabad,mobile,online data analytic,2024-11-26,26,11,1,48,True,0.065,0.03682634730538922,1.830569105691057,9.789565217391305,0.34782608695652173,0.0023952095808383233,0.18699186991869918,195.375,5.941730325102149,0.14405630198336533,0,0,1,5
A1505,data analytics course,97.0,3330.0,182.98,15.0,3.0,0.031,1102.0,2024-11-14,hyderabad,tablet,data analytics online,2024-11-14,14,11,3,46,False,0.0309,0.029129129129129128,1.8863917525773195,12.198666666666666,0.2,0.0009009009009009009,0.15463917525773196,367.3333333333333,5.022516121980544,0.16604355716878402,0,0,2,2
A1506,data analytics course,164.0,3117.0,198.53,25.0,5.0,0.047,1749.0,2024-11-29,hyderabad,mobile,analytics for data,2024-11-29,29,11,4,48,True,0.0305,0.05261469361565608,1.2105487804878048,7.9412,0.2,0.0016041065126724415,0.1524390243902439,349.8,7.809751674809853,0.11351057747284163,0,0,1,0
A1507,data analytics course,134.0,3562.0,247.59,24.0,10.0,0.075,1295.0,01-11-2024,hyderabad,tablet,analytics for data,2024-01-11,11,1,3,2,False,0.0746,0.037619314991577765,1.8476865671641791,10.31625,0.4166666666666667,0.002807411566535654,0.1791044776119403,129.5,4.230421260955612,0.1911891891891892,0,0,2,0
A1508,data analytics course,117.0,5144.0,221.76,23.0,3.0,0.038,1338.0,2024/11/11,hyderabad,mobile,analytics for data,2024-11-11,11,11,0,46,True,0.0256,0.022744945567651633,1.8953846153846152,9.641739130434782,0.13043478260869565,0.0005832037325038881,0.19658119658119658,446.0,5.033549783549784,0.16573991031390134,0,0,1,0
A1509,data analytics course,168.0,4375.0,214.965,19.0,8.0,0.048,1267.0,2024-11-06,hyderabad,mobile,online data analytic,2024-11-06,6,11,2,45,False,0.0476,0.0384,1.2795535714285715,11.313947368421053,0.42105263157894735,0.0018285714285714285,0.1130952380952381,158.375,4.893982741376504,0.16966456195737964,0,0,1,5
A1510,data analytics course,173.0,3328.0,224.17,15.0,10.0,0.043,1904.0,2024-11-28,hyderabad,mobile,online data analytic,2024-11-28,28,11,3,48,True,0.0578,0.05198317307692308,1.2957803468208091,14.944666666666667,0.6666666666666666,0.0030048076923076925,0.08670520231213873,190.4,7.493553999197038,0.11773634453781512,0,0,1,5
A1511,data analytics course,158.0,4336.0,238.29,26.0,9.0,0.052,1245.0,2024-11-30,hyderabad,tablet,online data analytic,2024-11-30,30,11,5,48,False,0.057,0.03643911439114391,1.5081645569620252,9.165,0.34615384615384615,0.0020756457564575647,0.16455696202531644,138.33333333333334,4.224726173989676,0.19139759036144577,0,0,2,5
A1512,data analytics course,135.0,5063.0,195.58,22.0,6.0,0.044,1507.0,29-11-2024,hyderabad,tablet,learn data analytics,2024-11-29,29,11,4,48,False,0.0444,0.02666403318190796,1.4487407407407409,8.89,0.2727272727272727,0.0011850681414181316,0.16296296296296298,251.16666666666666,6.705286839145106,0.12978102189781024,0,0,2,4
A1513,data analytics course,182.0,5993.0,214.965,19.0,3.0,0.047,1254.0,19-11-2024,hyderabad,desktop,data analytics training,2024-11-19,19,11,1,47,True,0.0165,0.03036876355748373,1.1811263736263737,11.313947368421053,0.15789473684210525,0.0005005840146837978,0.1043956043956044,418.0,4.833507780336334,0.17142344497607656,0,0,0,3
A1514,data analytics course,83.0,3926.0,237.07,22.0,5.0,0.06,1667.0,2024-11-07,hyderabad,mobile,analytics for data,2024-11-07,7,11,3,45,False,0.0602,0.021141110545084055,2.856265060240964,10.77590909090909,0.22727272727272727,0.0012735608762098828,0.26506024096385544,333.4,6.031678407221496,0.1422135572885423,0,0,1,0
A1515,data analytics course,85.0,5570.0,221.73,14.0,7.0,0.047,1292.0,29-11-2024,hyderabad,tablet,data analytics online,2024-11-29,29,11,4,48,True,0.0824,0.01526032315978456,2.6085882352941177,15.837857142857143,0.5,0.0012567324955116697,0.16470588235294117,184.57142857142858,4.8269065981148245,0.1716176470588235,0,0,2,2
A1516,data analytics course,98.0,5571.0,208.4,15.0,7.0,0.071,1890.0,14-11-2024,hyderabad,desktop,analytics for data,2024-11-14,14,11,3,46,False,0.0714,0.01759109675103213,2.126530612244898,13.893333333333334,0.4666666666666667,0.0012565069107880094,0.15306122448979592,270.0,8.069097888675623,0.11026455026455027,0,0,0,0
A1517,data analytics course,151.0,5700.0,182.27,13.0,3.0,0.054,1255.0,2024-11-23,hyderabad,mobile,data analytics course,2024-11-23,23,11,5,47,True,0.0199,0.026491228070175437,1.2070860927152318,14.02076923076923,0.23076923076923078,0.0005263157894736842,0.08609271523178808,418.3333333333333,5.885389806331267,0.1452350597609562,0,0,1,1
A1518,data analytics course,122.0,4441.0,244.38,25.0,6.0,0.049,1507.0,02-11-2024,hyderabad,desktop,analytics for data,2024-02-11,11,2,6,6,False,0.0492,0.027471290249943707,2.0031147540983607,9.7752,0.24,0.0013510470614726414,0.20491803278688525,251.16666666666666,5.166625746787789,0.16216323822163237,0,0,0,0
A1519,data analytics course,84.0,4646.0,226.32,11.0,7.0,0.051,1596.0,2024-11-30,hyderabad,tablet,analytics for data,2024-11-30,30,11,5,48,True,0.0833,0.018080068876452863,2.6942857142857144,20.574545454545454,0.6363636363636364,0.001506672406371072,0.13095238095238096,228.0,6.051961823966066,0.1418045112781955,0,0,2,0
A1520,data analytics course,127.0,5964.0,182.01,26.0,7.0,0.047,1490.0,25-11-2024,hyderabad,desktop,data analytics course,2024-11-25,25,11,0,48,True,0.04665,0.02129443326626425,1.4331496062992126,7.000384615384615,0.2692307692307692,0.0011737089201877935,0.2047244094488189,212.85714285714286,7.186363386627109,0.12215436241610737,0,0,0,1
A1521,data analytics course,148.0,4725.0,187.02,25.0,3.0,0.02,1586.0,2024/11/15,hyderabad,mobile,learn data analytics,2024-11-15,15,11,4,46,False,0.0203,0.03132275132275132,1.2636486486486487,7.4808,0.12,0.0006349206349206349,0.16891891891891891,528.6666666666666,7.480376430328307,0.11791929382093318,0,0,1,4
A1522,data analytics course,85.0,4230.0,233.73,18.0,8.0,0.047,1998.0,2024/11/08,hyderabad,tablet,data analytics course,2024-11-08,8,11,4,45,True,0.0941,0.02009456264775414,2.749764705882353,12.985,0.4444444444444444,0.0018912529550827422,0.21176470588235294,249.75,7.548324990373509,0.11698198198198198,0,0,2,1
A1523,data analytics course,105.0,3880.0,246.63,19.0,8.0,0.051,1598.0,2024/11/13,hyderabad,mobile,data analytics training,2024-11-13,13,11,2,46,True,0.0762,0.027061855670103094,2.3488571428571428,12.980526315789474,0.42105263157894735,0.002061855670103093,0.18095238095238095,199.75,5.479341523740015,0.15433667083854818,0,0,1,3
A1524,data analytics course,187.0,3842.0,214.35,28.0,5.0,0.031,1596.0,2024/11/13,hyderabad,mobile,online data analytic,2024-11-13,13,11,2,46,False,0.0267,0.048672566371681415,1.1462566844919786,7.6553571428571425,0.17857142857142858,0.0013014055179593961,0.1497326203208556,319.2,6.445766270118965,0.13430451127819548,0,0,1,5
A1525,data analytics course,153.0,3143.0,244.73,12.0,10.0,0.065,1365.0,2024/11/15,hyderabad,mobile,online data analytic,2024-11-15,15,11,4,46,False,0.0654,0.04867960547247852,1.5995424836601306,20.394166666666667,0.8333333333333334,0.003181673560292714,0.0784313725490196,136.5,4.577575287051036,0.17928937728937727,0,0,1,5
A1526,data analytics course,143.0,5781.0,208.63,21.0,9.0,0.05,1443.0,2024/11/26,hyderabad,mobile,data analytics online,2024-11-26,26,11,1,48,True,0.0629,0.024736204808856598,1.4589510489510489,9.934761904761904,0.42857142857142855,0.0015568240788790867,0.14685314685314685,160.33333333333334,5.916550831615779,0.1445807345807346,0,0,1,2
A1527,data analytics course,183.0,3790.0,202.48,21.0,8.0,0.037,1215.0,26-11-2024,hyderabad,desktop,data analytics training,2024-11-26,26,11,1,48,False,0.0437,0.04828496042216359,1.106448087431694,9.641904761904762,0.38095238095238093,0.0021108179419525065,0.11475409836065574,151.875,5.000592651126038,0.16665020576131687,0,0,0,3
A1528,data analytics course,172.0,4250.0,235.2,28.0,7.0,0.047,1036.0,06-11-2024,hyderabad,mobile,learn data analytics,2024-06-11,11,6,1,24,True,0.0407,0.04047058823529412,1.3674418604651162,8.4,0.25,0.0016470588235294118,0.16279069767441862,148.0,3.4047619047619047,0.227027027027027,0,0,1,4
A1529,data analytics course,98.0,3800.0,240.45,16.0,3.0,0.031,1700.0,2024-11-01,hyderabad,desktop,data analytics course,2024-11-01,1,11,4,44,False,0.0306,0.025789473684210525,2.4535714285714283,15.028125,0.1875,0.0007894736842105263,0.16326530612244897,566.6666666666666,6.070076939072572,0.14144117647058824,0,0,0,1
A1530,data analytics course,87.0,4675.0,200.71,28.0,6.0,0.069,1428.0,2024/11/20,hyderabad,mobile,analytics for data,2024-11-20,20,11,2,47,False,0.069,0.018609625668449196,2.3070114942528734,7.168214285714286,0.21428571428571427,0.0012834224598930481,0.3218390804597701,238.0,6.114742663544417,0.1405532212885154,0,0,1,0
A1531,data analytics course,84.0,5711.0,216.02,13.0,6.0,0.047,1654.0,2024-11-17,hyderabad,desktop,data analytics training,2024-11-17,17,11,6,46,True,0.0714,0.014708457362983715,2.5716666666666668,16.61692307692308,0.46153846153846156,0.0010506040973559797,0.15476190476190477,275.6666666666667,6.656698453846865,0.13060459492140267,0,0,0,3
A1532,data analytics course,151.0,3022.0,191.35,13.0,4.0,0.026,1133.0,2024/11/18,hyderabad,mobile,learn data analytics,2024-11-18,18,11,0,47,False,0.0265,0.0499669093315685,1.2672185430463576,14.71923076923077,0.3076923076923077,0.0013236267372600927,0.08609271523178808,283.25,4.921087013326365,0.16888790820829655,0,0,1,4
A1533,data analytics course,113.0,5407.0,203.23,15.0,9.0,0.037,1745.0,2024/11/16,hyderabad,desktop,data analytics training,2024-11-16,16,11,5,46,True,0.0796,0.0208988348437211,1.7984955752212388,13.548666666666666,0.6,0.001664508969853893,0.13274336283185842,193.88888888888889,7.586330758254195,0.11646418338108883,0,0,0,3
A1534,data analytics course,89.0,5095.0,202.21,22.0,4.0,0.056,1065.0,2024-11-07,hyderabad,tablet,data analytics course,2024-11-07,7,11,3,45,True,0.0449,0.01746810598626104,2.2720224719101125,9.191363636363636,0.18181818181818182,0.0007850834151128558,0.24719101123595505,266.25,4.266801839671628,0.18986854460093897,0,0,2,1
A1535,data analytics course,174.0,3587.0,217.67,10.0,7.0,0.04,1226.0,22-11-2024,hyderabad,mobile,data analytics training,2024-11-22,22,11,4,47,False,0.0402,0.04850850292723725,1.2509770114942529,21.767,0.7,0.0019514914970727628,0.05747126436781609,175.14285714285714,4.63237928975054,0.17754486133768352,0,0,1,3
A1536,data analytics course,166.0,5524.0,205.53,25.0,7.0,0.047,1241.0,24-11-2024,hyderabad,mobile,analytics for data,2024-11-24,24,11,6,47,True,0.0422,0.03005068790731354,1.238132530120482,8.2212,0.28,0.0012671976828385228,0.15060240963855423,177.28571428571428,5.038047973531844,0.16561643835616438,0,0,1,0
A1537,data analytics course,196.0,3777.0,246.52,20.0,5.0,0.026,1159.0,2024-11-15,hyderabad,desktop,data analytics course,2024-11-15,15,11,4,46,False,0.0255,0.051893036801694464,1.2577551020408164,12.326,0.25,0.0013238019592268996,0.10204081632653061,231.8,3.701444101898426,0.21270060396893875,0,0,0,1
A1538,data analytics course,97.0,3480.0,233.32,22.0,3.0,0.031,1008.0,2024/11/28,hyderabad,desktop,data analytics online,2024-11-28,28,11,3,48,False,0.0309,0.027873563218390806,2.4053608247422678,10.605454545454545,0.13636363636363635,0.0008620689655172414,0.2268041237113402,336.0,3.320246871249786,0.23146825396825396,0,0,0,2
A1539,data analytics course,89.0,4200.0,200.98,23.0,8.0,0.047,1476.0,23-11-2024,hyderabad,mobile,data analytics course,2024-11-23,23,11,5,47,True,0.0899,0.02119047619047619,2.258202247191011,8.738260869565217,0.34782608695652173,0.0019047619047619048,0.25842696629213485,184.5,6.344014329784058,0.13616531165311652,0,0,1,1
A1540,data analytics course,130.0,5384.0,218.6,24.0,8.0,0.062,1943.0,2024-11-28,hyderabad,mobile,learn data analytics,2024-11-28,28,11,3,48,False,0.0615,0.024145616641901933,1.6815384615384614,9.108333333333333,0.3333333333333333,0.0014858841010401188,0.18461538461538463,242.875,7.888380603842635,0.11250643335048893,0,0,1,4
A1541,data analytics course,103.0,4766.0,245.34,11.0,8.0,0.078,1488.0,2024-11-08,hyderabad,desktop,analytics for data,2024-11-08,8,11,4,45,False,0.0777,0.02161141418380193,2.3819417475728155,22.303636363636365,0.7272727272727273,0.001678556441460344,0.10679611650485436,186.0,5.0650525800929325,0.16487903225806452,0,0,0,0
A1542,data analytics course,138.0,3322.0,196.83,17.0,8.0,0.058,1507.0,2024/11/01,hyderabad,desktop,online data analytic,2024-11-01,1,11,4,44,False,0.058,0.041541240216736906,1.426304347826087,11.578235294117647,0.47058823529411764,0.002408187838651415,0.12318840579710146,188.375,6.656353198191333,0.13061048440610484,0,0,0,5
A1543,data analytics course,127.0,4625.0,207.62,17.0,3.0,0.024,1811.0,2024-11-17,hyderabad,desktop,learn data analytics,2024-11-17,17,11,6,46,False,0.0236,0.02745945945945946,1.6348031496062994,12.212941176470588,0.17647058823529413,0.0006486486486486486,0.13385826771653545,603.6666666666666,7.722666409787111,0.11464384318056323,0,0,0,4
A1544,data analytics course,170.0,4689.0,195.98,26.0,6.0,0.035,1873.0,2024-11-14,hyderabad,desktop,data analytics online,2024-11-14,14,11,3,46,False,0.0353,0.03625506504585199,1.1528235294117646,7.537692307692307,0.23076923076923078,0.0012795905310300703,0.15294117647058825,312.1666666666667,8.55709766302684,0.10463427656166577,0,0,0,2
A1545,data analytics course,115.0,3764.0,197.47,20.0,5.0,0.047,1952.0,2024/11/27,hyderabad,desktop,learn data analytics,2024-11-27,27,11,2,48,True,0.0435,0.03055260361317747,1.7171304347826086,9.8735,0.25,0.001328374070138151,0.17391304347826086,390.4,8.885045829746291,0.10116290983606557,0,0,0,4
A1546,data analytics course,132.0,3365.0,198.01,17.0,9.0,0.068,1161.0,2024/11/14,hyderabad,desktop,analytics for data,2024-11-14,14,11,3,46,False,0.0682,0.03922734026745914,1.5000757575757575,11.647647058823528,0.5294117647058824,0.002674591381872214,0.12878787878787878,129.0,4.863340235341649,0.17055124892334195,0,0,0,0
A1547,data analytics course,168.0,3392.0,230.77,15.0,9.0,0.054,1504.0,2024/11/11,hyderabad,mobile,online data analytic,2024-11-11,11,11,0,46,False,0.0536,0.049528301886792456,1.3736309523809525,15.384666666666668,0.6,0.0026533018867924527,0.08928571428571429,167.11111111111111,5.517311608961303,0.1534375,0,0,1,5
A1548,data analytics course,145.0,5978.0,223.3,30.0,10.0,0.047,1859.0,2024-11-20,hyderabad,mobile,online data analytic,2024-11-20,20,11,2,47,True,0.069,0.02425560388089662,1.54,7.443333333333333,0.3333333333333333,0.0016728002676480427,0.20689655172413793,185.9,7.325123152709359,0.12011834319526628,0,0,1,5
A1549,data analytics course,163.0,3340.0,217.35,26.0,7.0,0.043,1751.0,24-11-2024,hyderabad,tablet,data analytics training,2024-11-24,24,11,6,47,False,0.0429,0.04880239520958084,1.3334355828220859,8.359615384615385,0.2692307692307692,0.002095808383233533,0.15950920245398773,250.14285714285714,7.056130664826318,0.1241290691033695,0,0,2,3
A1550,data analytics course,84.0,4407.0,192.52,19.0,10.0,0.119,1221.0,2024-11-03,hyderabad,tablet,learn data analytics,2024-11-03,3,11,6,44,False,0.119,0.01906058543226685,2.291904761904762,10.132631578947368,0.5263157894736842,0.002269117313365101,0.2261904761904762,122.1,5.342198213172657,0.15767403767403768,0,0,2,4
A1551,data analytics course,124.0,3180.0,180.8,17.0,6.0,0.048,1822.0,2024-11-11,hyderabad,mobile,online data analytic,2024-11-11,11,11,0,46,False,0.0484,0.0389937106918239,1.4580645161290324,10.63529411764706,0.35294117647058826,0.0018867924528301887,0.13709677419354838,303.6666666666667,9.077433628318584,0.09923161361141604,0,0,1,5
A1552,data analytics course,162.0,4947.0,233.76,23.0,6.0,0.045,1973.0,2024/11/15,hyderabad,tablet,data analytics course,2024-11-15,15,11,4,46,False,0.037,0.03274711946634324,1.442962962962963,10.163478260869566,0.2608695652173913,0.001212856276531231,0.1419753086419753,328.8333333333333,7.440280629705681,0.1184794728839331,0,0,2,1
A1553,data analytics course,119.0,4480.0,184.25,20.0,3.0,0.025,1985.0,22-11-2024,hyderabad,mobile,online data analytic,2024-11-22,22,11,4,47,False,0.0252,0.0265625,1.5483193277310925,9.2125,0.15,0.0006696428571428571,0.16806722689075632,661.6666666666666,9.773405698778832,0.09282115869017632,0,0,1,5
A1554,data analytics course,151.0,5595.0,246.66,24.0,4.0,0.026,1921.0,2024-11-29,hyderabad,desktop,learn data analytics,2024-11-29,29,11,4,48,False,0.0265,0.026988382484361036,1.6335099337748344,10.2775,0.16666666666666666,0.0007149240393208221,0.15894039735099338,480.25,6.788048325630422,0.12840187402394587,0,0,0,4
A1555,data analytics course,190.0,4808.0,199.94,16.0,6.0,0.032,1454.0,2024/11/03,hyderabad,desktop,data analytics online,2024-11-03,3,11,6,44,False,0.0316,0.03951747088186356,1.052315789473684,12.49625,0.375,0.0012479201331114808,0.08421052631578947,242.33333333333334,6.2721816544963485,0.13751031636863822,0,0,0,2
A1556,data analytics course,138.0,3382.0,204.12,27.0,7.0,0.051,1386.0,05-11-2024,hyderabad,tablet,learn data analytics,2024-05-11,11,5,5,19,False,0.0507,0.04080425783560024,1.4791304347826086,7.5600000000000005,0.25925925925925924,0.0020697811945594325,0.1956521739130435,198.0,5.790123456790124,0.14727272727272728,0,0,2,4
A1557,data analytics course,100.0,4643.0,214.46,16.0,9.0,0.09,1179.0,2024/11/03,hyderabad,tablet,online data analytic,2024-11-03,3,11,6,44,False,0.09,0.021537798836958864,2.1446,13.40375,0.5625,0.0019384018953262977,0.16,131.0,4.4975286766763025,0.18189991518235793,0,0,2,5
A1558,data analytics course,187.0,5400.0,210.0,14.0,7.0,0.047,1945.0,2024-11-15,hyderabad,desktop,analytics for data,2024-11-15,15,11,4,46,True,0.0374,0.03462962962962963,1.1229946524064172,15.0,0.5,0.0012962962962962963,0.0748663101604278,277.85714285714283,8.261904761904763,0.10796915167095116,0,0,0,0
A1559,data analytics course,176.0,3400.0,191.5,29.0,3.0,0.047,1429.0,28-11-2024,hyderabad,mobile,online data analytic,2024-11-28,28,11,3,48,True,0.017,0.05176470588235294,1.0880681818181819,6.603448275862069,0.10344827586206896,0.0008823529411764706,0.16477272727272727,476.3333333333333,6.462140992167102,0.13400979706088173,0,0,1,5
A1560,data analytics course,117.0,4223.0,214.965,28.0,6.0,0.059,1489.0,2024/11/10,hyderabad,mobile,data analytics training,2024-11-10,10,11,6,45,False,0.0513,0.027705422685294814,1.8373076923076923,7.677321428571429,0.21428571428571427,0.0014207909069381957,0.23931623931623933,248.16666666666666,5.926708999139395,0.14436870382807254,0,0,1,3
A1561,data analytics course,196.0,4520.0,206.31,24.0,8.0,0.051,1426.0,2024/11/23,hyderabad,tablet,data analytics online,2024-11-23,23,11,5,47,True,0.0408,0.04336283185840708,1.0526020408163266,8.59625,0.3333333333333333,0.0017699115044247787,0.12244897959183673,178.25,5.911928651059086,0.14467741935483872,0,0,2,2
A1562,data analytics course,155.0,3864.0,222.17,12.0,3.0,0.047,1407.0,2024-11-21,hyderabad,mobile,data analytics training,2024-11-21,21,11,3,47,True,0.0194,0.04011387163561077,1.4333548387096773,18.514166666666664,0.25,0.0007763975155279503,0.07741935483870968,469.0,5.332988252239276,0.15790334044065388,0,0,1,3
A1563,data analytics course,188.0,3838.0,240.99,15.0,3.0,0.016,1951.0,10-11-2024,hyderabad,mobile,data analytics course,2024-10-11,11,10,4,41,False,0.016,0.04898384575299635,1.2818617021276597,16.066,0.2,0.000781657113079729,0.0797872340425532,650.3333333333334,7.095771608780447,0.1235212711430036,0,0,1,1
A1564,data analytics course,81.0,5659.0,222.98,25.0,4.0,0.057,1654.0,2024-11-19,hyderabad,tablet,data analytics online,2024-11-19,19,11,1,47,False,0.0494,0.014313482947517229,2.7528395061728395,8.9192,0.16,0.0007068386640749249,0.30864197530864196,413.5,6.417705623822765,0.13481257557436516,0,0,2,2
A1565,data analytics course,125.0,4794.0,214.965,28.0,7.0,0.051,1453.0,2024-11-22,hyderabad,desktop,data analytics online,2024-11-22,22,11,4,47,False,0.056,0.026074259491030455,1.7197200000000001,7.677321428571429,0.25,0.0014601585314977055,0.224,207.57142857142858,5.759239876258926,0.1479456297315898,0,0,0,2
A1566,data analytics course,158.0,5214.0,222.28,21.0,3.0,0.019,1630.0,03-11-2024,hyderabad,desktop,data analytics course,2024-03-11,11,3,0,11,False,0.019,0.030303030303030304,1.4068354430379746,10.584761904761905,0.14285714285714285,0.0005753739930955121,0.13291139240506328,543.3333333333334,6.333093395717114,0.1363680981595092,0,0,0,1
A1567,data analytics course,133.0,5762.0,196.02,10.0,5.0,0.038,1507.0,2024/11/03,hyderabad,tablet,data analytics course,2024-11-03,3,11,6,44,False,0.0376,0.023082263103089206,1.4738345864661655,19.602,0.5,0.0008677542519958348,0.07518796992481203,301.4,6.687991021324354,0.13007299270072994,0,0,2,1
A1568,data analytics course,128.0,5026.0,239.88,15.0,9.0,0.07,1745.0,2024/11/25,hyderabad,mobile,analytics for data,2024-11-25,25,11,0,48,False,0.0703,0.025467568643056108,1.8740625,15.991999999999999,0.6,0.0017906884202148826,0.1171875,193.88888888888889,6.274470568617642,0.13746704871060172,0,0,1,0
A1569,data analytics course,148.0,3883.0,181.4,30.0,4.0,0.027,1966.0,2024-11-16,hyderabad,desktop,analytics for data,2024-11-16,16,11,5,46,False,0.027,0.03811485964460469,1.2256756756756757,6.046666666666667,0.13333333333333333,0.0010301313417460727,0.20270270270270271,491.5,9.83792723263506,0.09226856561546287,0,0,0,0
A1570,data analytics course,92.0,4605.0,234.69,29.0,3.0,0.047,1264.0,2024-11-30,hyderabad,mobile,data analytics training,2024-11-30,30,11,5,48,True,0.0326,0.01997828447339848,2.5509782608695653,8.092758620689654,0.10344827586206896,0.0006514657980456026,0.31521739130434784,421.3333333333333,4.385828113681878,0.18567246835443038,0,0,1,3
A1571,data analytics course,147.0,4520.0,205.83,25.0,8.0,0.047,1728.0,2024-11-02,hyderabad,desktop,data analytics course,2024-11-02,2,11,5,44,True,0.0544,0.03252212389380531,1.400204081632653,8.2332,0.32,0.0017699115044247787,0.17006802721088435,216.0,7.395277656318321,0.11911458333333334,0,0,0,1
A1572,data analytics course,136.0,5454.0,247.7,13.0,6.0,0.044,1687.0,2024/11/06,hyderabad,mobile,data analytics online,2024-11-06,6,11,2,45,False,0.0441,0.024935826916024934,1.8213235294117647,19.053846153846152,0.46153846153846156,0.0011001100110011,0.09558823529411764,281.1666666666667,5.810658054097699,0.14682868998221696,0,0,1,2
A1573,data analytics course,132.0,4957.0,220.43,28.0,6.0,0.045,1218.0,03-11-2024,hyderabad,mobile,online data analytic,2024-03-11,11,3,0,11,False,0.0455,0.026629009481541253,1.6699242424242424,7.8725000000000005,0.21428571428571427,0.0012104095218882388,0.21212121212121213,203.0,4.525563671006668,0.18097701149425288,0,0,1,5
A1574,data analytics course,173.0,4520.0,241.61,28.0,3.0,0.017,1191.0,2024-11-13,hyderabad,tablet,learn data analytics,2024-11-13,13,11,2,46,False,0.0173,0.03827433628318584,1.3965895953757226,8.628928571428572,0.10714285714285714,0.000663716814159292,0.16184971098265896,397.0,3.929431728819171,0.20286314021830396,0,0,2,4
A1575,data analytics course,85.0,4747.0,224.35,26.0,5.0,0.059,1087.0,01-11-2024,hyderabad,tablet,data analytics course,2024-01-11,11,1,3,2,False,0.0588,0.01790604592374131,2.639411764705882,8.628846153846153,0.19230769230769232,0.0010532968190436064,0.3058823529411765,217.4,3.845108090037887,0.20639374425023,0,0,2,1
A1576,data analytics course,129.0,5874.0,200.17,12.0,5.0,0.039,1405.0,2024-11-29,hyderabad,tablet,online data analytic,2024-11-29,29,11,4,48,False,0.0388,0.021961184882533197,1.551705426356589,16.680833333333332,0.4166666666666667,0.0008512087163772557,0.09302325581395349,281.0,6.019033821251936,0.1424697508896797,0,0,2,5
A1577,data analytics course,181.0,4730.0,243.35,16.0,4.0,0.047,1975.0,2024/11/20,hyderabad,mobile,online data analytic,2024-11-20,20,11,2,47,True,0.0221,0.03826638477801268,1.344475138121547,15.209375,0.25,0.0008456659619450317,0.08839779005524862,493.75,7.115882473803165,0.12321518987341772,0,0,1,5
A1578,data analytics course,85.0,5341.0,249.64,21.0,6.0,0.032,1388.0,2024/11/10,hyderabad,mobile,online data analytic,2024-11-10,10,11,6,45,True,0.0706,0.015914622729825877,2.936941176470588,11.887619047619047,0.2857142857142857,0.0011233851338700617,0.24705882352941178,231.33333333333334,4.560006409229291,0.17985590778097982,0,0,1,5
A1579,data analytics course,92.0,4327.0,188.6,14.0,7.0,0.047,1140.0,2024-11-22,hyderabad,tablet,data analytics training,2024-11-22,22,11,4,47,True,0.0761,0.021261844233880285,2.05,13.471428571428572,0.5,0.0016177490177952392,0.15217391304347827,162.85714285714286,5.044538706256628,0.16543859649122805,0,0,2,3
A1580,data analytics course,192.0,4520.0,180.82,27.0,4.0,0.021,1847.0,09-11-2024,hyderabad,mobile,data analytics training,2024-09-11,11,9,2,37,False,0.0208,0.04247787610619469,0.9417708333333333,6.6970370370370365,0.14814814814814814,0.0008849557522123894,0.140625,461.75,9.214578033403384,0.09789929615592853,0,0,1,3
A1581,data analytics course,146.0,4484.0,194.67,27.0,9.0,0.052,1234.0,2024-11-02,hyderabad,tablet,data analytics training,2024-11-02,2,11,5,44,False,0.0616,0.03256021409455843,1.3333561643835616,7.21,0.3333333333333333,0.002007136485280999,0.18493150684931506,137.11111111111111,5.338932552524786,0.15775526742301457,0,0,2,3
A1582,data analytics course,178.0,4311.0,205.46,18.0,4.0,0.022,1671.0,2024-11-18,hyderabad,tablet,analytics for data,2024-11-18,18,11,0,47,False,0.0225,0.041289723961957785,1.1542696629213482,11.414444444444445,0.2222222222222222,0.0009278589654372535,0.10112359550561797,417.75,7.132969921152536,0.12295631358467984,0,0,2,0
A1583,data analytics course,197.0,3009.0,233.44,22.0,9.0,0.046,1374.0,18-11-2024,hyderabad,tablet,analytics for data,2024-11-18,18,11,0,47,False,0.0457,0.06547025589896975,1.18497461928934,10.610909090909091,0.4090909090909091,0.0029910269192422734,0.1116751269035533,152.66666666666666,4.885880740233036,0.1698981077147016,0,0,2,0
A1584,data analytics course,176.0,3110.0,205.23,23.0,5.0,0.028,1746.0,2024-11-19,hyderabad,desktop,online data analytic,2024-11-19,19,11,1,47,False,0.0284,0.05659163987138264,1.1660795454545454,8.923043478260869,0.21739130434782608,0.001607717041800643,0.13068181818181818,349.2,7.507528139160942,0.11754295532646047,0,0,0,5
A1585,data analytics course,98.0,3365.0,224.28,27.0,9.0,0.047,1108.0,27-11-2024,hyderabad,desktop,data analytics training,2024-11-27,27,11,2,48,True,0.0918,0.02912332838038633,2.2885714285714287,8.306666666666667,0.3333333333333333,0.002674591381872214,0.2755102040816326,123.11111111111111,3.9402532548599964,0.2024187725631769,0,0,0,3
A1586,data analytics course,105.0,3274.0,187.89,24.0,4.0,0.038,1360.0,2024/11/09,hyderabad,desktop,learn data analytics,2024-11-09,9,11,5,45,False,0.0381,0.03207086133170434,1.7894285714285714,7.828749999999999,0.16666666666666666,0.0012217470983506415,0.22857142857142856,340.0,6.238277715684711,0.13815441176470586,0,0,0,4
A1587,data analytics course,113.0,3231.0,210.13,19.0,10.0,0.041,1234.0,2024/11/15,hyderabad,desktop,online data analytic,2024-11-15,15,11,4,46,True,0.0885,0.03497369235530796,1.8595575221238938,11.059473684210525,0.5263157894736842,0.0030950170225936243,0.168141592920354,123.4,4.872555084947414,0.1702836304700162,0,0,0,5
A1588,data analytics course,139.0,3440.0,246.53,13.0,10.0,0.047,1217.0,27-11-2024,hyderabad,tablet,online data analytic,2024-11-27,27,11,2,48,True,0.04665,0.04040697674418604,1.7735971223021583,18.963846153846156,0.7692307692307693,0.0029069767441860465,0.09352517985611511,121.7,3.9365188820833166,0.2025718981101068,0,0,2,5
A1589,data analytics course,88.0,5196.0,197.32,26.0,5.0,0.057,1438.0,2024/11/03,hyderabad,desktop,online data analytic,2024-11-03,3,11,6,44,False,0.0568,0.016936104695919937,2.242272727272727,7.589230769230769,0.19230769230769232,0.000962278675904542,0.29545454545454547,287.6,6.287654571254815,0.1372183588317107,0,0,0,5
A1590,data analytics course,106.0,5321.0,239.76,11.0,7.0,0.066,1910.0,24-11-2024,hyderabad,desktop,data analytics training,2024-11-24,24,11,6,47,False,0.066,0.019921067468520955,2.26188679245283,21.796363636363637,0.6363636363636364,0.0013155421913174216,0.10377358490566038,272.85714285714283,6.9662996329663,0.12552879581151832,0,0,0,3
A1591,data analytics course,148.0,5841.0,243.09,15.0,7.0,0.047,1535.0,29-11-2024,hyderabad,mobile,data analytics online,2024-11-29,29,11,4,48,False,0.0473,0.025338127033042286,1.6425,16.206,0.4666666666666667,0.0011984249272384865,0.10135135135135136,219.28571428571428,5.314533711793986,0.15836482084690554,0,0,1,2
A1592,data analytics course,174.0,4520.0,227.96,25.0,5.0,0.029,1566.0,2024-11-15,hyderabad,tablet,online data analytic,2024-11-15,15,11,4,46,False,0.0287,0.03849557522123894,1.3101149425287357,9.118400000000001,0.2,0.0011061946902654867,0.14367816091954022,313.2,5.869626250219336,0.1455683269476373,0,0,2,5
A1593,data analytics course,196.0,5776.0,227.24,30.0,4.0,0.02,1507.0,04-11-2024,hyderabad,mobile,data analytics training,2024-04-11,11,4,3,15,False,0.0204,0.03393351800554017,1.1593877551020408,7.574666666666667,0.13333333333333333,0.0006925207756232687,0.15306122448979592,376.75,5.631754972716071,0.15078964830789648,0,0,1,3
A1594,data analytics course,128.0,4729.0,243.45,25.0,9.0,0.031,1782.0,2024-11-23,hyderabad,desktop,learn data analytics,2024-11-23,23,11,5,47,True,0.0703,0.027067033199407908,1.901953125,9.738,0.36,0.0019031507718333686,0.1953125,198.0,6.3197781885397415,0.1366161616161616,0,0,0,4
A1595,data analytics course,163.0,5371.0,215.89,29.0,7.0,0.043,1906.0,2024-11-05,hyderabad,tablet,data analytics course,2024-11-05,5,11,1,45,False,0.0429,0.03034816607708062,1.3244785276073618,7.444482758620689,0.2413793103448276,0.0013032954757028485,0.17791411042944785,272.2857142857143,7.828570105146141,0.11326862539349422,0,0,2,1
A1596,data analytics course,183.0,5268.0,203.65,17.0,5.0,0.027,1731.0,2024-11-12,hyderabad,mobile,learn data analytics,2024-11-12,12,11,1,46,False,0.0273,0.034738041002277904,1.1128415300546448,11.979411764705883,0.29411764705882354,0.0009491268033409263,0.09289617486338798,346.2,7.499877240363368,0.11764875794338533,0,0,1,4
A1597,data analytics course,196.0,5386.0,224.31,23.0,4.0,0.02,1423.0,2024/11/30,hyderabad,tablet,learn data analytics,2024-11-30,30,11,5,48,False,0.0204,0.0363906424062384,1.1444387755102041,9.752608695652174,0.17391304347826086,0.0007426661715558856,0.11734693877551021,355.75,5.343899068253756,0.1576317638791286,0,0,2,4
A1598,data analytics course,121.0,4432.0,218.71,25.0,10.0,0.047,1568.0,2024/11/13,hyderabad,desktop,analytics for data,2024-11-13,13,11,2,46,True,0.0826,0.0273014440433213,1.807520661157025,8.7484,0.4,0.002256317689530686,0.2066115702479339,156.8,6.169310959718348,0.13948341836734696,0,0,0,0
A1599,data analytics course,174.0,3031.0,242.32,25.0,6.0,0.034,1381.0,2024-11-08,hyderabad,mobile,online data analytic,2024-11-08,8,11,4,45,False,0.0345,0.057406796436819535,1.3926436781609195,9.6928,0.24,0.001979544704717915,0.14367816091954022,230.16666666666666,4.69907560250908,0.1754670528602462,0,0,1,5
A1600,data analytics course,142.0,5999.0,214.05,27.0,7.0,0.047,1064.0,2024-11-21,hyderabad,desktop,analytics for data,2024-11-21,21,11,3,47,True,0.04665,0.023670611768628103,1.5073943661971831,7.927777777777778,0.25925925925925924,0.0011668611435239206,0.19014084507042253,152.0,3.9708012146694696,0.2011748120300752,0,0,0,0
A1601,data analytics course,118.0,3274.0,222.62,10.0,3.0,0.025,1716.0,09-11-2024,hyderabad,tablet,analytics for data,2024-09-11,11,9,2,37,False,0.0254,0.03604153940134392,1.8866101694915254,22.262,0.3,0.0009163103237629811,0.0847457627118644,572.0,6.708202317851047,0.12973193473193473,0,0,2,0
A1602,data analytics course,118.0,5889.0,193.01,17.0,10.0,0.085,1789.0,2024-11-10,hyderabad,desktop,online data analytic,2024-11-10,10,11,6,45,False,0.0847,0.02003735778570216,1.635677966101695,11.353529411764706,0.5882352941176471,0.0016980811682798438,0.1440677966101695,178.9,8.268949795347392,0.1078870877585243,0,0,0,5
A1603,data analytics course,149.0,5601.0,222.01,15.0,6.0,0.04,1514.0,25-11-2024,hyderabad,desktop,analytics for data,2024-11-25,25,11,0,48,False,0.0403,0.026602392429923228,1.49,14.800666666666666,0.4,0.0010712372790573112,0.10067114093959731,252.33333333333334,5.819512634566011,0.14663804491413474,0,0,0,0
A1604,data analytics course,127.0,4295.0,212.6,26.0,10.0,0.079,1713.0,19-11-2024,hyderabad,tablet,data analytics course,2024-11-19,19,11,1,47,False,0.0787,0.029569266589057043,1.674015748031496,8.176923076923076,0.38461538461538464,0.002328288707799767,0.2047244094488189,171.3,7.057384760112889,0.12410974897840046,0,0,2,1
A1605,data analytics course,195.0,5135.0,226.37,17.0,3.0,0.047,1507.0,2024/11/24,hyderabad,desktop,data analytics training,2024-11-24,24,11,6,47,True,0.0154,0.0379746835443038,1.1608717948717948,13.315882352941177,0.17647058823529413,0.0005842259006815969,0.08717948717948718,502.3333333333333,5.657242567478023,0.15021234240212342,0,0,0,3
A1606,data analytics course,173.0,5233.0,229.38,28.0,7.0,0.047,1322.0,2024-11-16,hyderabad,mobile,learn data analytics,2024-11-16,16,11,5,46,True,0.0405,0.03305943053697688,1.3258959537572255,8.192142857142857,0.25,0.0013376648194152493,0.16184971098265896,188.85714285714286,4.763362106548086,0.17350983358547656,0,0,1,4
A1607,data analytics course,131.0,5727.0,218.65,28.0,4.0,0.031,1631.0,2024/11/07,hyderabad,mobile,data analytics training,2024-11-07,7,11,3,45,False,0.0305,0.02287410511611664,1.669083969465649,7.808928571428572,0.14285714285714285,0.0006984459577440195,0.21374045801526717,407.75,6.459410016007317,0.13405885959534028,0,0,1,3
A1608,data analytics course,105.0,4691.0,213.15,21.0,3.0,0.035,1276.0,2024-11-22,hyderabad,desktop,analytics for data,2024-11-22,22,11,4,47,False,0.0286,0.022383287145597952,2.0300000000000002,10.15,0.14285714285714285,0.0006395224898742272,0.2,425.3333333333333,4.986394557823129,0.16704545454545455,0,0,0,0
A1609,data analytics course,104.0,3409.0,207.63,19.0,4.0,0.047,1195.0,2024/11/16,hyderabad,mobile,analytics for data,2024-11-16,16,11,5,46,True,0.0385,0.030507480199471988,1.9964423076923077,10.927894736842106,0.21052631578947367,0.0011733646230566149,0.18269230769230768,298.75,4.755430332803545,0.1737489539748954,0,0,1,0
A1610,data analytics course,139.0,4333.0,230.05,19.0,6.0,0.043,1407.0,21-11-2024,hyderabad,desktop,analytics for data,2024-11-21,21,11,3,47,False,0.0432,0.03207939072236326,1.6550359712230216,12.107894736842105,0.3157894736842105,0.0013847219016847449,0.1366906474820144,234.5,5.116061725711802,0.1635039090262971,0,0,0,0
A1611,data analytics course,110.0,4430.0,197.84,23.0,5.0,0.045,1507.0,2024-11-15,hyderabad,mobile,learn data analytics,2024-11-15,15,11,4,46,False,0.0455,0.024830699774266364,1.7985454545454547,8.601739130434783,0.21739130434782608,0.001128668171557562,0.20909090909090908,301.4,6.61726647796199,0.1312806901128069,0,0,1,4
A1612,data analytics course,193.0,4860.0,181.27,14.0,5.0,0.026,1507.0,2024-11-16,hyderabad,desktop,online data analytic,2024-11-16,16,11,5,46,False,0.0259,0.0397119341563786,0.9392227979274612,12.947857142857144,0.35714285714285715,0.00102880658436214,0.07253886010362694,301.4,7.313565399680035,0.12028533510285336,0,0,0,5
A1613,data analytics course,109.0,4396.0,188.6,11.0,10.0,0.092,1451.0,18-11-2024,hyderabad,mobile,data analytics training,2024-11-18,18,11,0,47,False,0.0917,0.024795268425841673,1.730275229357798,17.145454545454545,0.9090909090909091,0.0022747952684258415,0.10091743119266056,145.1,6.693531283138919,0.12997932460372158,0,0,1,3
A1614,data analytics course,141.0,5000.0,223.7,29.0,10.0,0.071,1909.0,2024-11-12,hyderabad,tablet,data analytics online,2024-11-12,12,11,1,46,False,0.0709,0.0282,1.5865248226950355,7.713793103448276,0.3448275862068966,0.002,0.20567375886524822,190.9,7.533750558784086,0.11718177056050287,0,0,2,2
A1615,data analytics course,182.0,3487.0,211.71,23.0,7.0,0.038,1027.0,2024/11/24,hyderabad,mobile,data analytics online,2024-11-24,24,11,6,47,False,0.0385,0.05219386291941497,1.1632417582417582,9.204782608695652,0.30434782608695654,0.002007456266131345,0.12637362637362637,146.71428571428572,3.850975390864862,0.20614410905550146,0,0,1,2
A1616,data analytics course,179.0,4236.0,245.01,23.0,7.0,0.039,1822.0,2024-11-07,hyderabad,mobile,learn data analytics,2024-11-07,7,11,3,45,False,0.0391,0.042256846081208686,1.3687709497206704,10.652608695652173,0.30434782608695654,0.0016525023607176581,0.12849162011173185,260.2857142857143,6.436431166074854,0.13447310647639957,0,0,1,4
A1617,data analytics course,89.0,5349.0,214.965,20.0,8.0,0.09,1371.0,28-11-2024,hyderabad,tablet,data analytics online,2024-11-28,28,11,3,48,False,0.0899,0.016638624041876986,2.4153370786516852,10.74825,0.4,0.0014956066554496167,0.2247191011235955,171.375,5.3777824296978585,0.15679431072210065,0,0,2,2
A1618,data analytics course,181.0,5678.0,226.89,22.0,10.0,0.047,1992.0,2024/11/02,hyderabad,tablet,data analytics training,2024-11-02,2,11,5,44,True,0.0552,0.03187742162733357,1.2535359116022098,10.313181818181818,0.45454545454545453,0.0017611835153222965,0.12154696132596685,199.2,7.779584820838292,0.11390060240963855,0,0,2,3
A1619,data analytics course,85.0,5247.0,219.97,15.0,7.0,0.082,1612.0,2024-11-20,hyderabad,desktop,analytics for data,2024-11-20,20,11,2,47,False,0.0824,0.016199733180865258,2.5878823529411763,14.664666666666667,0.4666666666666667,0.0013340956737183153,0.17647058823529413,230.28571428571428,6.328272037095967,0.13645781637717122,0,0,0,0
A1620,data analytics course,179.0,3685.0,202.66,15.0,7.0,0.039,1634.0,2024-11-18,hyderabad,desktop,data analytics course,2024-11-18,18,11,0,47,True,0.04665,0.0485753052917232,1.1321787709497206,13.510666666666667,0.4666666666666667,0.0018995929443690637,0.08379888268156424,233.42857142857142,7.062765222540214,0.12402692778457772,0,0,0,1
A1621,data analytics course,172.0,5862.0,202.0,23.0,4.0,0.023,1469.0,2024/11/28,hyderabad,desktop,online data analytic,2024-11-28,28,11,3,48,False,0.0233,0.029341521664960766,1.1744186046511629,8.782608695652174,0.17391304347826086,0.000682360968952576,0.13372093023255813,367.25,6.272277227722772,0.13750850918992513,0,0,0,5
A1622,data analytics course,196.0,5040.0,197.08,11.0,9.0,0.046,1774.0,22-11-2024,hyderabad,desktop,data analytics course,2024-11-22,22,11,4,47,False,0.0459,0.03888888888888889,1.0055102040816326,17.916363636363638,0.8181818181818182,0.0017857142857142857,0.05612244897959184,197.11111111111111,8.001420742845545,0.1110935738444194,0,0,0,1
A1623,data analytics course,139.0,3423.0,223.95,30.0,4.0,0.055,1480.0,2024-11-03,hyderabad,desktop,analytics for data,2024-11-03,3,11,6,44,True,0.04665,0.04060765410458662,1.6111510791366905,7.465,0.13333333333333333,0.0011685655857434998,0.2158273381294964,370.0,5.608617995088189,0.15131756756756756,0,0,0,0
A1624,data analytics course,135.0,5981.0,228.66,26.0,6.0,0.047,1515.0,12-11-2024,hyderabad,desktop,data analytics training,2024-12-11,11,12,2,50,True,0.0444,0.022571476341748872,1.6937777777777778,8.794615384615385,0.23076923076923078,0.0010031767262999498,0.1925925925925926,252.5,5.625557596431382,0.15093069306930693,0,0,0,3
A1625,data analytics course,97.0,3495.0,230.83,16.0,6.0,0.062,1675.0,2024/11/23,hyderabad,tablet,analytics for data,2024-11-23,23,11,5,47,False,0.0619,0.027753934191702433,2.3796907216494847,14.426875,0.375,0.0017167381974248926,0.16494845360824742,279.1666666666667,6.256422475414808,0.1378089552238806,0,0,2,0
A1626,data analytics course,137.0,3702.0,215.41,25.0,9.0,0.066,1010.0,10-11-2024,hyderabad,desktop,learn data analytics,2024-10-11,11,10,4,41,False,0.0657,0.037007023230686116,1.5723357664233577,8.6164,0.36,0.0024311183144246355,0.18248175182481752,112.22222222222223,3.6887331135973263,0.21327722772277227,0,0,0,4
A1627,data analytics course,164.0,3405.0,217.58,10.0,3.0,0.018,1885.0,2024/11/30,hyderabad,desktop,data analytics online,2024-11-30,30,11,5,48,False,0.0183,0.04816446402349486,1.326707317073171,21.758000000000003,0.3,0.000881057268722467,0.06097560975609756,628.3333333333334,7.66348009927383,0.11542705570291778,0,0,0,2
A1628,data analytics course,178.0,3370.0,180.66,25.0,9.0,0.051,1830.0,2024-11-24,hyderabad,desktop,online data analytic,2024-11-24,24,11,6,47,False,0.0506,0.052818991097922846,1.0149438202247192,7.2264,0.36,0.0026706231454005935,0.1404494382022472,203.33333333333334,9.129525074726004,0.09872131147540983,0,0,0,5
A1629,data analytics course,146.0,4455.0,227.13,16.0,5.0,0.047,1040.0,24-11-2024,hyderabad,tablet,online data analytic,2024-11-24,24,11,6,47,True,0.0342,0.03277216610549944,1.5556849315068493,14.195625,0.3125,0.001122334455667789,0.1095890410958904,208.0,3.5788755338352485,0.21839423076923076,0,0,2,5
A1630,data analytics course,149.0,4670.0,218.31,10.0,10.0,0.067,1623.0,2024/11/02,hyderabad,mobile,analytics for data,2024-11-02,2,11,5,44,False,0.0671,0.03190578158458244,1.4651677852348994,21.831,1.0,0.0021413276231263384,0.06711409395973154,162.3,6.434382300398516,0.1345101663585952,0,0,1,0
A1631,data analytics course,193.0,4287.0,204.62,15.0,3.0,0.047,1800.0,2024/11/09,hyderabad,tablet,data analytics training,2024-11-09,9,11,5,45,True,0.0155,0.0450198273851178,1.0602072538860103,13.641333333333334,0.2,0.0006997900629811056,0.07772020725388601,600.0,7.7967940572769034,0.11367777777777778,0,0,2,3
A1632,data analytics course,139.0,3546.0,183.41,27.0,7.0,0.047,1701.0,2024/11/28,hyderabad,mobile,data analytics training,2024-11-28,28,11,3,48,True,0.04665,0.03919909757473209,1.3194964028776979,6.792962962962963,0.25925925925925924,0.0019740552735476595,0.19424460431654678,243.0,8.27430347309307,0.10782480893592004,0,0,1,3
A1633,data analytics course,106.0,4740.0,229.13,19.0,3.0,0.028,1149.0,2024-11-11,hyderabad,desktop,online data analytic,2024-11-11,11,11,0,46,False,0.0283,0.022362869198312235,2.1616037735849054,12.059473684210525,0.15789473684210525,0.0006329113924050633,0.1792452830188679,383.0,4.014620521101558,0.19941688424717144,0,0,0,5
A1634,data analytics course,131.0,5642.0,184.57,20.0,9.0,0.047,1827.0,16-11-2024,hyderabad,mobile,data analytics course,2024-11-16,16,11,5,46,True,0.0687,0.023218716767103863,1.4089312977099235,9.2285,0.45,0.0015951790145338532,0.15267175572519084,203.0,8.89868342634231,0.10102353585112206,0,0,1,1
A1635,data analytics course,111.0,4161.0,185.58,10.0,7.0,0.047,1434.0,2024-11-04,hyderabad,desktop,data analytics training,2024-11-04,4,11,0,45,True,0.0631,0.026676279740447006,1.671891891891892,18.558,0.7,0.0016822879115597211,0.09009009009009009,204.85714285714286,6.727125767862916,0.1294142259414226,0,0,0,3
A1636,data analytics course,144.0,4241.0,181.4,24.0,5.0,0.035,1693.0,2024/11/19,hyderabad,mobile,online data analytic,2024-11-19,19,11,1,47,False,0.0347,0.033954256071681205,1.2597222222222222,7.558333333333334,0.20833333333333334,0.001178967224711153,0.16666666666666666,338.6,8.332965821389195,0.1071470761961016,0,0,1,5
A1637,data analytics course,151.0,5875.0,192.46,28.0,7.0,0.047,1459.0,2024/11/18,hyderabad,mobile,data analytics online,2024-11-18,18,11,0,47,True,0.04665,0.02570212765957447,1.2745695364238412,6.873571428571429,0.25,0.0011914893617021277,0.18543046357615894,208.42857142857142,6.580796009560427,0.13191226867717615,0,0,1,2
A1638,data analytics course,146.0,5457.0,214.965,15.0,5.0,0.034,1029.0,2024-11-02,hyderabad,desktop,data analytics course,2024-11-02,2,11,5,44,False,0.0342,0.026754627084478653,1.47236301369863,14.331,0.3333333333333333,0.000916254352208173,0.10273972602739725,205.8,3.786825762333403,0.2089067055393586,0,0,0,1
A1639,data analytics course,133.0,4780.0,198.66,22.0,4.0,0.03,1905.0,09-11-2024,hyderabad,tablet,online data analytic,2024-09-11,11,9,2,37,False,0.0301,0.02782426778242678,1.4936842105263157,9.03,0.18181818181818182,0.0008368200836820083,0.16541353383458646,476.25,8.589247961340984,0.10428346456692913,0,0,2,5
A1640,data analytics course,139.0,5922.0,239.1,12.0,3.0,0.048,1733.0,2024/11/06,hyderabad,desktop,data analytics course,2024-11-06,6,11,2,45,True,0.04665,0.02347180006754475,1.7201438848920863,19.925,0.25,0.0005065856129685917,0.08633093525179857,577.6666666666666,6.248013383521539,0.13796884016156952,0,0,0,1
A1641,data analytics course,82.0,3454.0,228.02,30.0,7.0,0.049,1463.0,2024-11-09,hyderabad,desktop,learn data analytics,2024-11-09,9,11,5,45,True,0.0854,0.02374059061957151,2.780731707317073,7.600666666666667,0.23333333333333334,0.002026635784597568,0.36585365853658536,209.0,5.416103850539426,0.15585782638414217,0,0,0,4
A1642,data analytics course,135.0,3449.0,200.06,17.0,5.0,0.037,1950.0,2024/11/07,hyderabad,mobile,data analytics course,2024-11-07,7,11,3,45,False,0.037,0.03914178022615251,1.4819259259259259,11.768235294117646,0.29411764705882354,0.0014496955639315744,0.1259259259259259,390.0,8.74707587723683,0.1025948717948718,0,0,1,1
A1643,data analytics course,199.0,4287.0,235.58,12.0,10.0,0.05,1276.0,2024-11-10,hyderabad,tablet,data analytics course,2024-11-10,10,11,6,45,False,0.0503,0.04641940751108001,1.183819095477387,19.631666666666668,0.8333333333333334,0.002332633543270352,0.06030150753768844,127.6,4.4164190508532135,0.18462382445141068,0,0,2,1
A1644,data analytics course,123.0,5000.0,187.67,25.0,3.0,0.024,1351.0,2024-11-07,hyderabad,tablet,data analytics online,2024-11-07,7,11,3,45,False,0.0244,0.0246,1.525772357723577,7.506799999999999,0.12,0.0006,0.2032520325203252,450.3333333333333,6.198806415516598,0.13891191709844558,0,0,2,2
A1645,data analytics course,154.0,3437.0,211.63,28.0,4.0,0.026,1604.0,2024-11-14,hyderabad,tablet,data analytics training,2024-11-14,14,11,3,46,False,0.026,0.04480651731160896,1.3742207792207792,7.5582142857142856,0.14285714285714285,0.0011638056444573757,0.18181818181818182,401.0,6.579265699570004,0.13193890274314213,0,0,2,3
A1646,data analytics course,88.0,3475.0,191.96,12.0,7.0,0.08,1204.0,2024/11/25,hyderabad,desktop,online data analytic,2024-11-25,25,11,0,48,False,0.0795,0.025323741007194246,2.1813636363636366,15.996666666666668,0.5833333333333334,0.002014388489208633,0.13636363636363635,172.0,5.272140029172744,0.15943521594684387,0,0,0,5
A1647,data analytics course,165.0,4889.0,180.19,21.0,4.0,0.024,1458.0,2024/11/19,hyderabad,mobile,analytics for data,2024-11-19,19,11,1,47,False,0.0242,0.03374923297197791,1.092060606060606,8.58047619047619,0.19047619047619047,0.0008181632235631009,0.12727272727272726,364.5,7.091459015483656,0.12358710562414266,0,0,1,0
A1648,data analytics course,87.0,3639.0,220.76,22.0,3.0,0.036,1231.0,2024-11-14,hyderabad,mobile,analytics for data,2024-11-14,14,11,3,46,False,0.0345,0.023907666941467436,2.537471264367816,10.034545454545453,0.13636363636363635,0.0008244023083264633,0.25287356321839083,410.3333333333333,4.57619133901069,0.17933387489845654,0,0,1,0
A1649,data analytics course,147.0,3959.0,181.18,27.0,9.0,0.061,1627.0,2024/11/26,hyderabad,mobile,analytics for data,2024-11-26,26,11,1,48,False,0.0612,0.03713058853245769,1.2325170068027211,6.710370370370371,0.3333333333333333,0.0022733013387218996,0.1836734693877551,180.77777777777777,7.980019869742796,0.11135832821143209,0,0,1,0
A1650,data analytics course,137.0,5400.0,180.04,10.0,10.0,0.073,1375.0,2024-11-29,hyderabad,tablet,analytics for data,2024-11-29,29,11,4,48,False,0.073,0.02537037037037037,1.3141605839416057,18.003999999999998,1.0,0.001851851851851852,0.072992700729927,137.5,6.637191735169963,0.13093818181818181,0,0,2,0
A1651,data analytics course,188.0,5528.0,245.03,13.0,10.0,0.053,1202.0,2024-11-29,hyderabad,desktop,analytics for data,2024-11-29,29,11,4,48,False,0.0532,0.03400868306801737,1.3033510638297872,18.84846153846154,0.7692307692307693,0.001808972503617945,0.06914893617021277,120.2,3.905521772844142,0.20385191347753745,0,0,0,0
A1652,data analytics course,162.0,5456.0,193.69,10.0,6.0,0.037,1992.0,2024-11-29,hyderabad,tablet,online data analytic,2024-11-29,29,11,4,48,False,0.037,0.02969208211143695,1.1956172839506172,19.369,0.6,0.0010997067448680353,0.06172839506172839,332.0,9.28447519231762,0.09723393574297189,0,0,2,5
A1653,data analytics course,102.0,4308.0,221.54,13.0,7.0,0.06,1096.0,2024-11-08,hyderabad,mobile,data analytics online,2024-11-08,8,11,4,45,False,0.0686,0.023676880222841225,2.1719607843137254,17.04153846153846,0.5384615384615384,0.0016248839368616526,0.12745098039215685,156.57142857142858,3.9471878667509257,0.20213503649635037,0,0,1,2
A1654,data analytics course,120.0,3245.0,196.09,15.0,9.0,0.075,1056.0,2024/11/22,hyderabad,desktop,data analytics training,2024-11-22,22,11,4,47,False,0.075,0.03697996918335902,1.6340833333333333,13.072666666666667,0.6,0.002773497688751926,0.125,117.33333333333333,4.385282268346168,0.1856912878787879,0,0,0,3
A1655,data analytics course,125.0,3339.0,205.32,18.0,4.0,0.054,1985.0,28-11-2024,hyderabad,desktop,data analytics course,2024-11-28,28,11,3,48,True,0.032,0.03743635819107517,1.64256,11.406666666666666,0.2222222222222222,0.0011979634621144056,0.144,496.25,8.667835573738556,0.10343576826196474,0,0,0,1
A1656,data analytics course,155.0,5977.0,187.28,16.0,7.0,0.047,1607.0,2024/11/10,hyderabad,desktop,online data analytic,2024-11-10,10,11,6,45,True,0.0452,0.025932742178350343,1.208258064516129,11.705,0.4375,0.0011711560983771122,0.1032258064516129,229.57142857142858,7.580734728748398,0.11654013690105787,0,0,0,5
A1657,data analytics course,137.0,4231.0,226.49,25.0,5.0,0.036,1078.0,2024/11/12,hyderabad,tablet,analytics for data,2024-11-12,12,11,1,46,False,0.0365,0.03238005199716379,1.653211678832117,9.0596,0.2,0.001181753722524226,0.18248175182481752,215.6,3.7595920349684313,0.21010204081632655,0,0,2,0
A1658,data analytics course,91.0,4506.0,195.99,12.0,3.0,0.045,1179.0,2024-11-22,hyderabad,tablet,learn data analytics,2024-11-22,22,11,4,47,True,0.033,0.020195295162006213,2.153736263736264,16.3325,0.25,0.0006657789613848203,0.13186813186813187,393.0,5.015613041481708,0.16623409669211198,0,0,2,4
A1659,data analytics course,87.0,4869.0,220.97,29.0,5.0,0.057,1480.0,2024-11-05,hyderabad,desktop,data analytics training,2024-11-05,5,11,1,45,False,0.0575,0.017868145409735057,2.539885057471264,7.619655172413793,0.1724137931034483,0.0010269049086054631,0.3333333333333333,296.0,5.69774177490157,0.14930405405405406,0,0,0,3
A1660,data analytics course,124.0,5716.0,217.84,28.0,8.0,0.047,1791.0,2024/11/24,hyderabad,mobile,data analytics training,2024-11-24,24,11,6,47,True,0.0645,0.021693491952414275,1.7567741935483872,7.78,0.2857142857142857,0.0013995801259622112,0.22580645161290322,223.875,7.221630554535439,0.12163037409268565,0,0,1,3
A1661,data analytics course,128.0,3243.0,208.41,14.0,6.0,0.037,1514.0,02-11-2024,hyderabad,mobile,online data analytic,2024-02-11,11,2,6,6,False,0.0469,0.039469626888683315,1.628203125,14.88642857142857,0.42857142857142855,0.0018501387604070306,0.109375,252.33333333333334,6.264526654191258,0.1376552179656539,0,0,1,5
A1662,data analytics course,111.0,3911.0,239.24,28.0,9.0,0.047,1097.0,2024/11/01,hyderabad,tablet,online data analytic,2024-11-01,1,11,4,44,True,0.0811,0.028381488110457685,2.1553153153153155,8.544285714285715,0.32142857142857145,0.002301201738685758,0.25225225225225223,121.88888888888889,3.5853536197960207,0.21808568824065636,0,0,2,5
A1663,data analytics course,89.0,3982.0,209.87,27.0,7.0,0.079,1920.0,04-11-2024,hyderabad,desktop,data analytics course,2024-04-11,11,4,3,15,False,0.0787,0.022350577599196383,2.3580898876404497,7.772962962962963,0.25925925925925924,0.0017579105976896032,0.30337078651685395,274.2857142857143,8.148520512698337,0.10930729166666667,0,0,0,1
A1664,data analytics course,107.0,5299.0,207.36,19.0,8.0,0.047,1567.0,2024/11/26,hyderabad,tablet,data analytics training,2024-11-26,26,11,1,48,True,0.0748,0.020192489148896018,1.937943925233645,10.913684210526316,0.42105263157894735,0.0015097188148707303,0.17757009345794392,195.875,6.55690586419753,0.1323292916400766,0,0,2,3
A1665,data analytics course,181.0,4150.0,236.69,15.0,5.0,0.047,1251.0,2024-11-10,hyderabad,mobile,data analytics online,2024-11-10,10,11,6,45,True,0.0276,0.0436144578313253,1.3076795580110496,15.779333333333334,0.3333333333333333,0.0012048192771084338,0.08287292817679558,250.2,4.285394397735434,0.18920063948840926,0,0,1,2
A1666,data analytics course,110.0,5925.0,188.18,29.0,9.0,0.082,1682.0,23-11-2024,hyderabad,desktop,data analytics training,2024-11-23,23,11,5,47,False,0.0818,0.018565400843881856,1.7107272727272729,6.48896551724138,0.3103448275862069,0.0015189873417721519,0.2636363636363636,186.88888888888889,7.938250611117015,0.11187871581450655,0,0,0,3
A1667,data analytics course,85.0,4010.0,195.26,17.0,4.0,0.042,1853.0,06-11-2024,hyderabad,mobile,data analytics online,2024-06-11,11,6,1,24,False,0.0471,0.02119700748129676,2.2971764705882354,11.485882352941175,0.23529411764705882,0.000997506234413965,0.2,463.25,8.489910888046708,0.10537506745817593,0,0,1,2
A1668,data analytics course,125.0,5767.0,214.965,12.0,8.0,0.035,1020.0,2024-11-19,hyderabad,tablet,data analytics online,2024-11-19,19,11,1,47,True,0.064,0.021675047685104906,1.7197200000000001,17.91375,0.6666666666666666,0.001387203051846714,0.096,127.5,3.7449584816132857,0.21075,0,0,2,2
A1669,data analytics course,163.0,4520.0,214.965,11.0,3.0,0.018,1819.0,2024-11-20,hyderabad,tablet,data analytics training,2024-11-20,20,11,2,47,False,0.0184,0.036061946902654865,1.318803680981595,19.542272727272728,0.2727272727272727,0.000663716814159292,0.06748466257668712,606.3333333333334,7.461842625543693,0.11817757009345795,0,0,2,3
A1670,data analytics course,129.0,3787.0,229.81,10.0,6.0,0.047,1221.0,2024-11-13,hyderabad,desktop,online data analytic,2024-11-13,13,11,2,46,False,0.0465,0.0340639028254555,1.7814728682170542,22.981,0.6,0.0015843675732770002,0.07751937984496124,203.5,4.313084722161786,0.1882145782145782,0,0,0,5
A1671,data analytics course,112.0,4834.0,212.27,11.0,7.0,0.062,1524.0,2024/11/27,hyderabad,mobile,data analytics online,2024-11-27,27,11,2,48,False,0.0625,0.023169218038891187,1.8952678571428572,19.297272727272727,0.6363636363636364,0.0014480761274306992,0.09821428571428571,217.71428571428572,6.179535497244076,0.13928477690288715,0,0,1,2
A1672,data analytics course,104.0,3031.0,188.47,13.0,6.0,0.043,1998.0,2024-11-05,hyderabad,desktop,data analytics training,2024-11-05,5,11,1,45,True,0.0577,0.03431210821511053,1.8122115384615385,14.497692307692308,0.46153846153846156,0.001979544704717915,0.125,333.0,9.601156682761182,0.09432932932932933,0,0,0,3
A1673,data analytics course,132.0,3754.0,180.88,21.0,10.0,0.076,1601.0,2024-11-24,hyderabad,mobile,online data analytic,2024-11-24,24,11,6,47,False,0.0758,0.03516249334043687,1.3703030303030304,8.613333333333333,0.47619047619047616,0.002663825253063399,0.1590909090909091,160.1,7.851172047766474,0.11297938788257339,0,0,1,5
A1674,data analytics course,113.0,3281.0,241.85,16.0,6.0,0.053,1507.0,08-11-2024,hyderabad,tablet,data analytics online,2024-08-11,11,8,6,32,False,0.0531,0.034440719292898506,2.1402654867256636,15.115625,0.375,0.001828710758914965,0.1415929203539823,251.16666666666666,5.231135001033699,0.16048440610484405,0,0,2,2
A1675,data analytics course,109.0,4910.0,236.2,20.0,8.0,0.054,1145.0,2024/11/08,hyderabad,tablet,data analytics training,2024-11-08,8,11,4,45,True,0.0734,0.02219959266802444,2.16697247706422,11.809999999999999,0.4,0.001629327902240326,0.1834862385321101,143.125,3.8475867908552073,0.20628820960698688,0,0,2,3
A1676,data analytics course,144.0,5026.0,231.82,14.0,4.0,0.028,1645.0,2024/11/10,hyderabad,desktop,data analytics course,2024-11-10,10,11,6,45,False,0.0278,0.02865101472343812,1.609861111111111,16.55857142857143,0.2857142857142857,0.0007958615200955034,0.09722222222222222,411.25,6.096022776291951,0.1409240121580547,0,0,0,1
A1677,data analytics course,179.0,5091.0,238.62,10.0,6.0,0.034,1259.0,24-11-2024,hyderabad,mobile,learn data analytics,2024-11-24,24,11,6,47,False,0.0335,0.03516008642702809,1.333072625698324,23.862000000000002,0.6,0.0011785503830288745,0.055865921787709494,209.83333333333334,4.276171318414215,0.18953137410643367,0,0,1,4
A1678,data analytics course,139.0,5622.0,190.87,14.0,8.0,0.047,1400.0,17-11-2024,hyderabad,mobile,analytics for data,2024-11-17,17,11,6,46,True,0.04665,0.024724297403059408,1.3731654676258993,13.633571428571429,0.5714285714285714,0.001422981145499822,0.10071942446043165,175.0,6.334835228165768,0.13633571428571428,0,0,1,0
A1679,data analytics course,116.0,4538.0,221.74,23.0,9.0,0.078,1639.0,2024-11-24,hyderabad,desktop,data analytics training,2024-11-24,24,11,6,47,False,0.0776,0.025561921551344204,1.9115517241379312,9.640869565217391,0.391304347826087,0.001983252534156016,0.19827586206896552,182.11111111111111,6.391539641021016,0.13528981086028066,0,0,0,3
A1680,data analytics course,89.0,3509.0,192.14,27.0,9.0,0.101,1564.0,2024/11/12,hyderabad,mobile,online data analytic,2024-11-12,12,11,1,46,False,0.1011,0.02536335138216016,2.158876404494382,7.116296296296296,0.3333333333333333,0.002564833285836421,0.30337078651685395,173.77777777777777,7.139897991048195,0.12285166240409207,0,0,1,5
A1681,data analytics course,96.0,3346.0,248.48,15.0,7.0,0.073,1118.0,2024-11-28,hyderabad,desktop,data analytics online,2024-11-28,28,11,3,48,False,0.0729,0.02869097429766886,2.5883333333333334,16.56533333333333,0.4666666666666667,0.0020920502092050207,0.15625,159.71428571428572,3.4993560849967804,0.22225402504472272,0,0,0,2
A1682,data analytics course,193.0,4706.0,213.41,24.0,8.0,0.046,1058.0,2024/11/09,hyderabad,desktop,data analytics course,2024-11-09,9,11,5,45,False,0.0415,0.04101147471313217,1.1057512953367876,8.892083333333334,0.3333333333333333,0.0016999575010624734,0.12435233160621761,132.25,3.9575933648844948,0.20171077504725898,0,0,0,1
A1683,data analytics course,122.0,3896.0,194.3,23.0,3.0,0.025,1355.0,21-11-2024,hyderabad,mobile,data analytics course,2024-11-21,21,11,3,47,False,0.0246,0.03131416837782341,1.5926229508196723,8.447826086956523,0.13043478260869565,0.0007700205338809035,0.1885245901639344,451.6666666666667,5.973751930005147,0.1433948339483395,0,0,1,1
A1684,data analytics course,133.0,3332.0,201.59,14.0,7.0,0.047,1943.0,2024/11/15,hyderabad,tablet,data analytics course,2024-11-15,15,11,4,46,True,0.0526,0.03991596638655462,1.5157142857142858,14.399285714285714,0.5,0.0021008403361344537,0.10526315789473684,277.57142857142856,8.638374919390843,0.10375193000514668,0,0,2,1
A1685,data analytics course,177.0,5738.0,249.21,11.0,7.0,0.04,1435.0,16-11-2024,hyderabad,mobile,data analytics training,2024-11-16,16,11,5,46,False,0.0395,0.030846985012199374,1.4079661016949152,22.655454545454546,0.6363636363636364,0.0012199372603694668,0.062146892655367235,205.0,4.758195899040969,0.17366550522648083,0,0,1,3
A1686,data analytics course,162.0,5346.0,223.12,25.0,5.0,0.031,1052.0,28-11-2024,hyderabad,desktop,data analytics course,2024-11-28,28,11,3,48,False,0.0309,0.030303030303030304,1.377283950617284,8.9248,0.2,0.0009352787130564908,0.15432098765432098,210.4,3.714951595553962,0.2120912547528517,0,0,0,1
A1687,data analytics course,182.0,5857.0,192.69,15.0,4.0,0.048,1384.0,2024/11/02,hyderabad,desktop,data analytics course,2024-11-02,2,11,5,44,True,0.022,0.03107392863240567,1.0587362637362636,12.846,0.26666666666666666,0.0006829434864264982,0.08241758241758242,346.0,6.18252114795786,0.13922687861271676,0,0,0,1
A1688,data analytics course,154.0,4836.0,233.8,26.0,10.0,0.047,1838.0,2024/11/30,hyderabad,desktop,data analytics course,2024-11-30,30,11,5,48,True,0.0649,0.03184449958643507,1.5181818181818183,8.992307692307692,0.38461538461538464,0.0020678246484698098,0.16883116883116883,183.8,6.86142001710864,0.12720348204570187,0,0,0,1
A1689,data analytics course,104.0,5291.0,186.93,19.0,10.0,0.096,1805.0,2024-11-29,hyderabad,tablet,data analytics course,2024-11-29,29,11,4,48,False,0.0962,0.019656019656019656,1.7974038461538462,9.83842105263158,0.5263157894736842,0.00189000189000189,0.18269230769230768,180.5,8.656020970416733,0.1035623268698061,0,0,2,1
A1690,data analytics course,101.0,4840.0,230.68,21.0,9.0,0.089,1556.0,2024-11-22,hyderabad,desktop,data analytics training,2024-11-22,22,11,4,47,False,0.0891,0.020867768595041324,2.283960396039604,10.984761904761905,0.42857142857142855,0.001859504132231405,0.2079207920792079,172.88888888888889,5.7452748396046465,0.14825192802056555,0,0,0,3
A1691,data analytics course,173.0,4246.0,202.95,27.0,3.0,0.017,1276.0,2024-11-29,hyderabad,tablet,learn data analytics,2024-11-29,29,11,4,48,False,0.0173,0.04074422986340085,1.173121387283237,7.516666666666667,0.1111111111111111,0.000706547338671691,0.15606936416184972,425.3333333333333,5.287262872628727,0.15905172413793103,0,0,2,4
A1692,data analytics course,186.0,5824.0,224.48,29.0,6.0,0.047,1882.0,2024/11/28,hyderabad,mobile,data analytics online,2024-11-28,28,11,3,48,True,0.0323,0.031936813186813184,1.2068817204301074,7.740689655172414,0.20689655172413793,0.0010302197802197802,0.15591397849462366,313.6666666666667,7.383820384889523,0.11927736450584484,0,0,1,2
A1693,data analytics course,148.0,5952.0,186.32,14.0,4.0,0.044,1469.0,10-11-2024,hyderabad,mobile,data analytics course,2024-10-11,11,10,4,41,True,0.027,0.02486559139784946,1.258918918918919,13.308571428571428,0.2857142857142857,0.0006720430107526882,0.0945945945945946,367.25,6.884285100901675,0.1268345813478557,0,0,1,1
A1694,data analytics course,181.0,3691.0,229.14,25.0,10.0,0.047,1375.0,2024/11/06,hyderabad,mobile,analytics for data,2024-11-06,6,11,2,45,True,0.0552,0.04903820102953129,1.2659668508287292,9.1656,0.4,0.00270929287455974,0.13812154696132597,137.5,5.000698263070612,0.16664727272727273,0,0,1,0
A1695,data analytics course,110.0,4350.0,243.88,16.0,9.0,0.047,1157.0,15-11-2024,hyderabad,tablet,online data analytic,2024-11-15,15,11,4,46,True,0.0818,0.02528735632183908,2.217090909090909,15.2425,0.5625,0.0020689655172413794,0.14545454545454545,128.55555555555554,3.744136460554371,0.21078651685393257,0,0,2,5
A1696,data analytics course,151.0,5656.0,191.95,18.0,7.0,0.047,1813.0,02-11-2024,hyderabad,mobile,data analytics online,2024-02-11,11,2,6,6,True,0.0464,0.026697312588401696,1.2711920529801324,10.663888888888888,0.3888888888888889,0.0012376237623762376,0.11920529801324503,259.0,8.445168012503256,0.10587424158852729,0,0,1,2
A1697,data analytics course,90.0,4566.0,228.82,29.0,9.0,0.051,1697.0,2024-11-13,hyderabad,desktop,data analytics training,2024-11-13,13,11,2,46,True,0.1,0.01971090670170828,2.5424444444444445,7.8903448275862065,0.3103448275862069,0.0019710906701708277,0.32222222222222224,188.55555555555554,6.416309763132594,0.13483794932233353,0,0,0,3
A1698,data analytics course,111.0,4245.0,245.76,22.0,8.0,0.072,1507.0,2024-11-07,hyderabad,desktop,online data analytic,2024-11-07,7,11,3,45,False,0.0721,0.026148409893992933,2.214054054054054,11.17090909090909,0.36363636363636365,0.001884570082449941,0.1981981981981982,188.375,5.131998697916667,0.16307896483078965,0,0,0,5
A1699,data analytics course,170.0,5053.0,217.41,16.0,9.0,0.031,1497.0,17-11-2024,hyderabad,mobile,data analytics training,2024-11-17,17,11,6,46,True,0.0529,0.03364338017019592,1.2788823529411764,13.588125,0.5625,0.0017811201266574313,0.09411764705882353,166.33333333333334,5.8856078377259555,0.1452304609218437,0,0,1,3
A1700,data analytics course,112.0,5093.0,228.8,23.0,7.0,0.062,1188.0,17-11-2024,hyderabad,desktop,analytics for data,2024-11-17,17,11,6,46,False,0.0625,0.02199096799528765,2.042857142857143,9.947826086956523,0.30434782608695654,0.0013744354997054782,0.20535714285714285,169.71428571428572,4.1923076923076925,0.1925925925925926,0,0,0,0
A1701,data analytics course,188.0,5336.0,188.73,17.0,3.0,0.016,1601.0,2024-11-03,hyderabad,tablet,online data analytic,2024-11-03,3,11,6,44,False,0.016,0.03523238380809595,1.0038829787234043,11.101764705882353,0.17647058823529413,0.0005622188905547226,0.09042553191489362,533.6666666666666,7.48301806813967,0.11788257339163022,0,0,2,5
A1702,data analytics course,85.0,4963.0,186.21,14.0,6.0,0.047,1747.0,05-11-2024,hyderabad,mobile,data analytics course,2024-05-11,11,5,5,19,True,0.0706,0.017126737860165223,2.1907058823529413,13.300714285714287,0.42857142857142855,0.0012089462018940156,0.16470588235294117,291.1666666666667,8.381880672359165,0.10658843732112193,0,0,1,1
A1703,data analytics course,94.0,4544.0,235.77,23.0,8.0,0.047,1342.0,2024-11-05,hyderabad,tablet,online data analytic,2024-11-05,5,11,1,45,True,0.0851,0.02068661971830986,2.5081914893617023,10.250869565217391,0.34782608695652173,0.0017605633802816902,0.24468085106382978,167.75,4.691987954362302,0.1756855439642325,0,0,2,5
A1704,data analytics course,177.0,4901.0,217.54,20.0,10.0,0.056,1975.0,2024/11/13,hyderabad,tablet,data analytics online,2024-11-13,13,11,2,46,False,0.0565,0.036115078555396855,1.2290395480225988,10.876999999999999,0.5,0.0020403999183840034,0.11299435028248588,197.5,8.078790107566425,0.11014683544303797,0,0,2,2
A1705,data analytics course,150.0,5275.0,192.7,14.0,4.0,0.027,1170.0,27-11-2024,hyderabad,tablet,data analytics online,2024-11-27,27,11,2,48,False,0.0267,0.02843601895734597,1.2846666666666666,13.764285714285714,0.2857142857142857,0.0007582938388625592,0.09333333333333334,292.5,5.071613907628438,0.1647008547008547,0,0,2,2
A1706,data analytics course,88.0,5225.0,202.97,22.0,6.0,0.068,1128.0,13-11-2024,hyderabad,tablet,online data analytic,2024-11-13,13,11,2,46,False,0.0682,0.016842105263157894,2.306477272727273,9.225909090909092,0.2727272727272727,0.0011483253588516747,0.25,188.0,4.557471547519338,0.17993794326241136,0,0,2,5
A1707,data analytics course,128.0,4857.0,212.61,14.0,5.0,0.039,1538.0,25-11-2024,hyderabad,desktop,data analytics online,2024-11-25,25,11,0,48,False,0.0391,0.02635371628577311,1.661015625,15.186428571428573,0.35714285714285715,0.0010294420424130121,0.109375,307.6,6.233902450496212,0.13823797139141744,0,0,0,2
A1708,data analytics course,163.0,5310.0,242.76,26.0,9.0,0.055,1793.0,2024-11-12,hyderabad,mobile,learn data analytics,2024-11-12,12,11,1,46,False,0.0552,0.030696798493408662,1.489325153374233,9.336923076923076,0.34615384615384615,0.001694915254237288,0.15950920245398773,199.22222222222223,6.385895534684463,0.1353931957612939,0,0,1,4
A1709,data analytics course,147.0,5014.0,193.08,12.0,8.0,0.054,1017.0,2024-11-11,hyderabad,tablet,online data analytic,2024-11-11,11,11,0,46,False,0.0544,0.029317909852413244,1.313469387755102,16.09,0.6666666666666666,0.0015955325089748703,0.08163265306122448,127.125,4.2672467371037905,0.18985250737463127,0,0,2,5
A1710,data analytics course,191.0,5855.0,196.54,29.0,3.0,0.016,1085.0,21-11-2024,hyderabad,desktop,data analytics course,2024-11-21,21,11,3,47,False,0.0157,0.032621690862510676,1.0290052356020942,6.777241379310345,0.10344827586206896,0.0005123825789923143,0.1518324607329843,361.6666666666667,4.520504731861199,0.18114285714285713,0,0,0,1
A1711,data analytics course,139.0,5916.0,234.46,17.0,6.0,0.044,1982.0,2024-11-02,hyderabad,desktop,data analytics course,2024-11-02,2,11,5,44,True,0.04665,0.023495605138607167,1.6867625899280576,13.791764705882354,0.35294117647058826,0.0010141987829614604,0.1223021582733813,330.3333333333333,7.453467542437942,0.11829465186680121,0,0,0,1
A1712,data analytics course,115.0,3952.0,229.18,25.0,4.0,0.035,1440.0,20-11-2024,hyderabad,tablet,online data analytic,2024-11-20,20,11,2,47,False,0.0348,0.02909919028340081,1.9928695652173913,9.167200000000001,0.16,0.0010121457489878543,0.21739130434782608,360.0,5.283270791517584,0.15915277777777778,0,0,2,5
A1713,data analytics course,123.0,4208.0,212.92,29.0,6.0,0.049,1184.0,2024/11/05,hyderabad,desktop,learn data analytics,2024-11-05,5,11,1,45,False,0.0488,0.02923003802281369,1.7310569105691056,7.342068965517241,0.20689655172413793,0.0014258555133079848,0.23577235772357724,197.33333333333334,4.560773999624272,0.17983108108108106,0,0,0,4
A1714,data analytics course,121.0,5517.0,222.14,16.0,7.0,0.047,1682.0,2024/11/02,hyderabad,tablet,learn data analytics,2024-11-02,2,11,5,44,True,0.0579,0.02193220953416712,1.8358677685950413,13.88375,0.4375,0.0012688055102410732,0.1322314049586777,240.28571428571428,6.571801566579635,0.13206896551724137,0,0,2,4
A1715,data analytics course,126.0,5460.0,210.83,24.0,10.0,0.079,1326.0,2024-11-14,hyderabad,tablet,online data analytic,2024-11-14,14,11,3,46,False,0.0794,0.023076923076923078,1.6732539682539684,8.784583333333334,0.4166666666666667,0.0018315018315018315,0.19047619047619047,132.6,5.289427500830053,0.15899698340874813,0,0,2,5
A1716,data analytics course,110.0,3159.0,197.92,26.0,10.0,0.091,1608.0,2024-11-18,hyderabad,mobile,data analytics online,2024-11-18,18,11,0,47,False,0.0909,0.03482114593225704,1.7992727272727271,7.6123076923076916,0.38461538461538464,0.0031655587211142765,0.23636363636363636,160.8,7.124494745351657,0.12308457711442786,0,0,1,2
A1717,data analytics course,190.0,5545.0,223.96,13.0,7.0,0.037,1344.0,2024/11/14,hyderabad,tablet,analytics for data,2024-11-14,14,11,3,46,False,0.0368,0.034265103697024346,1.1787368421052633,17.22769230769231,0.5384615384615384,0.0012623985572587917,0.06842105263157895,192.0,5.00107161993213,0.16663690476190476,0,0,2,0
A1718,data analytics course,148.0,3668.0,245.79,15.0,10.0,0.068,1718.0,2024/11/25,hyderabad,desktop,data analytics course,2024-11-25,25,11,0,48,False,0.0676,0.04034896401308615,1.6607432432432432,16.386,0.6666666666666666,0.0027262813522355507,0.10135135135135136,171.8,5.989706660157045,0.14306752037252618,0,0,0,1
A1719,data analytics course,86.0,5663.0,231.79,19.0,10.0,0.116,1547.0,17-11-2024,hyderabad,mobile,data analytics training,2024-11-17,17,11,6,46,False,0.1163,0.015186297015716051,2.695232558139535,12.199473684210526,0.5263157894736842,0.0017658484901995409,0.22093023255813954,154.7,5.674144699943915,0.14983193277310924,0,0,1,3
A1720,data analytics course,172.0,3123.0,216.67,15.0,7.0,0.047,1759.0,02-11-2024,hyderabad,desktop,online data analytic,2024-02-11,11,2,6,6,True,0.04665,0.055075248158821644,1.2597093023255814,14.444666666666667,0.4666666666666667,0.002241434518091579,0.0872093023255814,251.28571428571428,7.118336640974754,0.1231779420125071,0,0,0,5
A1721,data analytics course,143.0,5638.0,229.41,23.0,4.0,0.058,1398.0,2024/11/03,hyderabad,desktop,online data analytic,2024-11-03,3,11,6,44,True,0.028,0.025363604114934372,1.6042657342657343,9.974347826086957,0.17391304347826086,0.000709471443774388,0.16083916083916083,349.5,5.093893029946384,0.16409871244635194,0,0,0,5
A1722,data analytics course,172.0,4436.0,232.16,21.0,7.0,0.041,1050.0,2024/11/27,hyderabad,mobile,learn data analytics,2024-11-27,27,11,2,48,False,0.0407,0.0387736699729486,1.349767441860465,11.055238095238096,0.3333333333333333,0.0015779981965734896,0.12209302325581395,150.0,3.5227429359062716,0.22110476190476192,0,0,1,4
A1723,data analytics course,138.0,5555.0,188.55,14.0,8.0,0.058,1593.0,24-11-2024,hyderabad,desktop,data analytics training,2024-11-24,24,11,6,47,False,0.058,0.02484248424842484,1.366304347826087,13.467857142857143,0.5714285714285714,0.00144014401440144,0.10144927536231885,199.125,7.448687350835322,0.11836158192090396,0,0,0,3
A1724,data analytics course,132.0,4972.0,248.45,25.0,9.0,0.047,1126.0,2024/11/19,hyderabad,tablet,data analytics online,2024-11-19,19,11,1,47,True,0.0682,0.02654867256637168,1.8821969696969696,9.937999999999999,0.36,0.0018101367658889783,0.1893939393939394,125.11111111111111,3.5320990138860937,0.22064831261101242,0,0,2,2
A1725,data analytics course,174.0,3231.0,214.965,10.0,7.0,0.04,1128.0,2024/11/12,hyderabad,mobile,data analytics course,2024-11-12,12,11,1,46,False,0.0402,0.05385329619312906,1.2354310344827586,21.4965,0.7,0.002166511915815537,0.05747126436781609,161.14285714285714,4.247365850254693,0.1905718085106383,0,0,1,1
A1726,data analytics course,154.0,3461.0,235.36,18.0,4.0,0.047,1212.0,18-11-2024,hyderabad,tablet,data analytics online,2024-11-18,18,11,0,47,True,0.026,0.044495810459404796,1.5283116883116885,13.075555555555557,0.2222222222222222,0.0011557353366079169,0.11688311688311688,303.0,4.149558123725357,0.1941914191419142,0,0,2,2
A1727,data analytics course,126.0,3423.0,236.21,25.0,9.0,0.071,1106.0,20-11-2024,hyderabad,tablet,data analytics training,2024-11-20,20,11,2,47,False,0.0714,0.03680981595092025,1.8746825396825397,9.4484,0.36,0.0026292725679228747,0.1984126984126984,122.88888888888889,3.6822742474916383,0.21357142857142858,0,0,2,3
A1728,data analytics course,138.0,4025.0,220.96,21.0,7.0,0.051,1416.0,2024-11-24,hyderabad,tablet,data analytics online,2024-11-24,24,11,6,47,False,0.0507,0.03428571428571429,1.6011594202898551,10.521904761904763,0.3333333333333333,0.0017391304347826088,0.15217391304347827,202.28571428571428,5.408399710354815,0.156045197740113,0,0,2,2
A1729,data analytics course,193.0,3800.0,199.76,27.0,9.0,0.047,1393.0,2024-11-17,hyderabad,mobile,data analytics course,2024-11-17,17,11,6,46,False,0.0466,0.05078947368421052,1.0350259067357512,7.398518518518518,0.3333333333333333,0.002368421052631579,0.13989637305699482,154.77777777777777,5.97336804164998,0.14340272792534098,0,0,1,1
A1730,data analytics course,156.0,5293.0,210.43,26.0,6.0,0.038,1449.0,28-11-2024,hyderabad,tablet,data analytics course,2024-11-28,28,11,3,48,False,0.0385,0.0294728887209522,1.3489102564102564,8.093461538461538,0.23076923076923078,0.0011335726431135461,0.16666666666666666,241.5,5.885900299386969,0.14522429261559697,0,0,2,1
A1731,data analytics course,142.0,3565.0,180.39,26.0,5.0,0.035,1147.0,2024-11-01,hyderabad,tablet,data analytics training,2024-11-01,1,11,4,44,False,0.0352,0.03983169705469846,1.2703521126760562,6.938076923076922,0.19230769230769232,0.001402524544179523,0.18309859154929578,229.4,5.358445590110317,0.15727114210985177,0,0,2,3
A1732,data analytics course,92.0,4296.0,239.12,11.0,10.0,0.047,1169.0,2024/11/02,hyderabad,tablet,data analytics training,2024-11-02,2,11,5,44,True,0.1087,0.021415270018621976,2.5991304347826087,21.73818181818182,0.9090909090909091,0.0023277467411545625,0.11956521739130435,116.9,3.888758782201405,0.20455089820359282,0,0,2,3
A1733,data analytics course,190.0,3567.0,249.26,20.0,7.0,0.057,1517.0,2024/11/26,hyderabad,desktop,data analytics online,2024-11-26,26,11,1,48,True,0.0368,0.05326604990187833,1.3118947368421052,12.463,0.35,0.0019624334174376226,0.10526315789473684,216.71428571428572,5.086014603225548,0.16431114040870137,0,0,0,2
A1734,data analytics course,134.0,4854.0,198.93,21.0,8.0,0.06,1101.0,03-11-2024,hyderabad,desktop,analytics for data,2024-03-11,11,3,0,11,False,0.0597,0.027606098063452822,1.4845522388059702,9.472857142857142,0.38095238095238093,0.0016481252575195715,0.15671641791044777,137.625,4.53461016437943,0.18068119891008175,0,0,0,0
A1735,data analytics course,144.0,4520.0,186.47,29.0,8.0,0.056,1437.0,29-11-2024,hyderabad,mobile,data analytics course,2024-11-29,29,11,4,48,False,0.0556,0.03185840707964602,1.2949305555555555,6.43,0.27586206896551724,0.0017699115044247787,0.2013888888888889,179.625,6.706333458465169,0.1297633959638135,0,0,1,1
A1736,data analytics course,117.0,4630.0,196.66,15.0,8.0,0.047,1361.0,17-11-2024,hyderabad,desktop,online data analytic,2024-11-17,17,11,6,46,True,0.0684,0.02526997840172786,1.6808547008547008,13.110666666666667,0.5333333333333333,0.0017278617710583153,0.1282051282051282,170.125,5.9205735787653815,0.14449669360764145,0,0,0,5
A1737,data analytics course,160.0,3448.0,210.38,19.0,7.0,0.044,1705.0,14-11-2024,hyderabad,desktop,data analytics course,2024-11-14,14,11,3,46,False,0.0437,0.04640371229698376,1.314875,11.072631578947368,0.3684210526315789,0.0020301624129930394,0.11875,243.57142857142858,7.104382545869379,0.1233900293255132,0,0,0,1
A1738,data analytics course,146.0,5297.0,198.89,30.0,8.0,0.055,2000.0,2024-11-02,hyderabad,desktop,data analytics training,2024-11-02,2,11,5,44,False,0.0548,0.02756277138002643,1.3622602739726026,6.629666666666666,0.26666666666666666,0.0015102888427411742,0.2054794520547945,250.0,9.055809744079644,0.09944499999999999,0,0,0,3
A1739,data analytics course,175.0,3818.0,190.89,30.0,10.0,0.039,1088.0,2024/11/10,hyderabad,tablet,data analytics online,2024-11-10,10,11,6,45,True,0.0571,0.045835515976951284,1.0908,6.3629999999999995,0.3333333333333333,0.0026191723415400735,0.17142857142857143,108.8,4.6996175808057,0.17545036764705882,0,0,2,2
A1740,data analytics course,122.0,4791.0,223.16,12.0,4.0,0.033,1246.0,05-11-2024,hyderabad,tablet,learn data analytics,2024-05-11,11,5,5,19,False,0.0328,0.02546441243999165,1.8291803278688525,18.596666666666668,0.3333333333333333,0.0008348987685243164,0.09836065573770492,311.5,4.583437892095358,0.17910112359550562,0,0,2,4
A1741,data analytics course,85.0,3713.0,225.74,23.0,5.0,0.047,1867.0,24-11-2024,hyderabad,tablet,data analytics online,2024-11-24,24,11,6,47,True,0.0588,0.022892539725289523,2.655764705882353,9.814782608695653,0.21739130434782608,0.00134661998384056,0.27058823529411763,373.4,7.270576769735093,0.12091055168719872,0,0,2,2
A1742,data analytics course,167.0,3634.0,202.75,30.0,10.0,0.06,1503.0,2024/11/23,hyderabad,desktop,data analytics training,2024-11-23,23,11,5,47,False,0.0599,0.04595487066593286,1.214071856287425,6.758333333333334,0.3333333333333333,0.00275178866263071,0.17964071856287425,150.3,6.413070283600494,0.13489687292082503,0,0,0,3
A1743,data analytics course,158.0,3025.0,180.5,24.0,9.0,0.047,1725.0,26-11-2024,hyderabad,tablet,data analytics training,2024-11-26,26,11,1,48,True,0.057,0.05223140495867769,1.1424050632911393,7.520833333333333,0.375,0.0029752066115702478,0.1518987341772152,191.66666666666666,8.556786703601109,0.10463768115942029,0,0,2,3
A1744,data analytics course,176.0,5868.0,184.46,20.0,4.0,0.023,1229.0,2024-11-20,hyderabad,desktop,data analytics course,2024-11-20,20,11,2,47,False,0.0227,0.029993183367416496,1.0480681818181818,9.223,0.2,0.0006816632583503749,0.11363636363636363,307.25,5.662691098341103,0.15008950366151344,0,0,0,1
A1745,data analytics course,111.0,3050.0,208.87,10.0,7.0,0.063,1774.0,2024-11-26,hyderabad,tablet,analytics for data,2024-11-26,26,11,1,48,False,0.0631,0.03639344262295082,1.8817117117117117,20.887,0.7,0.0022950819672131148,0.09009009009009009,253.42857142857142,7.49332120457701,0.11773957158962796,0,0,2,0
A1746,data analytics course,186.0,5301.0,214.965,14.0,9.0,0.047,1230.0,2024-11-17,hyderabad,desktop,learn data analytics,2024-11-17,17,11,6,46,True,0.0484,0.03508771929824561,1.155725806451613,15.354642857142858,0.6428571428571429,0.001697792869269949,0.07526881720430108,136.66666666666666,4.721861698416021,0.17476829268292685,0,0,0,4
A1747,data analytics course,177.0,3042.0,239.64,26.0,4.0,0.023,1646.0,2024/11/20,hyderabad,mobile,data analytics course,2024-11-20,20,11,2,47,False,0.0226,0.05818540433925049,1.3538983050847457,9.216923076923077,0.15384615384615385,0.0013149243918474688,0.14689265536723164,411.5,5.868636287764982,0.14558930741190765,0,0,1,1
A1748,data analytics course,150.0,5272.0,239.06,13.0,9.0,0.06,1232.0,01-11-2024,hyderabad,desktop,online data analytic,2024-01-11,11,1,3,2,False,0.06,0.028452200303490136,1.5937333333333334,18.38923076923077,0.6923076923076923,0.0017071320182094083,0.08666666666666667,136.88888888888889,4.153517945285703,0.1940422077922078,0,0,0,5
A1749,data analytics course,160.0,4279.0,191.56,22.0,10.0,0.039,1234.0,12-11-2024,hyderabad,mobile,data analytics course,2024-12-11,11,12,2,50,True,0.0625,0.0373919139985978,1.19725,8.707272727272727,0.45454545454545453,0.0023369946249123625,0.1375,123.4,5.441845896846941,0.15523500810372773,0,0,1,1
A1750,data analytics course,147.0,5659.0,188.07,22.0,4.0,0.045,1796.0,25-11-2024,hyderabad,mobile,analytics for data,2024-11-25,25,11,0,48,True,0.0272,0.02597632090475349,1.2793877551020407,8.548636363636364,0.18181818181818182,0.0007068386640749249,0.14965986394557823,449.0,8.54963577391397,0.10471603563474387,0,0,1,0
A1751,data analytics course,198.0,4816.0,224.96,21.0,4.0,0.042,1601.0,05-11-2024,hyderabad,mobile,online data analytic,2024-05-11,11,5,5,19,True,0.0202,0.04111295681063123,1.1361616161616162,10.712380952380952,0.19047619047619047,0.0008305647840531562,0.10606060606060606,400.25,6.116820768136558,0.14051217988757028,0,0,1,5
A1752,data analytics course,145.0,3874.0,214.965,10.0,10.0,0.069,1153.0,2024-11-30,hyderabad,mobile,data analytics training,2024-11-30,30,11,5,48,False,0.069,0.03742901393908105,1.4825172413793104,21.4965,1.0,0.002581311306143521,0.06896551724137931,115.3,4.363663852255018,0.18643972246313964,0,0,1,3
A1753,data analytics course,94.0,5221.0,225.23,17.0,3.0,0.036,1209.0,19-11-2024,hyderabad,tablet,learn data analytics,2024-11-19,19,11,1,47,False,0.0319,0.01800421375215476,2.396063829787234,13.248823529411764,0.17647058823529413,0.0005746025665581306,0.18085106382978725,403.0,4.367846201660525,0.1862944582299421,0,0,2,4
A1754,data analytics course,90.0,5859.0,187.29,17.0,5.0,0.056,1375.0,16-11-2024,hyderabad,mobile,analytics for data,2024-11-16,16,11,5,46,False,0.0556,0.015360983102918587,2.081,11.01705882352941,0.29411764705882354,0.0008533879501621437,0.18888888888888888,275.0,6.3415558759143575,0.13621090909090908,0,0,1,0
A1755,data analytics course,182.0,5055.0,232.64,26.0,8.0,0.036,1815.0,10-11-2024,hyderabad,mobile,data analytics training,2024-10-11,11,10,4,41,False,0.044,0.036003956478733924,1.2782417582417582,8.947692307692307,0.3076923076923077,0.001582591493570722,0.14285714285714285,226.875,6.801753782668501,0.12817630853994488,0,0,1,3
A1756,data analytics course,139.0,4373.0,199.32,16.0,5.0,0.047,1150.0,2024-11-02,hyderabad,desktop,data analytics training,2024-11-02,2,11,5,44,True,0.04665,0.031785959295678026,1.433956834532374,12.4575,0.3125,0.001143379830779785,0.11510791366906475,230.0,4.769616696769015,0.17332173913043478,0,0,0,3
A1757,data analytics course,139.0,4520.0,234.85,11.0,8.0,0.047,1398.0,2024-11-04,hyderabad,desktop,data analytics training,2024-11-04,4,11,0,45,True,0.04665,0.030752212389380532,1.689568345323741,21.349999999999998,0.7272727272727273,0.0017699115044247787,0.07913669064748201,174.75,4.9527357888013634,0.16798998569384835,0,0,0,3
A1758,data analytics course,103.0,3547.0,232.35,11.0,8.0,0.078,1663.0,26-11-2024,hyderabad,tablet,learn data analytics,2024-11-26,26,11,1,48,False,0.0777,0.029038624189455877,2.2558252427184464,21.12272727272727,0.7272727272727273,0.002255427121511136,0.10679611650485436,207.875,6.15730578868087,0.13971737823211064,0,0,2,4
A1759,data analytics course,148.0,3128.0,197.02,27.0,9.0,0.061,1214.0,2024/11/12,hyderabad,tablet,data analytics training,2024-11-12,12,11,1,46,False,0.0608,0.04731457800511509,1.3312162162162162,7.297037037037037,0.3333333333333333,0.002877237851662404,0.18243243243243243,134.88888888888889,5.161810983656482,0.16228995057660628,0,0,2,3
A1760,data analytics course,151.0,5201.0,198.56,15.0,10.0,0.066,1716.0,2024/11/05,hyderabad,tablet,data analytics training,2024-11-05,5,11,1,45,False,0.0662,0.02903287829263603,1.3149668874172185,13.237333333333334,0.6666666666666666,0.0019227071716977505,0.09933774834437085,171.6,7.642224012892829,0.11571095571095572,0,0,2,3
A1761,data analytics course,148.0,5510.0,210.42,27.0,4.0,0.048,1352.0,2024-11-06,hyderabad,mobile,learn data analytics,2024-11-06,6,11,2,45,True,0.027,0.026860254083484573,1.4217567567567566,7.793333333333333,0.14814814814814814,0.0007259528130671506,0.18243243243243243,338.0,5.425244748598042,0.1556360946745562,0,0,1,4
A1762,data analytics course,103.0,5628.0,195.6,24.0,8.0,0.034,1065.0,2024-11-09,hyderabad,mobile,analytics for data,2024-11-09,9,11,5,45,True,0.0777,0.01830135039090263,1.899029126213592,8.15,0.3333333333333333,0.0014214641080312722,0.23300970873786409,133.125,4.4447852760736195,0.1836619718309859,0,0,1,0
A1763,data analytics course,115.0,5445.0,183.55,21.0,7.0,0.059,1721.0,2024-11-07,hyderabad,tablet,data analytics course,2024-11-07,7,11,3,45,False,0.0609,0.021120293847566574,1.5960869565217393,8.74047619047619,0.3333333333333333,0.0012855831037649219,0.1826086956521739,245.85714285714286,8.376191773358757,0.10665310865775712,0,0,2,1
A1764,data analytics course,160.0,5936.0,239.87,29.0,4.0,0.047,1320.0,2024/11/24,hyderabad,mobile,analytics for data,2024-11-24,24,11,6,47,True,0.025,0.026954177897574125,1.4991875000000001,8.271379310344829,0.13793103448275862,0.0006738544474393531,0.18125,330.0,4.502980781256515,0.18171969696969698,0,0,1,0
A1765,data analytics course,166.0,5808.0,194.79,14.0,8.0,0.048,1799.0,2024/11/14,hyderabad,tablet,data analytics training,2024-11-14,14,11,3,46,False,0.0482,0.028581267217630855,1.173433734939759,13.913571428571428,0.5714285714285714,0.0013774104683195593,0.08433734939759036,224.875,8.235587042455979,0.10827682045580878,0,0,2,3
A1766,data analytics course,187.0,3282.0,234.91,10.0,7.0,0.041,1525.0,29-11-2024,hyderabad,mobile,online data analytic,2024-11-29,29,11,4,48,False,0.0374,0.056977452772699576,1.2562032085561496,23.491,0.7,0.0021328458257160268,0.053475935828877004,217.85714285714286,5.491847941764931,0.15403934426229507,0,0,1,5
A1767,data analytics course,172.0,3334.0,243.12,30.0,9.0,0.052,1507.0,2024-11-08,hyderabad,mobile,online data analytic,2024-11-08,8,11,4,45,False,0.0523,0.05158968206358728,1.4134883720930234,8.104000000000001,0.3,0.0026994601079784043,0.1744186046511628,167.44444444444446,5.198585060875288,0.1613271400132714,0,0,1,5
A1768,data analytics course,172.0,5546.0,241.81,24.0,10.0,0.058,1681.0,2024-11-03,hyderabad,desktop,learn data analytics,2024-11-03,3,11,6,44,False,0.0581,0.031013342949873783,1.4058720930232558,10.075416666666667,0.4166666666666667,0.0018031013342949874,0.13953488372093023,168.1,5.95173896861172,0.1438488994646044,0,0,0,4
A1769,data analytics course,187.0,5734.0,187.44,10.0,8.0,0.043,1183.0,23-11-2024,hyderabad,tablet,analytics for data,2024-11-23,23,11,5,47,False,0.0428,0.03261248692012557,1.0023529411764707,18.744,0.8,0.0013951866062085804,0.053475935828877004,147.875,5.311352966282543,0.15844463229078615,0,0,2,0
A1770,data analytics course,196.0,4964.0,249.47,26.0,9.0,0.046,1996.0,2024-11-19,hyderabad,mobile,learn data analytics,2024-11-19,19,11,1,47,False,0.0459,0.0394842868654311,1.2728061224489795,9.595,0.34615384615384615,0.0018130539887187753,0.1326530612244898,221.77777777777777,7.00096203952379,0.12498496993987976,0,0,1,4
A1771,data analytics course,131.0,4774.0,240.53,24.0,7.0,0.053,1507.0,09-11-2024,hyderabad,tablet,data analytics training,2024-09-11,11,9,2,37,False,0.0534,0.02744030163385002,1.8361068702290075,10.022083333333333,0.2916666666666667,0.001466275659824047,0.183206106870229,215.28571428571428,5.26533072797572,0.15960849369608493,0,0,2,3
A1772,data analytics course,103.0,5244.0,205.9,22.0,7.0,0.032,1954.0,2024-11-16,hyderabad,mobile,analytics for data,2024-11-16,16,11,5,46,True,0.068,0.019641495041952707,1.9990291262135922,9.35909090909091,0.3181818181818182,0.0013348588863463006,0.21359223300970873,279.14285714285717,8.490043710539096,0.10537359263050154,0,0,1,0
A1773,data analytics course,114.0,3064.0,196.01,23.0,6.0,0.053,1348.0,30-11-2024,hyderabad,mobile,learn data analytics,2024-11-30,30,11,5,48,False,0.0526,0.03720626631853786,1.7193859649122807,8.522173913043478,0.2608695652173913,0.0019582245430809398,0.20175438596491227,224.66666666666666,5.877200142849855,0.1454080118694362,0,0,1,4
A1774,data analytics course,116.0,3265.0,199.21,24.0,10.0,0.086,1006.0,21-11-2024,hyderabad,mobile,learn data analytics,2024-11-21,21,11,3,47,False,0.0862,0.03552833078101072,1.7173275862068966,8.300416666666667,0.4166666666666667,0.0030627871362940277,0.20689655172413793,100.6,4.04994729180262,0.19802186878727635,0,0,1,4
A1775,data analytics course,164.0,5351.0,217.9,10.0,9.0,0.055,1431.0,2024/11/12,hyderabad,tablet,online data analytic,2024-11-12,12,11,1,46,False,0.0549,0.030648476920201832,1.3286585365853658,21.79,0.9,0.0016819286114744907,0.06097560975609756,159.0,5.567232675539238,0.1522711390635919,0,0,2,5
A1776,data analytics course,160.0,5830.0,214.965,15.0,10.0,0.062,1270.0,26-11-2024,hyderabad,mobile,online data analytic,2024-11-26,26,11,1,48,False,0.0625,0.0274442538593482,1.34353125,14.331,0.6666666666666666,0.0017152658662092624,0.09375,127.0,4.907938501616543,0.16926377952755906,0,0,1,5
A1777,data analytics course,112.0,4808.0,221.57,17.0,7.0,0.062,1186.0,2024/11/25,hyderabad,desktop,data analytics online,2024-11-25,25,11,0,48,False,0.0625,0.02329450915141431,1.9783035714285713,13.033529411764706,0.4117647058823529,0.0014559068219633944,0.15178571428571427,169.42857142857142,4.352710204450061,0.1868212478920742,0,0,0,2
A1778,data analytics course,87.0,5506.0,188.77,11.0,5.0,0.047,1774.0,2024-11-22,hyderabad,mobile,learn data analytics,2024-11-22,22,11,4,47,True,0.0575,0.01580094442426444,2.169770114942529,17.16090909090909,0.45454545454545453,0.0009081002542680712,0.12643678160919541,354.8,8.397679716056576,0.10640924464487035,0,0,1,4
A1779,data analytics course,139.0,4798.0,198.45,20.0,10.0,0.047,1937.0,2024-11-14,hyderabad,mobile,data analytics training,2024-11-14,14,11,3,46,True,0.04665,0.02897040433513964,1.4276978417266186,9.9225,0.5,0.0020842017507294707,0.14388489208633093,193.7,8.760644998740236,0.10245224574083633,0,0,1,3
A1780,data analytics course,139.0,5763.0,214.49,15.0,5.0,0.045,1781.0,2024-11-01,hyderabad,desktop,data analytics online,2024-11-01,1,11,4,44,False,0.036,0.02411938226618081,1.543093525179856,14.299333333333333,0.3333333333333333,0.0008676036786395974,0.1079136690647482,356.2,7.303417408737004,0.12043234138124649,0,0,0,2
A1781,data analytics course,193.0,3271.0,187.76,30.0,9.0,0.053,1209.0,2024-11-13,hyderabad,tablet,online data analytic,2024-11-13,13,11,2,46,False,0.0466,0.059003362885967595,0.9728497409326424,6.258666666666667,0.3,0.0027514521553041885,0.15544041450777202,134.33333333333334,5.43907115466553,0.15530190239867658,0,0,2,5
A1782,data analytics course,151.0,4402.0,248.65,21.0,4.0,0.047,1722.0,19-11-2024,hyderabad,desktop,data analytics online,2024-11-19,19,11,1,47,True,0.0265,0.034302589731940024,1.6466887417218543,11.84047619047619,0.19047619047619047,0.0009086778736937755,0.1390728476821192,430.5,5.925397144580735,0.14439605110336817,0,0,0,2
A1783,data analytics course,90.0,4281.0,216.36,24.0,4.0,0.047,1768.0,2024/11/04,hyderabad,mobile,learn data analytics,2024-11-04,4,11,0,45,True,0.0444,0.02102312543798178,2.4040000000000004,9.015,0.16666666666666666,0.000934361130576968,0.26666666666666666,442.0,7.171565908670733,0.12237556561085973,0,0,1,4
A1784,data analytics course,169.0,4480.0,214.965,11.0,10.0,0.059,1769.0,2024/11/28,hyderabad,tablet,online data analytic,2024-11-28,28,11,3,48,False,0.0592,0.037723214285714284,1.2719822485207102,19.542272727272728,0.9090909090909091,0.002232142857142857,0.0650887573964497,176.9,7.229246621543042,0.12151780667043528,0,0,2,5
A1785,data analytics course,197.0,4373.0,218.3,18.0,9.0,0.059,1988.0,2024-11-14,hyderabad,desktop,learn data analytics,2024-11-14,14,11,3,46,True,0.0457,0.04504916533272353,1.1081218274111675,12.127777777777778,0.5,0.002058083695403613,0.09137055837563451,220.88888888888889,8.106733852496564,0.10980885311871227,0,0,0,4
A1786,data analytics course,132.0,4520.0,219.44,17.0,3.0,0.055,1949.0,2024/11/24,hyderabad,desktop,learn data analytics,2024-11-24,24,11,6,47,True,0.0227,0.02920353982300885,1.6624242424242424,12.908235294117647,0.17647058823529413,0.000663716814159292,0.12878787878787878,649.6666666666666,7.881698869850529,0.1125910723447922,0,0,0,4
A1787,data analytics course,96.0,5503.0,243.51,11.0,6.0,0.062,1687.0,2024-11-02,hyderabad,desktop,data analytics online,2024-11-02,2,11,5,44,False,0.0625,0.017445029983645284,2.5365625,22.137272727272727,0.5454545454545454,0.0010903143739778303,0.11458333333333333,281.1666666666667,5.927846905671225,0.14434499110847657,0,0,0,2
A1788,data analytics course,160.0,4154.0,230.16,15.0,6.0,0.047,1667.0,2024/11/16,hyderabad,mobile,online data analytic,2024-11-16,16,11,5,46,True,0.0375,0.038517091959557055,1.4385,15.344,0.4,0.0014443909484833895,0.09375,277.8333333333333,6.242787625999305,0.13806838632273546,0,0,1,5
A1789,data analytics course,162.0,5161.0,240.72,16.0,7.0,0.047,1649.0,2024-11-15,hyderabad,tablet,learn data analytics,2024-11-15,15,11,4,46,True,0.0432,0.0313892656461926,1.4859259259259259,15.045,0.4375,0.0013563262933540012,0.09876543209876543,235.57142857142858,5.850282485875706,0.14597938144329897,0,0,2,4
A1790,data analytics course,171.0,5517.0,233.86,23.0,5.0,0.029,1349.0,24-11-2024,hyderabad,tablet,data analytics course,2024-11-24,24,11,6,47,False,0.0292,0.03099510603588907,1.3676023391812866,10.167826086956522,0.21739130434782608,0.0009062896501721951,0.13450292397660818,269.8,4.7684084494997,0.17335804299481097,0,0,2,1
A1791,data analytics course,110.0,4161.0,204.28,16.0,10.0,0.047,1447.0,2024-11-14,hyderabad,mobile,data analytics online,2024-11-14,14,11,3,46,True,0.0909,0.026435952895938475,1.8570909090909091,12.7675,0.625,0.002403268445085316,0.14545454545454545,144.7,6.0834149206970825,0.14117484450587423,0,0,1,2
A1792,data analytics course,103.0,5332.0,243.72,16.0,3.0,0.029,1882.0,2024-11-28,hyderabad,desktop,online data analytic,2024-11-28,28,11,3,48,False,0.0291,0.019317329332333082,2.36621359223301,15.2325,0.1875,0.0005626406601650412,0.1553398058252427,627.3333333333334,6.721976038076481,0.12950053134962805,0,0,0,5
A1793,data analytics course,167.0,3620.0,243.81,24.0,8.0,0.053,1001.0,2024/11/05,hyderabad,desktop,data analytics course,2024-11-05,5,11,1,45,False,0.0479,0.04613259668508287,1.459940119760479,10.15875,0.3333333333333333,0.0022099447513812156,0.1437125748502994,125.125,3.10565604364054,0.24356643356643357,0,0,0,1
A1794,data analytics course,132.0,4117.0,239.04,28.0,3.0,0.023,1761.0,2024-11-07,hyderabad,mobile,analytics for data,2024-11-07,7,11,3,45,False,0.0227,0.03206218119990284,1.8109090909090908,8.537142857142857,0.10714285714285714,0.0007286859363614282,0.21212121212121213,587.0,6.366967871485945,0.1357410562180579,0,0,1,0
A1795,data analytics course,145.0,5400.0,219.89,29.0,3.0,0.047,1152.0,20-11-2024,hyderabad,tablet,data analytics course,2024-11-20,20,11,2,47,True,0.0207,0.026851851851851852,1.5164827586206895,7.582413793103448,0.10344827586206896,0.0005555555555555556,0.2,384.0,4.2389831279276,0.1908767361111111,0,0,2,1
A1796,data analytics course,140.0,5220.0,183.39,25.0,8.0,0.057,1918.0,11-11-2024,hyderabad,desktop,learn data analytics,2024-11-11,11,11,0,46,False,0.0571,0.02681992337164751,1.3099285714285713,7.3355999999999995,0.32,0.0015325670498084292,0.17857142857142858,239.75,9.458585528109495,0.09561522419186652,0,0,0,4
A1797,data analytics course,122.0,4520.0,217.66,25.0,10.0,0.053,1799.0,2024/11/26,hyderabad,tablet,data analytics online,2024-11-26,26,11,1,48,True,0.082,0.026991150442477876,1.7840983606557377,8.7064,0.4,0.0022123893805309734,0.20491803278688525,179.9,7.265184232288891,0.12098943857698721,0,0,2,2
A1798,data analytics course,87.0,4081.0,180.63,20.0,4.0,0.046,1665.0,2024/11/08,hyderabad,tablet,data analytics online,2024-11-08,8,11,4,45,False,0.046,0.021318304337172262,2.076206896551724,9.0315,0.2,0.00098015192354815,0.22988505747126436,416.25,8.217737917289487,0.10848648648648648,0,0,2,2
A1799,data analytics course,141.0,4239.0,199.82,15.0,5.0,0.035,1639.0,2024/11/27,hyderabad,mobile,data analytics training,2024-11-27,27,11,2,48,False,0.0355,0.03326256192498231,1.4171631205673758,13.321333333333333,0.3333333333333333,0.0011795234725171032,0.10638297872340426,327.8,7.202382143929537,0.12191580231848688,0,0,1,3
A1800,data analytics course,157.0,3367.0,248.9,20.0,8.0,0.051,1470.0,30-11-2024,hyderabad,tablet,data analytics training,2024-11-30,30,11,5,48,False,0.051,0.04662904662904663,1.5853503184713376,12.445,0.4,0.002376002376002376,0.12738853503184713,183.75,4.90598633989554,0.16931972789115646,0,0,2,3
A1801,data analytics course,95.0,5721.0,208.53,16.0,6.0,0.063,1863.0,2024/11/05,hyderabad,mobile,data analytics course,2024-11-05,5,11,1,45,False,0.0632,0.016605488550952632,2.1950526315789474,13.033125,0.375,0.001048767697954903,0.16842105263157894,310.5,7.933966335779025,0.11193236714975846,0,0,1,1
A1802,data analytics course,160.0,5166.0,210.21,20.0,7.0,0.044,1850.0,2024/11/21,hyderabad,desktop,data analytics course,2024-11-21,21,11,3,47,False,0.0437,0.03097173828881146,1.3138125,10.5105,0.35,0.0013550135501355014,0.125,264.2857142857143,7.800723086437372,0.11362702702702702,0,0,0,1
A1803,data analytics course,133.0,5430.0,217.34,16.0,6.0,0.045,1199.0,2024/11/14,hyderabad,mobile,data analytics online,2024-11-14,14,11,3,46,False,0.0451,0.024493554327808472,1.6341353383458648,13.58375,0.375,0.0011049723756906078,0.12030075187969924,199.83333333333334,4.516701941658231,0.1812677231025855,0,0,1,2
A1804,data analytics course,154.0,3452.0,215.61,21.0,7.0,0.058,1631.0,2024/11/02,hyderabad,mobile,analytics for data,2024-11-02,2,11,5,44,True,0.0455,0.044611819235225954,1.4000649350649352,10.267142857142858,0.3333333333333333,0.0020278099652375433,0.13636363636363635,233.0,6.564584202959045,0.13219497240956468,0,0,1,0
A1805,data analytics course,188.0,4520.0,220.11,13.0,4.0,0.021,1262.0,29-11-2024,hyderabad,tablet,data analytics online,2024-11-29,29,11,4,48,False,0.0213,0.0415929203539823,1.1707978723404255,16.931538461538462,0.3076923076923077,0.0008849557522123894,0.06914893617021277,315.5,4.733496887919675,0.1744136291600634,0,0,2,2
A1806,data analytics course,186.0,5073.0,233.58,15.0,4.0,0.047,1965.0,2024-11-04,hyderabad,tablet,online data analytic,2024-11-04,4,11,0,45,True,0.0215,0.03666469544648137,1.2558064516129033,15.572000000000001,0.26666666666666666,0.000788488074117879,0.08064516129032258,491.25,7.412535319804777,0.1188702290076336,0,0,2,5
A1807,data analytics course,101.0,5757.0,249.33,25.0,9.0,0.035,1129.0,2024/11/01,hyderabad,mobile,learn data analytics,2024-11-01,1,11,4,44,True,0.0891,0.017543859649122806,2.468613861386139,9.9732,0.36,0.001563314226159458,0.24752475247524752,125.44444444444444,3.5281354028797174,0.2208414526129318,0,0,1,4
A1808,data analytics course,150.0,3323.0,227.55,14.0,4.0,0.027,1931.0,2024-11-18,hyderabad,mobile,data analytics course,2024-11-18,18,11,0,47,False,0.0267,0.04513993379476377,1.5170000000000001,16.25357142857143,0.2857142857142857,0.0012037315678603672,0.09333333333333334,482.75,7.4860470226323885,0.11784049715173486,0,0,1,1
A1809,data analytics course,127.0,5417.0,229.06,26.0,8.0,0.063,1086.0,2024/11/21,hyderabad,tablet,learn data analytics,2024-11-21,21,11,3,47,False,0.063,0.023444711094701864,1.8036220472440945,8.81,0.3076923076923077,0.0014768321949418497,0.2047244094488189,135.75,3.741115864838907,0.2109208103130755,0,0,2,4
A1810,data analytics course,117.0,5445.0,213.9,10.0,5.0,0.043,1804.0,19-11-2024,hyderabad,desktop,data analytics course,2024-11-19,19,11,1,47,False,0.0427,0.021487603305785124,1.8282051282051281,21.39,0.5,0.0009182736455463728,0.08547008547008547,360.8,7.4338475923328655,0.11856984478935699,0,0,0,1
A1811,data analytics course,152.0,5173.0,230.47,15.0,5.0,0.036,1779.0,2024/11/26,hyderabad,desktop,learn data analytics,2024-11-26,26,11,1,48,False,0.0329,0.02938333655519041,1.51625,15.364666666666666,0.3333333333333333,0.0009665571235260004,0.09868421052631579,355.8,6.719008981646201,0.1295503091624508,0,0,0,4
A1812,data analytics course,87.0,3643.0,220.76,27.0,7.0,0.047,1393.0,2024/11/03,hyderabad,desktop,data analytics online,2024-11-03,3,11,6,44,True,0.0805,0.023881416415042548,2.537471264367816,8.176296296296297,0.25925925925925924,0.0019214932747735384,0.3103448275862069,199.0,5.310019931146948,0.1584781048097631,0,0,0,2
A1813,data analytics course,181.0,3863.0,180.12,17.0,7.0,0.035,1892.0,2024-11-28,hyderabad,desktop,data analytics course,2024-11-28,28,11,3,48,False,0.0387,0.04685477608076624,0.9951381215469614,10.59529411764706,0.4117647058823529,0.0018120631633445508,0.09392265193370165,270.2857142857143,9.504108372196313,0.09520084566596194,0,0,0,1
A1814,data analytics course,147.0,3661.0,191.67,17.0,4.0,0.027,1507.0,24-11-2024,hyderabad,desktop,online data analytic,2024-11-24,24,11,6,47,False,0.0272,0.040152963671128104,1.3038775510204081,11.27470588235294,0.23529411764705882,0.0010925976509150504,0.11564625850340136,376.75,6.8624719570094435,0.12718646317186463,0,0,0,5
A1815,data analytics course,173.0,5463.0,232.38,17.0,5.0,0.029,1568.0,2024-11-26,hyderabad,desktop,analytics for data,2024-11-26,26,11,1,48,False,0.0289,0.031667581914698886,1.3432369942196531,13.669411764705883,0.29411764705882354,0.0009152480322167307,0.09826589595375723,313.6,5.747568637576383,0.1482015306122449,0,0,0,0
A1816,data analytics course,123.0,3459.0,211.88,21.0,4.0,0.033,1223.0,24-11-2024,hyderabad,tablet,learn data analytics,2024-11-24,24,11,6,47,False,0.0325,0.03555941023417172,1.7226016260162602,10.08952380952381,0.19047619047619047,0.0011564035848511131,0.17073170731707318,305.75,4.772135170851425,0.1732461161079313,0,0,2,4
A1817,data analytics course,162.0,3906.0,237.24,13.0,5.0,0.033,1062.0,2024/11/10,hyderabad,desktop,data analytics training,2024-11-10,10,11,6,45,False,0.0309,0.041474654377880185,1.4644444444444444,18.24923076923077,0.38461538461538464,0.0012800819252432156,0.08024691358024691,212.4,3.4764795144157814,0.22338983050847458,0,0,0,3
A1818,data analytics course,135.0,4645.0,182.94,12.0,7.0,0.047,1927.0,2024-11-30,hyderabad,desktop,online data analytic,2024-11-30,30,11,5,48,True,0.04665,0.02906350914962325,1.3551111111111112,15.245,0.5833333333333334,0.0015069967707212056,0.08888888888888889,275.2857142857143,9.533508254072373,0.0949351323300467,0,0,0,5
A1819,data analytics course,169.0,3317.0,232.35,29.0,3.0,0.049,1988.0,2024-11-24,hyderabad,mobile,data analytics training,2024-11-24,24,11,6,47,True,0.0178,0.05094965330117576,1.374852071005917,8.01206896551724,0.10344827586206896,0.0009044317154054868,0.17159763313609466,662.6666666666666,7.556057671616097,0.11687625754527163,0,0,1,3
A1820,data analytics course,120.0,3235.0,220.67,11.0,4.0,0.047,1890.0,2024-11-17,hyderabad,mobile,learn data analytics,2024-11-17,17,11,6,46,True,0.0333,0.03709428129829984,1.8389166666666665,20.06090909090909,0.36363636363636365,0.0012364760432766616,0.09166666666666666,472.5,7.564825304753705,0.11675661375661375,0,0,1,4
A1821,data analytics course,139.0,4823.0,234.73,30.0,5.0,0.047,1361.0,25-11-2024,hyderabad,mobile,data analytics training,2024-11-25,25,11,0,48,True,0.04665,0.028820236367406177,1.688705035971223,7.824333333333333,0.16666666666666666,0.0010366991499066972,0.2158273381294964,272.2,4.798151067183572,0.17246877296105803,0,0,1,3
A1822,data analytics course,167.0,4403.0,189.36,25.0,4.0,0.03,1572.0,06-11-2024,hyderabad,desktop,learn data analytics,2024-06-11,11,6,1,24,False,0.024,0.03792868498750852,1.1338922155688624,7.574400000000001,0.16,0.0009084714967067908,0.1497005988023952,393.0,7.3016476552598215,0.12045801526717557,0,0,0,4
A1823,data analytics course,101.0,3530.0,184.83,22.0,5.0,0.047,1802.0,13-11-2024,hyderabad,mobile,learn data analytics,2024-11-13,13,11,2,46,True,0.0495,0.028611898016997168,1.83,8.401363636363637,0.22727272727272727,0.00141643059490085,0.21782178217821782,360.4,8.749499540117945,0.10256936736958935,0,0,1,4
A1824,data analytics course,129.0,4679.0,239.21,19.0,3.0,0.023,1215.0,2024/11/04,hyderabad,mobile,data analytics online,2024-11-04,4,11,0,45,False,0.0233,0.027569993588373583,1.8543410852713178,12.59,0.15789473684210525,0.0006411626415900834,0.14728682170542637,405.0,4.079219096191631,0.196880658436214,0,0,1,2
A1825,data analytics course,153.0,5396.0,233.79,13.0,8.0,0.047,1571.0,01-11-2024,hyderabad,mobile,data analytics training,2024-01-11,11,1,3,2,True,0.0523,0.028354336545589325,1.5280392156862745,17.98384615384615,0.6153846153846154,0.0014825796886582653,0.08496732026143791,196.375,5.719705718807477,0.1488160407383832,0,0,1,3
A1826,data analytics course,139.0,3976.0,248.65,16.0,4.0,0.047,1160.0,15-11-2024,hyderabad,mobile,data analytics training,2024-11-15,15,11,4,46,True,0.04665,0.03495975855130785,1.7888489208633094,15.540625,0.25,0.001006036217303823,0.11510791366906475,290.0,3.665192036999799,0.21435344827586209,0,0,1,3
A1827,data analytics course,108.0,5545.0,209.82,11.0,8.0,0.074,1491.0,2024/11/08,hyderabad,mobile,analytics for data,2024-11-08,8,11,4,45,False,0.0741,0.019477006311992787,1.9427777777777777,19.074545454545454,0.7272727272727273,0.001442741208295762,0.10185185185185185,186.375,6.106090935087218,0.14072434607645876,0,0,1,0
A1828,data analytics course,85.0,4772.0,211.62,15.0,10.0,0.118,1669.0,19-11-2024,hyderabad,mobile,learn data analytics,2024-11-19,19,11,1,47,False,0.1176,0.017812238055322716,2.4896470588235293,14.108,0.6666666666666666,0.0020955574182732607,0.17647058823529413,166.9,6.886778187316889,0.12679448771719593,0,0,1,4
A1829,data analytics course,109.0,4941.0,242.54,18.0,9.0,0.083,1278.0,2024-11-11,hyderabad,desktop,data analytics training,2024-11-11,11,11,0,46,False,0.0826,0.022060311677798018,2.225137614678899,13.474444444444444,0.5,0.0018214936247723133,0.1651376146788991,142.0,4.269233940793272,0.1897809076682316,0,0,0,3
A1830,data analytics course,119.0,4369.0,216.29,16.0,4.0,0.047,1507.0,2024/11/22,hyderabad,tablet,learn data analytics,2024-11-22,22,11,4,47,True,0.0336,0.027237354085603113,1.817563025210084,13.518125,0.25,0.0009155413138017853,0.13445378151260504,376.75,5.967497341532202,0.14352355673523556,0,0,2,4
A1831,data analytics course,143.0,5526.0,185.94,15.0,8.0,0.056,1712.0,25-11-2024,hyderabad,desktop,analytics for data,2024-11-25,25,11,0,48,False,0.0559,0.02587766920014477,1.3002797202797203,12.395999999999999,0.5333333333333333,0.0014477017734346724,0.1048951048951049,214.0,8.20727116274067,0.10860981308411215,0,0,0,0
A1832,data analytics course,161.0,5302.0,184.29,13.0,8.0,0.036,1703.0,30-11-2024,hyderabad,tablet,learn data analytics,2024-11-30,30,11,5,48,True,0.0497,0.030365899660505468,1.1446583850931678,14.176153846153845,0.6153846153846154,0.0015088645794039985,0.08074534161490683,212.875,8.240870367355798,0.10821491485613623,0,0,2,4
A1833,data analytics course,146.0,4424.0,196.88,20.0,3.0,0.021,1757.0,30-11-2024,hyderabad,tablet,online data analytic,2024-11-30,30,11,5,48,False,0.0205,0.03300180831826401,1.3484931506849316,9.844,0.15,0.000678119349005425,0.136986301369863,585.6666666666666,7.924217797643234,0.11205463858850313,0,0,2,5
A1834,data analytics course,82.0,5971.0,235.52,14.0,8.0,0.098,1568.0,06-11-2024,hyderabad,mobile,learn data analytics,2024-06-11,11,6,1,24,False,0.0976,0.013733043041366605,2.87219512195122,16.822857142857142,0.5714285714285714,0.001339809077206498,0.17073170731707318,196.0,5.657608695652174,0.15020408163265306,0,0,1,4
A1835,data analytics course,88.0,3733.0,244.35,12.0,8.0,0.091,1622.0,2024-11-27,hyderabad,mobile,online data analytic,2024-11-27,27,11,2,48,False,0.0909,0.02357353335119207,2.7767045454545456,20.3625,0.6666666666666666,0.0021430484864720066,0.13636363636363635,202.75,5.638019234704318,0.15064734895191123,0,0,1,5
A1836,data analytics course,127.0,4403.0,244.3,15.0,7.0,0.055,1832.0,22-11-2024,hyderabad,tablet,data analytics course,2024-11-22,22,11,4,47,False,0.0551,0.028843970020440608,1.9236220472440946,16.28666666666667,0.4666666666666667,0.001589825119236884,0.11811023622047244,261.7142857142857,6.498976668031109,0.1333515283842795,0,0,2,1
A1837,data analytics course,179.0,5118.0,189.59,15.0,6.0,0.034,1892.0,2024/11/28,hyderabad,tablet,data analytics course,2024-11-28,28,11,3,48,False,0.0335,0.034974599452911294,1.0591620111731843,12.639333333333333,0.4,0.0011723329425556857,0.08379888268156424,315.3333333333333,8.979429294794029,0.1002061310782241,0,0,2,1
A1838,data analytics course,199.0,4407.0,240.05,21.0,9.0,0.045,1054.0,13-11-2024,hyderabad,desktop,data analytics online,2024-11-13,13,11,2,46,False,0.0452,0.04515543453596551,1.206281407035176,11.430952380952382,0.42857142857142855,0.0020422055820285907,0.10552763819095477,117.11111111111111,3.3907519266819413,0.22775142314990512,0,0,0,2
A1839,data analytics course,191.0,3190.0,211.1,10.0,7.0,0.037,1507.0,22-11-2024,hyderabad,tablet,learn data analytics,2024-11-22,22,11,4,47,False,0.0366,0.05987460815047022,1.1052356020942409,21.11,0.7,0.00219435736677116,0.05235602094240838,215.28571428571428,6.138796778777831,0.14007962840079627,0,0,2,4
A1840,data analytics course,99.0,4880.0,245.13,25.0,8.0,0.047,1236.0,2024/11/19,hyderabad,tablet,data analytics course,2024-11-19,19,11,1,47,True,0.0808,0.02028688524590164,2.476060606060606,9.8052,0.32,0.001639344262295082,0.25252525252525254,154.5,4.042222494186758,0.1983252427184466,0,0,2,1
A1841,data analytics course,122.0,5774.0,224.4,23.0,10.0,0.047,1330.0,2024-11-14,hyderabad,mobile,learn data analytics,2024-11-14,14,11,3,46,True,0.082,0.02112919986144787,1.839344262295082,9.756521739130434,0.43478260869565216,0.0017319016279875303,0.1885245901639344,133.0,4.926916221033868,0.1687218045112782,0,0,1,4
A1842,data analytics course,178.0,4103.0,207.23,17.0,8.0,0.045,1612.0,2024/11/15,hyderabad,mobile,analytics for data,2024-11-15,15,11,4,46,False,0.0449,0.04338289056787716,1.1642134831460673,12.19,0.47058823529411764,0.0019497928345113332,0.09550561797752809,201.5,6.778796506297351,0.1285545905707196,0,0,1,0
A1843,data analytics course,157.0,4414.0,240.57,17.0,9.0,0.057,1483.0,2024-11-27,hyderabad,desktop,learn data analytics,2024-11-27,27,11,2,48,False,0.0573,0.03556864521975532,1.5322929936305731,14.151176470588235,0.5294117647058824,0.0020389669234254643,0.10828025477707007,164.77777777777777,5.1645259176123375,0.1622184760620364,0,0,0,4
A1844,data analytics course,199.0,5319.0,216.7,25.0,9.0,0.045,1507.0,01-11-2024,hyderabad,desktop,online data analytic,2024-01-11,11,1,3,2,False,0.0452,0.03741304756533183,1.0889447236180905,8.668,0.36,0.001692047377326565,0.12562814070351758,167.44444444444446,5.9543147208121825,0.14379562043795618,0,0,0,5
A1845,data analytics course,192.0,3320.0,208.09,17.0,3.0,0.016,1169.0,18-11-2024,hyderabad,mobile,data analytics training,2024-11-18,18,11,0,47,False,0.0156,0.05783132530120482,1.0838020833333333,12.240588235294117,0.17647058823529413,0.0009036144578313253,0.08854166666666667,389.6666666666667,4.617761545485126,0.17800684345594525,0,0,1,3
A1846,data analytics course,144.0,4146.0,246.1,18.0,10.0,0.069,1074.0,15-11-2024,hyderabad,desktop,analytics for data,2024-11-15,15,11,4,46,False,0.0694,0.03473227206946455,1.7090277777777778,13.672222222222222,0.5555555555555556,0.00241196333815726,0.125,107.4,3.3640796424217796,0.22914338919925512,0,0,0,0
A1847,data analytics course,147.0,4720.0,227.6,23.0,8.0,0.047,1907.0,2024/11/05,hyderabad,tablet,online data analytic,2024-11-05,5,11,1,45,True,0.0544,0.03114406779661017,1.5482993197278911,9.895652173913044,0.34782608695652173,0.001694915254237288,0.1564625850340136,238.375,7.378734622144113,0.11934976402726796,0,0,2,5
A1848,data analytics course,121.0,3557.0,237.03,16.0,7.0,0.047,1255.0,2024/11/25,hyderabad,mobile,data analytics online,2024-11-25,25,11,0,48,True,0.0579,0.034017430418892325,1.9589256198347107,14.814375,0.4375,0.001967950520101209,0.1322314049586777,179.28571428571428,4.294688436062946,0.18886852589641434,0,0,1,2
A1849,data analytics course,193.0,5899.0,227.24,12.0,9.0,0.042,1832.0,02-11-2024,hyderabad,desktop,analytics for data,2024-02-11,11,2,6,6,False,0.0466,0.03271740973046279,1.1774093264248706,18.936666666666667,0.75,0.0015256823190371248,0.06217616580310881,203.55555555555554,7.061960922372822,0.12403930131004368,0,0,0,0
A1850,data analytics course,170.0,4968.0,216.78,21.0,5.0,0.045,1997.0,2024/11/24,hyderabad,tablet,data analytics course,2024-11-24,24,11,6,47,True,0.0294,0.03421900161030596,1.2751764705882354,10.322857142857142,0.23809523809523808,0.001006441223832528,0.12352941176470589,399.4,8.212104437678752,0.1085528292438658,0,0,2,1
A1851,data analytics course,198.0,5934.0,199.61,14.0,6.0,0.03,1507.0,13-11-2024,hyderabad,tablet,learn data analytics,2024-11-13,13,11,2,46,False,0.0303,0.033367037411526794,1.0081313131313132,14.257857142857144,0.42857142857142855,0.0010111223458038423,0.0707070707070707,251.16666666666666,6.549721957817743,0.1324552090245521,0,0,2,4
A1852,data analytics course,133.0,4078.0,189.42,21.0,6.0,0.045,1969.0,21-11-2024,hyderabad,desktop,data analytics online,2024-11-21,21,11,3,47,False,0.0451,0.032614026483570376,1.4242105263157894,9.02,0.2857142857142857,0.0014713094654242277,0.15789473684210525,328.1666666666667,9.394889663182346,0.09620111731843575,0,0,0,2
A1853,data analytics course,82.0,4163.0,208.08,30.0,8.0,0.098,1297.0,2024-11-04,hyderabad,mobile,data analytics course,2024-11-04,4,11,0,45,False,0.0976,0.01969733365361518,2.537560975609756,6.936000000000001,0.26666666666666666,0.0019216910881575786,0.36585365853658536,162.125,5.233179546328335,0.16043176561295297,0,0,1,1
A1854,data analytics course,90.0,4330.0,249.24,20.0,4.0,0.044,1618.0,2024-11-15,hyderabad,tablet,data analytics training,2024-11-15,15,11,4,46,False,0.0444,0.020785219399538105,2.7693333333333334,12.462,0.2,0.0009237875288683603,0.2222222222222222,404.5,5.491734874017012,0.15404202719406676,0,0,2,3
A1855,data analytics course,122.0,5882.0,189.76,25.0,7.0,0.057,1357.0,2024-11-25,hyderabad,tablet,analytics for data,2024-11-25,25,11,0,48,False,0.0574,0.02074124447466848,1.5554098360655737,7.5904,0.28,0.0011900714042842571,0.20491803278688525,193.85714285714286,6.151138279932547,0.13983787767133382,0,0,2,0
A1856,data analytics course,105.0,5645.0,218.24,17.0,6.0,0.047,1420.0,2024/11/02,hyderabad,mobile,online data analytic,2024-11-02,2,11,5,44,True,0.0571,0.018600531443755536,2.0784761904761906,12.83764705882353,0.35294117647058826,0.0010628875110717448,0.1619047619047619,236.66666666666666,5.5065982404692075,0.15369014084507043,0,0,1,5
A1857,data analytics course,179.0,3848.0,213.26,12.0,5.0,0.047,1807.0,2024/11/29,hyderabad,desktop,data analytics course,2024-11-29,29,11,4,48,True,0.0279,0.04651767151767152,1.1913966480446927,17.771666666666665,0.4166666666666667,0.0012993762993762994,0.0670391061452514,361.4,7.473225171152584,0.11801881571665744,0,0,0,1
A1858,data analytics course,91.0,5609.0,228.27,12.0,10.0,0.11,1098.0,2024-11-11,hyderabad,desktop,analytics for data,2024-11-11,11,11,0,46,False,0.1099,0.016223925833481905,2.5084615384615385,19.0225,0.8333333333333334,0.0017828489926903191,0.13186813186813187,109.8,3.810093310553292,0.207896174863388,0,0,0,0
A1859,data analytics course,168.0,4390.0,195.52,22.0,10.0,0.06,1553.0,2024-11-04,hyderabad,desktop,data analytics course,2024-11-04,4,11,0,45,False,0.0595,0.03826879271070615,1.1638095238095238,8.887272727272729,0.45454545454545453,0.002277904328018223,0.13095238095238096,155.3,6.942921440261865,0.12589826142949131,0,0,0,1
A1860,data analytics course,162.0,4774.0,210.8,20.0,7.0,0.043,1387.0,2024/11/29,hyderabad,tablet,analytics for data,2024-11-29,29,11,4,48,False,0.0432,0.03393380812735652,1.3012345679012347,10.540000000000001,0.35,0.001466275659824047,0.12345679012345678,198.14285714285714,5.579696394686907,0.1519826964671954,0,0,2,0
A1861,data analytics course,130.0,5787.0,218.79,13.0,10.0,0.077,1679.0,2024-11-09,hyderabad,mobile,online data analytic,2024-11-09,9,11,5,45,False,0.0769,0.022464143770520133,1.6829999999999998,16.83,0.7692307692307693,0.0017280110592707793,0.1,167.9,6.674025321084145,0.13030970815961881,0,0,1,5
A1862,data analytics course,97.0,5192.0,184.79,13.0,10.0,0.047,1382.0,2024/11/05,hyderabad,mobile,learn data analytics,2024-11-05,5,11,1,45,True,0.1031,0.018682588597842834,1.9050515463917526,14.214615384615383,0.7692307692307693,0.001926040061633282,0.13402061855670103,138.2,6.478759673142487,0.13371201157742402,0,0,1,4
A1863,data analytics course,142.0,4223.0,222.28,27.0,5.0,0.038,1506.0,2024-11-07,hyderabad,desktop,learn data analytics,2024-11-07,7,11,3,45,False,0.0352,0.033625384797537294,1.5653521126760563,8.232592592592592,0.18518518518518517,0.0011839924224484964,0.19014084507042253,301.2,5.775238438006118,0.14759628154050464,0,0,0,4
A1864,data analytics course,138.0,3146.0,197.89,22.0,7.0,0.047,1507.0,2024/11/08,hyderabad,desktop,learn data analytics,2024-11-08,8,11,4,45,True,0.0507,0.043865225683407505,1.4339855072463767,8.995,0.3181818181818182,0.0022250476795931343,0.15942028985507245,215.28571428571428,6.615341856586994,0.13131386861313868,0,0,0,4
A1865,data analytics course,186.0,3988.0,237.69,15.0,5.0,0.027,1603.0,2024-11-14,hyderabad,tablet,data analytics course,2024-11-14,14,11,3,46,False,0.0269,0.04663991975927784,1.2779032258064515,15.846,0.3333333333333333,0.0012537612838515546,0.08064516129032258,320.6,5.744078421473348,0.14827822832189644,0,0,2,1
A1866,data analytics course,170.0,3437.0,232.08,23.0,5.0,0.029,1405.0,2024/11/29,hyderabad,mobile,learn data analytics,2024-11-29,29,11,4,48,False,0.0294,0.049461739889438465,1.3651764705882354,10.090434782608696,0.21739130434782608,0.0014547570555717194,0.13529411764705881,281.0,5.053946914856946,0.16518149466192172,0,0,1,4
A1867,data analytics course,85.0,3718.0,224.14,21.0,6.0,0.071,1938.0,2024-11-04,hyderabad,desktop,online data analytic,2024-11-04,4,11,0,45,False,0.0706,0.0228617536309844,2.636941176470588,10.673333333333332,0.2857142857142857,0.0016137708445400753,0.24705882352941178,323.0,7.6463817257071485,0.11565531475748193,0,0,0,5
A1868,data analytics course,115.0,5343.0,239.92,20.0,8.0,0.047,1381.0,2024-11-15,hyderabad,desktop,learn data analytics,2024-11-15,15,11,4,46,True,0.0696,0.02152348867677335,2.0862608695652174,11.995999999999999,0.4,0.0014972861688190156,0.17391304347826086,172.625,4.756085361787262,0.17372918175235336,0,0,0,4
A1869,data analytics course,167.0,5170.0,241.21,24.0,4.0,0.038,1515.0,21-11-2024,hyderabad,mobile,data analytics course,2024-11-21,21,11,3,47,True,0.024,0.03230174081237911,1.44437125748503,10.050416666666667,0.16666666666666666,0.0007736943907156673,0.1437125748502994,378.75,5.280834127938311,0.1592145214521452,0,0,1,1
A1870,data analytics course,113.0,5916.0,234.58,18.0,5.0,0.044,1165.0,2024/11/12,hyderabad,mobile,data analytics course,2024-11-12,12,11,1,46,False,0.0442,0.01910074374577417,2.075929203539823,13.032222222222224,0.2777777777777778,0.0008451656524678837,0.1592920353982301,233.0,3.9663227896666378,0.2013562231759657,0,0,1,1
A1871,data analytics course,175.0,4958.0,245.96,22.0,10.0,0.047,1777.0,2024-11-21,hyderabad,mobile,online data analytic,2024-11-21,21,11,3,47,True,0.0571,0.035296490520371114,1.4054857142857142,11.18,0.45454545454545453,0.002016942315449778,0.12571428571428572,177.7,6.224751992193852,0.13841305571187396,0,0,1,5
A1872,data analytics course,112.0,5538.0,225.66,22.0,4.0,0.041,1507.0,2024/11/22,hyderabad,desktop,online data analytic,2024-11-22,22,11,4,47,False,0.0357,0.020223907547851208,2.0148214285714285,10.257272727272728,0.18181818181818182,0.0007222824124232575,0.19642857142857142,376.75,5.678188425064255,0.1497412076974121,0,0,0,5
A1873,data analytics course,194.0,5309.0,191.4,19.0,10.0,0.046,1764.0,13-11-2024,hyderabad,desktop,data analytics training,2024-11-13,13,11,2,46,False,0.0515,0.036541721604822,0.98659793814433,10.073684210526316,0.5263157894736842,0.0018835938971557733,0.0979381443298969,176.4,8.21630094043887,0.10850340136054422,0,0,0,3
A1874,data analytics course,139.0,4539.0,244.4,18.0,6.0,0.047,1638.0,2024-11-28,hyderabad,mobile,analytics for data,2024-11-28,28,11,3,48,True,0.04665,0.03062348534919586,1.758273381294964,13.577777777777778,0.3333333333333333,0.0013218770654329147,0.12949640287769784,273.0,5.702127659574468,0.1492063492063492,0,0,1,0
A1875,data analytics course,82.0,4622.0,203.99,17.0,9.0,0.11,1375.0,2024/11/12,hyderabad,mobile,online data analytic,2024-11-12,12,11,1,46,False,0.1098,0.017741237559498052,2.4876829268292684,11.999411764705883,0.5294117647058824,0.0019472090004327132,0.2073170731707317,152.77777777777777,5.740526496396882,0.14835636363636365,0,0,1,5
A1876,data analytics course,139.0,3355.0,193.57,26.0,9.0,0.047,1961.0,2024/11/11,hyderabad,mobile,learn data analytics,2024-11-11,11,11,0,46,True,0.04665,0.04143070044709389,1.392589928057554,7.444999999999999,0.34615384615384615,0.002682563338301043,0.18705035971223022,217.88888888888889,9.130702071602006,0.09870984191738909,0,0,1,4
A1877,data analytics course,179.0,4992.0,221.48,27.0,10.0,0.037,1062.0,2024/11/06,hyderabad,tablet,learn data analytics,2024-11-06,6,11,2,45,True,0.0559,0.03585737179487179,1.23731843575419,8.202962962962962,0.37037037037037035,0.002003205128205128,0.15083798882681565,106.2,3.795015351273253,0.20854990583804142,0,0,2,4
A1878,data analytics course,93.0,3015.0,232.01,21.0,4.0,0.043,1770.0,2024-11-26,hyderabad,mobile,learn data analytics,2024-11-26,26,11,1,48,False,0.043,0.030845771144278607,2.494731182795699,11.048095238095238,0.19047619047619047,0.0013266998341625207,0.22580645161290322,442.5,6.628981509417698,0.13107909604519774,0,0,1,4
A1879,data analytics course,152.0,4662.0,249.13,24.0,7.0,0.046,1951.0,11-11-2024,hyderabad,desktop,online data analytic,2024-11-11,11,11,0,46,False,0.0461,0.03260403260403261,1.639013157894737,10.380416666666667,0.2916666666666667,0.0015015015015015015,0.15789473684210525,278.7142857142857,6.831252759603419,0.12769349051768325,0,0,0,5
A1880,data analytics course,81.0,3766.0,213.12,27.0,7.0,0.086,1183.0,27-11-2024,hyderabad,desktop,online data analytic,2024-11-27,27,11,2,48,False,0.0864,0.021508231545406268,2.631111111111111,7.8933333333333335,0.25925925925925924,0.0018587360594795538,0.3333333333333333,169.0,4.550863363363363,0.1801521555367709,0,0,0,5
A1881,data analytics course,130.0,5774.0,241.97,11.0,7.0,0.044,1708.0,2024/11/20,hyderabad,desktop,data analytics course,2024-11-20,20,11,2,47,False,0.0538,0.022514721163837893,1.8613076923076923,21.997272727272726,0.6363636363636364,0.0012123311395912711,0.08461538461538462,244.0,6.058726288382857,0.14166861826697894,0,0,0,1
A1882,data analytics course,110.0,4542.0,227.95,20.0,4.0,0.036,1423.0,2024/11/11,hyderabad,desktop,data analytics training,2024-11-11,11,11,0,46,False,0.0364,0.024218405988551298,2.0722727272727273,11.397499999999999,0.2,0.0008806693086745927,0.18181818181818182,355.75,5.242597060758938,0.16018973998594518,0,0,0,3
A1883,data analytics course,122.0,5179.0,214.965,11.0,4.0,0.033,1507.0,2024-11-18,hyderabad,tablet,analytics for data,2024-11-18,18,11,0,47,False,0.0328,0.023556671172040935,1.7620081967213115,19.542272727272728,0.36363636363636365,0.0007723498744931454,0.09016393442622951,376.75,6.010443560579629,0.14264432647644326,0,0,2,0
A1884,data analytics course,113.0,5265.0,184.21,27.0,5.0,0.044,1353.0,20-11-2024,hyderabad,tablet,data analytics online,2024-11-20,20,11,2,47,False,0.0442,0.021462488129154796,1.6301769911504425,6.822592592592593,0.18518518518518517,0.000949667616334283,0.23893805309734514,270.6,6.344878128223223,0.13614929785661495,0,0,2,2
A1885,data analytics course,140.0,5297.0,223.9,28.0,6.0,0.043,1630.0,2024-11-21,hyderabad,mobile,data analytics course,2024-11-21,21,11,3,47,False,0.0429,0.026430054747970548,1.5992857142857144,7.996428571428572,0.21428571428571427,0.0011327166320558807,0.2,271.6666666666667,6.280035730236713,0.13736196319018404,0,0,1,1
A1886,data analytics course,170.0,3347.0,248.44,27.0,3.0,0.047,1719.0,2024/11/20,hyderabad,desktop,learn data analytics,2024-11-20,20,11,2,47,True,0.0176,0.050791753809381536,1.4614117647058824,9.201481481481482,0.1111111111111111,0.00089632506722438,0.1588235294117647,573.0,5.919175656094026,0.1445258871436882,0,0,0,4
A1887,data analytics course,176.0,5960.0,245.33,19.0,8.0,0.045,1761.0,2024/11/25,hyderabad,tablet,analytics for data,2024-11-25,25,11,0,48,False,0.0455,0.02953020134228188,1.3939204545454547,12.912105263157896,0.42105263157894735,0.0013422818791946308,0.10795454545454546,220.125,6.178086658786125,0.13931289040318,0,0,2,0
A1888,data analytics course,139.0,5143.0,246.3,19.0,5.0,0.047,1346.0,05-11-2024,hyderabad,mobile,data analytics training,2024-05-11,11,5,5,19,True,0.04665,0.02702702702702703,1.7719424460431656,12.963157894736844,0.2631578947368421,0.0009721952167995333,0.1366906474820144,269.2,4.464880227365002,0.18298662704309065,0,0,1,3
A1889,data analytics course,195.0,5265.0,242.0,10.0,4.0,0.054,1699.0,2024/11/08,hyderabad,tablet,online data analytic,2024-11-08,8,11,4,45,True,0.0205,0.037037037037037035,1.241025641025641,24.2,0.4,0.0007597340930674264,0.05128205128205128,424.75,6.020661157024794,0.14243672748675693,0,0,2,5
A1890,data analytics course,162.0,4396.0,183.96,18.0,4.0,0.043,1054.0,2024/11/18,hyderabad,tablet,data analytics online,2024-11-18,18,11,0,47,True,0.0247,0.036851683348498636,1.1355555555555557,10.22,0.2222222222222222,0.0009099181073703367,0.1111111111111111,263.5,4.729506414437921,0.17453510436432637,0,0,2,2
A1891,data analytics course,138.0,4381.0,191.55,28.0,7.0,0.047,1756.0,2024-11-01,hyderabad,tablet,data analytics training,2024-11-01,1,11,4,44,True,0.0507,0.031499657612417256,1.3880434782608697,6.841071428571429,0.25,0.0015978087194704405,0.2028985507246377,250.85714285714286,8.167319237796919,0.10908314350797267,0,0,2,3
A1892,data analytics course,177.0,3965.0,225.82,15.0,4.0,0.023,1530.0,22-11-2024,hyderabad,mobile,online data analytic,2024-11-22,22,11,4,47,False,0.0226,0.044640605296343,1.275819209039548,15.054666666666666,0.26666666666666666,0.001008827238335435,0.0847457627118644,382.5,5.775307767248251,0.14759477124183007,0,0,1,5
A1893,data analytics course,159.0,3366.0,217.27,21.0,7.0,0.044,1515.0,2024/11/17,hyderabad,tablet,online data analytic,2024-11-17,17,11,6,46,False,0.044,0.04723707664884135,1.3664779874213837,10.346190476190477,0.3333333333333333,0.0020796197266785502,0.1320754716981132,216.42857142857142,5.972890873107193,0.14341254125412542,0,0,2,5
A1894,data analytics course,111.0,4026.0,229.01,13.0,3.0,0.047,1438.0,2024-11-01,hyderabad,desktop,learn data analytics,2024-11-01,1,11,4,44,True,0.027,0.027570789865871834,2.063153153153153,17.616153846153846,0.23076923076923078,0.0007451564828614009,0.11711711711711711,479.3333333333333,5.27920178158159,0.1592559109874826,0,0,0,4
A1895,data analytics course,184.0,5560.0,189.14,14.0,6.0,0.047,1250.0,2024-11-17,hyderabad,tablet,data analytics online,2024-11-17,17,11,6,46,True,0.0326,0.033093525179856115,1.0279347826086955,13.51,0.42857142857142855,0.001079136690647482,0.07608695652173914,208.33333333333334,5.60886116104473,0.151312,0,0,2,2
A1896,data analytics course,128.0,4500.0,188.21,10.0,3.0,0.047,1087.0,2024-11-14,hyderabad,desktop,online data analytic,2024-11-14,14,11,3,46,True,0.0234,0.028444444444444446,1.470390625,18.821,0.3,0.0006666666666666666,0.078125,362.3333333333333,4.775463577918282,0.17314627414903405,0,0,0,5
A1897,data analytics course,164.0,3851.0,219.15,22.0,6.0,0.049,1487.0,2024/11/09,hyderabad,mobile,learn data analytics,2024-11-09,9,11,5,45,True,0.0366,0.042586341210075304,1.3362804878048782,9.961363636363636,0.2727272727272727,0.0015580368735393405,0.13414634146341464,247.83333333333334,5.78530686744239,0.14737726967047748,0,0,1,4
A1898,data analytics course,120.0,3464.0,228.3,19.0,4.0,0.058,1426.0,22-11-2024,hyderabad,tablet,online data analytic,2024-11-22,22,11,4,47,True,0.0333,0.03464203233256351,1.9025,12.015789473684212,0.21052631578947367,0.0011547344110854503,0.15833333333333333,356.5,5.24616732369689,0.16009817671809257,0,0,2,5
A1899,data analytics course,89.0,3248.0,239.42,10.0,4.0,0.047,1507.0,2024/11/11,hyderabad,mobile,learn data analytics,2024-11-11,11,11,0,46,True,0.0449,0.027401477832512317,2.690112359550562,23.942,0.4,0.0012315270935960591,0.11235955056179775,376.75,5.294378080360872,0.1588719309887193,0,0,1,4
A1900,data analytics course,91.0,3721.0,231.45,24.0,6.0,0.06,1507.0,2024-11-14,hyderabad,tablet,online data analytic,2024-11-14,14,11,3,46,False,0.0659,0.02445579145391024,2.5434065934065933,9.643749999999999,0.25,0.0016124697661918839,0.26373626373626374,251.16666666666666,5.511125513069778,0.15358327803583277,0,0,2,5
A1901,data analytics course,143.0,4143.0,191.68,20.0,5.0,0.035,1460.0,2024-11-30,hyderabad,tablet,analytics for data,2024-11-30,30,11,5,48,False,0.035,0.034516051170649285,1.3404195804195804,9.584,0.25,0.0012068549360366883,0.13986013986013987,292.0,6.61686143572621,0.1312876712328767,0,0,2,0
A1902,data analytics course,176.0,5768.0,238.94,14.0,8.0,0.045,1016.0,2024/11/02,hyderabad,tablet,data analytics online,2024-11-02,2,11,5,44,False,0.0455,0.030513176144244106,1.3576136363636364,17.06714285714286,0.5714285714285714,0.0013869625520110957,0.07954545454545454,127.0,3.2521135012973965,0.2351771653543307,0,0,2,2
A1903,data analytics course,151.0,4408.0,214.29,20.0,5.0,0.033,1900.0,21-11-2024,hyderabad,desktop,data analytics course,2024-11-21,21,11,3,47,False,0.0331,0.03425589836660617,1.419139072847682,10.7145,0.25,0.001134301270417423,0.13245033112582782,380.0,7.86648933687993,0.11278421052631578,0,0,0,1
A1904,data analytics course,134.0,3623.0,221.65,19.0,5.0,0.047,1937.0,2024-11-24,hyderabad,desktop,data analytics online,2024-11-24,24,11,6,47,False,0.0373,0.03698592326800994,1.6541044776119402,11.66578947368421,0.2631578947368421,0.001380071763731714,0.1417910447761194,387.4,7.739002932551319,0.11442953020134229,0,0,0,2
A1905,data analytics course,191.0,3057.0,223.28,27.0,6.0,0.031,1208.0,2024/11/03,hyderabad,desktop,data analytics online,2024-11-03,3,11,6,44,False,0.0314,0.0624795551193981,1.1690052356020944,8.26962962962963,0.2222222222222222,0.001962708537782139,0.14136125654450263,201.33333333333334,4.4102472232174845,0.1848344370860927,0,0,0,2
A1906,data analytics course,170.0,3144.0,214.965,21.0,3.0,0.031,1695.0,2024-11-05,hyderabad,desktop,data analytics online,2024-11-05,5,11,1,45,True,0.0176,0.05407124681933842,1.2645,10.236428571428572,0.14285714285714285,0.0009541984732824427,0.12352941176470589,565.0,6.885004535622079,0.12682300884955752,0,0,0,2
A1907,data analytics course,112.0,3989.0,228.74,10.0,8.0,0.047,1812.0,13-11-2024,hyderabad,mobile,analytics for data,2024-11-13,13,11,2,46,True,0.0714,0.028077212333918276,2.042321428571429,22.874000000000002,0.8,0.002005515166708448,0.08928571428571429,226.5,6.921657777389175,0.12623620309050773,0,0,1,0
A1908,data analytics course,169.0,3619.0,246.66,28.0,3.0,0.018,1354.0,2024-11-25,hyderabad,desktop,online data analytic,2024-11-25,25,11,0,48,False,0.0178,0.04669798286819563,1.459526627218935,8.809285714285714,0.10714285714285714,0.0008289582757667864,0.16568047337278108,451.3333333333333,4.489337549663504,0.18217134416543573,0,0,0,5
A1909,data analytics course,172.0,4696.0,242.17,26.0,3.0,0.017,1719.0,2024-11-06,hyderabad,desktop,data analytics course,2024-11-06,6,11,2,45,False,0.0174,0.036626916524701875,1.4079651162790696,9.314230769230768,0.11538461538461539,0.0006388415672913117,0.1511627906976744,573.0,6.09831936243135,0.1408784176847004,0,0,0,1
A1910,data analytics course,162.0,5684.0,219.08,30.0,7.0,0.047,1295.0,2024/11/26,hyderabad,desktop,data analytics course,2024-11-26,26,11,1,48,True,0.0432,0.028501055594651655,1.3523456790123458,7.302666666666667,0.23333333333333334,0.0012315270935960591,0.18518518518518517,185.0,4.911082709512507,0.16917374517374517,0,0,0,1
A1911,data analytics course,183.0,4197.0,243.19,29.0,8.0,0.047,1593.0,2024/11/09,hyderabad,mobile,data analytics training,2024-11-09,9,11,5,45,True,0.0437,0.04360257326661901,1.3289071038251365,8.385862068965517,0.27586206896551724,0.0019061234214915416,0.15846994535519127,199.125,5.550433817179982,0.152661644695543,0,0,1,3
A1912,data analytics course,108.0,5949.0,184.25,23.0,8.0,0.074,1986.0,2024/11/23,hyderabad,desktop,data analytics training,2024-11-23,23,11,5,47,False,0.0741,0.018154311649016642,1.7060185185185186,8.01086956521739,0.34782608695652173,0.0013447638258530846,0.21296296296296297,248.25,9.778833107191316,0.09277442094662638,0,0,0,3
A1913,data analytics course,126.0,3784.0,214.965,24.0,5.0,0.047,1951.0,28-11-2024,hyderabad,mobile,analytics for data,2024-11-28,28,11,3,48,True,0.0397,0.033298097251585626,1.7060714285714287,8.956875,0.20833333333333334,0.001321353065539112,0.19047619047619047,390.2,8.075896076105412,0.11018195797027165,0,0,1,0
A1914,data analytics course,174.0,3570.0,222.65,25.0,3.0,0.017,1507.0,2024-11-19,hyderabad,tablet,learn data analytics,2024-11-19,19,11,1,47,False,0.0172,0.04873949579831933,1.2795977011494253,8.906,0.12,0.0008403361344537816,0.14367816091954022,502.3333333333333,5.768470693914215,0.14774386197743863,0,0,2,4
A1915,data analytics course,122.0,4632.0,236.57,13.0,6.0,0.047,1001.0,2024-11-15,hyderabad,desktop,data analytics course,2024-11-15,15,11,4,46,True,0.0492,0.026338514680483593,1.9390983606557377,18.197692307692307,0.46153846153846156,0.0012953367875647669,0.10655737704918032,166.83333333333334,3.2313057445999074,0.23633366633366631,0,0,0,1
A1916,data analytics course,191.0,3457.0,237.6,20.0,10.0,0.052,1507.0,2024/11/05,hyderabad,desktop,data analytics course,2024-11-05,5,11,1,45,False,0.0524,0.055250216951113686,1.243979057591623,11.879999999999999,0.5,0.0028926815157651145,0.10471204188481675,150.7,5.3425925925925934,0.15766423357664233,0,0,0,1
A1917,data analytics course,122.0,4525.0,202.89,23.0,8.0,0.034,1499.0,22-11-2024,hyderabad,tablet,data analytics training,2024-11-22,22,11,4,47,True,0.0656,0.02696132596685083,1.6630327868852457,8.821304347826086,0.34782608695652173,0.0017679558011049724,0.1885245901639344,187.375,6.388239932968605,0.13535023348899267,0,0,2,3
A1918,data analytics course,175.0,4850.0,186.25,28.0,10.0,0.057,1978.0,2024/11/18,hyderabad,desktop,analytics for data,2024-11-18,18,11,0,47,False,0.0571,0.03608247422680412,1.0642857142857143,6.651785714285714,0.35714285714285715,0.002061855670103093,0.16,197.8,9.62013422818792,0.09416076845298281,0,0,0,0
A1919,data analytics course,123.0,4938.0,180.64,24.0,9.0,0.073,1746.0,21-11-2024,hyderabad,tablet,data analytics course,2024-11-21,21,11,3,47,False,0.0732,0.02490886998784933,1.4686178861788617,7.526666666666666,0.375,0.0018226002430133657,0.1951219512195122,194.0,8.665633303808681,0.10345933562428407,0,0,2,1
A1920,data analytics course,135.0,5748.0,239.22,20.0,7.0,0.051,1222.0,2024/11/21,hyderabad,tablet,analytics for data,2024-11-21,21,11,3,47,False,0.0519,0.02348643006263048,1.772,11.961,0.35,0.0012178148921363954,0.14814814814814814,174.57142857142858,4.108268539419781,0.19576104746317513,0,0,2,0
A1921,data analytics course,139.0,4622.0,187.85,24.0,5.0,0.047,1998.0,11-11-2024,hyderabad,tablet,analytics for data,2024-11-11,11,11,0,46,True,0.04665,0.030073561228905237,1.3514388489208633,7.827083333333333,0.20833333333333334,0.0010817827780181739,0.17266187050359713,399.6,9.636145861059356,0.09401901901901902,0,0,2,0
A1922,data analytics course,90.0,5596.0,188.04,12.0,4.0,0.044,1507.0,2024/11/17,hyderabad,mobile,online data analytic,2024-11-17,17,11,6,46,False,0.0444,0.016082916368834882,2.0893333333333333,15.67,0.3333333333333333,0.0007147962830593281,0.13333333333333333,376.75,7.014252286747501,0.12477770404777704,0,0,1,5
A1923,data analytics course,139.0,5308.0,234.1,27.0,8.0,0.047,1150.0,2024/11/16,hyderabad,tablet,analytics for data,2024-11-16,16,11,5,46,True,0.04665,0.026186887716654107,1.6841726618705035,8.670370370370371,0.2962962962962963,0.0015071590052750565,0.19424460431654678,143.75,3.9124305852199917,0.20356521739130434,0,0,2,0
A1924,data analytics course,89.0,3069.0,205.37,19.0,6.0,0.047,1518.0,2024/11/28,hyderabad,desktop,data analytics online,2024-11-28,28,11,3,48,True,0.0674,0.028999674160964484,2.3075280898876405,10.808947368421054,0.3157894736842105,0.0019550342130987292,0.21348314606741572,253.0,6.391537225495448,0.13528985507246377,0,0,0,2
A1925,data analytics course,139.0,4221.0,180.83,24.0,10.0,0.033,1082.0,2024/11/13,hyderabad,tablet,learn data analytics,2024-11-13,13,11,2,46,True,0.04665,0.03293058516939114,1.3009352517985613,7.534583333333334,0.4166666666666667,0.002369106846718787,0.17266187050359713,108.2,4.983520433556379,0.16712569316081333,0,0,2,4
A1926,data analytics course,148.0,4514.0,203.54,23.0,3.0,0.047,1622.0,05-11-2024,hyderabad,desktop,data analytics online,2024-05-11,11,5,5,19,True,0.0203,0.03278688524590164,1.3752702702702702,8.849565217391303,0.13043478260869565,0.000664599025254763,0.1554054054054054,540.6666666666666,6.968949592217746,0.12548705302096178,0,0,0,2
A1927,data analytics course,96.0,3468.0,228.41,16.0,9.0,0.094,1035.0,04-11-2024,hyderabad,desktop,learn data analytics,2024-04-11,11,4,3,15,False,0.0938,0.02768166089965398,2.3792708333333334,14.275625,0.5625,0.0025951557093425604,0.16666666666666666,115.0,3.5313252484567226,0.22068599033816425,0,0,0,4
A1928,data analytics course,126.0,3613.0,208.74,18.0,7.0,0.047,1106.0,2024-11-06,hyderabad,desktop,learn data analytics,2024-11-06,6,11,2,45,True,0.0556,0.034874065873235535,1.6566666666666667,11.596666666666668,0.3888888888888889,0.0019374481040686411,0.14285714285714285,158.0,4.298457411133467,0.18873417721518987,0,0,0,4
A1929,data analytics course,115.0,3234.0,227.77,30.0,3.0,0.026,1272.0,13-11-2024,hyderabad,tablet,learn data analytics,2024-11-13,13,11,2,46,False,0.0261,0.035559678416821276,1.980608695652174,7.592333333333333,0.1,0.0009276437847866419,0.2608695652173913,424.0,4.584580936910041,0.17906446540880505,0,0,2,4
A1930,data analytics course,135.0,5436.0,245.86,28.0,9.0,0.067,1453.0,2024/11/03,hyderabad,desktop,data analytics online,2024-11-03,3,11,6,44,False,0.0667,0.024834437086092714,1.8211851851851852,8.780714285714286,0.32142857142857145,0.0016556291390728477,0.2074074074074074,161.44444444444446,4.909867404213779,0.16920853406744668,0,0,0,2
A1931,data analytics course,158.0,4519.0,191.84,26.0,4.0,0.025,1507.0,2024-11-29,hyderabad,desktop,data analytics online,2024-11-29,29,11,4,48,False,0.0253,0.0349634874972339,1.2141772151898735,7.378461538461538,0.15384615384615385,0.0008851515822084533,0.16455696202531644,376.75,6.855504587155964,0.12729927007299272,0,0,0,2
A1932,data analytics course,80.0,3777.0,199.52,12.0,7.0,0.047,1694.0,2024-11-22,hyderabad,desktop,learn data analytics,2024-11-22,22,11,4,47,True,0.0875,0.021180831347630394,2.494,16.62666666666667,0.5833333333333334,0.0018533227429176596,0.15,242.0,7.49037690457097,0.11778040141676506,0,0,0,4
A1933,data analytics course,190.0,3461.0,205.22,28.0,10.0,0.047,1616.0,25-11-2024,hyderabad,mobile,online data analytic,2024-11-25,25,11,0,48,True,0.0526,0.05489742848887605,1.0801052631578947,7.329285714285715,0.35714285714285715,0.002889338341519792,0.14736842105263157,161.6,6.874476171913069,0.12699257425742574,0,0,1,5
A1934,data analytics course,135.0,4575.0,241.92,10.0,5.0,0.047,1553.0,22-11-2024,hyderabad,desktop,data analytics course,2024-11-22,22,11,4,47,True,0.037,0.029508196721311476,1.7919999999999998,24.192,0.5,0.001092896174863388,0.07407407407407407,310.6,5.4194775132275135,0.15577591757887957,0,0,0,1
A1935,data analytics course,149.0,3471.0,242.14,23.0,4.0,0.027,1937.0,2024-11-19,hyderabad,desktop,data analytics training,2024-11-19,19,11,1,47,False,0.0268,0.04292711034284068,1.6251006711409395,10.527826086956521,0.17391304347826086,0.0011524056467876692,0.15436241610738255,484.25,6.999504418931198,0.12500774393391842,0,0,0,3
A1936,data analytics course,164.0,3115.0,232.62,10.0,7.0,0.047,1802.0,04-11-2024,hyderabad,tablet,data analytics online,2024-04-11,11,4,3,15,True,0.04665,0.05264847512038523,1.4184146341463415,23.262,0.7,0.0022471910112359553,0.06097560975609756,257.42857142857144,6.746539420514144,0.12908990011098778,0,0,2,2
A1937,data analytics course,132.0,5428.0,180.73,10.0,7.0,0.039,1732.0,16-11-2024,hyderabad,desktop,data analytics course,2024-11-16,16,11,5,46,True,0.053,0.02431834929992631,1.3691666666666666,18.073,0.7,0.0012896094325718496,0.07575757575757576,247.42857142857142,8.583356387982073,0.10434757505773672,0,0,0,1
A1938,data analytics course,198.0,4499.0,245.24,27.0,7.0,0.035,1165.0,2024/11/01,hyderabad,tablet,online data analytic,2024-11-01,1,11,4,44,False,0.0354,0.044009779951100246,1.2385858585858587,9.082962962962963,0.25925925925925924,0.001555901311402534,0.13636363636363635,166.42857142857142,3.7504485402055128,0.21050643776824035,0,0,2,5
A1939,data analytics course,153.0,3285.0,226.26,12.0,7.0,0.046,1838.0,2024-11-21,hyderabad,desktop,online data analytic,2024-11-21,21,11,3,47,False,0.0458,0.04657534246575343,1.4788235294117646,18.855,0.5833333333333334,0.00213089802130898,0.0784313725490196,262.57142857142856,7.123397860868028,0.12310119695321001,0,0,0,5
A1940,data analytics course,142.0,3431.0,235.09,19.0,7.0,0.047,1334.0,2024-11-08,hyderabad,desktop,data analytics online,2024-11-08,8,11,4,45,True,0.04665,0.041387350626639466,1.6555633802816903,12.373157894736842,0.3684210526315789,0.0020402215097639173,0.13380281690140844,190.57142857142858,4.674422561572164,0.17622938530734633,0,0,0,2
A1941,data analytics course,91.0,4600.0,194.14,19.0,7.0,0.077,1255.0,2024-11-19,hyderabad,mobile,data analytics online,2024-11-19,19,11,1,47,False,0.0769,0.019782608695652175,2.133406593406593,10.217894736842105,0.3684210526315789,0.0015217391304347826,0.2087912087912088,179.28571428571428,5.46440712887607,0.15469322709163347,0,0,1,2
A1942,data analytics course,154.0,4804.0,190.98,21.0,3.0,0.019,1521.0,23-11-2024,hyderabad,desktop,data analytics training,2024-11-23,23,11,5,47,False,0.0195,0.03205661948376353,1.24012987012987,9.094285714285714,0.14285714285714285,0.0006244796003330558,0.13636363636363635,507.0,6.964184731385486,0.12556213017751477,0,0,0,3
A1943,data analytics course,115.0,5472.0,230.29,26.0,4.0,0.047,1275.0,2024-11-07,hyderabad,mobile,learn data analytics,2024-11-07,7,11,3,45,True,0.0348,0.02101608187134503,2.002521739130435,8.857307692307693,0.15384615384615385,0.0007309941520467836,0.22608695652173913,318.75,4.536497459724695,0.18061960784313724,0,0,1,4
A1944,data analytics course,86.0,5493.0,191.28,18.0,9.0,0.105,1204.0,2024/11/20,hyderabad,tablet,data analytics course,2024-11-20,20,11,2,47,False,0.1047,0.015656289823411614,2.224186046511628,10.626666666666667,0.5,0.0016384489350081922,0.20930232558139536,133.77777777777777,5.2944374738603095,0.1588704318936877,0,0,2,1
A1945,data analytics course,116.0,3188.0,238.62,15.0,10.0,0.086,1429.0,14-11-2024,hyderabad,tablet,online data analytic,2024-11-14,14,11,3,46,False,0.0862,0.03638644918444166,2.0570689655172414,15.908,0.6666666666666666,0.003136762860727729,0.12931034482758622,142.9,4.988601123124634,0.16698390482855144,0,0,2,5
A1946,data analytics course,144.0,3579.0,237.97,21.0,10.0,0.069,1155.0,2024/11/02,hyderabad,desktop,data analytics course,2024-11-02,2,11,5,44,False,0.0694,0.040234702430846606,1.6525694444444445,11.331904761904761,0.47619047619047616,0.002794076557697681,0.14583333333333334,115.5,3.8535529688616212,0.20603463203463204,0,0,0,1
A1947,data analytics course,101.0,4198.0,204.09,30.0,10.0,0.099,1642.0,2024/11/21,hyderabad,desktop,data analytics training,2024-11-21,21,11,3,47,False,0.099,0.024059075750357314,2.020693069306931,6.803,0.3333333333333333,0.0023820867079561697,0.297029702970297,164.2,7.045470135724435,0.12429354445797808,0,0,0,3
A1948,data analytics course,116.0,4224.0,245.99,10.0,5.0,0.047,1054.0,2024-11-05,hyderabad,tablet,data analytics online,2024-11-05,5,11,1,45,True,0.0431,0.027462121212121212,2.1206034482758622,24.599,0.5,0.0011837121212121212,0.08620689655172414,210.8,3.284727021423635,0.23338709677419356,0,0,2,2
A1949,data analytics course,187.0,3199.0,193.29,24.0,6.0,0.032,1430.0,2024/11/20,hyderabad,tablet,online data analytic,2024-11-20,20,11,2,47,False,0.0321,0.05845576742732104,1.0336363636363637,8.053749999999999,0.25,0.001875586120662707,0.12834224598930483,238.33333333333334,6.398209943608051,0.13516783216783215,0,0,2,5
A1950,data analytics course,114.0,4333.0,192.81,26.0,6.0,0.053,1722.0,08-11-2024,hyderabad,tablet,data analytics training,2024-08-11,11,8,6,32,False,0.0526,0.026309716132010153,1.6913157894736843,7.4157692307692304,0.23076923076923078,0.0013847219016847449,0.22807017543859648,287.0,7.931072039831959,0.11196864111498259,0,0,2,3
A1951,data analytics course,141.0,3617.0,198.52,20.0,9.0,0.047,1858.0,21-11-2024,hyderabad,desktop,data analytics course,2024-11-21,21,11,3,47,True,0.0638,0.03898258225048382,1.4079432624113475,9.926,0.45,0.0024882499308819463,0.14184397163120568,206.44444444444446,8.35925851299617,0.10684607104413348,0,0,0,1
A1952,data analytics course,167.0,5588.0,181.95,18.0,9.0,0.035,1507.0,2024-11-23,hyderabad,tablet,data analytics training,2024-11-23,23,11,5,47,True,0.0539,0.029885468861846815,1.0895209580838323,10.108333333333333,0.5,0.0016105941302791697,0.10778443113772455,167.44444444444446,7.282495190986535,0.12073656270736562,0,0,2,3
A1953,data analytics course,186.0,4689.0,204.31,26.0,6.0,0.032,1936.0,2024-11-21,hyderabad,desktop,data analytics online,2024-11-21,21,11,3,47,False,0.0323,0.03966730646193218,1.0984408602150537,7.858076923076923,0.23076923076923078,0.0012795905310300703,0.13978494623655913,322.6666666666667,8.475796583622927,0.10553202479338843,0,0,0,2
A1954,data analytics course,139.0,4846.0,206.4,21.0,7.0,0.047,1526.0,28-11-2024,hyderabad,mobile,data analytics online,2024-11-28,28,11,3,48,True,0.04665,0.028683450268262484,1.4848920863309354,9.82857142857143,0.3333333333333333,0.0014444903012794056,0.1510791366906475,218.0,6.393410852713178,0.13525557011795544,0,0,1,2
A1955,data analytics course,136.0,3441.0,236.21,26.0,9.0,0.047,1461.0,2024/11/15,hyderabad,desktop,learn data analytics,2024-11-15,15,11,4,46,True,0.0662,0.03952339436210404,1.7368382352941176,9.085,0.34615384615384615,0.0026155187445510027,0.19117647058823528,162.33333333333334,5.185174209389949,0.1616769336071184,0,0,0,4
A1956,data analytics course,185.0,3719.0,245.91,17.0,9.0,0.049,1218.0,2024-11-09,hyderabad,mobile,online data analytic,2024-11-09,9,11,5,45,False,0.0486,0.049744554987899973,1.3292432432432433,14.465294117647058,0.5294117647058824,0.0024200053777897286,0.0918918918918919,135.33333333333334,3.9530315969257046,0.20189655172413792,0,0,1,5
A1957,data analytics course,162.0,3337.0,200.94,11.0,9.0,0.056,1820.0,2024-11-16,hyderabad,mobile,data analytics course,2024-11-16,16,11,5,46,False,0.0556,0.04854659874138448,1.2403703703703703,18.267272727272726,0.8181818181818182,0.0026970332634102486,0.06790123456790123,202.22222222222223,8.057430078630437,0.11040659340659341,0,0,1,1
A1958,data analytics course,91.0,3694.0,234.02,23.0,5.0,0.055,1507.0,2024/11/24,hyderabad,desktop,online data analytic,2024-11-24,24,11,6,47,False,0.0549,0.024634542501353548,2.571648351648352,10.174782608695653,0.21739130434782608,0.0013535462912831618,0.25274725274725274,301.4,5.439620545252542,0.15528865295288655,0,0,0,5
A1959,data analytics course,109.0,5641.0,224.36,30.0,4.0,0.037,1531.0,13-11-2024,hyderabad,tablet,analytics for data,2024-11-13,13,11,2,46,False,0.0367,0.019322815103705017,2.058348623853211,7.478666666666667,0.13333333333333333,0.0007090941322460556,0.27522935779816515,382.75,5.823854519522196,0.14654474199869366,0,0,2,0
A1960,data analytics course,88.0,3992.0,195.38,14.0,4.0,0.047,1228.0,2024/11/15,hyderabad,desktop,data analytics course,2024-11-15,15,11,4,46,True,0.0455,0.022044088176352707,2.2202272727272727,13.955714285714285,0.2857142857142857,0.001002004008016032,0.1590909090909091,307.0,5.285187839082813,0.1591042345276873,0,0,0,1
A1961,data analytics course,189.0,3411.0,205.26,28.0,7.0,0.047,1147.0,27-11-2024,hyderabad,desktop,analytics for data,2024-11-27,27,11,2,48,True,0.037,0.055408970976253295,1.086031746031746,7.3307142857142855,0.25,0.0020521841102316037,0.14814814814814814,163.85714285714286,4.588034687713145,0.1789537925021796,0,0,0,0
A1962,data analytics course,154.0,3099.0,218.7,30.0,6.0,0.039,1366.0,10-11-2024,hyderabad,desktop,data analytics online,2024-10-11,11,10,4,41,False,0.039,0.04969344949983866,1.4201298701298701,7.29,0.2,0.001936108422071636,0.19480519480519481,227.66666666666666,5.245999085505258,0.16010248901903368,0,0,0,2
A1963,data analytics course,106.0,3017.0,242.71,24.0,5.0,0.03,1701.0,2024/11/04,hyderabad,mobile,learn data analytics,2024-11-04,4,11,0,45,True,0.0472,0.03513423931057342,2.2897169811320754,10.112916666666667,0.20833333333333334,0.0016572754391779914,0.22641509433962265,340.2,6.008363891063409,0.14268665490887714,0,0,1,4
A1964,data analytics course,134.0,4520.0,202.32,17.0,5.0,0.057,1963.0,2024/11/23,hyderabad,tablet,data analytics training,2024-11-23,23,11,5,47,True,0.0373,0.029646017699115044,1.5098507462686566,11.901176470588235,0.29411764705882354,0.0011061946902654867,0.12686567164179105,392.6,8.702451561882167,0.10306673458991339,0,0,2,3
A1965,data analytics course,84.0,5662.0,228.62,25.0,9.0,0.107,1988.0,26-11-2024,hyderabad,desktop,analytics for data,2024-11-26,26,11,1,48,False,0.1071,0.014835747085835394,2.7216666666666667,9.1448,0.36,0.0015895443306252208,0.2976190476190476,220.88888888888889,7.695652173913044,0.115,0,0,0,0
A1966,data analytics course,190.0,4476.0,198.18,12.0,4.0,0.047,1002.0,2024/11/07,hyderabad,desktop,data analytics online,2024-11-07,7,11,3,45,True,0.0211,0.04244861483467382,1.0430526315789475,16.515,0.3333333333333333,0.0008936550491510277,0.06315789473684211,250.5,4.056009688162276,0.19778443113772456,0,0,0,2
A1967,data analytics course,156.0,4771.0,199.3,26.0,8.0,0.051,1823.0,2024-11-04,hyderabad,tablet,data analytics online,2024-11-04,4,11,0,45,False,0.0513,0.0326975476839237,1.2775641025641027,7.665384615384616,0.3076923076923077,0.0016767973171242926,0.16666666666666666,227.875,8.14701455092825,0.1093252879868349,0,0,2,2
A1968,data analytics course,139.0,5510.0,198.92,23.0,9.0,0.047,1063.0,2024/11/14,hyderabad,desktop,data analytics course,2024-11-14,14,11,3,46,True,0.04665,0.025226860254083484,1.4310791366906475,8.648695652173913,0.391304347826087,0.001633393829401089,0.16546762589928057,118.11111111111111,4.343856826865072,0.18713076199435558,0,0,0,1
A1969,data analytics course,170.0,4786.0,202.62,27.0,6.0,0.04,1372.0,2024/11/04,hyderabad,mobile,data analytics training,2024-11-04,4,11,0,45,False,0.0353,0.0355202674467196,1.1918823529411764,7.504444444444444,0.2222222222222222,0.0012536564981195152,0.1588235294117647,228.66666666666666,5.771296022110355,0.14768221574344023,0,0,1,3
A1970,data analytics course,86.0,3964.0,193.15,26.0,5.0,0.045,1639.0,23-11-2024,hyderabad,desktop,learn data analytics,2024-11-23,23,11,5,47,True,0.0581,0.021695257315842584,2.2459302325581394,7.428846153846154,0.19230769230769232,0.0012613521695257316,0.3023255813953488,327.8,7.485632927776339,0.11784624771201953,0,0,0,4
A1971,data analytics course,143.0,5317.0,236.37,10.0,3.0,0.047,1861.0,16-11-2024,hyderabad,tablet,data analytics online,2024-11-16,16,11,5,46,True,0.021,0.02689486552567237,1.652937062937063,23.637,0.3,0.0005642279480910288,0.06993006993006994,620.3333333333334,6.8732495663578295,0.1270123589468028,0,0,2,2
A1972,data analytics course,84.0,3454.0,206.8,23.0,3.0,0.036,1573.0,2024/11/17,hyderabad,desktop,learn data analytics,2024-11-17,17,11,6,46,False,0.0357,0.024319629415170817,2.461904761904762,8.991304347826087,0.13043478260869565,0.0008685581933989577,0.27380952380952384,524.3333333333334,6.6063829787234045,0.13146853146853146,0,0,0,4
A1973,data analytics course,145.0,3804.0,236.92,29.0,8.0,0.047,1328.0,2024-11-23,hyderabad,tablet,data analytics course,2024-11-23,23,11,5,47,True,0.0552,0.03811777076761304,1.6339310344827584,8.169655172413792,0.27586206896551724,0.002103049421661409,0.2,166.0,4.605267600877934,0.17840361445783132,0,0,2,1
A1974,data analytics course,126.0,4670.0,234.65,25.0,8.0,0.047,1470.0,2024/11/23,hyderabad,desktop,online data analytic,2024-11-23,23,11,5,47,True,0.0635,0.026980728051391862,1.8623015873015873,9.386000000000001,0.32,0.0017130620985010706,0.1984126984126984,183.75,5.264649477945876,0.15962585034013607,0,0,0,5
A1975,data analytics course,156.0,3273.0,189.36,14.0,6.0,0.038,1860.0,2024-11-15,hyderabad,mobile,data analytics online,2024-11-15,15,11,4,46,False,0.0385,0.04766269477543538,1.213846153846154,13.525714285714287,0.42857142857142855,0.0018331805682859762,0.08974358974358974,310.0,8.822560202788338,0.10180645161290323,0,0,1,2
A1976,data analytics course,124.0,4236.0,182.02,20.0,9.0,0.073,1979.0,22-11-2024,hyderabad,desktop,data analytics training,2024-11-22,22,11,4,47,False,0.0726,0.02927289896128423,1.4679032258064517,9.101,0.45,0.002124645892351275,0.16129032258064516,219.88888888888889,9.872431600922974,0.09197574532592219,0,0,0,3
A1977,data analytics course,197.0,5866.0,217.81,28.0,7.0,0.036,1331.0,18-11-2024,hyderabad,mobile,learn data analytics,2024-11-18,18,11,0,47,False,0.0355,0.033583361745652913,1.1056345177664975,7.778928571428572,0.25,0.0011933174224343676,0.14213197969543148,190.14285714285714,5.11083054037923,0.16364387678437264,0,0,1,4
A1978,data analytics course,106.0,3102.0,214.56,12.0,7.0,0.047,1881.0,2024-11-25,hyderabad,mobile,learn data analytics,2024-11-25,25,11,0,48,True,0.04665,0.03417150225660864,2.0241509433962266,17.88,0.5833333333333334,0.002256608639587363,0.11320754716981132,268.7142857142857,7.766778523489933,0.11406698564593301,0,0,1,4
A1979,data analytics course,129.0,4856.0,230.13,23.0,7.0,0.054,1720.0,25-11-2024,hyderabad,tablet,learn data analytics,2024-11-25,25,11,0,48,False,0.0543,0.02656507413509061,1.7839534883720929,10.005652173913044,0.30434782608695654,0.001441515650741351,0.17829457364341086,245.71428571428572,6.474036414200669,0.13379651162790698,0,0,2,4
A1980,data analytics course,93.0,4054.0,244.73,11.0,8.0,0.086,1066.0,2024-11-24,hyderabad,desktop,online data analytic,2024-11-24,24,11,6,47,False,0.086,0.022940305870744943,2.631505376344086,22.248181818181816,0.7272727272727273,0.001973359644795264,0.11827956989247312,133.25,3.355820700363666,0.229577861163227,0,0,0,5
A1981,data analytics course,96.0,4074.0,219.66,16.0,8.0,0.083,1507.0,07-11-2024,hyderabad,tablet,data analytics online,2024-07-11,11,7,3,28,False,0.0833,0.023564064801178203,2.288125,13.72875,0.5,0.0019636720667648502,0.16666666666666666,188.375,5.860602749704088,0.14575978765759787,0,0,2,2
A1982,data analytics course,135.0,4430.0,196.18,12.0,9.0,0.067,1374.0,2024-11-08,hyderabad,mobile,analytics for data,2024-11-08,8,11,4,45,False,0.0667,0.030474040632054177,1.4531851851851851,16.348333333333333,0.75,0.0020316027088036117,0.08888888888888889,152.66666666666666,6.00377204608013,0.1427802037845706,0,0,1,0
A1983,data analytics course,138.0,5356.0,204.86,15.0,9.0,0.065,1268.0,2024-11-22,hyderabad,mobile,online data analytic,2024-11-22,22,11,4,47,False,0.0652,0.025765496639283045,1.4844927536231884,13.657333333333334,0.6,0.0016803584764749813,0.10869565217391304,140.88888888888889,5.189592892707214,0.1615615141955836,0,0,1,5
A1984,data analytics course,92.0,4898.0,247.49,19.0,7.0,0.047,1969.0,2024/11/07,hyderabad,desktop,data analytics training,2024-11-07,7,11,3,45,True,0.04665,0.018783176806859942,2.690108695652174,13.025789473684211,0.3684210526315789,0.0014291547570436914,0.20652173913043478,281.2857142857143,6.95587700513152,0.12569324530218384,0,0,0,3
A1985,data analytics course,151.0,5301.0,232.06,13.0,9.0,0.06,1893.0,2024-11-05,hyderabad,mobile,data analytics online,2024-11-05,5,11,1,45,False,0.0596,0.028485191473306925,1.5368211920529802,17.85076923076923,0.6923076923076923,0.001697792869269949,0.08609271523178808,210.33333333333334,7.15737309316556,0.12258848388800846,0,0,1,2
A1986,data analytics course,189.0,3031.0,209.84,25.0,6.0,0.032,1936.0,2024-11-26,hyderabad,tablet,online data analytic,2024-11-26,26,11,1,48,False,0.0317,0.06235565819861432,1.1102645502645503,8.3936,0.24,0.001979544704717915,0.13227513227513227,322.6666666666667,8.226077011056043,0.10838842975206611,0,0,2,5
A1987,data analytics course,97.0,3410.0,180.52,24.0,7.0,0.047,1532.0,07-11-2024,hyderabad,tablet,analytics for data,2024-07-11,11,7,3,28,True,0.04665,0.02844574780058651,1.8610309278350516,7.521666666666667,0.2916666666666667,0.0020527859237536657,0.24742268041237114,218.85714285714286,7.486594283181919,0.11783289817232377,0,0,2,0
A1988,data analytics course,178.0,4745.0,200.61,12.0,9.0,0.051,1574.0,2024/11/18,hyderabad,desktop,learn data analytics,2024-11-18,18,11,0,47,False,0.0506,0.0375131717597471,1.1270224719101125,16.7175,0.75,0.0018967334035827187,0.06741573033707865,174.88888888888889,6.846069488061412,0.12745235069885644,0,0,0,4
A1989,data analytics course,164.0,3024.0,192.34,12.0,8.0,0.049,1997.0,2024/11/07,hyderabad,desktop,data analytics course,2024-11-07,7,11,3,45,False,0.0488,0.05423280423280423,1.1728048780487805,16.028333333333332,0.6666666666666666,0.0026455026455026454,0.07317073170731707,249.625,9.382655713840075,0.09631447170756134,0,0,0,1
A1990,data analytics course,94.0,5435.0,231.42,21.0,5.0,0.056,1114.0,2024-11-03,hyderabad,desktop,data analytics online,2024-11-03,3,11,6,44,False,0.0532,0.017295308187672494,2.461914893617021,11.02,0.23809523809523808,0.0009199632014719411,0.22340425531914893,222.8,3.8137585342667015,0.20773788150807898,0,0,0,2
A1991,data analytics course,176.0,3021.0,204.53,29.0,7.0,0.03,1620.0,2024/11/13,hyderabad,tablet,online data analytic,2024-11-13,13,11,2,46,False,0.0398,0.05825885468387951,1.1621022727272727,7.052758620689655,0.2413793103448276,0.0023171135385633896,0.16477272727272727,231.42857142857142,6.920598445215861,0.12625308641975308,0,0,2,5
A1992,data analytics course,165.0,5335.0,192.53,23.0,5.0,0.03,1402.0,12-11-2024,hyderabad,mobile,data analytics training,2024-12-11,11,12,2,50,False,0.0303,0.030927835051546393,1.1668484848484848,8.370869565217392,0.21739130434782608,0.0009372071227741331,0.1393939393939394,280.4,6.2819820287747365,0.13732524964336662,0,0,1,3
A1993,data analytics course,188.0,4081.0,237.05,18.0,8.0,0.05,1846.0,06-11-2024,hyderabad,tablet,data analytics course,2024-06-11,11,6,1,24,False,0.0426,0.046067140406763046,1.260904255319149,13.169444444444444,0.4444444444444444,0.0019603038470963,0.09574468085106383,230.75,6.78738662729382,0.1284127843986999,0,0,2,1
A1994,data analytics course,87.0,4840.0,205.72,16.0,6.0,0.047,1040.0,09-11-2024,hyderabad,desktop,online data analytic,2024-09-11,11,9,2,37,True,0.069,0.017975206611570246,2.3645977011494255,12.8575,0.375,0.0012396694214876034,0.1839080459770115,173.33333333333334,4.055415127357573,0.1978076923076923,0,0,0,5
A1995,data analytics course,106.0,4738.0,196.7,17.0,4.0,0.038,1515.0,2024-11-29,hyderabad,tablet,data analytics training,2024-11-29,29,11,4,48,False,0.0377,0.0223723089911355,1.8556603773584905,11.570588235294117,0.23529411764705882,0.0008442380751371887,0.16037735849056603,378.75,6.702084392475852,0.12983498349834982,0,0,2,3
A1996,data analytics course,198.0,4181.0,218.4,10.0,8.0,0.04,1298.0,2024/11/17,hyderabad,mobile,data analytics training,2024-11-17,17,11,6,46,False,0.0404,0.04735709160487921,1.103030303030303,21.84,0.8,0.0019134178426213825,0.050505050505050504,162.25,4.9432234432234425,0.1682588597842835,0,0,1,3
A1997,data analytics course,121.0,5813.0,202.92,25.0,6.0,0.05,1226.0,14-11-2024,hyderabad,tablet,data analytics online,2024-11-14,14,11,3,46,False,0.0496,0.020815413727851367,1.6770247933884297,8.1168,0.24,0.001032169275761225,0.2066115702479339,204.33333333333334,5.041789867928248,0.16551386623164763,0,0,2,2
A1998,data analytics course,120.0,4303.0,202.8,21.0,4.0,0.033,1033.0,2024-11-26,hyderabad,tablet,online data analytic,2024-11-26,26,11,1,48,False,0.0333,0.027887520334650244,1.6900000000000002,9.657142857142858,0.19047619047619047,0.0009295840111550081,0.175,258.25,4.093688362919132,0.1963213939980639,0,0,2,5
A1999,data analytics course,189.0,5201.0,210.87,21.0,10.0,0.053,1560.0,2024-11-11,hyderabad,mobile,data analytics course,2024-11-11,11,11,0,46,False,0.0529,0.03633916554508748,1.1157142857142857,10.041428571428572,0.47619047619047616,0.0019227071716977505,0.1111111111111111,156.0,6.397922890880638,0.13517307692307692,0,0,1,1
A2000,data analytics course,131.0,4603.0,228.63,30.0,7.0,0.047,1270.0,2024/11/03,hyderabad,tablet,analytics for data,2024-11-03,3,11,6,44,True,0.04665,0.028459700195524656,1.745267175572519,7.6209999999999996,0.23333333333333334,0.0015207473386921572,0.22900763358778625,181.42857142857142,4.554826575689979,0.1800236220472441,0,0,2,0
A2001,data analytics course,99.0,4051.0,207.42,10.0,9.0,0.091,1797.0,14-11-2024,hyderabad,mobile,analytics for data,2024-11-14,14,11,3,46,False,0.0909,0.024438410269069365,2.095151515151515,20.741999999999997,0.9,0.002221673660824488,0.10101010101010101,199.66666666666666,7.663581139716517,0.11542570951585976,0,0,1,0
A2002,data analytics course,199.0,4080.0,243.8,23.0,7.0,0.05,1507.0,15-11-2024,hyderabad,desktop,data analytics training,2024-11-15,15,11,4,46,True,0.0352,0.04877450980392157,1.2251256281407035,10.6,0.30434782608695654,0.001715686274509804,0.11557788944723618,215.28571428571428,5.18129614438064,0.1617783676177837,0,0,0,3
A2003,data analytics course,180.0,4140.0,240.76,21.0,8.0,0.044,1248.0,11-11-2024,hyderabad,desktop,online data analytic,2024-11-11,11,11,0,46,False,0.0444,0.043478260869565216,1.3375555555555556,11.464761904761904,0.38095238095238093,0.001932367149758454,0.11666666666666667,156.0,4.183585313174946,0.19291666666666665,0,0,0,5
A2004,data analytics course,88.0,3333.0,193.25,29.0,3.0,0.034,1398.0,2024/11/14,hyderabad,tablet,data analytics online,2024-11-14,14,11,3,46,False,0.0341,0.026402640264026403,2.196022727272727,6.663793103448276,0.10344827586206896,0.0009000900090009,0.32954545454545453,466.0,6.234152652005174,0.13823319027181688,0,0,2,2
A2005,data analytics course,140.0,3689.0,249.33,20.0,9.0,0.064,1329.0,2024-11-22,hyderabad,mobile,learn data analytics,2024-11-22,22,11,4,47,False,0.0643,0.03795066413662239,1.7809285714285714,12.4665,0.45,0.002439685551640011,0.14285714285714285,147.66666666666666,4.330285164240164,0.187607223476298,0,0,1,4
A2006,data analytics course,166.0,4665.0,223.95,23.0,9.0,0.054,1404.0,2024/11/07,hyderabad,tablet,data analytics online,2024-11-07,7,11,3,45,False,0.0542,0.035584137191854236,1.3490963855421687,9.73695652173913,0.391304347826087,0.0019292604501607716,0.13855421686746988,156.0,5.269256530475553,0.159508547008547,0,0,2,2
A2007,data analytics course,185.0,3670.0,198.66,30.0,4.0,0.057,1440.0,13-11-2024,hyderabad,desktop,data analytics training,2024-11-13,13,11,2,46,True,0.0216,0.05040871934604905,1.073837837837838,6.622,0.13333333333333333,0.0010899182561307902,0.16216216216216217,360.0,6.248565388100271,0.13795833333333332,0,0,0,3
A2008,data analytics course,139.0,4036.0,242.12,25.0,5.0,0.036,1329.0,2024-11-26,hyderabad,tablet,learn data analytics,2024-11-26,26,11,1,48,False,0.036,0.0344400396432111,1.7418705035971223,9.684800000000001,0.2,0.001238850346878097,0.17985611510791366,265.8,4.4890137122088225,0.18218209179834463,0,0,2,4
A2009,data analytics course,142.0,4497.0,198.98,27.0,3.0,0.047,1582.0,2024-11-30,hyderabad,tablet,analytics for data,2024-11-30,30,11,5,48,True,0.0211,0.03157660662663998,1.4012676056338027,7.369629629629629,0.1111111111111111,0.00066711140760507,0.19014084507042253,527.3333333333334,6.9505477937481155,0.12577749683944373,0,0,2,0
A2010,data analytics course,173.0,3705.0,197.01,20.0,10.0,0.058,1010.0,26-11-2024,hyderabad,desktop,data analytics training,2024-11-26,26,11,1,48,False,0.0578,0.04669365721997301,1.13878612716763,9.8505,0.5,0.002699055330634278,0.11560693641618497,101.0,4.126643317598091,0.19505940594059404,0,0,0,3
A2011,data analytics course,139.0,5849.0,214.965,27.0,3.0,0.047,1146.0,2024-11-25,hyderabad,tablet,learn data analytics,2024-11-25,25,11,0,48,True,0.04665,0.023764746110446232,1.5465107913669065,7.961666666666667,0.1111111111111111,0.0005129081894340913,0.19424460431654678,382.0,4.331100411694927,0.1875785340314136,0,0,2,4
A2012,data analytics course,153.0,5283.0,205.72,24.0,3.0,0.02,1591.0,10-11-2024,hyderabad,desktop,learn data analytics,2024-10-11,11,10,4,41,False,0.0196,0.028960817717206135,1.3445751633986929,8.571666666666667,0.125,0.0005678591709256105,0.1568627450980392,530.3333333333334,6.733812949640288,0.12930232558139534,0,0,0,4
A2013,data analytics course,104.0,5203.0,241.15,17.0,6.0,0.048,1164.0,28-11-2024,hyderabad,mobile,data analytics online,2024-11-28,28,11,3,48,False,0.0577,0.01998846819142802,2.31875,14.185294117647059,0.35294117647058826,0.0011531808571977706,0.16346153846153846,194.0,3.8268712419655815,0.20717353951890036,0,0,1,2
A2014,data analytics course,120.0,4243.0,198.49,15.0,10.0,0.083,1891.0,27-11-2024,hyderabad,desktop,data analytics training,2024-11-27,27,11,2,48,False,0.0833,0.028281876031110063,1.6540833333333333,13.232666666666667,0.6666666666666666,0.0023568230025925053,0.125,189.1,8.526928308730918,0.10496562665256479,0,0,0,3
A2015,data analytics course,100.0,3716.0,247.95,23.0,8.0,0.047,1924.0,2024/11/14,hyderabad,mobile,learn data analytics,2024-11-14,14,11,3,46,True,0.08,0.02691065662002153,2.4795,10.780434782608696,0.34782608695652173,0.002152852529601722,0.23,240.5,6.759628957451099,0.12887214137214137,0,0,1,4
A2016,data analytics course,106.0,3646.0,237.89,28.0,7.0,0.046,1564.0,2024/11/02,hyderabad,mobile,analytics for data,2024-11-02,2,11,5,44,True,0.066,0.029072956664838178,2.2442452830188677,8.496071428571428,0.25,0.0019199122325836533,0.2641509433962264,223.42857142857142,5.5744671907184005,0.15210358056265985,0,0,1,0
A2017,data analytics course,136.0,4101.0,227.43,28.0,9.0,0.057,1284.0,19-11-2024,hyderabad,tablet,learn data analytics,2024-11-19,19,11,1,47,False,0.0662,0.033162643257742014,1.672279411764706,8.1225,0.32142857142857145,0.0021945866861741038,0.20588235294117646,142.66666666666666,4.645693180319219,0.17712616822429908,0,0,2,4
A2018,data analytics course,121.0,3366.0,246.56,25.0,7.0,0.047,1170.0,2024-11-02,hyderabad,desktop,online data analytic,2024-11-02,2,11,5,44,True,0.04665,0.03594771241830065,2.037685950413223,9.862400000000001,0.28,0.0020796197266785502,0.2066115702479339,167.14285714285714,3.745295262816353,0.21073504273504273,0,0,0,5
A2019,data analytics course,153.0,3381.0,231.35,29.0,5.0,0.033,1769.0,2024-11-28,hyderabad,tablet,data analytics course,2024-11-28,28,11,3,48,False,0.0327,0.04525288376220053,1.5120915032679738,7.977586206896552,0.1724137931034483,0.0014788524105294291,0.1895424836601307,353.8,6.646423168359629,0.13078010175240248,0,0,2,1
A2020,data analytics course,111.0,5003.0,213.34,29.0,3.0,0.047,1938.0,2024/11/25,hyderabad,tablet,analytics for data,2024-11-25,25,11,0,48,True,0.027,0.022186687987207677,1.9219819819819821,7.3565517241379315,0.10344827586206896,0.0005996402158704777,0.26126126126126126,646.0,8.084091122152433,0.11008255933952528,0,0,2,0
A2021,data analytics course,156.0,5415.0,198.27,29.0,7.0,0.037,1918.0,17-11-2024,hyderabad,desktop,data analytics training,2024-11-17,17,11,6,46,False,0.0449,0.028808864265927978,1.2709615384615385,6.836896551724139,0.2413793103448276,0.0012927054478301017,0.1858974358974359,274.0,8.673677308720432,0.1033733055265902,0,0,0,3
A2022,data analytics course,137.0,3838.0,226.92,18.0,6.0,0.044,1507.0,27-11-2024,hyderabad,tablet,analytics for data,2024-11-27,27,11,2,48,False,0.0438,0.035695674830640955,1.6563503649635036,12.606666666666666,0.3333333333333333,0.001563314226159458,0.13138686131386862,251.16666666666666,5.641106998060991,0.15057730590577306,0,0,2,0
A2023,data analytics course,138.0,3002.0,246.3,24.0,7.0,0.036,1530.0,2024/11/01,hyderabad,tablet,learn data analytics,2024-11-01,1,11,4,44,True,0.04665,0.04596935376415723,1.7847826086956522,10.262500000000001,0.2916666666666667,0.002331778814123917,0.17391304347826086,218.57142857142858,5.211936662606577,0.16098039215686274,0,0,2,4
A2024,data analytics course,96.0,3958.0,238.06,17.0,4.0,0.042,1750.0,2024-11-07,hyderabad,mobile,online data analytic,2024-11-07,7,11,3,45,False,0.0417,0.02425467407781708,2.479791666666667,14.003529411764706,0.23529411764705882,0.001010611419909045,0.17708333333333334,437.5,6.351087961018231,0.13603428571428572,0,0,1,5
A2025,data analytics course,180.0,3060.0,194.47,21.0,5.0,0.054,1429.0,2024/11/10,hyderabad,tablet,online data analytic,2024-11-10,10,11,6,45,True,0.0278,0.058823529411764705,1.0803888888888888,9.26047619047619,0.23809523809523808,0.0016339869281045752,0.11666666666666667,285.8,6.34817709672443,0.13608817354793562,0,0,2,5
A2026,data analytics course,132.0,5514.0,208.57,16.0,7.0,0.053,1072.0,2024-11-26,hyderabad,mobile,online data analytic,2024-11-26,26,11,1,48,False,0.053,0.023939064200217627,1.5800757575757576,13.035625,0.4375,0.0012694958287994198,0.12121212121212122,153.14285714285714,4.139761231241311,0.1945615671641791,0,0,1,5
A2027,data analytics course,147.0,5373.0,233.68,20.0,7.0,0.048,1685.0,2024/11/01,hyderabad,desktop,data analytics course,2024-11-01,1,11,4,44,False,0.0476,0.027359017308766054,1.5896598639455783,11.684000000000001,0.35,0.0013028103480364787,0.1360544217687075,240.71428571428572,6.210715508387538,0.13868249258160237,0,0,0,1
A2028,data analytics course,84.0,4720.0,213.68,20.0,5.0,0.06,1412.0,2024/11/21,hyderabad,tablet,data analytics course,2024-11-21,21,11,3,47,False,0.0595,0.017796610169491526,2.5438095238095237,10.684000000000001,0.25,0.001059322033898305,0.23809523809523808,282.4,5.608011980531636,0.1513314447592068,0,0,2,1
A2029,data analytics course,82.0,4330.0,228.68,18.0,8.0,0.098,1510.0,2024-11-04,hyderabad,desktop,analytics for data,2024-11-04,4,11,0,45,False,0.0976,0.018937644341801386,2.7887804878048783,12.704444444444444,0.4444444444444444,0.0018475750577367205,0.21951219512195122,188.75,5.603113521077487,0.15144370860927153,0,0,0,0
A2030,data analytics course,173.0,4365.0,214.965,28.0,9.0,0.047,1311.0,06-11-2024,hyderabad,desktop,data analytics online,2024-06-11,11,6,1,24,True,0.052,0.03963344788087056,1.2425722543352602,7.677321428571429,0.32142857142857145,0.002061855670103093,0.16184971098265896,145.66666666666666,5.098667224897077,0.16397025171624713,0,0,0,2
A2031,data analytics course,89.0,5899.0,226.95,13.0,7.0,0.079,1058.0,2024/11/10,hyderabad,mobile,data analytics training,2024-11-10,10,11,6,45,False,0.0787,0.015087302932700457,2.55,17.457692307692305,0.5384615384615384,0.0011866418036955415,0.14606741573033707,151.14285714285714,3.661819784093413,0.2145085066162571,0,0,1,3
A2032,data analytics course,198.0,3500.0,206.88,19.0,6.0,0.03,1684.0,11-11-2024,hyderabad,mobile,analytics for data,2024-11-11,11,11,0,46,False,0.0303,0.05657142857142857,1.044848484848485,10.888421052631578,0.3157894736842105,0.0017142857142857142,0.09595959595959595,280.6666666666667,7.139984532095901,0.12285035629453682,0,0,1,0
A2033,data analytics course,135.0,4155.0,207.81,25.0,9.0,0.049,1313.0,03-11-2024,hyderabad,desktop,online data analytic,2024-03-11,11,3,0,11,True,0.0667,0.032490974729241874,1.5393333333333334,8.3124,0.36,0.0021660649819494585,0.18518518518518517,145.88888888888889,5.318271498002984,0.15827113480578828,0,0,0,5
A2034,data analytics course,94.0,5437.0,190.49,16.0,6.0,0.044,1234.0,2024/11/16,hyderabad,tablet,data analytics training,2024-11-16,16,11,5,46,True,0.0638,0.017288946109987127,2.0264893617021276,11.905625,0.375,0.001103549751701306,0.1702127659574468,205.66666666666666,5.478030342800147,0.1543679092382496,0,0,2,3
A2035,data analytics course,151.0,3251.0,224.8,13.0,6.0,0.04,1507.0,2024/11/21,hyderabad,desktop,learn data analytics,2024-11-21,21,11,3,47,False,0.0397,0.046447247000922794,1.4887417218543046,17.292307692307695,0.46153846153846156,0.001845585973546601,0.08609271523178808,251.16666666666666,5.7037366548042705,0.1491705374917054,0,0,0,4
A2036,data analytics course,113.0,5392.0,205.13,28.0,3.0,0.034,1208.0,17-11-2024,hyderabad,mobile,online data analytic,2024-11-17,17,11,6,46,False,0.0265,0.020956973293768544,1.8153097345132743,7.326071428571429,0.10714285714285714,0.000556379821958457,0.24778761061946902,402.6666666666667,4.888948471700873,0.16980960264900663,0,0,1,5
A2037,data analytics course,164.0,5403.0,213.0,11.0,8.0,0.037,1507.0,2024-11-22,hyderabad,desktop,analytics for data,2024-11-22,22,11,4,47,True,0.0488,0.030353507310753286,1.298780487804878,19.363636363636363,0.7272727272727273,0.0014806588932074773,0.06707317073170732,188.375,6.075117370892019,0.14134041141340412,0,0,0,0
A2038,data analytics course,135.0,5054.0,224.03,16.0,6.0,0.044,1765.0,07-11-2024,hyderabad,mobile,data analytics training,2024-07-11,11,7,3,28,False,0.0444,0.026711515631183222,1.6594814814814816,14.001875,0.375,0.001187178472497032,0.11851851851851852,294.1666666666667,6.878409141632817,0.12692917847025495,0,0,1,3
A2039,data analytics course,116.0,5757.0,218.69,10.0,7.0,0.045,1834.0,2024-11-23,hyderabad,mobile,online data analytic,2024-11-23,23,11,5,47,True,0.0603,0.02014938335938857,1.885258620689655,21.869,0.7,0.0012159110647906896,0.08620689655172414,262.0,7.3863002423521875,0.11924209378407852,0,0,1,5
A2040,data analytics course,139.0,4485.0,220.3,14.0,6.0,0.047,1801.0,2024/11/01,hyderabad,mobile,data analytics course,2024-11-01,1,11,4,44,True,0.04665,0.030992196209587514,1.5848920863309353,15.735714285714286,0.42857142857142855,0.0013377926421404682,0.10071942446043165,300.1666666666667,7.175215615070359,0.12232093281510273,0,0,1,1
A2041,data analytics course,164.0,4053.0,245.26,28.0,7.0,0.043,1384.0,2024-11-01,hyderabad,tablet,learn data analytics,2024-11-01,1,11,4,44,False,0.0427,0.04046385393535653,1.4954878048780487,8.759285714285713,0.25,0.0017271157167530224,0.17073170731707318,197.71428571428572,4.642991111473538,0.17721098265895954,0,0,2,4
A2042,data analytics course,146.0,5733.0,225.48,26.0,3.0,0.035,1658.0,2024/11/10,hyderabad,desktop,online data analytic,2024-11-10,10,11,6,45,True,0.0205,0.025466596895168322,1.5443835616438355,8.672307692307692,0.11538461538461539,0.0005232862375719519,0.1780821917808219,552.6666666666666,6.35320205783218,0.13599517490952956,0,0,0,5
A2043,data analytics course,181.0,3225.0,190.25,22.0,5.0,0.028,1677.0,10-11-2024,hyderabad,mobile,learn data analytics,2024-10-11,11,10,4,41,False,0.0276,0.056124031007751936,1.0511049723756907,8.647727272727273,0.22727272727272727,0.0015503875968992248,0.12154696132596685,335.4,7.814717477003942,0.11344663088849136,0,0,1,4
A2044,data analytics course,156.0,4170.0,244.72,29.0,3.0,0.019,1962.0,20-11-2024,hyderabad,desktop,data analytics online,2024-11-20,20,11,2,47,False,0.0192,0.03741007194244604,1.5687179487179488,8.438620689655172,0.10344827586206896,0.0007194244604316547,0.1858974358974359,654.0,7.017325923504413,0.12472986748216106,0,0,0,2
A2045,data analytics course,182.0,4039.0,240.35,12.0,7.0,0.038,1214.0,2024/11/13,hyderabad,tablet,data analytics training,2024-11-13,13,11,2,46,False,0.0385,0.045060658578856154,1.3206043956043956,20.029166666666665,0.5833333333333334,0.0017331022530329288,0.06593406593406594,173.42857142857142,4.050967339296859,0.19798187808896212,0,0,2,3
A2046,data analytics course,137.0,3150.0,184.36,19.0,3.0,0.041,1218.0,29-11-2024,hyderabad,tablet,data analytics online,2024-11-29,29,11,4,48,True,0.0219,0.04349206349206349,1.3456934306569344,9.703157894736842,0.15789473684210525,0.0009523809523809524,0.1386861313868613,406.0,5.606639184204815,0.15136288998357966,0,0,2,2
A2047,data analytics course,93.0,4498.0,237.67,27.0,3.0,0.032,1102.0,2024/11/30,hyderabad,mobile,online data analytic,2024-11-30,30,11,5,48,False,0.0323,0.020675855935971543,2.5555913978494624,8.802592592592593,0.1111111111111111,0.0006669630947087594,0.2903225806451613,367.3333333333333,3.6366811124668663,0.2156715063520871,0,0,1,5
A2048,data analytics course,136.0,4683.0,228.82,22.0,5.0,0.037,1493.0,19-11-2024,hyderabad,desktop,learn data analytics,2024-11-19,19,11,1,47,False,0.0368,0.02904121289771514,1.6824999999999999,10.40090909090909,0.22727272727272727,0.001067691650651292,0.16176470588235295,298.6,5.524779302508523,0.1532618888144675,0,0,0,4
A2049,data analytics course,194.0,5620.0,194.91,22.0,10.0,0.047,1607.0,08-11-2024,hyderabad,tablet,data analytics course,2024-08-11,11,8,6,32,True,0.0515,0.03451957295373666,1.0046907216494845,8.859545454545454,0.45454545454545453,0.0017793594306049821,0.1134020618556701,160.7,7.244830947616848,0.12128811449906658,0,0,2,1
A2050,data analytics course,139.0,4653.0,194.99,11.0,5.0,0.054,1928.0,2024-11-12,hyderabad,tablet,learn data analytics,2024-11-12,12,11,1,46,True,0.04665,0.029873200085966042,1.4028057553956834,17.726363636363637,0.45454545454545453,0.001074575542660649,0.07913669064748201,385.6,8.887686548028103,0.10113589211618258,0,0,2,4
A2051,data analytics course,181.0,3063.0,191.03,15.0,4.0,0.022,1125.0,2024-11-21,hyderabad,desktop,data analytics training,2024-11-21,21,11,3,47,False,0.0221,0.059092393078681034,1.055414364640884,12.735333333333333,0.26666666666666666,0.001305909239307868,0.08287292817679558,281.25,4.88912736219442,0.16980444444444445,0,0,0,3
A2052,data analytics course,156.0,3273.0,245.27,30.0,8.0,0.035,1507.0,2024-11-05,hyderabad,tablet,learn data analytics,2024-11-05,5,11,1,45,True,0.0513,0.04766269477543538,1.5722435897435898,8.175666666666666,0.26666666666666666,0.002444240757714635,0.19230769230769232,188.375,5.144249194764953,0.16275381552753818,0,0,2,4
A2053,data analytics course,128.0,4314.0,181.68,28.0,5.0,0.047,1456.0,2024-11-25,hyderabad,mobile,analytics for data,2024-11-25,25,11,0,48,True,0.0391,0.0296708391284191,1.419375,6.488571428571428,0.17857142857142858,0.0011590171534538712,0.21875,291.2,7.0140907089387925,0.12478021978021979,0,0,1,0
A2054,data analytics course,133.0,5945.0,223.43,16.0,6.0,0.045,1329.0,2024-11-16,hyderabad,tablet,data analytics training,2024-11-16,16,11,5,46,False,0.0451,0.022371740958788897,1.6799248120300752,13.964375,0.375,0.001009251471825063,0.12030075187969924,221.5,4.948171686881797,0.1681188863807374,0,0,2,3
A2055,data analytics course,118.0,4794.0,233.49,20.0,3.0,0.025,1707.0,27-11-2024,hyderabad,mobile,data analytics course,2024-11-27,27,11,2,48,False,0.0254,0.024614100959532748,1.9787288135593222,11.6745,0.15,0.0006257822277847309,0.1694915254237288,569.0,6.310805601952974,0.13678383128295254,0,0,1,1
A2056,data analytics course,191.0,5227.0,204.87,26.0,6.0,0.047,1605.0,2024/11/20,hyderabad,mobile,data analytics course,2024-11-20,20,11,2,47,True,0.0314,0.03654103692366558,1.0726178010471203,7.879615384615385,0.23076923076923078,0.0011478859766596518,0.13612565445026178,267.5,6.834236344999268,0.12764485981308413,0,0,1,1
A2057,data analytics course,172.0,4850.0,242.33,27.0,4.0,0.023,1391.0,2024/11/21,hyderabad,tablet,data analytics online,2024-11-21,21,11,3,47,False,0.0233,0.03546391752577319,1.4088953488372093,8.975185185185186,0.14814814814814814,0.0008247422680412372,0.1569767441860465,347.75,4.740106466388808,0.17421279654924515,0,0,2,2
A2058,data analytics course,143.0,5314.0,222.14,21.0,9.0,0.063,1507.0,22-11-2024,hyderabad,tablet,learn data analytics,2024-11-22,22,11,4,47,False,0.0629,0.026910048927361686,1.5534265734265733,10.578095238095237,0.42857142857142855,0.0016936394429808055,0.14685314685314685,167.44444444444446,5.784010083730982,0.14740544127405442,0,0,2,4
A2059,data analytics course,110.0,4394.0,194.23,28.0,3.0,0.027,1394.0,2024-11-25,hyderabad,tablet,analytics for data,2024-11-25,25,11,0,48,False,0.0273,0.025034137460172964,1.7657272727272726,6.936785714285714,0.10714285714285714,0.0006827492034592626,0.2545454545454545,464.6666666666667,6.177058126962879,0.1393328550932568,0,0,2,0
A2060,data analytics course,119.0,5820.0,196.42,11.0,10.0,0.084,1707.0,22-11-2024,hyderabad,tablet,learn data analytics,2024-11-22,22,11,4,47,False,0.084,0.020446735395189004,1.6505882352941175,17.856363636363636,0.9090909090909091,0.001718213058419244,0.09243697478991597,170.7,7.69056104266368,0.11506736965436437,0,0,2,4
A2061,data analytics course,178.0,5328.0,201.9,20.0,9.0,0.051,1452.0,21-11-2024,hyderabad,mobile,data analytics course,2024-11-21,21,11,3,47,False,0.0506,0.03340840840840841,1.1342696629213485,10.095,0.45,0.0016891891891891893,0.11235955056179775,161.33333333333334,6.191679049034175,0.1390495867768595,0,0,1,1
A2062,data analytics course,139.0,3557.0,190.84,17.0,4.0,0.047,1925.0,28-11-2024,hyderabad,desktop,data analytics online,2024-11-28,28,11,3,48,True,0.04665,0.03907787461343829,1.37294964028777,11.225882352941177,0.23529411764705882,0.001124543154343548,0.1223021582733813,481.25,9.086983860825823,0.09913766233766234,0,0,0,2
A2063,data analytics course,95.0,4050.0,234.79,20.0,5.0,0.047,1783.0,18-11-2024,hyderabad,mobile,data analytics online,2024-11-18,18,11,0,47,True,0.0526,0.02345679012345679,2.471473684210526,11.7395,0.25,0.0012345679012345679,0.21052631578947367,356.6,6.594020188253333,0.1316825574873808,0,0,1,2
A2064,data analytics course,198.0,3575.0,224.07,13.0,3.0,0.047,1070.0,2024/11/09,hyderabad,desktop,data analytics online,2024-11-09,9,11,5,45,True,0.0152,0.055384615384615386,1.1316666666666666,17.236153846153847,0.23076923076923078,0.0008391608391608392,0.06565656565656566,356.6666666666667,3.77529343508725,0.20941121495327103,0,0,0,2
A2065,data analytics course,134.0,5570.0,233.77,15.0,4.0,0.03,1101.0,2024/11/27,hyderabad,mobile,data analytics course,2024-11-27,27,11,2,48,False,0.0299,0.02405745062836625,1.7445522388059702,15.584666666666667,0.26666666666666666,0.000718132854578097,0.11194029850746269,275.25,3.7097574539076867,0.21232515894641235,0,0,1,1
A2066,data analytics course,83.0,4883.0,228.3,29.0,10.0,0.047,1456.0,2024-11-07,hyderabad,mobile,learn data analytics,2024-11-07,7,11,3,45,True,0.1205,0.0169977472865042,2.7506024096385544,7.872413793103449,0.3448275862068966,0.0020479213598197828,0.3493975903614458,145.6,5.377573368374946,0.15679945054945055,0,0,1,4
A2067,data analytics course,187.0,4753.0,236.03,13.0,3.0,0.054,1906.0,2024-11-18,hyderabad,desktop,data analytics online,2024-11-18,18,11,0,47,True,0.016,0.03934357248053861,1.262192513368984,18.156153846153845,0.23076923076923078,0.0006311803071744162,0.06951871657754011,635.3333333333334,7.075244672287421,0.12383525708289612,0,0,0,2
A2068,data analytics course,81.0,5653.0,245.33,23.0,8.0,0.099,1248.0,2024-11-26,hyderabad,mobile,data analytics online,2024-11-26,26,11,1,48,False,0.0988,0.014328675039801874,3.0287654320987656,10.666521739130435,0.34782608695652173,0.0014151777817088271,0.2839506172839506,156.0,4.0870256389353115,0.19657852564102565,0,0,1,2
A2069,data analytics course,144.0,5750.0,184.37,19.0,8.0,0.056,1098.0,2024/11/26,hyderabad,desktop,learn data analytics,2024-11-26,26,11,1,48,False,0.0556,0.025043478260869566,1.2803472222222223,9.703684210526315,0.42105263157894735,0.001391304347826087,0.13194444444444445,137.25,4.955415740087867,0.16791438979963572,0,0,0,4
A2070,data analytics course,161.0,5766.0,221.93,10.0,8.0,0.05,1830.0,2024/11/13,hyderabad,tablet,online data analytic,2024-11-13,13,11,2,46,False,0.0497,0.02792230315643427,1.3784472049689442,22.193,0.8,0.001387443635102324,0.062111801242236024,228.75,7.245843283918352,0.12127322404371585,0,0,2,5
A2071,data analytics course,90.0,4424.0,219.77,10.0,4.0,0.047,1396.0,08-11-2024,hyderabad,desktop,data analytics online,2024-08-11,11,8,6,32,True,0.0444,0.02034358047016275,2.441888888888889,21.977,0.4,0.0009041591320072332,0.1111111111111111,349.0,5.352095372434818,0.15742836676217767,0,0,0,2
A2072,data analytics course,128.0,5043.0,231.72,26.0,8.0,0.062,1508.0,2024-11-26,hyderabad,tablet,analytics for data,2024-11-26,26,11,1,48,False,0.0625,0.025381717231806464,1.8103125,8.912307692307692,0.3076923076923077,0.001586357326987904,0.203125,188.5,5.507854306922147,0.1536604774535809,0,0,2,0
A2073,data analytics course,195.0,4529.0,200.36,25.0,7.0,0.034,1343.0,2024-11-30,hyderabad,tablet,data analytics training,2024-11-30,30,11,5,48,False,0.0359,0.043055862221240894,1.0274871794871796,8.0144,0.28,0.0015455950540958269,0.1282051282051282,191.85714285714286,5.702934717508484,0.14918838421444527,0,0,2,3
A2074,data analytics course,160.0,5751.0,214.965,28.0,4.0,0.04,1802.0,2024-11-22,hyderabad,mobile,learn data analytics,2024-11-22,22,11,4,47,True,0.025,0.027821248478525473,1.34353125,7.677321428571429,0.14285714285714285,0.0006955312119631368,0.175,450.5,7.382759984183472,0.11929245283018867,0,0,1,4
A2075,data analytics course,176.0,4518.0,237.95,17.0,10.0,0.057,1933.0,2024-11-11,hyderabad,desktop,analytics for data,2024-11-11,11,11,0,46,False,0.0568,0.038955289951305885,1.3519886363636362,13.99705882352941,0.5882352941176471,0.002213368747233289,0.09659090909090909,193.3,7.123555368774952,0.12309881013967924,0,0,0,0
A2076,data analytics course,157.0,5201.0,228.72,14.0,8.0,0.051,1458.0,2024/11/09,hyderabad,mobile,data analytics online,2024-11-09,9,11,5,45,False,0.051,0.030186502595654682,1.456815286624204,16.337142857142858,0.5714285714285714,0.0015381657373582003,0.08917197452229299,182.25,5.374606505771249,0.1568724279835391,0,0,1,2
A2077,data analytics course,104.0,4735.0,233.95,19.0,6.0,0.058,1493.0,2024/11/23,hyderabad,mobile,learn data analytics,2024-11-23,23,11,5,47,False,0.0577,0.021964097148891235,2.2495192307692307,12.313157894736841,0.3157894736842105,0.0012671594508975714,0.18269230769230768,248.83333333333334,5.3817054926266295,0.15669792364367047,0,0,1,4
A2078,data analytics course,117.0,3014.0,242.24,12.0,7.0,0.047,1432.0,29-11-2024,hyderabad,mobile,learn data analytics,2024-11-29,29,11,4,48,True,0.04665,0.03881884538818845,2.0704273504273507,20.186666666666667,0.5833333333333334,0.00232249502322495,0.10256410256410256,204.57142857142858,4.911492734478204,0.16916201117318436,0,0,1,4
A2079,data analytics course,138.0,5506.0,192.89,27.0,6.0,0.043,1261.0,2024-11-02,hyderabad,tablet,learn data analytics,2024-11-02,2,11,5,44,False,0.0435,0.025063567017798764,1.3977536231884058,7.144074074074074,0.2222222222222222,0.0010897203051216855,0.1956521739130435,210.16666666666666,5.5374047384519685,0.15296590007930214,0,0,2,4
A2080,data analytics course,84.0,3758.0,232.56,26.0,5.0,0.06,1384.0,06-11-2024,hyderabad,desktop,data analytics course,2024-06-11,11,6,1,24,False,0.0595,0.022352315061202766,2.7685714285714287,8.944615384615386,0.19230769230769232,0.0013304949441192123,0.30952380952380953,276.8,4.951152390780874,0.16803468208092487,0,0,0,1
A2081,data analytics course,102.0,4460.0,182.23,15.0,6.0,0.059,1849.0,14-11-2024,hyderabad,tablet,data analytics online,2024-11-14,14,11,3,46,False,0.0588,0.022869955156950672,1.7865686274509802,12.148666666666665,0.4,0.0013452914798206279,0.14705882352941177,308.1666666666667,9.146518136421006,0.09855597620335316,0,0,2,2
A2082,data analytics course,122.0,5518.0,202.0,27.0,3.0,0.025,1884.0,11-11-2024,hyderabad,tablet,analytics for data,2024-11-11,11,11,0,46,False,0.0246,0.022109459949256977,1.6557377049180328,7.481481481481482,0.1111111111111111,0.0005436752446538601,0.22131147540983606,628.0,8.326732673267326,0.10721868365180467,0,0,2,0
A2083,data analytics course,198.0,5542.0,234.62,10.0,10.0,0.051,1605.0,2024/11/27,hyderabad,tablet,online data analytic,2024-11-27,27,11,2,48,False,0.0505,0.03572717430530494,1.184949494949495,23.462,1.0,0.001804402742692169,0.050505050505050504,160.5,5.84084903247805,0.14618068535825546,0,0,2,5
A2084,data analytics course,152.0,5678.0,204.41,22.0,4.0,0.047,1794.0,20-11-2024,hyderabad,desktop,online data analytic,2024-11-20,20,11,2,47,True,0.0263,0.02676998943289891,1.3448026315789474,9.291363636363636,0.18181818181818182,0.0007044734061289186,0.14473684210526316,448.5,7.776478645858813,0.11394091415830546,0,0,0,5
A2085,data analytics course,147.0,4608.0,180.04,20.0,6.0,0.041,1351.0,21-11-2024,hyderabad,desktop,data analytics online,2024-11-21,21,11,3,47,False,0.0408,0.031901041666666664,1.2247619047619047,9.001999999999999,0.3,0.0013020833333333333,0.1360544217687075,225.16666666666666,6.50388802488336,0.13326424870466322,0,0,0,2
A2086,data analytics course,108.0,5448.0,230.17,12.0,10.0,0.052,1039.0,2024-11-19,hyderabad,desktop,data analytics course,2024-11-19,19,11,1,47,True,0.0926,0.019823788546255508,2.1312037037037035,19.180833333333332,0.8333333333333334,0.0018355359765051395,0.1111111111111111,103.9,3.5140548290394062,0.2215303176130895,0,0,0,1
A2087,data analytics course,137.0,5261.0,196.48,23.0,5.0,0.036,1227.0,2024-11-26,hyderabad,tablet,data analytics training,2024-11-26,26,11,1,48,False,0.0365,0.02604067667743775,1.4341605839416058,8.542608695652174,0.21739130434782608,0.0009503896597605018,0.1678832116788321,245.4,5.244910423452769,0.16013039934800324,0,0,2,3
A2088,data analytics course,131.0,4520.0,209.38,16.0,9.0,0.069,1645.0,2024-11-12,hyderabad,mobile,data analytics online,2024-11-12,12,11,1,46,False,0.0687,0.028982300884955754,1.598320610687023,13.08625,0.5625,0.001991150442477876,0.12213740458015267,182.77777777777777,6.856528799312255,0.12728267477203647,0,0,1,2
A2089,data analytics course,80.0,3760.0,236.82,13.0,4.0,0.05,1927.0,2024-11-21,hyderabad,desktop,learn data analytics,2024-11-21,21,11,3,47,False,0.05,0.02127659574468085,2.96025,18.216923076923077,0.3076923076923077,0.0010638297872340426,0.1625,481.75,7.136981673845115,0.1228956927867151,0,0,0,4
A2090,data analytics course,114.0,4157.0,248.56,10.0,7.0,0.061,1671.0,2024-11-10,hyderabad,desktop,analytics for data,2024-11-10,10,11,6,45,False,0.0614,0.027423622804907385,2.1803508771929825,24.856,0.7,0.0016839066634592255,0.08771929824561403,238.71428571428572,5.72272288381075,0.14874925194494315,0,0,0,0
A2091,data analytics course,123.0,4580.0,223.0,15.0,7.0,0.057,1614.0,18-11-2024,hyderabad,mobile,analytics for data,2024-11-18,18,11,0,47,False,0.0569,0.026855895196506552,1.8130081300813008,14.866666666666667,0.4666666666666667,0.0015283842794759825,0.12195121951219512,230.57142857142858,6.237668161434978,0.13816604708798016,0,0,1,0
A2092,data analytics course,168.0,4068.0,233.54,23.0,5.0,0.03,1636.0,2024-11-27,hyderabad,mobile,analytics for data,2024-11-27,27,11,2,48,False,0.0298,0.04129793510324484,1.3901190476190475,10.15391304347826,0.21739130434782608,0.0012291052114060963,0.13690476190476192,327.2,6.0052239445062945,0.14275061124694377,0,0,1,0
A2093,data analytics course,180.0,3072.0,218.47,28.0,9.0,0.05,1200.0,06-11-2024,hyderabad,mobile,learn data analytics,2024-06-11,11,6,1,24,False,0.05,0.05859375,1.2137222222222221,7.8025,0.32142857142857145,0.0029296875,0.15555555555555556,133.33333333333334,4.492744999313407,0.18205833333333332,0,0,1,4
A2094,data analytics course,117.0,5379.0,240.68,18.0,3.0,0.038,1361.0,2024/11/06,hyderabad,tablet,analytics for data,2024-11-06,6,11,2,45,True,0.0256,0.021751254880089235,2.057094017094017,13.371111111111112,0.16666666666666666,0.0005577244841048522,0.15384615384615385,453.6666666666667,4.6548113677912575,0.17684055841293167,0,0,2,0
A2095,data analytics course,103.0,4885.0,221.05,21.0,10.0,0.097,1507.0,2024-11-25,hyderabad,mobile,online data analytic,2024-11-25,25,11,0,48,False,0.0971,0.021084953940634595,2.146116504854369,10.526190476190477,0.47619047619047616,0.0020470829068577278,0.20388349514563106,150.7,5.817462112644198,0.1466821499668215,0,0,1,5
A2096,data analytics course,140.0,5859.0,211.08,26.0,9.0,0.064,1276.0,2024-11-15,hyderabad,desktop,data analytics training,2024-11-15,15,11,4,46,False,0.0643,0.023894862604540025,1.5077142857142858,8.118461538461538,0.34615384615384615,0.0015360983102918587,0.18571428571428572,141.77777777777777,5.045101383361759,0.16542319749216303,0,0,0,3
A2097,data analytics course,158.0,4574.0,198.9,21.0,8.0,0.047,1706.0,04-11-2024,hyderabad,desktop,learn data analytics,2024-04-11,11,4,3,15,True,0.0506,0.03454306952339309,1.258860759493671,9.471428571428572,0.38095238095238093,0.0017490161783996502,0.13291139240506328,213.25,7.5771744595274,0.11658851113716295,0,0,0,4
A2098,data analytics course,162.0,5911.0,232.03,12.0,7.0,0.043,1613.0,09-11-2024,hyderabad,tablet,data analytics online,2024-09-11,11,9,2,37,False,0.0432,0.02740653019793605,1.432283950617284,19.335833333333333,0.5833333333333334,0.0011842327863305702,0.07407407407407407,230.42857142857142,5.951687281817007,0.1438499690018599,0,0,2,2
A2099,data analytics course,122.0,3440.0,206.78,20.0,3.0,0.025,1222.0,2024/11/24,hyderabad,tablet,online data analytic,2024-11-24,24,11,6,47,False,0.0246,0.035465116279069765,1.6949180327868854,10.339,0.15,0.0008720930232558139,0.16393442622950818,407.3333333333333,4.909662443176323,0.16921440261865794,0,0,2,5
A2100,data analytics course,89.0,4319.0,198.79,23.0,10.0,0.112,1980.0,16-11-2024,hyderabad,mobile,learn data analytics,2024-11-16,16,11,5,46,False,0.1124,0.02060662190321834,2.2335955056179775,8.64304347826087,0.43478260869565216,0.0023153507756425097,0.25842696629213485,198.0,8.960259570400925,0.10039898989898989,0,0,1,4
A2101,data analytics course,119.0,3956.0,188.53,20.0,5.0,0.044,1311.0,15-11-2024,hyderabad,tablet,data analytics training,2024-11-15,15,11,4,46,False,0.042,0.03008088978766431,1.5842857142857143,9.4265,0.25,0.0012639029322548028,0.16806722689075632,262.2,5.953800456160823,0.14380625476735318,0,0,2,3
A2102,data analytics course,155.0,4220.0,200.81,20.0,3.0,0.019,1199.0,30-11-2024,hyderabad,mobile,data analytics course,2024-11-30,30,11,5,48,False,0.0194,0.03672985781990521,1.2955483870967741,10.0405,0.15,0.0007109004739336493,0.12903225806451613,399.6666666666667,4.970818186345301,0.1674812343619683,0,0,1,1
A2103,data analytics course,139.0,3692.0,243.6,30.0,4.0,0.047,1954.0,2024-11-01,hyderabad,mobile,analytics for data,2024-11-01,1,11,4,44,True,0.04665,0.037648970747562294,1.7525179856115107,8.12,0.13333333333333333,0.0010834236186348862,0.2158273381294964,488.5,7.021346469622332,0.12466734902763561,0,0,1,0
A2104,data analytics course,179.0,4188.0,231.23,25.0,9.0,0.05,1936.0,19-11-2024,hyderabad,mobile,online data analytic,2024-11-19,19,11,1,47,False,0.0503,0.04274116523400191,1.2917877094972066,9.2492,0.36,0.002148997134670487,0.13966480446927373,215.11111111111111,7.3726160100333,0.11943698347107437,0,0,1,5
A2105,data analytics course,194.0,4520.0,217.93,29.0,7.0,0.047,1457.0,2024/11/25,hyderabad,mobile,data analytics course,2024-11-25,25,11,0,48,True,0.04665,0.04292035398230089,1.1233505154639176,7.514827586206897,0.2413793103448276,0.0015486725663716814,0.14948453608247422,208.14285714285714,5.685633001422475,0.14957446808510638,0,0,1,1
A2106,data analytics course,101.0,3401.0,194.12,27.0,3.0,0.03,1721.0,2024-11-11,hyderabad,mobile,learn data analytics,2024-11-11,11,11,0,46,False,0.0297,0.029697147897677155,1.9219801980198021,7.189629629629629,0.1111111111111111,0.0008820935019112026,0.26732673267326734,573.6666666666666,7.86565011333196,0.11279488669378268,0,0,1,4
A2107,data analytics course,110.0,3382.0,249.88,17.0,6.0,0.044,1327.0,2024/11/22,hyderabad,mobile,learn data analytics,2024-11-22,22,11,4,47,True,0.0545,0.03252513305736251,2.2716363636363637,14.698823529411765,0.35294117647058826,0.0017740981667652277,0.15454545454545454,221.16666666666666,4.3105490635505035,0.18830444611906555,0,0,1,4
A2108,data analytics course,179.0,5366.0,204.5,20.0,9.0,0.05,1510.0,22-11-2024,hyderabad,tablet,data analytics online,2024-11-22,22,11,4,47,False,0.0503,0.03335818114051435,1.1424581005586592,10.225,0.45,0.0016772269847185985,0.11173184357541899,167.77777777777777,6.383863080684597,0.13543046357615893,0,0,2,2
A2109,data analytics course,193.0,4611.0,197.28,27.0,10.0,0.034,1701.0,29-11-2024,hyderabad,mobile,data analytics course,2024-11-29,29,11,4,48,True,0.0518,0.041856430275428326,1.0221761658031088,7.306666666666667,0.37037037037037035,0.002168726957276079,0.13989637305699482,170.1,7.622262773722627,0.11597883597883597,0,0,1,1
A2110,data analytics course,188.0,4447.0,234.18,14.0,8.0,0.045,1449.0,2024-11-17,hyderabad,mobile,analytics for data,2024-11-17,17,11,6,46,False,0.0426,0.04227569147740049,1.2456382978723404,16.72714285714286,0.5714285714285714,0.0017989655947829998,0.07446808510638298,181.125,5.187548039969254,0.16161490683229815,0,0,1,0
A2111,data analytics course,139.0,4075.0,211.41,11.0,7.0,0.047,1764.0,2024/11/08,hyderabad,tablet,data analytics online,2024-11-08,8,11,4,45,True,0.04665,0.03411042944785276,1.520935251798561,19.21909090909091,0.6363636363636364,0.0017177914110429449,0.07913669064748201,252.0,7.343976160068114,0.1198469387755102,0,0,2,2
A2112,data analytics course,177.0,4230.0,213.46,15.0,4.0,0.023,1389.0,2024-11-06,hyderabad,desktop,analytics for data,2024-11-06,6,11,2,45,False,0.0226,0.04184397163120567,1.2059887005649719,14.230666666666668,0.26666666666666666,0.0009456264775413711,0.0847457627118644,347.25,5.507073924857115,0.153678905687545,0,0,0,0
A2113,data analytics course,152.0,3729.0,214.23,22.0,7.0,0.047,2000.0,20-11-2024,hyderabad,tablet,analytics for data,2024-11-20,20,11,2,47,False,0.0461,0.04076159828372218,1.409407894736842,9.737727272727271,0.3181818181818182,0.0018771788683293108,0.14473684210526316,285.7142857142857,8.335760631097418,0.10711499999999999,0,0,2,0
A2114,data analytics course,168.0,4710.0,214.49,15.0,9.0,0.054,1466.0,24-11-2024,hyderabad,mobile,data analytics training,2024-11-24,24,11,6,47,False,0.0536,0.035668789808917196,1.2767261904761906,14.299333333333333,0.6,0.001910828025477707,0.08928571428571429,162.88888888888889,5.834817474008112,0.14630968622100957,0,0,1,3
A2115,data analytics course,171.0,5332.0,229.69,11.0,3.0,0.018,1685.0,03-11-2024,hyderabad,mobile,data analytics course,2024-03-11,11,3,0,11,False,0.0175,0.03207051762940735,1.3432163742690058,20.88090909090909,0.2727272727272727,0.0005626406601650412,0.06432748538011696,561.6666666666666,6.335974574426401,0.13631454005934718,0,0,1,1
A2116,data analytics course,150.0,3833.0,202.55,29.0,10.0,0.047,1509.0,10-11-2024,hyderabad,tablet,learn data analytics,2024-10-11,11,10,4,41,True,0.0667,0.03913383772501957,1.3503333333333334,6.98448275862069,0.3448275862068966,0.0026089225150013043,0.19333333333333333,150.9,6.450012342631449,0.13422796554009278,0,0,2,4
A2117,data analytics course,139.0,4833.0,193.96,23.0,9.0,0.047,1987.0,2024-11-16,hyderabad,mobile,online data analytic,2024-11-16,16,11,5,46,True,0.04665,0.02876060417959859,1.3953956834532375,8.43304347826087,0.391304347826087,0.00186219739292365,0.16546762589928057,220.77777777777777,9.244380284594762,0.09761449421238047,0,0,1,5
A2118,data analytics course,174.0,4720.0,214.965,25.0,10.0,0.047,1209.0,21-11-2024,hyderabad,tablet,analytics for data,2024-11-21,21,11,3,47,True,0.0575,0.03686440677966102,1.2354310344827586,8.5986,0.4,0.00211864406779661,0.14367816091954022,120.9,4.624171376735747,0.17780397022332506,0,0,2,0
A2119,data analytics course,127.0,3131.0,227.93,24.0,7.0,0.047,1571.0,14-11-2024,hyderabad,desktop,data analytics training,2024-11-14,14,11,3,46,True,0.04665,0.04056212072820185,1.794724409448819,9.497083333333334,0.2916666666666667,0.002235707441711913,0.1889763779527559,224.42857142857142,5.892466985477997,0.14508593252705285,0,0,0,3
A2120,data analytics course,148.0,5147.0,244.42,18.0,4.0,0.045,1348.0,30-11-2024,hyderabad,desktop,data analytics online,2024-11-30,30,11,5,48,True,0.027,0.028754614338449582,1.6514864864864864,13.578888888888889,0.2222222222222222,0.0007771517388770158,0.12162162162162163,337.0,4.515096964241879,0.18132047477744806,0,0,0,2
A2121,data analytics course,112.0,5288.0,246.27,26.0,10.0,0.089,1507.0,2024/11/10,hyderabad,mobile,data analytics training,2024-11-10,10,11,6,45,False,0.0893,0.02118003025718608,2.198839285714286,9.471923076923078,0.38461538461538464,0.0018910741301059002,0.23214285714285715,150.7,5.1192999553335765,0.16341738553417387,0,0,1,3
A2122,data analytics course,184.0,3908.0,240.68,15.0,7.0,0.047,1332.0,2024-11-23,hyderabad,tablet,analytics for data,2024-11-23,23,11,5,47,True,0.038,0.04708290685772774,1.3080434782608696,16.045333333333335,0.4666666666666667,0.0017911975435005118,0.08152173913043478,190.28571428571428,4.534319428286521,0.1806906906906907,0,0,2,0
A2123,data analytics course,116.0,3380.0,196.75,23.0,9.0,0.033,1434.0,2024-11-06,hyderabad,mobile,analytics for data,2024-11-06,6,11,2,45,True,0.0776,0.03431952662721893,1.6961206896551724,8.554347826086957,0.391304347826087,0.0026627218934911242,0.19827586206896552,159.33333333333334,6.28843710292249,0.1372036262203626,0,0,1,0
A2124,data analytics course,152.0,3948.0,189.73,17.0,5.0,0.053,1851.0,2024-11-26,hyderabad,mobile,analytics for data,2024-11-26,26,11,1,48,True,0.0329,0.03850050658561297,1.2482236842105263,11.160588235294117,0.29411764705882354,0.0012664640324214793,0.1118421052631579,370.2,8.755969008591157,0.10250135062128579,0,0,1,0
A2125,data analytics course,197.0,3741.0,210.33,24.0,9.0,0.046,1883.0,26-11-2024,hyderabad,desktop,data analytics course,2024-11-26,26,11,1,48,False,0.0457,0.052659716653301256,1.0676649746192894,8.76375,0.375,0.0024057738572574178,0.1218274111675127,209.22222222222223,7.952598297912804,0.11169941582580989,0,0,0,1
A2126,data analytics course,115.0,5836.0,233.52,21.0,6.0,0.052,1301.0,2024-11-08,hyderabad,mobile,learn data analytics,2024-11-08,8,11,4,45,False,0.0522,0.019705277587388624,2.030608695652174,11.120000000000001,0.2857142857142857,0.001028101439342015,0.1826086956521739,216.83333333333334,4.571257279890373,0.17949269792467334,0,0,1,4
A2127,data analytics course,192.0,3381.0,219.26,28.0,7.0,0.036,1377.0,2024/11/15,hyderabad,mobile,online data analytic,2024-11-15,15,11,4,46,False,0.0365,0.05678793256433008,1.1419791666666665,7.8307142857142855,0.25,0.002070393374741201,0.14583333333333334,196.71428571428572,5.2802152695430085,0.1592302106027596,0,0,1,5
A2128,data analytics course,88.0,5781.0,246.82,21.0,6.0,0.057,1020.0,2024-11-25,hyderabad,tablet,data analytics online,2024-11-25,25,11,0,48,True,0.0682,0.015222279882373293,2.804772727272727,11.753333333333334,0.2857142857142857,0.0010378827192527244,0.23863636363636365,170.0,3.132566242605948,0.24198039215686273,0,0,2,2
A2129,data analytics course,134.0,4707.0,239.9,29.0,8.0,0.06,1383.0,2024/11/24,hyderabad,mobile,learn data analytics,2024-11-24,24,11,6,47,False,0.0597,0.028468238793286596,1.7902985074626867,8.272413793103448,0.27586206896551724,0.0016995963458678563,0.21641791044776118,172.875,4.764902042517715,0.17346348517715113,0,0,1,4
A2130,data analytics course,160.0,5611.0,216.65,21.0,10.0,0.047,1714.0,30-11-2024,hyderabad,tablet,learn data analytics,2024-11-30,30,11,5,48,True,0.0625,0.02851541614685439,1.3540625,10.316666666666666,0.47619047619047616,0.0017822135091783995,0.13125,171.4,6.911377798292175,0.12640023337222872,0,0,2,4
A2131,data analytics course,195.0,3174.0,218.06,12.0,7.0,0.036,1476.0,25-11-2024,hyderabad,mobile,online data analytic,2024-11-25,25,11,0,48,False,0.0359,0.06143667296786389,1.1182564102564103,18.171666666666667,0.5833333333333334,0.002205419029615627,0.06153846153846154,210.85714285714286,5.768779235072916,0.1477371273712737,0,0,1,5
A2132,data analytics course,142.0,5076.0,190.49,22.0,7.0,0.049,1509.0,2024/11/20,hyderabad,mobile,learn data analytics,2024-11-20,20,11,2,47,False,0.0493,0.02797478329393223,1.3414788732394367,8.658636363636363,0.3181818181818182,0.0013790386130811663,0.15492957746478872,215.57142857142858,6.921675678513307,0.12623591782637508,0,0,1,4
A2133,data analytics course,81.0,5942.0,236.07,15.0,7.0,0.047,1288.0,12-11-2024,hyderabad,desktop,online data analytic,2024-12-11,11,12,2,50,True,0.04665,0.013631773813530798,2.9144444444444444,15.738,0.4666666666666667,0.0011780545270952542,0.18518518518518517,184.0,4.456008810945907,0.18328416149068322,0,0,0,5
A2134,data analytics course,139.0,4234.0,201.93,16.0,4.0,0.047,1462.0,2024/11/25,hyderabad,mobile,analytics for data,2024-11-25,25,11,0,48,True,0.04665,0.032829475673122346,1.4527338129496403,12.620625,0.25,0.000944733112895607,0.11510791366906475,365.5,6.240132719259148,0.13811901504787963,0,0,1,0
A2135,data analytics course,115.0,3963.0,225.32,22.0,9.0,0.078,1622.0,01-11-2024,hyderabad,desktop,data analytics online,2024-01-11,11,1,3,2,False,0.0783,0.0290184203885945,1.959304347826087,10.241818181818182,0.4090909090909091,0.002271006813020439,0.19130434782608696,180.22222222222223,6.198650807740103,0.13891491985203452,0,0,0,2
A2136,data analytics course,172.0,4349.0,243.53,28.0,5.0,0.049,1195.0,2024-11-13,hyderabad,tablet,online data analytic,2024-11-13,13,11,2,46,True,0.0291,0.03954932168314555,1.4158720930232558,8.6975,0.17857142857142858,0.0011496895838123706,0.16279069767441862,239.0,3.9069929782778305,0.2037907949790795,0,0,2,5
A2137,data analytics course,91.0,5294.0,245.21,21.0,7.0,0.047,1227.0,2024/11/26,hyderabad,desktop,online data analytic,2024-11-26,26,11,1,48,True,0.0769,0.01718927087268606,2.6946153846153846,11.676666666666668,0.3333333333333333,0.0013222516055912353,0.23076923076923078,175.28571428571428,4.003874230251621,0.19984515077424614,0,0,0,5
A2138,data analytics course,166.0,5381.0,246.52,21.0,7.0,0.042,1579.0,2024/11/09,hyderabad,desktop,data analytics training,2024-11-09,9,11,5,45,False,0.0422,0.030849284519606023,1.4850602409638556,11.73904761904762,0.3333333333333333,0.0013008734435978444,0.12650602409638553,225.57142857142858,5.405159824760668,0.1561241291956935,0,0,0,3
A2139,data analytics course,155.0,3052.0,199.46,13.0,6.0,0.046,1362.0,2024/11/01,hyderabad,mobile,data analytics training,2024-11-01,1,11,4,44,False,0.0387,0.050786369593709045,1.2868387096774194,15.343076923076923,0.46153846153846156,0.001965923984272608,0.08387096774193549,227.0,5.828436779304121,0.14644640234948605,0,0,1,3
A2140,data analytics course,127.0,4634.0,218.04,26.0,7.0,0.055,1410.0,2024-11-02,hyderabad,tablet,learn data analytics,2024-11-02,2,11,5,44,False,0.0551,0.02740612861458783,1.7168503937007873,8.386153846153846,0.2692307692307692,0.0015105740181268882,0.2047244094488189,201.42857142857142,5.466703357182169,0.15463829787234043,0,0,2,4
A2141,data analytics course,94.0,5564.0,203.88,22.0,6.0,0.064,1507.0,2024/11/14,hyderabad,desktop,data analytics training,2024-11-14,14,11,3,46,False,0.0638,0.01689432063263839,2.168936170212766,9.267272727272728,0.2727272727272727,0.0010783608914450035,0.23404255319148937,251.16666666666666,6.391602903668824,0.13528865295288653,0,0,0,3
A2142,data analytics course,90.0,5196.0,192.83,21.0,8.0,0.089,1783.0,2024/11/07,hyderabad,desktop,data analytics course,2024-11-07,7,11,3,45,False,0.0889,0.017321016166281754,2.1425555555555555,9.182380952380953,0.38095238095238093,0.001539645881447267,0.23333333333333334,222.875,8.246486542550432,0.1081491867638811,0,0,0,1
A2143,data analytics course,161.0,5749.0,203.25,12.0,4.0,0.025,1507.0,2024-11-28,hyderabad,tablet,online data analytic,2024-11-28,28,11,3,48,False,0.0248,0.028004870412245607,1.2624223602484472,16.9375,0.3333333333333333,0.0006957731779439903,0.07453416149068323,376.75,6.414514145141451,0.13487060384870603,0,0,2,5
A2144,data analytics course,157.0,5483.0,245.31,24.0,6.0,0.038,1507.0,2024-11-22,hyderabad,mobile,analytics for data,2024-11-22,22,11,4,47,False,0.0382,0.028633959511216486,1.562484076433121,10.22125,0.25,0.0010942914462885281,0.15286624203821655,251.16666666666666,5.143247319717908,0.16278035832780358,0,0,1,0
A2145,data analytics course,157.0,4093.0,202.85,27.0,8.0,0.051,1370.0,03-11-2024,hyderabad,mobile,analytics for data,2024-03-11,11,3,0,11,False,0.051,0.03835817248961642,1.2920382165605095,7.512962962962963,0.2962962962962963,0.0019545565599804545,0.17197452229299362,171.25,5.753758935173774,0.14806569343065693,0,0,1,0
A2146,data analytics course,179.0,4459.0,181.7,27.0,5.0,0.041,1320.0,2024/11/13,hyderabad,tablet,data analytics online,2024-11-13,13,11,2,46,True,0.0279,0.04014352993944831,1.0150837988826815,6.729629629629629,0.18518518518518517,0.001121327651939897,0.15083798882681565,264.0,6.2647220693450745,0.13765151515151514,0,0,2,2
A2147,data analytics course,165.0,5937.0,220.65,23.0,6.0,0.036,1576.0,2024-11-04,hyderabad,mobile,analytics for data,2024-11-04,4,11,0,45,False,0.0364,0.027791814047498736,1.3372727272727274,9.593478260869565,0.2608695652173913,0.001010611419909045,0.1393939393939394,262.6666666666667,6.14253342397462,0.14000634517766497,0,0,1,0
A2148,data analytics course,167.0,4475.0,231.64,13.0,5.0,0.051,1750.0,2024/11/03,hyderabad,desktop,online data analytic,2024-11-03,3,11,6,44,True,0.0299,0.037318435754189944,1.387065868263473,17.818461538461538,0.38461538461538464,0.0011173184357541898,0.07784431137724551,350.0,6.554826454843724,0.13236571428571428,0,0,0,5
A2149,data analytics course,126.0,4212.0,182.54,29.0,8.0,0.063,1066.0,19-11-2024,hyderabad,mobile,online data analytic,2024-11-19,19,11,1,47,False,0.0635,0.029914529914529916,1.4487301587301586,6.294482758620689,0.27586206896551724,0.001899335232668566,0.23015873015873015,133.25,4.839815930754903,0.17123827392120075,0,0,1,5
A2150,data analytics course,134.0,4506.0,220.09,13.0,5.0,0.047,1745.0,2024-11-29,hyderabad,mobile,data analytics online,2024-11-29,29,11,4,48,True,0.0373,0.029738126941855306,1.642462686567164,16.93,0.38461538461538464,0.0011096316023080338,0.09701492537313433,349.0,6.9285746739970016,0.12612607449856733,0,0,1,2
A2151,data analytics course,142.0,3147.0,190.93,13.0,5.0,0.047,1740.0,2024-11-05,hyderabad,mobile,learn data analytics,2024-11-05,5,11,1,45,True,0.0352,0.04512233873530346,1.3445774647887325,14.686923076923078,0.38461538461538464,0.0015888147442008262,0.09154929577464789,348.0,8.113287592311318,0.10972988505747126,0,0,1,4
A2152,data analytics course,139.0,4387.0,198.93,22.0,3.0,0.047,1629.0,2024/11/11,hyderabad,desktop,learn data analytics,2024-11-11,11,11,0,46,True,0.04665,0.03168452245270116,1.4311510791366906,9.042272727272728,0.13636363636363635,0.0006838386140870754,0.15827338129496402,543.0,7.188810134218066,0.12211786372007367,0,0,0,4
A2153,data analytics course,163.0,5948.0,184.84,12.0,3.0,0.049,1248.0,11-11-2024,hyderabad,tablet,data analytics training,2024-11-11,11,11,0,46,True,0.0184,0.027404169468728985,1.1339877300613497,15.403333333333334,0.25,0.0005043712172158709,0.0736196319018405,416.0,5.751785327851115,0.14810897435897435,0,0,2,3
A2154,data analytics course,171.0,4855.0,235.23,25.0,6.0,0.035,1507.0,2024-11-21,hyderabad,desktop,data analytics course,2024-11-21,21,11,3,47,False,0.0351,0.03522142121524202,1.3756140350877193,9.4092,0.24,0.0012358393408856848,0.14619883040935672,251.16666666666666,5.406495770097352,0.15609157266091572,0,0,0,1
A2155,data analytics course,97.0,4674.0,221.39,15.0,10.0,0.047,1332.0,2024-11-07,hyderabad,tablet,data analytics course,2024-11-07,7,11,3,45,True,0.1031,0.020753102267864785,2.2823711340206185,14.759333333333332,0.6666666666666666,0.002139495079161318,0.15463917525773196,133.2,5.01653191201048,0.16620870870870869,0,0,2,1
A2156,data analytics course,176.0,3336.0,193.72,15.0,9.0,0.047,1696.0,12-11-2024,hyderabad,tablet,learn data analytics,2024-12-11,11,12,2,50,True,0.0511,0.05275779376498801,1.100681818181818,12.914666666666667,0.6,0.002697841726618705,0.08522727272727272,188.44444444444446,7.754903985133182,0.11422169811320755,0,0,2,4
A2157,data analytics course,129.0,5839.0,213.72,10.0,6.0,0.047,1476.0,2024-11-18,hyderabad,desktop,analytics for data,2024-11-18,18,11,0,47,True,0.0465,0.0220928241137181,1.6567441860465115,21.372,0.6,0.0010275732145915396,0.07751937984496124,246.0,5.906232453677709,0.14479674796747968,0,0,0,0
A2158,data analytics course,178.0,3943.0,217.96,29.0,6.0,0.034,1037.0,2024-11-15,hyderabad,mobile,learn data analytics,2024-11-15,15,11,4,46,False,0.0337,0.04514329190971342,1.2244943820224719,7.515862068965517,0.20689655172413793,0.001521683996956632,0.16292134831460675,172.83333333333334,3.757753716278216,0.21018322082931534,0,0,1,4
A2159,data analytics course,111.0,3787.0,215.48,15.0,10.0,0.047,1660.0,2024/11/14,hyderabad,tablet,online data analytic,2024-11-14,14,11,3,46,True,0.0901,0.029310800105624504,1.9412612612612612,14.365333333333332,0.6666666666666666,0.0026406126221283337,0.13513513513513514,166.0,6.703731204752182,0.12980722891566265,0,0,2,5
A2160,data analytics course,156.0,4196.0,192.96,11.0,5.0,0.047,1504.0,2024-11-26,hyderabad,mobile,learn data analytics,2024-11-26,26,11,1,48,True,0.0321,0.037178265014299335,1.236923076923077,17.541818181818183,0.45454545454545453,0.0011916110581506197,0.07051282051282051,300.8,6.794361525704809,0.12829787234042553,0,0,1,4
A2161,data analytics course,139.0,3408.0,193.07,20.0,5.0,0.042,1412.0,2024/11/19,hyderabad,tablet,data analytics course,2024-11-19,19,11,1,47,True,0.04665,0.04078638497652582,1.3889928057553957,9.6535,0.25,0.0014671361502347417,0.14388489208633093,282.4,6.313409644170509,0.13673512747875355,0,0,2,1
A2162,data analytics course,145.0,4982.0,203.33,29.0,5.0,0.045,1555.0,2024/11/23,hyderabad,tablet,data analytics training,2024-11-23,23,11,5,47,True,0.0345,0.029104777197912483,1.4022758620689657,7.011379310344828,0.1724137931034483,0.0010036130068245685,0.2,311.0,6.647666355186151,0.1307588424437299,0,0,2,3
A2163,data analytics course,156.0,5509.0,185.39,29.0,4.0,0.044,1649.0,2024-11-18,hyderabad,mobile,data analytics online,2024-11-18,18,11,0,47,True,0.0256,0.02831729896532946,1.1883974358974358,6.392758620689655,0.13793103448275862,0.0007260845888546016,0.1858974358974359,412.25,7.894762392793572,0.11242571255306245,0,0,1,2
A2164,data analytics course,127.0,3797.0,214.67,20.0,7.0,0.055,1735.0,2024/11/13,hyderabad,desktop,analytics for data,2024-11-13,13,11,2,46,False,0.0551,0.03344745851988412,1.6903149606299213,10.7335,0.35,0.0018435607058203845,0.15748031496062992,247.85714285714286,7.082172637070853,0.12372910662824206,0,0,0,0
A2165,data analytics course,121.0,5064.0,246.78,13.0,9.0,0.074,1268.0,01-11-2024,hyderabad,tablet,online data analytic,2024-01-11,11,1,3,2,False,0.0744,0.023894154818325436,2.039504132231405,18.983076923076922,0.6923076923076923,0.0017772511848341231,0.10743801652892562,140.88888888888889,4.138179755247589,0.19462145110410095,0,0,2,5
A2166,data analytics course,98.0,4217.0,234.16,17.0,4.0,0.047,1556.0,11-11-2024,hyderabad,tablet,learn data analytics,2024-11-11,11,11,0,46,True,0.0408,0.02323926962295471,2.3893877551020406,13.774117647058823,0.23529411764705882,0.0009485416172634575,0.17346938775510204,389.0,5.645029039972668,0.15048843187660668,0,0,2,4
A2167,data analytics course,156.0,3315.0,223.22,14.0,10.0,0.064,1581.0,2024-11-20,hyderabad,mobile,online data analytic,2024-11-20,20,11,2,47,False,0.0641,0.047058823529411764,1.4308974358974358,15.944285714285714,0.7142857142857143,0.0030165912518853697,0.08974358974358974,158.1,6.082698682913717,0.14118912080961415,0,0,1,5
A2168,data analytics course,191.0,4017.0,203.52,20.0,4.0,0.021,1507.0,2024/11/30,hyderabad,mobile,online data analytic,2024-11-30,30,11,5,48,False,0.0209,0.0475479213343291,1.0655497382198953,10.176,0.2,0.0009957679860592482,0.10471204188481675,376.75,6.404677672955975,0.13504976775049768,0,0,1,5
A2169,data analytics course,193.0,5094.0,205.53,18.0,3.0,0.016,1451.0,2024/11/07,hyderabad,mobile,data analytics online,2024-11-07,7,11,3,45,False,0.0155,0.03788771103258736,1.0649222797927462,11.418333333333333,0.16666666666666666,0.0005889281507656066,0.09326424870466321,483.6666666666667,6.059796623363986,0.14164713990351482,0,0,1,2
A2170,data analytics course,167.0,4520.0,244.62,11.0,9.0,0.047,1465.0,2024-11-10,hyderabad,tablet,data analytics online,2024-11-10,10,11,6,45,True,0.0539,0.036946902654867254,1.4647904191616767,22.23818181818182,0.8181818181818182,0.001991150442477876,0.0658682634730539,162.77777777777777,4.988880712942524,0.16697610921501707,0,0,2,2
A2171,data analytics course,177.0,5449.0,190.53,10.0,5.0,0.028,1257.0,2024/11/19,hyderabad,mobile,data analytics course,2024-11-19,19,11,1,47,False,0.0282,0.032483024408148285,1.0764406779661018,19.053,0.5,0.0009175995595522114,0.05649717514124294,251.4,5.597386238387656,0.15157517899761336,0,0,1,1
A2172,data analytics course,175.0,5732.0,208.46,25.0,3.0,0.017,1579.0,2024/11/11,hyderabad,tablet,data analytics online,2024-11-11,11,11,0,46,False,0.0171,0.03053035589672017,1.1912,8.3384,0.12,0.00052337752965806,0.14285714285714285,526.3333333333334,6.574594646454955,0.13202026599113365,0,0,2,2
A2173,data analytics course,122.0,4678.0,248.7,25.0,4.0,0.031,1744.0,11-11-2024,hyderabad,desktop,data analytics course,2024-11-11,11,11,0,46,False,0.0328,0.026079521162890123,2.0385245901639344,9.948,0.16,0.0008550662676357417,0.20491803278688525,436.0,6.012464817048653,0.1426032110091743,0,0,0,1
A2174,data analytics course,121.0,4088.0,223.85,19.0,3.0,0.025,1248.0,2024/11/26,hyderabad,mobile,online data analytic,2024-11-26,26,11,1,48,False,0.0248,0.029598825831702542,1.8499999999999999,11.781578947368422,0.15789473684210525,0.0007338551859099804,0.15702479338842976,416.0,4.575161938798303,0.17936698717948718,0,0,1,5
A2175,data analytics course,125.0,4528.0,186.6,10.0,9.0,0.072,1167.0,2024-11-06,hyderabad,desktop,data analytics training,2024-11-06,6,11,2,45,False,0.072,0.027606007067137808,1.4928,18.66,0.9,0.001987632508833922,0.08,129.66666666666666,5.254019292604502,0.15989717223650385,0,0,0,3
A2176,data analytics course,81.0,3946.0,202.95,10.0,7.0,0.046,1970.0,2024-11-27,hyderabad,mobile,data analytics training,2024-11-27,27,11,2,48,True,0.0864,0.020527116066903193,2.5055555555555555,20.294999999999998,0.7,0.0017739483020780538,0.12345679012345678,281.42857142857144,8.706824340970682,0.10302030456852791,0,0,1,3
A2177,data analytics course,112.0,4486.0,249.23,28.0,3.0,0.027,1572.0,2024-11-26,hyderabad,desktop,analytics for data,2024-11-26,26,11,1,48,False,0.0268,0.024966562639322336,2.2252678571428572,8.901071428571429,0.10714285714285714,0.0006687472135532769,0.25,524.0,5.307426874774305,0.15854325699745547,0,0,0,0
A2178,data analytics course,152.0,5290.0,182.01,24.0,4.0,0.047,1673.0,05-11-2024,hyderabad,mobile,analytics for data,2024-05-11,11,5,5,19,True,0.0263,0.028733459357277884,1.1974342105263158,7.583749999999999,0.16666666666666666,0.0007561436672967864,0.15789473684210525,418.25,8.191802648206142,0.1087925881649731,0,0,1,0
A2179,data analytics course,134.0,5163.0,245.4,26.0,5.0,0.047,1507.0,2024/11/14,hyderabad,tablet,analytics for data,2024-11-14,14,11,3,46,False,0.0373,0.025953902769707535,1.8313432835820895,9.438461538461539,0.19230769230769232,0.000968429207824908,0.19402985074626866,301.4,5.140994295028524,0.1628400796284008,0,0,2,0
A2180,data analytics course,111.0,3978.0,192.14,19.0,5.0,0.045,1500.0,06-11-2024,hyderabad,desktop,analytics for data,2024-06-11,11,6,1,24,False,0.045,0.02790346907993967,1.7309909909909909,10.112631578947367,0.2631578947368421,0.001256913021618904,0.17117117117117117,300.0,6.806807536171543,0.12809333333333334,0,0,0,0
A2181,data analytics course,194.0,4217.0,187.34,12.0,10.0,0.052,1669.0,2024/11/07,hyderabad,tablet,data analytics training,2024-11-07,7,11,3,45,False,0.0515,0.04600426843727769,0.9656701030927836,15.611666666666666,0.8333333333333334,0.0023713540431586438,0.061855670103092786,166.9,7.908935625066724,0.11224685440383464,0,0,2,3
A2182,data analytics course,150.0,5907.0,241.8,25.0,7.0,0.047,1430.0,2024/11/11,hyderabad,desktop,data analytics online,2024-11-11,11,11,0,46,False,0.0467,0.025393600812595226,1.612,9.672,0.28,0.0011850347045877772,0.16666666666666666,204.28571428571428,4.913978494623656,0.1690909090909091,0,0,0,2
A2183,data analytics course,100.0,5970.0,224.79,13.0,9.0,0.09,1895.0,2024-11-15,hyderabad,mobile,data analytics training,2024-11-15,15,11,4,46,False,0.09,0.01675041876046901,2.2479,17.29153846153846,0.6923076923076923,0.001507537688442211,0.13,210.55555555555554,7.430090306508297,0.11862269129287599,0,0,1,3
A2184,data analytics course,186.0,5142.0,236.2,18.0,4.0,0.047,1990.0,2024/11/24,hyderabad,tablet,data analytics online,2024-11-24,24,11,6,47,True,0.0215,0.03617269544924154,1.2698924731182795,13.122222222222222,0.2222222222222222,0.0007779074290159471,0.0967741935483871,497.5,7.42506350550381,0.11869346733668341,0,0,2,2
A2185,data analytics course,130.0,3715.0,243.34,12.0,8.0,0.062,1482.0,2024-11-01,hyderabad,desktop,data analytics online,2024-11-01,1,11,4,44,False,0.0615,0.034993270524899055,1.871846153846154,20.278333333333332,0.6666666666666666,0.0021534320323014803,0.09230769230769231,185.25,5.09024410290129,0.1641970310391363,0,0,0,2
A2186,data analytics course,158.0,4192.0,186.25,27.0,10.0,0.047,1968.0,06-11-2024,hyderabad,tablet,online data analytic,2024-06-11,11,6,1,24,True,0.0633,0.03769083969465649,1.1787974683544304,6.898148148148148,0.37037037037037035,0.002385496183206107,0.17088607594936708,196.8,9.566442953020134,0.09463922764227642,0,0,2,5
A2187,data analytics course,155.0,5121.0,248.16,22.0,8.0,0.052,1027.0,2024/11/06,hyderabad,tablet,online data analytic,2024-11-06,6,11,2,45,False,0.0516,0.030267525873852764,1.6010322580645162,11.28,0.36363636363636365,0.0015621948838117556,0.14193548387096774,128.375,3.138459058671825,0.24163583252190846,0,0,2,5
A2188,data analytics course,190.0,5984.0,209.35,14.0,6.0,0.032,1964.0,06-11-2024,hyderabad,desktop,data analytics course,2024-06-11,11,6,1,24,False,0.0316,0.031751336898395724,1.101842105263158,14.953571428571427,0.42857142857142855,0.001002673796791444,0.07368421052631578,327.3333333333333,8.381418676856939,0.10659368635437881,0,0,0,1
A2189,data analytics course,191.0,3220.0,183.33,20.0,6.0,0.051,1942.0,2024/11/28,hyderabad,tablet,data analytics training,2024-11-28,28,11,3,48,True,0.0314,0.0593167701863354,0.9598429319371728,9.166500000000001,0.3,0.0018633540372670807,0.10471204188481675,323.6666666666667,9.592919871270386,0.09440267765190526,0,0,2,3
A2190,data analytics course,145.0,5761.0,202.07,17.0,3.0,0.021,1037.0,2024-11-13,hyderabad,mobile,data analytics online,2024-11-13,13,11,2,46,False,0.0207,0.025169241451136956,1.3935862068965517,11.886470588235294,0.17647058823529413,0.0005207429265752473,0.11724137931034483,345.6666666666667,4.131884990349879,0.19486017357762778,0,0,1,2
A2191,data analytics course,102.0,5683.0,188.73,28.0,8.0,0.078,1623.0,2024/11/16,hyderabad,tablet,analytics for data,2024-11-16,16,11,5,46,False,0.0784,0.017948266760513813,1.8502941176470586,6.7403571428571425,0.2857142857142857,0.0014077071969030442,0.27450980392156865,202.875,7.599586711174695,0.11628465804066543,0,0,2,0
A2192,data analytics course,86.0,5238.0,217.28,13.0,3.0,0.047,1610.0,2024-11-22,hyderabad,desktop,data analytics online,2024-11-22,22,11,4,47,True,0.0349,0.016418480336006108,2.526511627906977,16.713846153846156,0.23076923076923078,0.000572737686139748,0.1511627906976744,536.6666666666666,6.40979381443299,0.13495652173913045,0,0,0,2
A2193,data analytics course,115.0,5116.0,227.76,24.0,3.0,0.041,1748.0,2024-11-15,hyderabad,desktop,learn data analytics,2024-11-15,15,11,4,46,True,0.0261,0.022478498827208756,1.9805217391304346,9.49,0.125,0.0005863956215793589,0.20869565217391303,582.6666666666666,6.674745345978223,0.1302974828375286,0,0,0,4
A2194,data analytics course,83.0,4476.0,204.88,27.0,8.0,0.047,1359.0,2024/11/02,hyderabad,tablet,online data analytic,2024-11-02,2,11,5,44,True,0.0964,0.018543342269883824,2.468433734939759,7.588148148148148,0.2962962962962963,0.0017873100983020554,0.3253012048192771,169.875,5.633151112846544,0.1507579102281089,0,0,2,5
A2195,data analytics course,178.0,3461.0,238.96,16.0,5.0,0.028,1321.0,2024-11-16,hyderabad,mobile,learn data analytics,2024-11-16,16,11,5,46,False,0.0281,0.051430222479052295,1.3424719101123597,14.935,0.3125,0.001444669170759896,0.0898876404494382,264.2,4.528121861399397,0.18089326267978806,0,0,1,4
A2196,data analytics course,148.0,5080.0,191.92,12.0,6.0,0.058,1070.0,2024/11/17,hyderabad,tablet,data analytics course,2024-11-17,17,11,6,46,True,0.0405,0.029133858267716535,1.2967567567567566,15.993333333333332,0.5,0.0011811023622047244,0.08108108108108109,178.33333333333334,4.5752396832013345,0.17936448598130839,0,0,2,1
A2197,data analytics course,139.0,3334.0,223.21,14.0,10.0,0.048,1317.0,03-11-2024,hyderabad,tablet,data analytics course,2024-03-11,11,3,0,11,True,0.04665,0.04169166166766647,1.6058273381294965,15.94357142857143,0.7142857142857143,0.002999400119976005,0.10071942446043165,131.7,4.900273285247076,0.16948367501898254,0,0,2,1
A2198,data analytics course,101.0,5166.0,203.74,30.0,5.0,0.05,1763.0,2024/11/13,hyderabad,desktop,data analytics training,2024-11-13,13,11,2,46,False,0.0495,0.019550909794812235,2.0172277227722772,6.791333333333333,0.16666666666666666,0.0009678668215253581,0.297029702970297,352.6,7.653185432413861,0.11556437889960296,0,0,0,3
A2199,data analytics course,113.0,5642.0,245.69,19.0,7.0,0.062,1366.0,20-11-2024,hyderabad,mobile,data analytics training,2024-11-20,20,11,2,47,False,0.0619,0.020028358738036156,2.1742477876106197,12.931052631578947,0.3684210526315789,0.0012406947890818859,0.168141592920354,195.14285714285714,4.559851845821971,0.17986090775988287,0,0,1,3
A2200,data analytics course,97.0,5552.0,228.97,14.0,6.0,0.062,1304.0,2024-11-07,hyderabad,desktop,analytics for data,2024-11-07,7,11,3,45,False,0.0619,0.017471181556195967,2.3605154639175256,16.355,0.42857142857142855,0.001080691642651297,0.14432989690721648,217.33333333333334,4.69506922304232,0.17559049079754602,0,0,0,0
A2201,data analytics course,155.0,3662.0,208.16,23.0,4.0,0.026,1913.0,2024-11-27,hyderabad,desktop,online data analytic,2024-11-27,27,11,2,48,False,0.0258,0.042326597487711635,1.3429677419354837,9.050434782608695,0.17391304347826086,0.0010922992900054614,0.14838709677419354,478.25,8.190046118370484,0.10881338212232096,0,0,0,5
A2202,data analytics course,109.0,5187.0,222.69,17.0,7.0,0.047,1690.0,23-11-2024,hyderabad,tablet,learn data analytics,2024-11-23,23,11,5,47,True,0.0642,0.02101407364565259,2.04302752293578,13.099411764705883,0.4117647058823529,0.001349527665317139,0.1559633027522936,241.42857142857142,6.589025102159953,0.13176923076923078,0,0,2,4
A2203,data analytics course,181.0,3647.0,227.37,30.0,6.0,0.033,1412.0,2024-11-30,hyderabad,desktop,data analytics course,2024-11-30,30,11,5,48,False,0.0331,0.04962983273923773,1.2561878453038675,7.579,0.2,0.0016451878256100905,0.16574585635359115,235.33333333333334,5.210142059198663,0.1610269121813031,0,0,0,1
A2204,data analytics course,131.0,3626.0,193.68,27.0,3.0,0.05,1507.0,25-11-2024,hyderabad,tablet,data analytics online,2024-11-25,25,11,0,48,True,0.0229,0.03612796469939327,1.4784732824427482,7.173333333333334,0.1111111111111111,0.000827357970215113,0.20610687022900764,502.3333333333333,6.780875671210243,0.1285202388852024,0,0,2,2
A2205,data analytics course,139.0,5650.0,225.22,26.0,3.0,0.047,1774.0,02-11-2024,hyderabad,desktop,online data analytic,2024-02-11,11,2,6,6,True,0.04665,0.024601769911504423,1.6202877697841727,8.662307692307692,0.11538461538461539,0.0005309734513274337,0.18705035971223022,591.3333333333334,6.8767427404315775,0.12695603156708005,0,0,0,5
A2206,data analytics course,109.0,5219.0,215.76,15.0,3.0,0.028,1408.0,18-11-2024,hyderabad,tablet,learn data analytics,2024-11-18,18,11,0,47,False,0.0275,0.02088522705499138,1.9794495412844035,14.383999999999999,0.2,0.0005748227629814141,0.13761467889908258,469.3333333333333,5.525769373377828,0.15323863636363635,0,0,2,4
A2207,data analytics course,191.0,3333.0,187.71,13.0,5.0,0.026,1360.0,2024-11-26,hyderabad,desktop,learn data analytics,2024-11-26,26,11,1,48,False,0.0262,0.05730573057305731,0.9827748691099477,14.43923076923077,0.38461538461538464,0.0015001500150015,0.06806282722513089,272.0,6.245218688402322,0.13802205882352941,0,0,0,4
A2208,data analytics course,101.0,4435.0,222.49,11.0,10.0,0.099,1277.0,2024-11-21,hyderabad,mobile,data analytics training,2024-11-21,21,11,3,47,False,0.099,0.022773393461104848,2.202871287128713,20.226363636363637,0.9090909090909091,0.002254791431792559,0.10891089108910891,127.7,4.739583801519169,0.17422866092404074,0,0,1,3
A2209,data analytics course,152.0,5204.0,210.28,11.0,7.0,0.046,1507.0,2024-11-23,hyderabad,mobile,online data analytic,2024-11-23,23,11,5,47,False,0.0461,0.029208301306687164,1.3834210526315789,19.116363636363637,0.6363636363636364,0.001345119139123751,0.07236842105263158,215.28571428571428,6.166634962906601,0.139535500995355,0,0,1,5
A2210,data analytics course,164.0,3856.0,241.65,27.0,4.0,0.024,1786.0,21-11-2024,hyderabad,desktop,data analytics training,2024-11-21,21,11,3,47,False,0.0244,0.04253112033195021,1.4734756097560977,8.950000000000001,0.14814814814814814,0.001037344398340249,0.16463414634146342,446.5,6.39085454169253,0.1353023516237402,0,0,0,3
A2211,data analytics course,83.0,4143.0,203.11,23.0,10.0,0.047,1517.0,2024/11/26,hyderabad,mobile,learn data analytics,2024-11-26,26,11,1,48,True,0.1205,0.020033791938209027,2.44710843373494,8.830869565217393,0.43478260869565216,0.0024137098720733766,0.27710843373493976,151.7,6.468859238836098,0.1338892551087673,0,0,1,4
A2212,data analytics course,199.0,5895.0,239.59,21.0,4.0,0.02,1592.0,2024-11-30,hyderabad,mobile,data analytics training,2024-11-30,30,11,5,48,False,0.0201,0.03375742154368109,1.2039698492462312,11.40904761904762,0.19047619047619047,0.0006785411365564037,0.10552763819095477,398.0,5.644684669643976,0.1504962311557789,0,0,1,3
A2213,data analytics course,141.0,4039.0,205.8,28.0,6.0,0.047,1220.0,2024-11-08,hyderabad,desktop,data analytics online,2024-11-08,8,11,4,45,True,0.0426,0.03490963109680614,1.4595744680851064,7.3500000000000005,0.21428571428571427,0.0014855162168853676,0.19858156028368795,203.33333333333334,4.928085519922255,0.16868852459016395,0,0,0,2
A2214,data analytics course,131.0,4773.0,215.36,26.0,7.0,0.053,1363.0,2024-11-08,hyderabad,tablet,data analytics online,2024-11-08,8,11,4,45,False,0.0534,0.027446050701864656,1.643969465648855,8.283076923076923,0.2692307692307692,0.001466582861931699,0.1984732824427481,194.71428571428572,5.328937592867756,0.158004402054292,0,0,2,2
A2215,data analytics course,139.0,5360.0,229.38,30.0,7.0,0.047,1896.0,2024/11/19,hyderabad,tablet,learn data analytics,2024-11-19,19,11,1,47,True,0.04665,0.025932835820895523,1.6502158273381295,7.646,0.23333333333333334,0.0013059701492537314,0.2158273381294964,270.85714285714283,7.265759874444154,0.12098101265822785,0,0,2,4
A2216,data analytics course,164.0,5380.0,223.15,13.0,5.0,0.047,1661.0,23-11-2024,hyderabad,desktop,analytics for data,2024-11-23,23,11,5,47,True,0.0305,0.030483271375464683,1.360670731707317,17.165384615384617,0.38461538461538464,0.0009293680297397769,0.07926829268292683,332.2,6.443423706027335,0.1343467790487658,0,0,0,0
A2217,data analytics course,149.0,3323.0,197.76,23.0,4.0,0.027,1181.0,2024-11-17,hyderabad,mobile,data analytics online,2024-11-17,17,11,6,46,False,0.0268,0.04483900090279867,1.327248322147651,8.598260869565218,0.17391304347826086,0.0012037315678603672,0.15436241610738255,295.25,4.971885113268609,0.16745131244707873,0,0,1,2
A2218,data analytics course,112.0,3870.0,215.05,26.0,6.0,0.054,1483.0,2024-11-03,hyderabad,desktop,learn data analytics,2024-11-03,3,11,6,44,False,0.0536,0.028940568475452195,1.9200892857142857,8.271153846153847,0.23076923076923078,0.0015503875968992248,0.23214285714285715,247.16666666666666,5.896070681236922,0.14501011463250169,0,0,0,4
A2219,data analytics course,139.0,4486.0,205.46,28.0,4.0,0.058,1853.0,24-11-2024,hyderabad,tablet,online data analytic,2024-11-24,24,11,6,47,True,0.0288,0.030985287561301828,1.4781294964028777,7.3378571428571435,0.14285714285714285,0.0008916629514043691,0.2014388489208633,463.25,8.018787111846587,0.11087965461413923,0,0,2,5
A2220,data analytics course,105.0,3384.0,240.41,26.0,8.0,0.057,1399.0,2024/11/03,hyderabad,desktop,data analytics online,2024-11-03,3,11,6,44,True,0.0762,0.03102836879432624,2.2896190476190474,9.246538461538462,0.3076923076923077,0.002364066193853428,0.24761904761904763,174.875,4.819225489788278,0.17184417441029307,0,0,0,2
A2221,data analytics course,83.0,5066.0,236.91,22.0,7.0,0.047,1507.0,2024-11-21,hyderabad,desktop,learn data analytics,2024-11-21,21,11,3,47,True,0.04665,0.016383734701934466,2.8543373493975905,10.768636363636363,0.3181818181818182,0.0013817607579944729,0.26506024096385544,215.28571428571428,5.361065383478958,0.1572063702720637,0,0,0,4
A2222,data analytics course,127.0,5947.0,209.67,27.0,3.0,0.024,1155.0,2024-11-28,hyderabad,desktop,learn data analytics,2024-11-28,28,11,3,48,False,0.0236,0.02135530519589709,1.6509448818897636,7.765555555555555,0.1111111111111111,0.0005044560282495376,0.2125984251968504,385.0,4.508656460151667,0.18153246753246752,0,0,0,4
A2223,data analytics course,133.0,4286.0,216.16,18.0,9.0,0.054,1839.0,08-11-2024,hyderabad,desktop,data analytics online,2024-08-11,11,8,6,32,True,0.0677,0.031031264582361176,1.6252631578947367,12.008888888888889,0.5,0.002099860009332711,0.13533834586466165,204.33333333333334,7.507586972612879,0.117542142468733,0,0,0,2
A2224,data analytics course,197.0,5733.0,185.09,14.0,5.0,0.025,1295.0,2024/11/05,hyderabad,tablet,data analytics training,2024-11-05,5,11,1,45,False,0.0254,0.0343624629338915,0.9395431472081218,13.220714285714285,0.35714285714285715,0.0008721437292865864,0.07106598984771574,259.0,5.996596250472743,0.14292664092664092,0,0,2,3
A2225,data analytics course,125.0,5103.0,221.93,30.0,7.0,0.052,1398.0,08-11-2024,hyderabad,tablet,analytics for data,2024-08-11,11,8,6,32,False,0.056,0.024495394865765237,1.7754400000000001,7.397666666666667,0.23333333333333334,0.0013717421124828531,0.24,199.71428571428572,5.29928355787861,0.15874821173104436,0,0,2,0
A2226,data analytics course,147.0,5228.0,210.94,12.0,9.0,0.047,1784.0,2024-11-28,hyderabad,desktop,data analytics training,2024-11-28,28,11,3,48,True,0.0612,0.028117827084927313,1.4349659863945579,17.578333333333333,0.75,0.0017214996174445293,0.08163265306122448,198.22222222222223,7.4573812458519,0.11823991031390134,0,0,0,3
A2227,data analytics course,153.0,3666.0,198.4,16.0,4.0,0.026,1820.0,2024/11/20,hyderabad,mobile,learn data analytics,2024-11-20,20,11,2,47,False,0.0261,0.041734860883797055,1.296732026143791,12.4,0.25,0.0010911074740861974,0.10457516339869281,455.0,8.173387096774192,0.10901098901098902,0,0,1,4
A2228,data analytics course,196.0,3440.0,212.98,15.0,5.0,0.026,1539.0,2024-11-26,hyderabad,tablet,learn data analytics,2024-11-26,26,11,1,48,False,0.0255,0.056976744186046514,1.0866326530612245,14.198666666666666,0.3333333333333333,0.0014534883720930232,0.07653061224489796,307.8,6.226030613203118,0.13838856400259908,0,0,2,4
A2229,data analytics course,87.0,3031.0,234.25,17.0,7.0,0.08,1167.0,2024-11-05,hyderabad,desktop,data analytics online,2024-11-05,5,11,1,45,False,0.0805,0.028703398218409767,2.692528735632184,13.779411764705882,0.4117647058823529,0.0023094688221709007,0.19540229885057472,166.71428571428572,3.9818569903948773,0.20072836332476435,0,0,0,2
A2230,data analytics course,151.0,5957.0,188.22,15.0,8.0,0.053,1468.0,2024-11-25,hyderabad,tablet,analytics for data,2024-11-25,25,11,0,48,False,0.053,0.02534832969615578,1.2464900662251654,12.548,0.5333333333333333,0.001342957864696995,0.09933774834437085,183.5,6.7993836999256185,0.12821525885558582,0,0,2,0
A2231,data analytics course,93.0,4689.0,197.54,15.0,4.0,0.043,1073.0,25-11-2024,hyderabad,mobile,data analytics online,2024-11-25,25,11,0,48,False,0.043,0.01983365323096609,2.1240860215053763,13.169333333333332,0.26666666666666666,0.0008530603540200469,0.16129032258064516,268.25,4.431811278728359,0.18410065237651443,0,0,1,2
A2232,data analytics course,145.0,3085.0,194.96,26.0,5.0,0.033,1673.0,24-11-2024,hyderabad,desktop,online data analytic,2024-11-24,24,11,6,47,False,0.0345,0.04700162074554295,1.344551724137931,7.498461538461539,0.19230769230769232,0.0016207455429497568,0.1793103448275862,334.6,7.581247435371358,0.11653317393903169,0,0,0,5
A2233,data analytics course,128.0,3341.0,185.57,25.0,5.0,0.039,1516.0,2024-11-20,hyderabad,tablet,online data analytic,2024-11-20,20,11,2,47,False,0.0391,0.038311882669859326,1.449765625,7.4228,0.2,0.00149655791679138,0.1953125,303.2,7.169423937058792,0.12240765171503958,0,0,2,5
A2234,data analytics course,134.0,5521.0,243.57,15.0,3.0,0.047,1658.0,24-11-2024,hyderabad,desktop,online data analytic,2024-11-24,24,11,6,47,True,0.0224,0.02427096540481797,1.817686567164179,16.238,0.2,0.0005433798224959246,0.11194029850746269,552.6666666666666,5.807078047378577,0.1469059107358263,0,0,0,5
A2235,data analytics course,104.0,3696.0,206.54,28.0,7.0,0.053,1985.0,2024-11-11,hyderabad,desktop,data analytics training,2024-11-11,11,11,0,46,True,0.04665,0.02813852813852814,1.9859615384615383,7.376428571428571,0.25,0.001893939393939394,0.2692307692307692,283.57142857142856,8.61072915657984,0.10405037783375315,0,0,0,3
A2236,data analytics course,177.0,3765.0,216.48,26.0,10.0,0.056,1507.0,2024/11/20,hyderabad,tablet,data analytics online,2024-11-20,20,11,2,47,False,0.0565,0.04701195219123506,1.2230508474576272,8.326153846153845,0.38461538461538464,0.0026560424966799467,0.14689265536723164,150.7,5.961382113821139,0.14364963503649633,0,0,2,2
A2237,data analytics course,94.0,5455.0,249.09,15.0,3.0,0.047,1507.0,14-11-2024,hyderabad,mobile,analytics for data,2024-11-14,14,11,3,46,True,0.0319,0.017231897341888177,2.649893617021277,16.606,0.2,0.0005499541704857929,0.1595744680851064,502.3333333333333,5.050022080372556,0.16528865295288653,0,0,1,0
A2238,data analytics course,198.0,5260.0,205.53,13.0,10.0,0.051,1766.0,2024-11-12,hyderabad,desktop,analytics for data,2024-11-12,12,11,1,46,False,0.0505,0.0376425855513308,1.038030303030303,15.81,0.7692307692307693,0.0019011406844106464,0.06565656565656566,176.6,7.592419598112198,0.11638165345413364,0,0,0,0
A2239,data analytics course,140.0,4404.0,186.01,23.0,6.0,0.059,1625.0,2024/11/09,hyderabad,tablet,analytics for data,2024-11-09,9,11,5,45,True,0.0429,0.03178928247048138,1.328642857142857,8.087391304347825,0.2608695652173913,0.0013623978201634877,0.16428571428571428,270.8333333333333,7.736089457556046,0.1144676923076923,0,0,2,0
A2240,data analytics course,137.0,5445.0,237.51,20.0,5.0,0.047,1904.0,25-11-2024,hyderabad,tablet,learn data analytics,2024-11-25,25,11,0,48,True,0.0365,0.025160697887970616,1.7336496350364963,11.875499999999999,0.25,0.0009182736455463728,0.145985401459854,380.8,7.016504568228706,0.12474264705882353,0,0,2,4
A2241,data analytics course,153.0,3068.0,214.965,25.0,8.0,0.052,1165.0,19-11-2024,hyderabad,tablet,analytics for data,2024-11-19,19,11,1,47,False,0.0523,0.049869621903520206,1.405,8.5986,0.32,0.002607561929595828,0.16339869281045752,145.625,4.419486893215175,0.18451931330472104,0,0,2,0
A2242,data analytics course,177.0,4520.0,240.09,26.0,10.0,0.047,1507.0,2024/11/08,hyderabad,mobile,data analytics training,2024-11-08,8,11,4,45,True,0.0565,0.03915929203539823,1.3564406779661018,9.23423076923077,0.38461538461538464,0.0022123893805309734,0.14689265536723164,150.7,5.276812861843475,0.15931652289316522,0,0,1,3
A2243,data analytics course,100.0,4042.0,214.965,13.0,6.0,0.047,1678.0,2024/11/18,hyderabad,desktop,analytics for data,2024-11-18,18,11,0,47,True,0.06,0.024740227610094014,2.14965,16.53576923076923,0.46153846153846156,0.0014844136566056407,0.13,279.6666666666667,6.805921894261857,0.12810786650774733,0,0,0,0
A2244,data analytics course,160.0,5645.0,195.42,25.0,6.0,0.031,1600.0,16-11-2024,hyderabad,tablet,data analytics online,2024-11-16,16,11,5,46,False,0.0375,0.0283436669619132,1.2213749999999999,7.8168,0.24,0.0010628875110717448,0.15625,266.6666666666667,7.187493603520623,0.1221375,0,0,2,2
A2245,data analytics course,194.0,3751.0,244.34,23.0,5.0,0.026,1507.0,02-11-2024,hyderabad,mobile,data analytics online,2024-02-11,11,2,6,6,False,0.0258,0.051719541455611834,1.2594845360824742,10.623478260869565,0.21739130434782608,0.0013329778725673154,0.11855670103092783,301.4,5.167635262339363,0.16213669542136697,0,0,1,2
A2246,data analytics course,128.0,5010.0,202.34,26.0,7.0,0.055,1507.0,2024/11/16,hyderabad,tablet,data analytics training,2024-11-16,16,11,5,46,False,0.0547,0.02554890219560878,1.58078125,7.782307692307692,0.2692307692307692,0.0013972055888223553,0.203125,215.28571428571428,6.447860037560542,0.13426675514266756,0,0,2,3
A2247,data analytics course,80.0,4506.0,236.47,11.0,5.0,0.047,1953.0,20-11-2024,hyderabad,desktop,data analytics course,2024-11-20,20,11,2,47,True,0.0625,0.01775410563692854,2.955875,21.497272727272726,0.45454545454545453,0.0011096316023080338,0.1375,390.6,7.258975768596439,0.12108038914490528,0,0,0,1
A2248,data analytics course,81.0,5843.0,209.54,10.0,9.0,0.047,1979.0,2024-11-09,hyderabad,tablet,data analytics training,2024-11-09,9,11,5,45,True,0.1111,0.01386274174225569,2.5869135802469136,20.954,0.9,0.00154030463802841,0.12345679012345678,219.88888888888889,8.444497470649996,0.10588175846387064,0,0,2,3
A2249,data analytics course,102.0,5369.0,198.39,29.0,4.0,0.039,1659.0,19-11-2024,hyderabad,tablet,data analytics course,2024-11-19,19,11,1,47,False,0.0392,0.018997951201341033,1.9449999999999998,6.84103448275862,0.13793103448275862,0.0007450176941702365,0.28431372549019607,414.75,7.36231664902465,0.11958408679927666,0,0,2,1
A2250,data analytics course,197.0,4047.0,202.72,15.0,3.0,0.015,1345.0,05-11-2024,hyderabad,mobile,data analytics online,2024-05-11,11,5,5,19,False,0.0152,0.04867803311094638,1.029035532994924,13.514666666666667,0.2,0.0007412898443291327,0.07614213197969544,448.3333333333333,5.634767166535123,0.15072118959107805,0,0,1,2
A2251,data analytics course,84.0,4463.0,198.44,17.0,3.0,0.036,1110.0,2024-11-02,hyderabad,mobile,analytics for data,2024-11-02,2,11,5,44,False,0.0357,0.018821420569123906,2.3623809523809522,11.672941176470587,0.17647058823529413,0.0006721935917544253,0.20238095238095238,370.0,4.593630316468453,0.17877477477477477,0,0,1,0
A2252,data analytics course,119.0,4610.0,222.7,18.0,3.0,0.025,1473.0,2024-11-18,hyderabad,desktop,data analytics online,2024-11-18,18,11,0,47,False,0.0252,0.025813449023861172,1.8714285714285714,12.372222222222222,0.16666666666666666,0.0006507592190889371,0.15126050420168066,491.0,5.614279299506062,0.15118805159538357,0,0,0,2
A2253,data analytics course,96.0,5957.0,225.59,27.0,10.0,0.104,1062.0,2024/11/21,hyderabad,mobile,data analytics online,2024-11-21,21,11,3,47,False,0.1042,0.01611549437636394,2.3498958333333335,8.355185185185185,0.37037037037037035,0.0016786973308712439,0.28125,106.2,3.7076554811826763,0.21241996233521657,0,0,1,2
A2254,data analytics course,144.0,5704.0,196.67,29.0,6.0,0.042,1573.0,29-11-2024,hyderabad,mobile,analytics for data,2024-11-29,29,11,4,48,False,0.0417,0.025245441795231416,1.3657638888888888,6.781724137931034,0.20689655172413793,0.0010518934081346423,0.2013888888888889,262.1666666666667,6.998169522550465,0.12502860775588048,0,0,1,0
A2255,data analytics course,148.0,5335.0,223.36,21.0,9.0,0.061,1251.0,2024/11/20,hyderabad,tablet,data analytics online,2024-11-20,20,11,2,47,False,0.0608,0.027741330834114338,1.5091891891891893,10.636190476190476,0.42857142857142855,0.0016869728209934396,0.14189189189189189,139.0,4.600823782234956,0.1785451638689049,0,0,2,2
A2256,data analytics course,151.0,4901.0,224.29,27.0,7.0,0.047,1425.0,2024/11/05,hyderabad,mobile,data analytics training,2024-11-05,5,11,1,45,True,0.0464,0.030810038767598448,1.485364238410596,8.307037037037036,0.25925925925925924,0.0014282799428688023,0.17880794701986755,203.57142857142858,5.35338178251371,0.15739649122807017,0,0,1,3
A2257,data analytics course,175.0,5392.0,187.74,17.0,9.0,0.047,1015.0,2024-11-21,hyderabad,tablet,data analytics online,2024-11-21,21,11,3,47,True,0.0514,0.03245548961424333,1.0728,11.043529411764707,0.5294117647058824,0.0016691394658753709,0.09714285714285714,112.77777777777777,4.4064131245339295,0.18496551724137933,0,0,2,2
A2258,data analytics course,189.0,3461.0,224.72,20.0,7.0,0.047,1390.0,2024/11/21,hyderabad,desktop,data analytics training,2024-11-21,21,11,3,47,True,0.04665,0.05460849465472407,1.188994708994709,11.236,0.35,0.0020225368390638545,0.10582010582010581,198.57142857142858,5.185475258098967,0.16166906474820145,0,0,0,3
A2259,data analytics course,157.0,5451.0,183.89,12.0,10.0,0.064,1180.0,29-11-2024,hyderabad,desktop,data analytics course,2024-11-29,29,11,4,48,False,0.0637,0.028802054668868097,1.1712738853503184,15.324166666666665,0.8333333333333334,0.00183452577508714,0.07643312101910828,118.0,5.416879656316277,0.15583898305084745,0,0,0,1
A2260,data analytics course,126.0,4520.0,201.56,27.0,10.0,0.079,1122.0,2024-11-21,hyderabad,desktop,analytics for data,2024-11-21,21,11,3,47,False,0.0794,0.027876106194690265,1.5996825396825396,7.465185185185185,0.37037037037037035,0.0022123893805309734,0.21428571428571427,112.2,4.56658067076801,0.17964349376114083,0,0,0,0
A2261,data analytics course,85.0,3770.0,204.04,30.0,7.0,0.047,1238.0,14-11-2024,hyderabad,mobile,learn data analytics,2024-11-14,14,11,3,46,True,0.0824,0.022546419098143235,2.400470588235294,6.801333333333333,0.23333333333333334,0.001856763925729443,0.35294117647058826,176.85714285714286,5.06743775730249,0.1648142164781906,0,0,1,4
A2262,data analytics course,89.0,3573.0,193.53,20.0,10.0,0.112,1926.0,15-11-2024,hyderabad,desktop,learn data analytics,2024-11-15,15,11,4,46,False,0.1124,0.02490904002239015,2.174494382022472,9.6765,0.5,0.00279876854184159,0.2247191011235955,192.6,8.951945434816308,0.10048286604361371,0,0,0,4
A2263,data analytics course,152.0,4092.0,196.66,10.0,5.0,0.047,1396.0,2024-11-11,hyderabad,desktop,analytics for data,2024-11-11,11,11,0,46,True,0.0329,0.03714565004887586,1.2938157894736841,19.666,0.5,0.0012218963831867058,0.06578947368421052,279.2,6.098545713414014,0.14087392550143266,0,0,0,0
A2264,data analytics course,126.0,3999.0,181.58,22.0,9.0,0.071,1145.0,2024/11/27,hyderabad,mobile,online data analytic,2024-11-27,27,11,2,48,False,0.0714,0.03150787696924231,1.4411111111111112,8.253636363636364,0.4090909090909091,0.002250562640660165,0.1746031746031746,127.22222222222223,5.305760546315673,0.15858515283842795,0,0,1,5
A2265,data analytics course,153.0,3354.0,243.13,24.0,6.0,0.039,1536.0,2024/11/10,hyderabad,mobile,data analytics course,2024-11-10,10,11,6,45,False,0.0392,0.04561717352415027,1.5890849673202614,10.130416666666667,0.25,0.0017889087656529517,0.1568627450980392,256.0,5.317607864105622,0.15828776041666667,0,0,1,1
A2266,data analytics course,98.0,4801.0,186.52,10.0,3.0,0.031,1121.0,2024/11/07,hyderabad,desktop,learn data analytics,2024-11-07,7,11,3,45,False,0.0306,0.020412414080399916,1.9032653061224492,18.652,0.3,0.0006248698187877526,0.10204081632653061,373.6666666666667,5.010079348059189,0.1663871543264942,0,0,0,4
A2267,data analytics course,145.0,4799.0,194.74,17.0,6.0,0.047,1381.0,07-11-2024,hyderabad,desktop,analytics for data,2024-07-11,11,7,3,28,True,0.0414,0.0302146280475099,1.3430344827586207,11.455294117647059,0.35294117647058826,0.001250260470931444,0.11724137931034483,230.16666666666666,6.091506624216905,0.14101375814627082,0,0,0,0
A2268,data analytics course,179.0,3753.0,220.87,23.0,6.0,0.047,1966.0,2024/11/14,hyderabad,tablet,data analytics course,2024-11-14,14,11,3,46,True,0.0335,0.04769517719158007,1.2339106145251397,9.60304347826087,0.2608695652173913,0.0015987210231814548,0.12849162011173185,327.6666666666667,7.901163580386653,0.11234486266531028,0,0,2,1
A2269,data analytics course,108.0,4698.0,187.19,19.0,10.0,0.047,1118.0,15-11-2024,hyderabad,mobile,data analytics online,2024-11-15,15,11,4,46,True,0.0926,0.022988505747126436,1.7332407407407406,9.852105263157895,0.5263157894736842,0.0021285653469561515,0.17592592592592593,111.8,4.97254126823014,0.167432915921288,0,0,1,2
A2270,data analytics course,191.0,3522.0,216.65,25.0,5.0,0.026,1835.0,2024/11/24,hyderabad,tablet,data analytics training,2024-11-24,24,11,6,47,False,0.0262,0.0542305508233958,1.1342931937172775,8.666,0.2,0.0014196479273140261,0.13089005235602094,367.0,7.469882298638356,0.11806539509536786,0,0,2,3
A2271,data analytics course,183.0,3363.0,212.08,10.0,9.0,0.049,1511.0,07-11-2024,hyderabad,tablet,data analytics online,2024-07-11,11,7,3,28,False,0.0492,0.054415700267618196,1.1589071038251366,21.208000000000002,0.9,0.0026761819803746653,0.0546448087431694,167.88888888888889,6.124669935873255,0.14035737921906025,0,0,2,2
A2272,data analytics course,175.0,5924.0,223.3,14.0,3.0,0.017,1505.0,2024-11-04,hyderabad,mobile,analytics for data,2024-11-04,4,11,0,45,False,0.0171,0.029540850776502363,1.276,15.950000000000001,0.21428571428571427,0.0005064145847400405,0.08,501.6666666666667,5.739811912225705,0.14837209302325582,0,0,1,0
A2273,data analytics course,97.0,3558.0,195.5,13.0,3.0,0.058,1544.0,2024-11-11,hyderabad,desktop,data analytics course,2024-11-11,11,11,0,46,True,0.0309,0.027262507026419337,2.015463917525773,15.038461538461538,0.23076923076923078,0.0008431703204047217,0.13402061855670103,514.6666666666666,6.89769820971867,0.12661917098445596,0,0,0,1
A2274,data analytics course,159.0,4208.0,236.75,13.0,8.0,0.05,1849.0,2024-11-16,hyderabad,tablet,data analytics training,2024-11-16,16,11,5,46,False,0.0503,0.037785171102661594,1.4889937106918238,18.21153846153846,0.6153846153846154,0.0019011406844106464,0.08176100628930817,231.125,6.809926082365364,0.12804218496484587,0,0,2,3
A2275,data analytics course,125.0,3607.0,224.45,22.0,9.0,0.072,1392.0,02-11-2024,hyderabad,tablet,analytics for data,2024-02-11,11,2,6,6,False,0.072,0.034654837815359024,1.7955999999999999,10.202272727272726,0.4090909090909091,0.00249514832270585,0.176,154.66666666666666,5.201826687458231,0.161242816091954,0,0,2,0
A2276,data analytics course,193.0,4520.0,199.27,13.0,9.0,0.047,1612.0,08-11-2024,hyderabad,mobile,data analytics online,2024-08-11,11,8,6,32,True,0.0466,0.04269911504424779,1.0324870466321243,15.32846153846154,0.6923076923076923,0.001991150442477876,0.06735751295336788,179.11111111111111,7.089526772720429,0.1236166253101737,0,0,1,2
A2277,data analytics course,110.0,5220.0,233.06,16.0,4.0,0.036,1711.0,15-11-2024,hyderabad,mobile,data analytics training,2024-11-15,15,11,4,46,False,0.0364,0.0210727969348659,2.1187272727272726,14.56625,0.25,0.0007662835249042146,0.14545454545454545,427.75,6.341457135501588,0.1362127410870836,0,0,1,3
A2278,data analytics course,83.0,5247.0,231.04,27.0,3.0,0.054,1636.0,2024-11-04,hyderabad,desktop,data analytics online,2024-11-04,4,11,0,45,True,0.0361,0.01581856298837431,2.7836144578313253,8.557037037037036,0.1111111111111111,0.0005717552887364208,0.3253012048192771,545.3333333333334,6.0810249307479225,0.14122249388753055,0,0,0,2
A2279,data analytics course,166.0,5522.0,218.34,13.0,3.0,0.018,1235.0,2024/11/22,hyderabad,desktop,online data analytic,2024-11-22,22,11,4,47,False,0.0181,0.030061571894241218,1.3153012048192771,16.795384615384616,0.23076923076923078,0.0005432814197754436,0.0783132530120482,411.6666666666667,4.656315837684345,0.1767935222672065,0,0,0,5
A2280,data analytics course,108.0,3682.0,214.43,20.0,3.0,0.028,1553.0,27-11-2024,hyderabad,desktop,learn data analytics,2024-11-27,27,11,2,48,False,0.0278,0.02933188484519283,1.985462962962963,10.7215,0.15,0.0008147745790331341,0.18518518518518517,517.6666666666666,6.242456745791166,0.1380746941403735,0,0,0,4
A2281,data analytics course,84.0,4549.0,191.96,15.0,7.0,0.047,1303.0,13-11-2024,hyderabad,desktop,data analytics course,2024-11-13,13,11,2,46,True,0.0833,0.018465596834469113,2.2852380952380953,12.797333333333334,0.4666666666666667,0.0015387997362057595,0.17857142857142858,186.14285714285714,5.787872473431965,0.14732156561780507,0,0,0,1
A2282,data analytics course,117.0,5170.0,214.965,16.0,10.0,0.085,1507.0,20-11-2024,hyderabad,tablet,data analytics online,2024-11-20,20,11,2,47,False,0.0855,0.02263056092843327,1.8373076923076923,13.4353125,0.625,0.0019342359767891683,0.13675213675213677,150.7,6.010443560579629,0.14264432647644326,0,0,2,2
A2283,data analytics course,195.0,3122.0,205.3,24.0,4.0,0.043,1326.0,2024/11/14,hyderabad,mobile,data analytics training,2024-11-14,14,11,3,46,True,0.0205,0.062459961563100574,1.0528205128205128,8.554166666666667,0.16666666666666666,0.0012812299807815502,0.12307692307692308,331.5,5.45884072089625,0.1548265460030166,0,0,1,3
A2284,data analytics course,149.0,3650.0,220.25,17.0,3.0,0.02,1507.0,29-11-2024,hyderabad,mobile,data analytics online,2024-11-29,29,11,4,48,False,0.0201,0.04082191780821918,1.4781879194630871,12.955882352941176,0.17647058823529413,0.0008219178082191781,0.11409395973154363,502.3333333333333,5.8422247446084,0.14615129396151294,0,0,1,2
A2285,data analytics course,142.0,5436.0,237.09,14.0,7.0,0.047,1269.0,20-11-2024,hyderabad,tablet,online data analytic,2024-11-20,20,11,2,47,True,0.0493,0.02612214863870493,1.6696478873239438,16.935,0.5,0.0012877115526122149,0.09859154929577464,181.28571428571428,4.3523978236112875,0.18683215130023642,0,0,2,5
A2286,data analytics course,98.0,5485.0,182.29,16.0,5.0,0.051,1518.0,2024/11/19,hyderabad,desktop,learn data analytics,2024-11-19,19,11,1,47,False,0.051,0.017866909753874203,1.8601020408163265,11.393125,0.3125,0.0009115770282588879,0.16326530612244897,303.6,7.327390421855286,0.12008563899868248,0,0,0,4
A2287,data analytics course,169.0,3778.0,214.965,11.0,3.0,0.018,1721.0,14-11-2024,hyderabad,desktop,data analytics training,2024-11-14,14,11,3,46,False,0.0178,0.044732662784542084,1.2719822485207102,19.542272727272728,0.2727272727272727,0.0007940709370037057,0.0650887573964497,573.6666666666666,7.005954457702417,0.12490703079604881,0,0,0,3
A2288,data analytics course,99.0,3051.0,214.965,18.0,6.0,0.053,1762.0,2024-11-29,hyderabad,mobile,online data analytic,2024-11-29,29,11,4,48,False,0.0606,0.032448377581120944,2.1713636363636364,11.9425,0.3333333333333333,0.0019665683382497543,0.18181818181818182,293.6666666666667,7.196683180982951,0.1220005675368899,0,0,1,5
A2289,data analytics course,170.0,5286.0,190.65,22.0,7.0,0.041,1110.0,2024-11-09,hyderabad,desktop,data analytics online,2024-11-09,9,11,5,45,False,0.0412,0.03216042376087779,1.1214705882352942,8.665909090909091,0.3181818181818182,0.0013242527430949679,0.12941176470588237,158.57142857142858,4.822187254130606,0.17175675675675675,0,0,0,2
A2290,data analytics course,139.0,3533.0,248.96,22.0,4.0,0.047,1606.0,05-11-2024,hyderabad,mobile,data analytics training,2024-05-11,11,5,5,19,True,0.04665,0.03934333427681857,1.7910791366906476,11.316363636363636,0.18181818181818182,0.0011321822813472968,0.15827338129496402,401.5,5.450835475578406,0.1550186799501868,0,0,1,3
A2291,data analytics course,156.0,5125.0,182.15,26.0,10.0,0.064,1658.0,16-11-2024,hyderabad,mobile,data analytics course,2024-11-16,16,11,5,46,False,0.0641,0.0304390243902439,1.1676282051282052,7.005769230769231,0.38461538461538464,0.001951219512195122,0.16666666666666666,165.8,8.102388141641503,0.10986127864897467,0,0,1,1
A2292,data analytics course,91.0,4500.0,241.81,20.0,3.0,0.033,1902.0,2024/11/22,hyderabad,mobile,data analytics online,2024-11-22,22,11,4,47,False,0.033,0.02022222222222222,2.6572527472527474,12.0905,0.15,0.0006666666666666666,0.21978021978021978,634.0,6.8656796658533565,0.12713459516298634,0,0,1,2
A2293,data analytics course,140.0,4633.0,228.65,15.0,4.0,0.049,1738.0,2024/11/20,hyderabad,mobile,data analytics online,2024-11-20,20,11,2,47,True,0.0286,0.0302180012950572,1.6332142857142857,15.243333333333334,0.26666666666666666,0.0008633714655730628,0.10714285714285714,434.5,6.60113710911874,0.13155926352128883,0,0,1,2
A2294,data analytics course,142.0,3155.0,229.01,20.0,10.0,0.053,1955.0,01-11-2024,hyderabad,mobile,learn data analytics,2024-01-11,11,1,3,2,True,0.0704,0.045007923930269415,1.6127464788732393,11.4505,0.5,0.003169572107765452,0.14084507042253522,195.5,7.536745120300424,0.11714066496163682,0,0,1,4
A2295,data analytics course,198.0,3444.0,195.91,27.0,4.0,0.056,1317.0,10-11-2024,hyderabad,desktop,data analytics online,2024-10-11,11,10,4,41,True,0.0202,0.05749128919860627,0.9894444444444445,7.255925925925926,0.14814814814814814,0.0011614401858304297,0.13636363636363635,329.25,5.722474605686284,0.1487547456340167,0,0,0,2
A2296,data analytics course,88.0,4253.0,210.5,23.0,8.0,0.051,1918.0,11-11-2024,hyderabad,tablet,data analytics online,2024-11-11,11,11,0,46,True,0.0909,0.020691276745826475,2.3920454545454546,9.152173913043478,0.34782608695652173,0.0018810251587114979,0.26136363636363635,239.75,8.111638954869358,0.10974973931178311,0,0,2,2
A2297,data analytics course,130.0,4925.0,201.1,26.0,5.0,0.047,1301.0,15-11-2024,hyderabad,tablet,analytics for data,2024-11-15,15,11,4,46,True,0.0385,0.026395939086294416,1.5469230769230768,7.734615384615385,0.19230769230769232,0.0010152284263959391,0.2,260.2,5.469418199900548,0.15457340507302075,0,0,2,0
A2298,data analytics course,186.0,3576.0,213.96,26.0,4.0,0.022,1689.0,02-11-2024,hyderabad,tablet,learn data analytics,2024-02-11,11,2,6,6,False,0.0215,0.05201342281879195,1.1503225806451614,8.22923076923077,0.15384615384615385,0.0011185682326621924,0.13978494623655913,422.25,6.893998878295008,0.1266785079928952,0,0,2,4
A2299,data analytics course,146.0,5831.0,203.07,19.0,5.0,0.055,1216.0,28-11-2024,hyderabad,mobile,analytics for data,2024-11-28,28,11,3,48,True,0.0342,0.025038586863316756,1.390890410958904,10.687894736842106,0.2631578947368421,0.0008574858514834505,0.13013698630136986,243.2,4.988082927069484,0.1669983552631579,0,0,1,0
A2300,data analytics course,199.0,5147.0,203.08,27.0,10.0,0.05,1126.0,30-11-2024,hyderabad,tablet,data analytics course,2024-11-30,30,11,5,48,False,0.0503,0.038663299009131534,1.0205025125628142,7.521481481481482,0.37037037037037035,0.0019428793471925393,0.135678391959799,112.6,4.54461296040969,0.18035523978685614,0,0,2,1
A2301,data analytics course,94.0,4242.0,208.78,14.0,5.0,0.053,1122.0,2024-11-17,hyderabad,tablet,learn data analytics,2024-11-17,17,11,6,46,False,0.0532,0.02215935879302216,2.221063829787234,14.912857142857144,0.35714285714285715,0.0011786892975011788,0.14893617021276595,224.4,4.374077976817703,0.186078431372549,0,0,2,4
A2302,data analytics course,119.0,5530.0,205.75,25.0,9.0,0.047,1725.0,2024-11-14,hyderabad,mobile,analytics for data,2024-11-14,14,11,3,46,True,0.0756,0.021518987341772152,1.7289915966386555,8.23,0.36,0.0016274864376130199,0.21008403361344538,191.66666666666666,7.383961117861483,0.11927536231884057,0,0,1,0
A2303,data analytics course,168.0,4614.0,241.24,28.0,9.0,0.047,1307.0,2024/11/01,hyderabad,mobile,online data analytic,2024-11-01,1,11,4,44,True,0.0536,0.036410923276983094,1.435952380952381,8.615714285714287,0.32142857142857145,0.0019505851755526658,0.16666666666666666,145.22222222222223,4.417841154037473,0.18457536342769704,0,0,1,5
A2304,data analytics course,117.0,5016.0,249.38,10.0,9.0,0.077,1832.0,02-11-2024,hyderabad,tablet,learn data analytics,2024-02-11,11,2,6,6,False,0.0769,0.02332535885167464,2.1314529914529916,24.938,0.9,0.0017942583732057417,0.08547008547008547,203.55555555555554,6.346218622183014,0.1361244541484716,0,0,2,4
A2305,data analytics course,156.0,5072.0,249.37,18.0,3.0,0.058,1701.0,2024/11/12,hyderabad,mobile,learn data analytics,2024-11-12,12,11,1,46,True,0.0192,0.030757097791798107,1.598525641025641,13.85388888888889,0.16666666666666666,0.0005914826498422713,0.11538461538461539,567.0,5.821189397281149,0.14660199882422104,0,0,1,4
A2306,data analytics course,151.0,4805.0,241.95,22.0,3.0,0.056,1571.0,2024-11-03,hyderabad,tablet,online data analytic,2024-11-03,3,11,6,44,True,0.0199,0.03142559833506764,1.6023178807947018,10.997727272727273,0.13636363636363635,0.0006243496357960458,0.1456953642384106,523.6666666666666,5.4930770820417445,0.15401018459579885,0,0,2,5
A2307,data analytics course,133.0,4474.0,198.99,10.0,7.0,0.047,1394.0,2024-11-03,hyderabad,mobile,online data analytic,2024-11-03,3,11,6,44,True,0.04665,0.029727313366115334,1.4961654135338347,19.899,0.7,0.0015645954403218597,0.07518796992481203,199.14285714285714,6.005377154630886,0.1427474892395983,0,0,1,5
A2308,data analytics course,105.0,5151.0,188.18,14.0,9.0,0.032,1595.0,2024-11-03,hyderabad,tablet,online data analytic,2024-11-03,3,11,6,44,True,0.0857,0.0203843913803145,1.7921904761904763,13.441428571428572,0.6428571428571429,0.0017472335468841002,0.13333333333333333,177.22222222222223,7.475927303645445,0.11798119122257053,0,0,2,5
A2309,data analytics course,98.0,4515.0,219.39,12.0,7.0,0.047,1805.0,2024/11/07,hyderabad,desktop,learn data analytics,2024-11-07,7,11,3,45,True,0.0714,0.021705426356589147,2.238673469387755,18.2825,0.5833333333333334,0.0015503875968992248,0.12244897959183673,257.85714285714283,7.227357673549388,0.12154570637119112,0,0,0,4
A2310,data analytics course,93.0,4269.0,247.76,21.0,8.0,0.086,1543.0,19-11-2024,hyderabad,tablet,learn data analytics,2024-11-19,19,11,1,47,False,0.086,0.02178496134926212,2.6640860215053763,11.798095238095238,0.38095238095238093,0.0018739751698289998,0.22580645161290322,192.875,5.2278010978366165,0.1605703175631886,0,0,2,4
A2311,data analytics course,165.0,3759.0,231.62,23.0,7.0,0.047,1052.0,2024/11/28,hyderabad,mobile,analytics for data,2024-11-28,28,11,3,48,True,0.04665,0.04389465283320032,1.4037575757575758,10.070434782608697,0.30434782608695654,0.00186219739292365,0.1393939393939394,150.28571428571428,3.5419221138070975,0.22017110266159695,0,0,1,0
A2312,data analytics course,156.0,4476.0,186.68,17.0,10.0,0.033,1372.0,2024/11/13,hyderabad,tablet,analytics for data,2024-11-13,13,11,2,46,True,0.0641,0.03485254691689008,1.1966666666666668,10.981176470588236,0.5882352941176471,0.002234137622877569,0.10897435897435898,137.2,6.349475037497321,0.13606413994169098,0,0,2,0
A2313,data analytics course,166.0,5749.0,236.52,11.0,5.0,0.036,1780.0,2024/11/15,hyderabad,desktop,analytics for data,2024-11-15,15,11,4,46,False,0.0301,0.028874586884675597,1.4248192771084338,21.501818181818184,0.45454545454545453,0.0008697164724299878,0.06626506024096386,356.0,6.525790630813462,0.13287640449438204,0,0,0,0
A2314,data analytics course,134.0,5166.0,191.92,10.0,3.0,0.037,1526.0,2024/11/04,hyderabad,mobile,learn data analytics,2024-11-04,4,11,0,45,True,0.0224,0.025938830816879598,1.4322388059701492,19.192,0.3,0.0005807200929152149,0.07462686567164178,508.6666666666667,6.951229679032931,0.1257667103538663,0,0,1,4
A2315,data analytics course,103.0,3687.0,194.73,27.0,4.0,0.047,1347.0,2024/11/15,hyderabad,tablet,learn data analytics,2024-11-15,15,11,4,46,True,0.0388,0.027935991320857067,1.8905825242718446,7.212222222222222,0.14814814814814814,0.0010848928668294006,0.2621359223300971,336.75,5.917270066245571,0.14456570155902004,0,0,2,4
A2316,data analytics course,95.0,4939.0,219.43,26.0,3.0,0.032,1785.0,07-11-2024,hyderabad,mobile,data analytics training,2024-07-11,11,7,3,28,False,0.0316,0.019234662887224134,2.3097894736842104,8.439615384615385,0.11538461538461539,0.0006074104069649726,0.2736842105263158,595.0,7.134712664631089,0.12292997198879552,0,0,1,3
A2317,data analytics course,155.0,3180.0,229.63,15.0,8.0,0.052,1832.0,15-11-2024,hyderabad,desktop,data analytics course,2024-11-15,15,11,4,46,False,0.0516,0.04874213836477988,1.4814838709677418,15.308666666666666,0.5333333333333333,0.0025157232704402514,0.0967741935483871,229.0,6.978051648303793,0.12534388646288208,0,0,0,1
A2318,data analytics course,184.0,3981.0,193.25,16.0,3.0,0.035,1359.0,30-11-2024,hyderabad,tablet,learn data analytics,2024-11-30,30,11,5,48,True,0.0163,0.046219542828435066,1.0502717391304348,12.078125,0.1875,0.0007535795026375283,0.08695652173913043,453.0,6.032341526520052,0.14220014716703458,0,0,2,4
A2319,data analytics course,186.0,3392.0,218.16,29.0,7.0,0.038,1012.0,08-11-2024,hyderabad,desktop,analytics for data,2024-08-11,11,8,6,32,False,0.0376,0.05483490566037736,1.1729032258064516,7.522758620689655,0.2413793103448276,0.002063679245283019,0.15591397849462366,144.57142857142858,3.638797213054639,0.21557312252964428,0,0,0,0
A2320,data analytics course,93.0,3160.0,220.75,30.0,8.0,0.086,1472.0,2024/11/08,hyderabad,desktop,data analytics online,2024-11-08,8,11,4,45,False,0.086,0.029430379746835444,2.3736559139784945,7.358333333333333,0.26666666666666666,0.002531645569620253,0.3225806451612903,184.0,5.668176670441676,0.14996603260869565,0,0,0,2
A2321,data analytics course,138.0,4699.0,202.54,26.0,9.0,0.065,1133.0,2024-11-25,hyderabad,tablet,online data analytic,2024-11-25,25,11,0,48,False,0.0652,0.029367950627793148,1.4676811594202899,7.79,0.34615384615384615,0.001915301127899553,0.18840579710144928,125.88888888888889,4.593956749284092,0.17876434245366282,0,0,2,5
A2322,data analytics course,96.0,3730.0,217.61,16.0,4.0,0.042,1283.0,2024-11-07,hyderabad,desktop,analytics for data,2024-11-07,7,11,3,45,False,0.0417,0.025737265415549597,2.2667708333333336,13.600625,0.25,0.0010723860589812334,0.16666666666666666,320.75,4.895868756031431,0.16961028838659392,0,0,0,0
A2323,data analytics course,127.0,5221.0,226.67,17.0,3.0,0.047,1384.0,2024-11-03,hyderabad,tablet,data analytics training,2024-11-03,3,11,6,44,True,0.0236,0.024324841984294198,1.784803149606299,13.333529411764705,0.17647058823529413,0.0005746025665581306,0.13385826771653545,461.3333333333333,5.1057925618740905,0.16377890173410403,0,0,2,3
A2324,data analytics course,92.0,3299.0,188.58,11.0,9.0,0.098,1678.0,2024-11-27,hyderabad,desktop,data analytics online,2024-11-27,27,11,2,48,False,0.0978,0.027887238557138528,2.049782608695652,17.143636363636364,0.8181818181818182,0.002728099424067899,0.11956521739130435,186.44444444444446,7.89808039028529,0.11238379022646008,0,0,0,2
A2325,data analytics course,156.0,5634.0,247.45,16.0,5.0,0.032,1925.0,08-11-2024,hyderabad,tablet,data analytics course,2024-08-11,11,8,6,32,False,0.0321,0.027689030883919063,1.5862179487179486,15.465625,0.3125,0.0008874689385871495,0.10256410256410256,385.0,6.779349363507779,0.12854545454545455,0,0,2,1
A2326,data analytics course,113.0,5991.0,211.28,16.0,3.0,0.027,1499.0,16-11-2024,hyderabad,tablet,learn data analytics,2024-11-16,16,11,5,46,False,0.0265,0.01886162577199132,1.8697345132743364,13.205,0.1875,0.000500751126690035,0.1415929203539823,499.6666666666667,6.094850435441121,0.1409472981987992,0,0,2,4
A2327,data analytics course,84.0,3917.0,233.19,13.0,10.0,0.049,1507.0,2024/11/11,hyderabad,desktop,data analytics course,2024-11-11,11,11,0,46,True,0.119,0.021444983405667604,2.7760714285714285,17.93769230769231,0.7692307692307693,0.0025529742149604288,0.15476190476190477,150.7,5.462541275354861,0.1547378898473789,0,0,0,1
A2328,data analytics course,189.0,5335.0,181.46,27.0,9.0,0.048,1734.0,08-11-2024,hyderabad,mobile,online data analytic,2024-08-11,11,8,6,32,False,0.0476,0.03542642924086223,0.9601058201058201,6.720740740740741,0.3333333333333333,0.0016869728209934396,0.14285714285714285,192.66666666666666,8.555824975201146,0.1046482122260669,0,0,1,5
A2329,data analytics course,149.0,4550.0,219.44,11.0,9.0,0.06,1659.0,2024/11/16,hyderabad,tablet,online data analytic,2024-11-16,16,11,5,46,False,0.0604,0.03274725274725275,1.472751677852349,19.94909090909091,0.8181818181818182,0.001978021978021978,0.0738255033557047,184.33333333333334,6.560153117025155,0.1322724532851115,0,0,2,5
A2330,data analytics course,100.0,5805.0,181.27,15.0,4.0,0.04,1195.0,04-11-2024,hyderabad,desktop,learn data analytics,2024-04-11,11,4,3,15,False,0.04,0.017226528854435832,1.8127000000000002,12.084666666666667,0.26666666666666666,0.0006890611541774332,0.15,298.75,5.592376013681249,0.15169037656903767,0,0,0,4
A2331,data analytics course,105.0,5156.0,201.01,25.0,10.0,0.047,1472.0,2024-11-11,hyderabad,desktop,analytics for data,2024-11-11,11,11,0,46,True,0.0952,0.020364623739332816,1.9143809523809523,8.0404,0.4,0.001939487975174554,0.23809523809523808,147.2,6.323018755285807,0.13655570652173912,0,0,0,0
A2332,data analytics course,86.0,5060.0,249.4,15.0,4.0,0.047,1761.0,15-11-2024,hyderabad,tablet,data analytics online,2024-11-15,15,11,4,46,False,0.0465,0.01699604743083004,2.9,16.62666666666667,0.26666666666666666,0.0007905138339920949,0.1744186046511628,440.25,6.060946271050521,0.14162407722884726,0,0,2,2
A2333,data analytics course,93.0,5178.0,245.13,14.0,5.0,0.054,1080.0,2024/11/08,hyderabad,mobile,data analytics online,2024-11-08,8,11,4,45,False,0.0538,0.017960602549246814,2.635806451612903,17.509285714285713,0.35714285714285715,0.0009656237929702588,0.15053763440860216,216.0,3.4058254803573615,0.22697222222222221,0,0,1,2
A2334,data analytics course,180.0,3076.0,227.91,12.0,10.0,0.056,1507.0,05-11-2024,hyderabad,desktop,online data analytic,2024-05-11,11,5,5,19,False,0.0556,0.05851755526657997,1.2661666666666667,18.9925,0.8333333333333334,0.003250975292587776,0.06666666666666667,150.7,5.6122592251327275,0.1512342402123424,0,0,0,5
A2335,data analytics course,156.0,3218.0,235.69,28.0,6.0,0.038,1289.0,2024-11-16,hyderabad,tablet,data analytics online,2024-11-16,16,11,5,46,False,0.0385,0.048477315102548164,1.5108333333333333,8.4175,0.21428571428571427,0.0018645121193287756,0.1794871794871795,214.83333333333334,4.469048326191183,0.18284716834755624,0,0,2,2
A2336,data analytics course,124.0,4682.0,207.53,20.0,3.0,0.033,1550.0,2024/11/03,hyderabad,tablet,online data analytic,2024-11-03,3,11,6,44,False,0.0242,0.02648440837249039,1.6736290322580645,10.3765,0.15,0.0006407518154634772,0.16129032258064516,516.6666666666666,6.468799691610852,0.13389032258064515,0,0,2,5
A2337,data analytics course,177.0,3592.0,205.25,29.0,9.0,0.051,1271.0,2024-11-15,hyderabad,desktop,data analytics training,2024-11-15,15,11,4,46,False,0.0508,0.04927616926503341,1.1596045197740112,7.077586206896552,0.3103448275862069,0.0025055679287305124,0.1638418079096045,141.22222222222223,5.192448233861145,0.16148701809598742,0,0,0,3
A2338,data analytics course,156.0,3506.0,242.9,13.0,7.0,0.047,1208.0,2024/11/01,hyderabad,desktop,analytics for data,2024-11-01,1,11,4,44,True,0.04665,0.04449515116942385,1.557051282051282,18.684615384615384,0.5384615384615384,0.0019965772960638907,0.08333333333333333,172.57142857142858,3.973240016467682,0.20107615894039735,0,0,0,0
A2339,data analytics course,132.0,3562.0,238.34,23.0,4.0,0.03,1033.0,29-11-2024,hyderabad,tablet,data analytics course,2024-11-29,29,11,4,48,False,0.0303,0.03705783267827063,1.8056060606060607,10.362608695652174,0.17391304347826086,0.0011229646266142617,0.17424242424242425,258.25,3.3341444994545606,0.23072604065827687,0,0,2,1
A2340,data analytics course,178.0,4520.0,203.6,12.0,3.0,0.017,1155.0,2024-11-02,hyderabad,tablet,analytics for data,2024-11-02,2,11,5,44,False,0.0169,0.03938053097345133,1.1438202247191012,16.966666666666665,0.25,0.000663716814159292,0.06741573033707865,385.0,4.672888015717092,0.17627705627705628,0,0,2,0
A2341,data analytics course,153.0,3953.0,237.56,20.0,6.0,0.053,1388.0,26-11-2024,hyderabad,tablet,learn data analytics,2024-11-26,26,11,1,48,True,0.0392,0.038704781178851504,1.5526797385620916,11.878,0.3,0.0015178345560333923,0.13071895424836602,231.33333333333334,4.842734467082001,0.1711527377521614,0,0,2,4
A2342,data analytics course,187.0,4891.0,223.99,14.0,8.0,0.043,1014.0,2024/11/26,hyderabad,mobile,online data analytic,2024-11-26,26,11,1,48,False,0.0428,0.03823349008382744,1.197807486631016,15.999285714285715,0.5714285714285714,0.001635657329789409,0.0748663101604278,126.75,3.5269878119558906,0.2208974358974359,0,0,1,5
A2343,data analytics course,155.0,4976.0,183.21,10.0,5.0,0.053,1554.0,13-11-2024,hyderabad,tablet,online data analytic,2024-11-13,13,11,2,46,True,0.0323,0.03114951768488746,1.1820000000000002,18.321,0.5,0.0010048231511254019,0.06451612903225806,310.8,7.482069756017684,0.1178957528957529,0,0,2,5
A2344,data analytics course,90.0,5781.0,200.71,28.0,5.0,0.046,1507.0,07-11-2024,hyderabad,mobile,data analytics online,2024-07-11,11,7,3,28,False,0.0556,0.015568240788790867,2.2301111111111114,7.168214285714286,0.17857142857142858,0.0008649022660439371,0.3111111111111111,301.4,6.508345373922574,0.13318513603185136,0,0,1,2
A2345,data analytics course,172.0,3001.0,210.62,14.0,4.0,0.023,1192.0,2024/11/25,hyderabad,tablet,data analytics online,2024-11-25,25,11,0,48,False,0.0233,0.05731422859046984,1.2245348837209302,15.044285714285715,0.2857142857142857,0.0013328890369876708,0.08139534883720931,298.0,4.65948153071883,0.17669463087248322,0,0,2,2
A2346,data analytics course,92.0,5728.0,224.5,14.0,9.0,0.098,1876.0,26-11-2024,hyderabad,tablet,online data analytic,2024-11-26,26,11,1,48,False,0.0978,0.01606145251396648,2.4402173913043477,16.035714285714285,0.6428571428571429,0.0015712290502793297,0.15217391304347827,208.44444444444446,7.356347438752784,0.11966950959488273,0,0,2,5
A2347,data analytics course,162.0,5103.0,188.15,13.0,9.0,0.056,1264.0,2024-11-28,hyderabad,mobile,analytics for data,2024-11-28,28,11,3,48,False,0.0556,0.031746031746031744,1.1614197530864199,14.473076923076924,0.6923076923076923,0.001763668430335097,0.08024691358024691,140.44444444444446,5.718044113739038,0.14885284810126584,0,0,1,0
A2348,data analytics course,193.0,3131.0,198.1,22.0,5.0,0.035,1870.0,2024/11/19,hyderabad,tablet,data analytics course,2024-11-19,19,11,1,47,False,0.0259,0.06164164803577132,1.0264248704663212,9.004545454545454,0.22727272727272727,0.0015969338869370809,0.11398963730569948,374.0,8.439676930843008,0.10593582887700534,0,0,2,1
A2349,data analytics course,139.0,3547.0,238.34,13.0,5.0,0.047,1130.0,2024/11/02,hyderabad,desktop,data analytics online,2024-11-02,2,11,5,44,True,0.04665,0.03918804623625599,1.7146762589928057,18.333846153846153,0.38461538461538464,0.00140964195094446,0.09352517985611511,226.0,3.7411261223462278,0.21092035398230088,0,0,0,2
A2350,data analytics course,185.0,4070.0,200.95,21.0,5.0,0.027,1503.0,2024-11-07,hyderabad,mobile,online data analytic,2024-11-07,7,11,3,45,False,0.027,0.045454545454545456,1.0862162162162161,9.569047619047618,0.23809523809523808,0.0012285012285012285,0.11351351351351352,300.6,6.479472505598408,0.13369926813040584,0,0,1,5
A2351,data analytics course,117.0,3350.0,243.68,23.0,5.0,0.056,1204.0,2024/11/14,hyderabad,desktop,analytics for data,2024-11-14,14,11,3,46,True,0.0427,0.03492537313432836,2.0827350427350426,10.594782608695652,0.21739130434782608,0.0014925373134328358,0.19658119658119658,240.8,3.9409061063690083,0.2023920265780731,0,0,0,0
A2352,data analytics course,123.0,4976.0,244.49,14.0,4.0,0.033,1579.0,2024/11/02,hyderabad,desktop,analytics for data,2024-11-02,2,11,5,44,False,0.0325,0.024718649517684887,1.9877235772357724,17.46357142857143,0.2857142857142857,0.0008038585209003215,0.11382113821138211,394.75,5.458341854472575,0.1548385053831539,0,0,0,0
A2353,data analytics course,181.0,5612.0,203.66,17.0,3.0,0.017,1507.0,07-11-2024,hyderabad,tablet,data analytics training,2024-07-11,11,7,3,28,False,0.0166,0.03225231646471846,1.125193370165746,11.98,0.17647058823529413,0.0005345687811831789,0.09392265193370165,502.3333333333333,6.3995875478739075,0.13514266755142668,0,0,2,3
A2354,data analytics course,118.0,4390.0,214.04,24.0,8.0,0.068,1071.0,2024/11/18,hyderabad,tablet,analytics for data,2024-11-18,18,11,0,47,False,0.0678,0.026879271070615034,1.8138983050847457,8.918333333333333,0.3333333333333333,0.0018223234624145787,0.2033898305084746,133.875,4.0037376191366105,0.19985060690943043,0,0,2,0
A2355,data analytics course,82.0,3698.0,229.12,30.0,9.0,0.11,1246.0,2024/11/20,hyderabad,mobile,learn data analytics,2024-11-20,20,11,2,47,False,0.1098,0.022174148188209845,2.794146341463415,7.637333333333333,0.3,0.0024337479718766902,0.36585365853658536,138.44444444444446,4.438198324022347,0.183884430176565,0,0,1,4
A2356,data analytics course,175.0,4295.0,195.17,18.0,6.0,0.047,1939.0,27-11-2024,hyderabad,tablet,data analytics online,2024-11-27,27,11,2,48,True,0.0343,0.04074505238649592,1.1152571428571427,10.842777777777776,0.3333333333333333,0.0013969732246798604,0.10285714285714286,323.1666666666667,8.934928523851001,0.1006549767921609,0,0,2,2
A2357,data analytics course,130.0,3332.0,202.06,14.0,5.0,0.038,1184.0,2024-11-14,hyderabad,desktop,online data analytic,2024-11-14,14,11,3,46,False,0.0385,0.039015606242496996,1.5543076923076924,14.432857142857143,0.35714285714285715,0.0015006002400960385,0.1076923076923077,236.8,4.859645649806988,0.1706587837837838,0,0,0,5
A2358,data analytics course,92.0,4082.0,186.29,25.0,5.0,0.054,1046.0,2024-11-24,hyderabad,tablet,online data analytic,2024-11-24,24,11,6,47,False,0.0543,0.02253797158255757,2.024891304347826,7.4516,0.2,0.001224889759921607,0.2717391304347826,209.2,4.614901497664931,0.17809751434034415,0,0,2,5
A2359,data analytics course,159.0,4464.0,204.86,27.0,3.0,0.047,1963.0,20-11-2024,hyderabad,tablet,analytics for data,2024-11-20,20,11,2,47,True,0.0189,0.035618279569892476,1.288427672955975,7.587407407407408,0.1111111111111111,0.0006720430107526882,0.16981132075471697,654.3333333333334,8.582153665918186,0.10436067244014265,0,0,2,0
A2360,data analytics course,193.0,5263.0,240.5,18.0,6.0,0.054,1670.0,2024-11-21,hyderabad,tablet,online data analytic,2024-11-21,21,11,3,47,True,0.0311,0.03667110013300399,1.2461139896373057,13.36111111111111,0.3333333333333333,0.0011400342010260307,0.09326424870466321,278.3333333333333,5.943866943866944,0.1440119760479042,0,0,2,5
A2361,data analytics course,98.0,4371.0,246.23,25.0,7.0,0.071,1114.0,2024/11/14,hyderabad,tablet,analytics for data,2024-11-14,14,11,3,46,False,0.0714,0.022420498741706704,2.5125510204081634,9.8492,0.28,0.001601464195836193,0.25510204081632654,159.14285714285714,3.524225317792308,0.22103231597845602,0,0,2,0
A2362,data analytics course,176.0,3657.0,209.44,19.0,3.0,0.017,1171.0,2024/11/07,hyderabad,desktop,online data analytic,2024-11-07,7,11,3,45,False,0.017,0.04812687995624829,1.19,11.023157894736842,0.15789473684210525,0.0008203445447087777,0.10795454545454546,390.3333333333333,4.591100076394194,0.17885567890691717,0,0,0,5
A2363,data analytics course,182.0,5833.0,243.72,20.0,5.0,0.027,1206.0,14-11-2024,hyderabad,desktop,data analytics course,2024-11-14,14,11,3,46,False,0.0275,0.03120178295902623,1.339120879120879,12.186,0.25,0.0008571918395336877,0.10989010989010989,241.2,3.9483013293943867,0.20208955223880598,0,0,0,1
A2364,data analytics course,85.0,3077.0,200.16,11.0,10.0,0.118,1876.0,2024-11-23,hyderabad,mobile,analytics for data,2024-11-23,23,11,5,47,False,0.1176,0.027624309392265192,2.3548235294117648,18.196363636363635,0.9090909090909091,0.003249918752031199,0.12941176470588237,187.6,8.372501998401278,0.10669509594882728,0,0,1,0
A2365,data analytics course,98.0,3646.0,239.05,14.0,6.0,0.034,1586.0,14-11-2024,hyderabad,desktop,data analytics course,2024-11-14,14,11,3,46,True,0.0612,0.026878771256171146,2.4392857142857145,17.075,0.42857142857142855,0.0016456390565002743,0.14285714285714285,264.3333333333333,5.6345952729554485,0.1507250945775536,0,0,0,1
A2366,data analytics course,160.0,3139.0,230.55,28.0,5.0,0.031,1449.0,15-11-2024,hyderabad,desktop,analytics for data,2024-11-15,15,11,4,46,False,0.0312,0.05097164702134438,1.4409375,8.233928571428573,0.17857142857142858,0.0015928639694170119,0.175,289.8,5.284970722186077,0.1591097308488613,0,0,0,0
A2367,data analytics course,179.0,4005.0,232.47,16.0,10.0,0.056,1553.0,2024/11/24,hyderabad,desktop,analytics for data,2024-11-24,24,11,6,47,False,0.0559,0.04469413233458177,1.2987150837988828,14.529375,0.625,0.0024968789013732834,0.0893854748603352,155.3,5.680431883683916,0.1496909207984546,0,0,0,0
A2368,data analytics course,139.0,4315.0,196.3,24.0,5.0,0.047,1364.0,2024-11-26,hyderabad,mobile,data analytics course,2024-11-26,26,11,1,48,True,0.04665,0.03221320973348783,1.4122302158273383,8.179166666666667,0.20833333333333334,0.0011587485515643105,0.17266187050359713,272.8,5.948548140601121,0.1439149560117302,0,0,1,1
A2369,data analytics course,195.0,3876.0,187.59,28.0,3.0,0.047,1828.0,21-11-2024,hyderabad,mobile,data analytics course,2024-11-21,21,11,3,47,True,0.0154,0.05030959752321981,0.962,6.699642857142857,0.10714285714285714,0.0007739938080495357,0.14358974358974358,609.3333333333334,8.744655898502053,0.10262035010940919,0,0,1,1
A2370,data analytics course,197.0,3174.0,214.965,22.0,7.0,0.036,1527.0,2024-11-14,hyderabad,tablet,data analytics online,2024-11-14,14,11,3,46,False,0.0355,0.06206679269061122,1.0911928934010153,9.771136363636364,0.3181818181818182,0.002205419029615627,0.1116751269035533,218.14285714285714,6.10348196217989,0.14077603143418468,0,0,2,2
A2371,data analytics course,92.0,5550.0,226.38,28.0,8.0,0.087,1322.0,21-11-2024,hyderabad,tablet,learn data analytics,2024-11-21,21,11,3,47,False,0.087,0.016576576576576577,2.4606521739130436,8.084999999999999,0.2857142857142857,0.0014414414414414415,0.30434782608695654,165.25,4.839738492799717,0.17124054462934946,0,0,2,4
A2372,data analytics course,90.0,3526.0,211.39,10.0,3.0,0.037,1395.0,2024-11-20,hyderabad,desktop,online data analytic,2024-11-20,20,11,2,47,False,0.0333,0.025524673851389675,2.3487777777777774,21.139,0.3,0.0008508224617129892,0.1111111111111111,465.0,5.599176876862672,0.15153405017921145,0,0,0,5
A2373,data analytics course,149.0,3192.0,214.965,20.0,4.0,0.038,1708.0,2024-11-14,hyderabad,tablet,online data analytic,2024-11-14,14,11,3,46,True,0.0268,0.046679197994987466,1.4427181208053692,10.74825,0.2,0.0012531328320802004,0.1342281879194631,427.0,6.945479496662248,0.12585772833723655,0,0,2,5
A2374,data analytics course,82.0,4132.0,247.13,11.0,6.0,0.073,1091.0,2024/11/12,hyderabad,tablet,data analytics training,2024-11-12,12,11,1,46,False,0.0732,0.01984511132623427,3.013780487804878,22.466363636363635,0.5454545454545454,0.001452081316553727,0.13414634146341464,181.83333333333334,3.4146805325132523,0.22651695692025664,0,0,2,3
A2375,data analytics course,151.0,5826.0,226.53,16.0,8.0,0.053,1511.0,2024/11/25,hyderabad,desktop,learn data analytics,2024-11-25,25,11,0,48,False,0.053,0.025918297288019223,1.5001986754966887,14.158125,0.5,0.0013731548232063166,0.10596026490066225,188.875,5.670198207742904,0.1499205823957644,0,0,0,4
A2376,data analytics course,162.0,5997.0,240.29,20.0,5.0,0.035,1144.0,24-11-2024,hyderabad,mobile,data analytics online,2024-11-24,24,11,6,47,False,0.0309,0.027013506753376687,1.4832716049382715,12.0145,0.25,0.0008337502084375521,0.12345679012345678,228.8,3.7609138957093515,0.21004370629370628,0,0,1,2
A2377,data analytics course,197.0,4541.0,243.81,19.0,9.0,0.057,1701.0,11-11-2024,hyderabad,desktop,data analytics training,2024-11-11,11,11,0,46,True,0.0457,0.043382514864567276,1.2376142131979695,12.832105263157894,0.47368421052631576,0.001981942303457388,0.09644670050761421,189.0,5.976744186046512,0.14333333333333334,0,0,0,3
A2378,data analytics course,133.0,4642.0,184.52,22.0,4.0,0.032,1074.0,2024/11/14,hyderabad,desktop,online data analytic,2024-11-14,14,11,3,46,False,0.0301,0.02865144334338647,1.3873684210526316,8.387272727272729,0.18181818181818182,0.0008616975441619991,0.16541353383458646,268.5,4.82050726208541,0.17180633147113594,0,0,0,5
A2379,data analytics course,194.0,5509.0,235.45,18.0,5.0,0.047,1025.0,2024-11-12,hyderabad,tablet,online data analytic,2024-11-12,12,11,1,46,True,0.0258,0.03521510255944817,1.213659793814433,13.080555555555556,0.2777777777777778,0.0009076057360682519,0.09278350515463918,205.0,3.3533658950945,0.2297073170731707,0,0,2,5
A2380,data analytics course,169.0,3647.0,194.12,12.0,6.0,0.036,1697.0,2024/11/22,hyderabad,desktop,learn data analytics,2024-11-22,22,11,4,47,False,0.0355,0.046339457088017545,1.148639053254438,16.176666666666666,0.5,0.0016451878256100905,0.07100591715976332,282.8333333333333,7.742015248300021,0.11439010017678256,0,0,0,4
A2381,data analytics course,149.0,5209.0,183.91,18.0,10.0,0.047,1799.0,29-11-2024,hyderabad,desktop,learn data analytics,2024-11-29,29,11,4,48,True,0.0671,0.028604338644653483,1.2342953020134229,10.217222222222222,0.5555555555555556,0.001919754271453254,0.12080536912751678,179.9,8.781958566690228,0.1022290161200667,0,0,0,4
A2382,data analytics course,124.0,5980.0,200.65,25.0,4.0,0.032,1768.0,2024/11/04,hyderabad,desktop,learn data analytics,2024-11-04,4,11,0,45,False,0.0323,0.02073578595317726,1.6181451612903226,8.026,0.16,0.0006688963210702341,0.20161290322580644,442.0,7.811363070022426,0.11348981900452489,0,0,0,4
A2383,data analytics course,170.0,5443.0,235.99,23.0,5.0,0.047,1314.0,21-11-2024,hyderabad,mobile,analytics for data,2024-11-21,21,11,3,47,True,0.0294,0.031232776042623554,1.3881764705882353,10.260434782608696,0.21739130434782608,0.0009186110600771634,0.13529411764705881,262.8,4.568032543751854,0.1795966514459665,0,0,1,0
A2384,data analytics course,127.0,5326.0,226.11,18.0,10.0,0.04,1040.0,21-11-2024,hyderabad,mobile,online data analytic,2024-11-21,21,11,3,47,True,0.0787,0.023845287269996244,1.7803937007874018,12.561666666666667,0.5555555555555556,0.001877581674802854,0.14173228346456693,104.0,3.599531201627526,0.21741346153846156,0,0,1,5
A2385,data analytics course,114.0,5565.0,210.04,16.0,4.0,0.035,1800.0,2024/11/07,hyderabad,desktop,data analytics training,2024-11-07,7,11,3,45,False,0.0351,0.020485175202156335,1.842456140350877,13.1275,0.25,0.0007187780772686433,0.14035087719298245,450.0,7.5697962292896595,0.11668888888888888,0,0,0,3
A2386,data analytics course,154.0,3312.0,203.23,16.0,5.0,0.042,1977.0,2024-11-04,hyderabad,desktop,data analytics training,2024-11-04,4,11,0,45,False,0.0325,0.0464975845410628,1.3196753246753246,12.701875,0.3125,0.0015096618357487923,0.1038961038961039,395.4,8.727894503764208,0.10279716742539201,0,0,0,3
A2387,data analytics course,139.0,4369.0,225.53,28.0,4.0,0.047,1241.0,2024/11/23,hyderabad,tablet,data analytics online,2024-11-23,23,11,5,47,True,0.04665,0.03181506065461204,1.6225179856115108,8.054642857142857,0.14285714285714285,0.0009155413138017853,0.2014388489208633,310.25,4.502593889948122,0.1817324738114424,0,0,2,2
A2388,data analytics course,126.0,3570.0,214.78,28.0,9.0,0.071,1078.0,12-11-2024,hyderabad,tablet,data analytics training,2024-12-11,11,12,2,50,False,0.0714,0.03529411764705882,1.7046031746031747,7.670714285714285,0.32142857142857145,0.0025210084033613447,0.2222222222222222,119.77777777777777,4.019089300679766,0.19923933209647496,0,0,2,3
A2389,data analytics course,139.0,3883.0,225.89,23.0,5.0,0.047,1183.0,21-11-2024,hyderabad,mobile,online data analytic,2024-11-21,21,11,3,47,True,0.04665,0.03579706412567602,1.6251079136690647,9.821304347826086,0.21739130434782608,0.0012876641771825909,0.16546762589928057,236.6,4.237062286953828,0.19094674556213018,0,0,1,5
A2390,data analytics course,125.0,5736.0,197.28,30.0,5.0,0.04,1265.0,18-11-2024,hyderabad,mobile,analytics for data,2024-11-18,18,11,0,47,False,0.04,0.02179218967921897,1.57824,6.576,0.16666666666666666,0.0008716875871687587,0.24,253.0,5.41220600162206,0.15595256916996048,0,0,1,0
A2391,data analytics course,197.0,5921.0,214.97,18.0,6.0,0.03,1975.0,2024-11-14,hyderabad,desktop,learn data analytics,2024-11-14,14,11,3,46,False,0.0305,0.03327140685694984,1.0912182741116752,11.942777777777778,0.3333333333333333,0.0010133423408208073,0.09137055837563451,329.1666666666667,8.187328464436899,0.10884556962025316,0,0,0,4
A2392,data analytics course,98.0,3687.0,206.7,12.0,10.0,0.047,1640.0,2024/11/07,hyderabad,mobile,online data analytic,2024-11-07,7,11,3,45,True,0.102,0.026579875237320316,2.1091836734693876,17.224999999999998,0.8333333333333334,0.0027122321670735015,0.12244897959183673,164.0,6.934204160619255,0.12603658536585366,0,0,1,5
A2393,data analytics course,164.0,5334.0,203.91,18.0,6.0,0.057,1128.0,18-11-2024,hyderabad,desktop,data analytics course,2024-11-18,18,11,0,47,True,0.0366,0.0307461567304087,1.2433536585365854,11.328333333333333,0.3333333333333333,0.0011248593925759281,0.10975609756097561,188.0,4.531852287774019,0.18077127659574468,0,0,0,1
A2394,data analytics course,111.0,4647.0,247.0,15.0,4.0,0.047,1601.0,2024-11-29,hyderabad,desktop,learn data analytics,2024-11-29,29,11,4,48,True,0.036,0.023886378308586184,2.225225225225225,16.466666666666665,0.26666666666666666,0.0008607703894986013,0.13513513513513514,400.25,5.481781376518219,0.15427857589006871,0,0,0,4
A2395,data analytics course,191.0,3485.0,212.43,10.0,7.0,0.047,1813.0,28-11-2024,hyderabad,mobile,analytics for data,2024-11-28,28,11,3,48,True,0.0366,0.054806312769010046,1.1121989528795813,21.243000000000002,0.7,0.0020086083213773313,0.05235602094240838,259.0,7.534576095655039,0.11717043574186432,0,0,1,0
A2396,data analytics course,149.0,5720.0,211.54,14.0,5.0,0.034,1612.0,2024/11/29,hyderabad,desktop,data analytics course,2024-11-29,29,11,4,48,False,0.0336,0.02604895104895105,1.419731543624161,15.11,0.35714285714285715,0.0008741258741258741,0.09395973154362416,322.4,6.620308215940248,0.13122828784119106,0,0,0,1
A2397,data analytics course,183.0,3540.0,222.14,15.0,3.0,0.016,1248.0,2024/11/11,hyderabad,mobile,learn data analytics,2024-11-11,11,11,0,46,False,0.0164,0.051694915254237285,1.213879781420765,14.809333333333333,0.2,0.000847457627118644,0.08196721311475409,416.0,4.618078689114974,0.17799679487179487,0,0,1,4
A2398,data analytics course,198.0,4035.0,215.94,22.0,8.0,0.047,1507.0,10-11-2024,hyderabad,mobile,learn data analytics,2024-10-11,11,10,4,41,True,0.0404,0.04907063197026022,1.0906060606060606,9.815454545454545,0.36363636363636365,0.001982651796778191,0.1111111111111111,188.375,5.978790404742058,0.14329130723291308,0,0,1,4
A2399,data analytics course,170.0,3024.0,234.76,11.0,10.0,0.047,1941.0,06-11-2024,hyderabad,mobile,learn data analytics,2024-06-11,11,6,1,24,True,0.0588,0.056216931216931214,1.3809411764705881,21.34181818181818,0.9090909090909091,0.0033068783068783067,0.06470588235294118,194.1,7.268018401772022,0.1209479649665121,0,0,1,4
A2400,data analytics course,174.0,4334.0,186.29,12.0,4.0,0.023,1457.0,2024-11-22,hyderabad,mobile,analytics for data,2024-11-22,22,11,4,47,False,0.023,0.04014766958929396,1.070632183908046,15.524166666666666,0.3333333333333333,0.0009229349330872173,0.06896551724137931,364.25,6.821139084223523,0.1278586135895676,0,0,1,0
A2401,data analytics course,91.0,4038.0,197.15,23.0,6.0,0.066,1000.0,2024-11-29,hyderabad,mobile,data analytics online,2024-11-29,29,11,4,48,False,0.0659,0.022535908865775136,2.1664835164835163,8.571739130434782,0.2608695652173913,0.0014858841010401188,0.25274725274725274,166.66666666666666,4.07227998985544,0.19715,0,0,1,2
A2402,data analytics course,197.0,4347.0,215.2,20.0,6.0,0.047,1204.0,2024/11/26,hyderabad,desktop,online data analytic,2024-11-26,26,11,1,48,True,0.0305,0.04531861053600184,1.0923857868020304,10.76,0.3,0.0013802622498274672,0.10152284263959391,200.66666666666666,4.594795539033457,0.1787375415282392,0,0,0,5
A2403,data analytics course,139.0,5803.0,203.03,16.0,8.0,0.034,1397.0,2024-11-30,hyderabad,mobile,analytics for data,2024-11-30,30,11,5,48,True,0.04665,0.023953127692572806,1.4606474820143884,12.689375,0.5,0.0013785972772703773,0.11510791366906475,174.625,5.880756538442594,0.1453328561202577,0,0,1,0
A2404,data analytics course,152.0,4182.0,233.45,19.0,5.0,0.033,1719.0,2024/11/13,hyderabad,mobile,data analytics course,2024-11-13,13,11,2,46,False,0.0329,0.03634624581539933,1.5358552631578946,12.286842105263156,0.2631578947368421,0.0011956001912960307,0.125,343.8,6.363461126579567,0.13580570098894706,0,0,1,1
A2405,data analytics course,189.0,4809.0,225.32,27.0,10.0,0.053,1324.0,2024-11-18,hyderabad,mobile,analytics for data,2024-11-18,18,11,0,47,False,0.0529,0.039301310043668124,1.1921693121693122,8.345185185185185,0.37037037037037035,0.002079434393844874,0.14285714285714285,132.4,4.876087342446299,0.17018126888217522,0,0,1,0
A2406,data analytics course,139.0,5640.0,210.51,13.0,8.0,0.047,1536.0,2024/11/11,hyderabad,desktop,data analytics course,2024-11-11,11,11,0,46,True,0.04665,0.024645390070921987,1.5144604316546761,16.193076923076923,0.6153846153846154,0.0014184397163120568,0.09352517985611511,192.0,6.296565483824997,0.13705078125,0,0,0,1
A2407,data analytics course,159.0,3401.0,222.71,18.0,3.0,0.019,1849.0,2024-11-05,hyderabad,desktop,data analytics online,2024-11-05,5,11,1,45,False,0.0189,0.046750955601293734,1.400691823899371,12.372777777777777,0.16666666666666666,0.0008820935019112026,0.11320754716981132,616.3333333333334,7.302276503075748,0.12044889129259059,0,0,0,2
A2408,data analytics course,175.0,5561.0,231.96,20.0,8.0,0.057,1174.0,2024-11-14,hyderabad,mobile,data analytics course,2024-11-14,14,11,3,46,True,0.0457,0.031469160222981477,1.3254857142857144,11.598,0.4,0.0014385901816220104,0.11428571428571428,146.75,4.061217451284704,0.19758091993185692,0,0,1,1
A2409,data analytics course,175.0,5720.0,243.8,17.0,6.0,0.047,1507.0,2024-11-26,hyderabad,desktop,data analytics online,2024-11-26,26,11,1,48,True,0.0343,0.030594405594405596,1.3931428571428572,14.341176470588236,0.35294117647058826,0.001048951048951049,0.09714285714285714,251.16666666666666,5.18129614438064,0.1617783676177837,0,0,0,2
A2410,data analytics course,82.0,4898.0,215.11,25.0,8.0,0.098,1776.0,09-11-2024,hyderabad,tablet,analytics for data,2024-09-11,11,9,2,37,False,0.0976,0.016741527153940384,2.6232926829268295,8.6044,0.32,0.0016333197223356473,0.3048780487804878,222.0,7.256240992980334,0.1211204954954955,0,0,2,0
A2411,data analytics course,146.0,5871.0,218.69,30.0,4.0,0.047,1507.0,2024-11-22,hyderabad,desktop,learn data analytics,2024-11-22,22,11,4,47,True,0.0274,0.024867995230795435,1.497876712328767,7.289666666666666,0.13333333333333333,0.0006813149378300119,0.2054794520547945,376.75,5.8910329690429375,0.14511612475116126,0,0,0,4
A2412,data analytics course,85.0,5954.0,201.88,18.0,6.0,0.071,1526.0,2024/11/27,hyderabad,tablet,analytics for data,2024-11-27,27,11,2,48,False,0.0706,0.014276116896204233,2.375058823529412,11.215555555555556,0.3333333333333333,0.001007725898555593,0.21176470588235294,254.33333333333334,6.558945908460471,0.13229357798165137,0,0,2,0
A2413,data analytics course,128.0,3487.0,236.19,25.0,6.0,0.047,1961.0,02-11-2024,hyderabad,tablet,data analytics course,2024-02-11,11,2,6,6,False,0.0469,0.03670777172354459,1.845234375,9.4476,0.24,0.0017206767995411529,0.1953125,326.8333333333333,7.30263770693086,0.12044365119836818,0,0,2,1
A2414,data analytics course,153.0,3808.0,189.61,19.0,8.0,0.052,1246.0,02-11-2024,hyderabad,tablet,data analytics course,2024-02-11,11,2,6,6,False,0.0523,0.04017857142857143,1.2392810457516341,9.979473684210527,0.42105263157894735,0.0021008403361344537,0.12418300653594772,155.75,5.57138336585623,0.1521749598715891,0,0,2,1
A2415,data analytics course,192.0,5720.0,243.11,30.0,9.0,0.047,1555.0,2024-11-02,hyderabad,mobile,online data analytic,2024-11-02,2,11,5,44,True,0.0469,0.033566433566433566,1.2661979166666668,8.103666666666667,0.3,0.0015734265734265735,0.15625,172.77777777777777,5.396281518654106,0.15634083601286175,0,0,1,5
A2416,data analytics course,148.0,4721.0,189.48,26.0,8.0,0.054,1176.0,2024/11/01,hyderabad,mobile,online data analytic,2024-11-01,1,11,4,44,False,0.0541,0.0313492904045753,1.2802702702702702,7.287692307692307,0.3076923076923077,0.0016945562380851515,0.17567567567567569,147.0,5.206459784673845,0.16112244897959183,0,0,1,5
A2417,data analytics course,153.0,4768.0,214.39,25.0,5.0,0.041,1837.0,26-11-2024,hyderabad,tablet,data analytics online,2024-11-26,26,11,1,48,False,0.0327,0.03208892617449664,1.4012418300653593,8.5756,0.2,0.0010486577181208054,0.16339869281045752,367.4,7.568496664956389,0.1167065868263473,0,0,2,2
A2418,data analytics course,139.0,5494.0,187.68,23.0,8.0,0.046,1402.0,24-11-2024,hyderabad,tablet,data analytics course,2024-11-24,24,11,6,47,True,0.04665,0.025300327630141974,1.3502158273381295,8.16,0.34782608695652173,0.0014561339643247178,0.16546762589928057,175.25,6.4701619778346116,0.13386590584878746,0,0,2,1
A2419,data analytics course,169.0,4520.0,180.58,30.0,7.0,0.049,1661.0,2024-11-26,hyderabad,mobile,data analytics training,2024-11-26,26,11,1,48,False,0.0414,0.03738938053097345,1.0685207100591716,6.019333333333334,0.23333333333333334,0.0015486725663716814,0.17751479289940827,237.28571428571428,8.198139328829328,0.10871763997591813,0,0,1,3
A2420,data analytics course,146.0,5173.0,234.26,20.0,7.0,0.048,1089.0,2024-11-28,hyderabad,mobile,online data analytic,2024-11-28,28,11,3,48,False,0.0479,0.028223468006959213,1.6045205479452054,11.713,0.35,0.0013531799729364006,0.136986301369863,155.57142857142858,3.648680952787501,0.2151147842056933,0,0,1,5
A2421,data analytics course,81.0,4808.0,189.19,17.0,9.0,0.111,1759.0,25-11-2024,hyderabad,desktop,online data analytic,2024-11-25,25,11,0,48,False,0.1111,0.01684692179700499,2.335679012345679,11.128823529411765,0.5294117647058824,0.0018718801996672214,0.20987654320987653,195.44444444444446,8.297531582007505,0.10755542922114839,0,0,0,5
A2422,data analytics course,185.0,4520.0,234.72,18.0,6.0,0.032,1508.0,2024/11/27,hyderabad,desktop,data analytics online,2024-11-27,27,11,2,48,False,0.0324,0.04092920353982301,1.2687567567567568,13.04,0.3333333333333333,0.001327433628318584,0.0972972972972973,251.33333333333334,5.424676209952284,0.1556498673740053,0,0,0,2
A2423,data analytics course,90.0,5319.0,208.19,13.0,7.0,0.047,1719.0,2024-11-26,hyderabad,tablet,data analytics training,2024-11-26,26,11,1,48,True,0.0778,0.01692047377326565,2.313222222222222,16.014615384615386,0.5384615384615384,0.0013160368490317729,0.14444444444444443,245.57142857142858,7.256880733944954,0.12111111111111111,0,0,2,3
A2424,data analytics course,155.0,4532.0,203.44,19.0,8.0,0.052,1709.0,17-11-2024,hyderabad,desktop,learn data analytics,2024-11-17,17,11,6,46,False,0.0516,0.03420123565754634,1.312516129032258,10.707368421052632,0.42105263157894735,0.00176522506619594,0.12258064516129032,213.625,7.400511207235549,0.11904037448800468,0,0,0,4
A2425,data analytics course,125.0,3458.0,180.49,19.0,3.0,0.047,1754.0,2024-11-09,hyderabad,tablet,data analytics online,2024-11-09,9,11,5,45,True,0.024,0.03614806246385194,1.44392,9.499473684210527,0.15789473684210525,0.0008675534991324465,0.152,584.6666666666666,8.717989916338855,0.10290193842645383,0,0,2,2
A2426,data analytics course,151.0,5432.0,204.76,18.0,9.0,0.06,1507.0,2024/11/13,hyderabad,mobile,data analytics training,2024-11-13,13,11,2,46,False,0.0596,0.02779823269513991,1.356026490066225,11.375555555555556,0.5,0.0016568483063328424,0.11920529801324503,167.44444444444446,6.359835905450284,0.13587259455872594,0,0,1,3
A2427,data analytics course,82.0,3052.0,211.11,12.0,3.0,0.037,1917.0,2024/11/06,hyderabad,desktop,learn data analytics,2024-11-06,6,11,2,45,False,0.0366,0.026867627785058978,2.5745121951219514,17.5925,0.25,0.000982961992136304,0.14634146341463414,639.0,8.080574108284779,0.11012519561815337,0,0,0,4
A2428,data analytics course,198.0,5718.0,194.37,13.0,8.0,0.04,1118.0,2024-11-16,hyderabad,tablet,data analytics training,2024-11-16,16,11,5,46,False,0.0404,0.03462749213011543,0.9816666666666667,14.951538461538462,0.6153846153846154,0.0013990905911157748,0.06565656565656566,139.75,4.751916448011524,0.17385509838998212,0,0,2,3
A2429,data analytics course,115.0,4762.0,241.63,20.0,8.0,0.058,1555.0,03-11-2024,hyderabad,desktop,data analytics course,2024-03-11,11,3,0,11,True,0.0696,0.024149517009659806,2.1011304347826085,12.0815,0.4,0.0016799664006719867,0.17391304347826086,194.375,5.4354591731159205,0.15538906752411574,0,0,0,1
A2430,data analytics course,158.0,4953.0,243.07,20.0,8.0,0.051,1955.0,2024-11-04,hyderabad,tablet,learn data analytics,2024-11-04,4,11,0,45,False,0.0506,0.03189985867151222,1.5384177215189874,12.1535,0.4,0.0016151827175449223,0.12658227848101267,244.375,7.042950590364916,0.12433248081841432,0,0,2,4
A2431,data analytics course,102.0,3784.0,219.45,13.0,9.0,0.045,1967.0,2024/11/20,hyderabad,desktop,data analytics course,2024-11-20,20,11,2,47,True,0.0882,0.026955602536997886,2.151470588235294,16.88076923076923,0.6923076923076923,0.0023784355179704017,0.12745098039215685,218.55555555555554,7.963317384370016,0.11156583629893238,0,0,0,1
A2432,data analytics course,93.0,4520.0,192.81,22.0,7.0,0.075,1726.0,2024/11/18,hyderabad,desktop,learn data analytics,2024-11-18,18,11,0,47,False,0.0753,0.020575221238938055,2.073225806451613,8.764090909090909,0.3181818181818182,0.0015486725663716814,0.23655913978494625,246.57142857142858,7.951817851771174,0.11170915411355736,0,0,0,4
A2433,data analytics course,198.0,5860.0,185.25,24.0,9.0,0.041,1950.0,2024-11-01,hyderabad,tablet,data analytics training,2024-11-01,1,11,4,44,False,0.0455,0.03378839590443686,0.9356060606060606,7.71875,0.375,0.0015358361774744026,0.12121212121212122,216.66666666666666,9.526315789473685,0.095,0,0,2,3
A2434,data analytics course,174.0,4169.0,189.36,23.0,8.0,0.046,1110.0,2024/11/14,hyderabad,tablet,data analytics course,2024-11-14,14,11,3,46,False,0.046,0.04173662748860638,1.0882758620689656,8.23304347826087,0.34782608695652173,0.001918925401775006,0.13218390804597702,138.75,4.861850443599493,0.1705945945945946,0,0,2,1
A2435,data analytics course,193.0,5831.0,214.965,24.0,5.0,0.047,1265.0,2024-11-14,hyderabad,mobile,online data analytic,2024-11-14,14,11,3,46,True,0.0259,0.03309895386726119,1.1138082901554405,8.956875,0.20833333333333334,0.0008574858514834505,0.12435233160621761,253.0,4.8846789012164775,0.16993280632411067,0,0,1,5
A2436,data analytics course,117.0,5269.0,196.1,26.0,7.0,0.047,1096.0,05-11-2024,hyderabad,desktop,online data analytic,2024-05-11,11,5,5,19,True,0.04665,0.022205352059214273,1.676068376068376,7.542307692307692,0.2692307692307692,0.0013285253368760675,0.2222222222222222,156.57142857142858,4.588985211626721,0.17892335766423356,0,0,0,5
A2437,data analytics course,147.0,5793.0,240.32,25.0,5.0,0.049,1645.0,2024/11/27,hyderabad,tablet,data analytics course,2024-11-27,27,11,2,48,True,0.034,0.025375453133091662,1.634829931972789,9.6128,0.2,0.0008631106507854307,0.17006802721088435,329.0,5.845039946737684,0.14609118541033433,0,0,2,1
A2438,data analytics course,179.0,3338.0,218.33,30.0,7.0,0.039,1507.0,2024/11/24,hyderabad,desktop,data analytics online,2024-11-24,24,11,6,47,False,0.0391,0.053624925104853206,1.2197206703910615,7.277666666666667,0.23333333333333334,0.002097064110245656,0.16759776536312848,215.28571428571428,5.902395456419182,0.1448772395487724,0,0,0,2
A2439,data analytics course,194.0,4297.0,237.87,22.0,3.0,0.047,1739.0,2024/11/29,hyderabad,desktop,data analytics course,2024-11-29,29,11,4,48,True,0.0155,0.04514777751919944,1.2261340206185567,10.812272727272727,0.13636363636363635,0.0006981615080288574,0.1134020618556701,579.6666666666666,6.310715937276664,0.13678550891316849,0,0,0,1
A2440,data analytics course,112.0,3961.0,214.45,13.0,7.0,0.047,1594.0,2024/11/17,hyderabad,desktop,analytics for data,2024-11-17,17,11,6,46,True,0.0625,0.02827568795758647,1.9147321428571427,16.496153846153845,0.5384615384615384,0.0017672304973491543,0.11607142857142858,227.71428571428572,6.432968057822336,0.13453575909661228,0,0,0,0
A2441,data analytics course,88.0,5063.0,195.2,22.0,3.0,0.034,1460.0,2024/11/20,hyderabad,mobile,analytics for data,2024-11-20,20,11,2,47,False,0.0341,0.01738099940746593,2.2181818181818183,8.872727272727273,0.13636363636363635,0.0005925340707090658,0.25,486.6666666666667,6.479508196721311,0.1336986301369863,0,0,1,0
A2442,data analytics course,172.0,5635.0,200.16,21.0,7.0,0.036,1727.0,14-11-2024,hyderabad,mobile,data analytics online,2024-11-14,14,11,3,46,False,0.0407,0.030523513753327416,1.1637209302325582,9.531428571428572,0.3333333333333333,0.0012422360248447205,0.12209302325581395,246.71428571428572,7.628097521982414,0.11590040532715691,0,0,1,2
A2443,data analytics course,81.0,4404.0,239.62,11.0,4.0,0.035,1814.0,2024-11-21,hyderabad,mobile,data analytics course,2024-11-21,21,11,3,47,True,0.0494,0.018392370572207085,2.958271604938272,21.783636363636365,0.36363636363636365,0.0009082652134423251,0.13580246913580246,453.5,6.570319672815291,0.13209481808158766,0,0,1,1
A2444,data analytics course,142.0,4312.0,213.54,21.0,7.0,0.049,1666.0,2024/11/20,hyderabad,desktop,learn data analytics,2024-11-20,20,11,2,47,False,0.0493,0.03293135435992579,1.5038028169014084,10.168571428571429,0.3333333333333333,0.0016233766233766235,0.14788732394366197,238.0,6.80181698979114,0.12817527010804322,0,0,0,4
A2445,data analytics course,111.0,3302.0,193.18,30.0,10.0,0.047,1783.0,19-11-2024,hyderabad,mobile,analytics for data,2024-11-19,19,11,1,47,True,0.0901,0.03361599030890369,1.7403603603603603,6.439333333333334,0.3333333333333333,0.0030284675953967293,0.2702702702702703,178.3,8.229733926907548,0.10834548513740887,0,0,1,0
A2446,data analytics course,81.0,3575.0,192.71,27.0,4.0,0.049,1158.0,11-11-2024,hyderabad,tablet,online data analytic,2024-11-11,11,11,0,46,False,0.0494,0.022657342657342656,2.379135802469136,7.137407407407408,0.14814814814814814,0.0011188811188811189,0.3333333333333333,289.5,5.009029111099579,0.1664162348877375,0,0,2,5
A2447,data analytics course,112.0,5055.0,213.36,26.0,5.0,0.058,1959.0,2024/11/29,hyderabad,desktop,data analytics training,2024-11-29,29,11,4,48,True,0.0446,0.022156280909990108,1.905,8.206153846153846,0.19230769230769232,0.0009891196834817012,0.23214285714285715,391.8,8.181664791901012,0.10891271056661563,0,0,0,3
A2448,data analytics course,101.0,5415.0,236.41,13.0,10.0,0.039,1832.0,15-11-2024,hyderabad,tablet,learn data analytics,2024-11-15,15,11,4,46,True,0.099,0.018651892890120036,2.3406930693069308,18.185384615384613,0.7692307692307693,0.0018467220683287165,0.12871287128712872,183.2,6.749249185736644,0.1290447598253275,0,0,2,4
A2449,data analytics course,166.0,3118.0,212.46,25.0,7.0,0.042,1813.0,2024/11/14,hyderabad,tablet,online data analytic,2024-11-14,14,11,3,46,False,0.0422,0.05323925593329057,1.2798795180722893,8.4984,0.28,0.0022450288646568314,0.15060240963855423,259.0,7.533370987479996,0.11718698290126862,0,0,2,5
A2450,data analytics course,139.0,5271.0,214.965,14.0,8.0,0.047,1629.0,2024/11/22,hyderabad,mobile,data analytics online,2024-11-22,22,11,4,47,True,0.04665,0.026370707645608043,1.5465107913669065,15.354642857142858,0.5714285714285714,0.0015177385695313982,0.10071942446043165,203.625,6.577977810341219,0.13196132596685084,0,0,1,2
A2451,data analytics course,148.0,4520.0,214.26,21.0,8.0,0.047,1629.0,2024/11/13,hyderabad,tablet,data analytics online,2024-11-13,13,11,2,46,True,0.0541,0.03274336283185841,1.4477027027027027,10.202857142857143,0.38095238095238093,0.0017699115044247787,0.14189189189189189,203.625,6.602912349481938,0.13152854511970533,0,0,2,2
A2452,data analytics course,126.0,5250.0,239.73,30.0,4.0,0.032,1070.0,2024/11/23,hyderabad,tablet,analytics for data,2024-11-23,23,11,5,47,False,0.0317,0.024,1.9026190476190474,7.991,0.13333333333333333,0.0007619047619047619,0.23809523809523808,267.5,3.463354607266508,0.2240467289719626,0,0,2,0
A2453,data analytics course,119.0,4405.0,233.66,25.0,3.0,0.039,1407.0,12-11-2024,hyderabad,desktop,data analytics course,2024-12-11,11,12,2,50,True,0.0252,0.027014755959137344,1.9635294117647057,9.3464,0.12,0.000681044267877412,0.21008403361344538,469.0,5.0215698022768125,0.16606965174129354,0,0,0,1
A2454,data analytics course,189.0,5060.0,236.54,26.0,7.0,0.043,1877.0,2024-11-10,hyderabad,mobile,data analytics training,2024-11-10,10,11,6,45,False,0.037,0.03735177865612648,1.2515343915343915,9.097692307692308,0.2692307692307692,0.001383399209486166,0.13756613756613756,268.14285714285717,6.935232941574364,0.12602024507192328,0,0,1,3
A2455,data analytics course,167.0,3296.0,246.85,29.0,8.0,0.048,1723.0,2024/11/17,hyderabad,desktop,data analytics online,2024-11-17,17,11,6,46,False,0.0479,0.05066747572815534,1.4781437125748502,8.51206896551724,0.27586206896551724,0.0024271844660194173,0.17365269461077845,215.375,5.979947336439134,0.14326755658734763,0,0,0,2
A2456,data analytics course,198.0,3499.0,209.74,30.0,9.0,0.04,1893.0,2024/11/25,hyderabad,desktop,data analytics course,2024-11-25,25,11,0,48,False,0.0455,0.056587596456130325,1.0592929292929294,6.991333333333333,0.3,0.002572163475278651,0.15151515151515152,210.33333333333334,8.025460093449032,0.11079767564712098,0,0,0,1
A2457,data analytics course,95.0,3449.0,184.55,10.0,10.0,0.041,1601.0,16-11-2024,hyderabad,mobile,analytics for data,2024-11-16,16,11,5,46,True,0.1053,0.027544215714699914,1.9426315789473685,18.455000000000002,1.0,0.0028993911278631487,0.10526315789473684,160.1,7.675155784340287,0.11527170518425985,0,0,1,0
A2458,data analytics course,181.0,3738.0,206.61,16.0,9.0,0.05,1868.0,2024/11/09,hyderabad,mobile,online data analytic,2024-11-09,9,11,5,45,False,0.0497,0.04842161583734617,1.1414917127071824,12.913125,0.5625,0.002407704654895666,0.08839779005524862,207.55555555555554,8.041188713034218,0.1106049250535332,0,0,1,5
A2459,data analytics course,105.0,4236.0,180.2,12.0,7.0,0.067,1507.0,2024-11-24,hyderabad,mobile,learn data analytics,2024-11-24,24,11,6,47,False,0.0667,0.024787535410764873,1.716190476190476,15.016666666666666,0.5833333333333334,0.0016525023607176581,0.11428571428571428,215.28571428571428,7.362930077691455,0.11957531519575315,0,0,1,4
A2460,data analytics course,178.0,5751.0,205.34,24.0,10.0,0.047,1903.0,2024/11/20,hyderabad,desktop,data analytics course,2024-11-20,20,11,2,47,True,0.0562,0.03095113893235959,1.1535955056179776,8.555833333333334,0.4166666666666667,0.001738828029907842,0.1348314606741573,190.3,8.267556248173761,0.10790331056227011,0,0,0,1
A2461,data analytics course,127.0,5050.0,184.77,28.0,9.0,0.071,1906.0,2024/11/02,hyderabad,desktop,data analytics online,2024-11-02,2,11,5,44,False,0.0709,0.02514851485148515,1.4548818897637796,6.598928571428572,0.32142857142857145,0.0017821782178217822,0.2204724409448819,211.77777777777777,9.315527412458732,0.09694123819517314,0,0,0,2
A2462,data analytics course,198.0,4773.0,202.54,17.0,10.0,0.047,1082.0,2024-11-19,hyderabad,mobile,data analytics online,2024-11-19,19,11,1,47,True,0.0505,0.041483343808925204,1.0229292929292928,11.914117647058823,0.5882352941176471,0.002095118374188142,0.08585858585858586,108.2,4.34215463612126,0.18719038817005546,0,0,1,2
A2463,data analytics course,86.0,5652.0,249.13,25.0,7.0,0.081,1981.0,06-11-2024,hyderabad,mobile,data analytics training,2024-06-11,11,6,1,24,False,0.0814,0.01521585279547063,2.896860465116279,9.9652,0.28,0.0012384996461429583,0.29069767441860467,283.0,6.951671817926384,0.12575971731448762,0,0,1,3
A2464,data analytics course,139.0,5085.0,182.42,11.0,7.0,0.047,1109.0,04-11-2024,hyderabad,desktop,online data analytic,2024-04-11,11,4,3,15,True,0.04665,0.02733529990167158,1.3123741007194243,16.583636363636362,0.6363636363636364,0.0013765978367748278,0.07913669064748201,158.42857142857142,5.079377261265213,0.16449053201082056,0,0,0,5
A2465,data analytics course,191.0,5070.0,247.41,12.0,4.0,0.047,1266.0,25-11-2024,hyderabad,mobile,analytics for data,2024-11-25,25,11,0,48,True,0.0209,0.03767258382642998,1.2953403141361257,20.6175,0.3333333333333333,0.0007889546351084812,0.06282722513089005,316.5,4.117012246877652,0.19542654028436018,0,0,1,0
A2466,data analytics course,139.0,5879.0,197.9,24.0,4.0,0.029,1476.0,2024-11-05,hyderabad,mobile,data analytics course,2024-11-05,5,11,1,45,False,0.0288,0.023643476781765607,1.4237410071942447,8.245833333333334,0.16666666666666666,0.000680387821058003,0.17266187050359713,369.0,6.4583122789287515,0.13407859078590786,0,0,1,1
A2467,data analytics course,197.0,3620.0,235.19,18.0,7.0,0.036,1740.0,2024/11/01,hyderabad,mobile,online data analytic,2024-11-01,1,11,4,44,False,0.0355,0.05441988950276243,1.1938578680203045,13.06611111111111,0.3888888888888889,0.0019337016574585636,0.09137055837563451,248.57142857142858,6.398273736128236,0.13516666666666666,0,0,1,5
A2468,data analytics course,116.0,4250.0,216.66,10.0,9.0,0.078,1877.0,2024/11/02,hyderabad,mobile,data analytics training,2024-11-02,2,11,5,44,False,0.0776,0.027294117647058823,1.867758620689655,21.666,0.9,0.0021176470588235292,0.08620689655172414,208.55555555555554,7.663343487491923,0.1154288758657432,0,0,1,3
A2469,data analytics course,192.0,4850.0,235.42,22.0,10.0,0.052,1124.0,2024-11-14,hyderabad,desktop,analytics for data,2024-11-14,14,11,3,46,False,0.0521,0.03958762886597938,1.2261458333333333,10.700909090909091,0.45454545454545453,0.002061855670103093,0.11458333333333333,112.4,3.774445671565713,0.20944839857651246,0,0,0,0
A2470,data analytics course,118.0,3815.0,185.78,16.0,4.0,0.047,1093.0,17-11-2024,hyderabad,desktop,data analytics online,2024-11-17,17,11,6,46,True,0.0339,0.0309305373525557,1.574406779661017,11.61125,0.25,0.0010484927916120576,0.13559322033898305,273.25,4.883302831305846,0.1699725526075023,0,0,0,2
A2471,data analytics course,172.0,5741.0,198.44,14.0,4.0,0.023,1755.0,2024/11/11,hyderabad,desktop,analytics for data,2024-11-11,11,11,0,46,False,0.0233,0.029959937293154503,1.1537209302325582,14.174285714285714,0.2857142857142857,0.0006967427277477791,0.08139534883720931,438.75,7.843983067929853,0.11307122507122506,0,0,0,0
A2472,data analytics course,174.0,4272.0,240.77,16.0,7.0,0.041,1004.0,2024/11/23,hyderabad,desktop,learn data analytics,2024-11-23,23,11,5,47,False,0.0402,0.04073033707865169,1.383735632183908,15.048125,0.4375,0.0016385767790262173,0.09195402298850575,143.42857142857142,3.169954728579142,0.23981075697211157,0,0,0,4
A2473,data analytics course,175.0,4974.0,182.22,21.0,5.0,0.047,1300.0,23-11-2024,hyderabad,mobile,learn data analytics,2024-11-23,23,11,5,47,True,0.0286,0.03518295134700442,1.0412571428571429,8.677142857142858,0.23809523809523808,0.0010052271813429834,0.12,260.0,6.134233344309076,0.14016923076923077,0,0,1,4
A2474,data analytics course,139.0,3215.0,191.22,30.0,7.0,0.047,1588.0,2024-11-23,hyderabad,desktop,analytics for data,2024-11-23,23,11,5,47,True,0.04665,0.0432348367029549,1.37568345323741,6.374,0.23333333333333334,0.002177293934681182,0.2158273381294964,226.85714285714286,7.304570651605481,0.12041561712846348,0,0,0,0
A2475,data analytics course,139.0,3723.0,201.32,21.0,8.0,0.047,1507.0,06-11-2024,hyderabad,tablet,data analytics course,2024-06-11,11,6,1,24,True,0.04665,0.037335482138060705,1.448345323741007,9.586666666666666,0.38095238095238093,0.0021488047273704003,0.1510791366906475,188.375,6.48559507252136,0.13358991373589912,0,0,2,1
A2476,data analytics course,103.0,4670.0,203.4,21.0,4.0,0.047,1562.0,25-11-2024,hyderabad,mobile,analytics for data,2024-11-25,25,11,0,48,True,0.0388,0.022055674518201285,1.974757281553398,9.685714285714287,0.19047619047619047,0.0008565310492505353,0.20388349514563106,390.5,6.67944936086529,0.13021766965428938,0,0,1,0
A2477,data analytics course,187.0,4474.0,182.47,10.0,7.0,0.047,1768.0,13-11-2024,hyderabad,tablet,online data analytic,2024-11-13,13,11,2,46,True,0.04665,0.041797049620026824,0.9757754010695187,18.247,0.7,0.0015645954403218597,0.053475935828877004,252.57142857142858,8.689263988600866,0.10320701357466064,0,0,2,5
A2478,data analytics course,139.0,3009.0,195.17,20.0,6.0,0.047,1083.0,2024-11-23,hyderabad,tablet,data analytics online,2024-11-23,23,11,5,47,True,0.04665,0.046194749086075106,1.4041007194244604,9.7585,0.3,0.0019940179461615153,0.14388489208633093,180.5,4.549008556642927,0.18021237303785778,0,0,2,2
A2479,data analytics course,109.0,3933.0,189.73,11.0,4.0,0.047,1700.0,07-11-2024,hyderabad,desktop,data analytics online,2024-07-11,11,7,3,28,True,0.0367,0.027714213068904144,1.7406422018348624,17.248181818181816,0.36363636363636365,0.0010170353419781336,0.10091743119266056,425.0,7.9601011964370425,0.11160588235294117,0,0,0,2
A2480,data analytics course,118.0,4360.0,232.09,10.0,9.0,0.076,1252.0,2024/11/13,hyderabad,desktop,data analytics training,2024-11-13,13,11,2,46,False,0.0763,0.02706422018348624,1.966864406779661,23.209,0.9,0.0020642201834862386,0.0847457627118644,139.11111111111111,4.394459046059718,0.18537539936102237,0,0,0,3
A2481,data analytics course,164.0,5120.0,185.69,10.0,5.0,0.031,1597.0,2024/11/23,hyderabad,tablet,analytics for data,2024-11-23,23,11,5,47,False,0.0305,0.03203125,1.1322560975609757,18.569,0.5,0.0009765625,0.06097560975609756,319.4,7.600355431094835,0.11627426424546024,0,0,2,0
A2482,data analytics course,166.0,3887.0,192.0,24.0,9.0,0.054,1890.0,2024-11-13,hyderabad,tablet,data analytics course,2024-11-13,13,11,2,46,False,0.0542,0.042706457422176484,1.1566265060240963,8.0,0.375,0.002315410342166195,0.14457831325301204,210.0,8.84375,0.10158730158730159,0,0,2,1
A2483,data analytics course,88.0,3909.0,189.57,30.0,10.0,0.114,1750.0,29-11-2024,hyderabad,desktop,data analytics training,2024-11-29,29,11,4,48,False,0.1136,0.02251215144538245,2.1542045454545455,6.319,0.3333333333333333,0.0025581990278843694,0.3409090909090909,175.0,8.23141847338714,0.10832571428571428,0,0,0,3
A2484,data analytics course,125.0,3017.0,232.51,14.0,7.0,0.047,1510.0,2024-11-08,hyderabad,tablet,data analytics training,2024-11-08,8,11,4,45,True,0.056,0.04143188597944979,1.86008,16.607857142857142,0.5,0.002320185614849188,0.112,215.71428571428572,5.49434432927616,0.15398013245033113,0,0,2,3
A2485,data analytics course,139.0,5127.0,206.95,26.0,5.0,0.047,1902.0,17-11-2024,hyderabad,desktop,online data analytic,2024-11-17,17,11,6,46,True,0.04665,0.027111371172225472,1.4888489208633093,7.959615384615384,0.19230769230769232,0.0009752291788570314,0.18705035971223022,380.4,8.190625755013288,0.10880651945320714,0,0,0,5
A2486,data analytics course,151.0,3992.0,212.42,10.0,9.0,0.06,1890.0,2024-11-26,hyderabad,tablet,learn data analytics,2024-11-26,26,11,1,48,False,0.0596,0.037825651302605214,1.406754966887417,21.241999999999997,0.9,0.0022545090180360722,0.06622516556291391,210.0,7.897467281800207,0.11239153439153439,0,0,2,4
A2487,data analytics course,182.0,3554.0,181.74,18.0,4.0,0.022,1933.0,02-11-2024,hyderabad,tablet,learn data analytics,2024-02-11,11,2,6,6,False,0.022,0.051209904333145755,0.9985714285714287,10.096666666666668,0.2222222222222222,0.0011254924029262803,0.0989010989010989,483.25,9.636073511609991,0.09401965856182101,0,0,2,4
A2488,data analytics course,84.0,4051.0,196.83,21.0,4.0,0.048,1094.0,2024-11-14,hyderabad,mobile,online data analytic,2024-11-14,14,11,3,46,False,0.0476,0.020735620834361885,2.3432142857142857,9.372857142857143,0.19047619047619047,0.0009874105159219946,0.25,273.5,4.5580958187268195,0.17991773308957953,0,0,1,5
A2489,data analytics course,127.0,3541.0,239.47,16.0,10.0,0.079,1474.0,2024-11-25,hyderabad,tablet,data analytics training,2024-11-25,25,11,0,48,False,0.0787,0.035865574696413445,1.8855905511811024,14.966875,0.625,0.002824060999717594,0.12598425196850394,147.4,5.155259531465319,0.16246268656716417,0,0,2,3
A2490,data analytics course,104.0,5878.0,228.79,21.0,3.0,0.05,1101.0,05-11-2024,hyderabad,mobile,data analytics course,2024-05-11,11,5,5,19,True,0.0288,0.017693092888737667,2.199903846153846,10.894761904761904,0.14285714285714285,0.0005103776794828172,0.20192307692307693,367.0,3.812273263691595,0.20780199818346956,0,0,1,1
A2491,data analytics course,161.0,4611.0,228.34,26.0,7.0,0.043,1473.0,2024/11/25,hyderabad,tablet,data analytics online,2024-11-25,25,11,0,48,False,0.0435,0.03491650401214487,1.4182608695652175,8.782307692307693,0.2692307692307692,0.0015181088700932553,0.16149068322981366,210.42857142857142,5.450906542874661,0.15501697216564833,0,0,2,2
A2492,data analytics course,141.0,4764.0,187.72,28.0,4.0,0.028,1428.0,2024-11-16,hyderabad,mobile,analytics for data,2024-11-16,16,11,5,46,False,0.0284,0.02959697732997481,1.3313475177304965,6.704285714285715,0.14285714285714285,0.0008396305625524769,0.19858156028368795,357.0,6.6070743660771365,0.1314565826330532,0,0,1,0
A2493,data analytics course,186.0,4603.0,191.84,26.0,9.0,0.047,1918.0,2024/11/07,hyderabad,desktop,learn data analytics,2024-11-07,7,11,3,45,False,0.0484,0.04040842928524875,1.0313978494623657,7.378461538461538,0.34615384615384615,0.001955246578318488,0.13978494623655913,213.11111111111111,8.99791492910759,0.10002085505735141,0,0,0,4
A2494,data analytics course,139.0,5003.0,195.4,15.0,7.0,0.047,1273.0,2024/11/18,hyderabad,desktop,data analytics training,2024-11-18,18,11,0,47,True,0.04665,0.027783330001998802,1.4057553956834532,13.026666666666667,0.4666666666666667,0.0013991605036977814,0.1079136690647482,181.85714285714286,5.514841351074718,0.1534956794972506,0,0,0,3
A2495,data analytics course,124.0,5212.0,190.83,13.0,6.0,0.048,1399.0,2024-11-07,hyderabad,desktop,data analytics course,2024-11-07,7,11,3,45,False,0.0484,0.023791250959324637,1.538951612903226,14.67923076923077,0.46153846153846156,0.0011511895625479663,0.10483870967741936,233.16666666666666,6.3311324215270135,0.1364045746962116,0,0,0,1
A2496,data analytics course,97.0,5285.0,249.65,12.0,7.0,0.051,1411.0,2024/11/27,hyderabad,desktop,data analytics training,2024-11-27,27,11,2,48,True,0.0722,0.018353831598864712,2.5737113402061857,20.804166666666667,0.5833333333333334,0.0013245033112582781,0.12371134020618557,201.57142857142858,4.6519126777488475,0.17693125442948265,0,0,0,3
A2497,data analytics course,111.0,3177.0,224.51,18.0,8.0,0.047,1946.0,2024-11-25,hyderabad,desktop,learn data analytics,2024-11-25,25,11,0,48,True,0.0721,0.03493862134088763,2.0226126126126127,12.472777777777777,0.4444444444444444,0.0025180988353792886,0.16216216216216217,243.25,7.6677653556634455,0.1153699897225077,0,0,0,4
A2498,data analytics course,93.0,5571.0,185.71,12.0,7.0,0.075,1630.0,21-11-2024,hyderabad,tablet,online data analytic,2024-11-21,21,11,3,47,False,0.0753,0.01669359181475498,1.9968817204301077,15.475833333333334,0.5833333333333334,0.0012565069107880094,0.12903225806451613,232.85714285714286,7.777125625975984,0.11393251533742332,0,0,2,5
A2499,data analytics course,92.0,3237.0,245.48,15.0,6.0,0.065,1507.0,2024/11/19,hyderabad,desktop,data analytics online,2024-11-19,19,11,1,47,False,0.0652,0.02842137781896818,2.6682608695652172,16.365333333333332,0.4,0.0018535681186283596,0.16304347826086957,251.16666666666666,5.138992993319212,0.16289316522893166,0,0,0,2
A2500,data analytics course,138.0,5314.0,198.39,17.0,10.0,0.072,1250.0,2024-11-20,hyderabad,desktop,online data analytic,2024-11-20,20,11,2,47,False,0.0725,0.025969138125705685,1.4376086956521739,11.67,0.5882352941176471,0.001881821603312006,0.12318840579710146,125.0,5.300720802459803,0.158712,0,0,0,5
A2501,data analytics course,129.0,4452.0,196.06,10.0,9.0,0.053,1069.0,2024/11/13,hyderabad,tablet,learn data analytics,2024-11-13,13,11,2,46,True,0.0698,0.028975741239892182,1.51984496124031,19.606,0.9,0.0020215633423180594,0.07751937984496124,118.77777777777777,4.452412526777517,0.18340505144995323,0,0,2,4
A2502,data analytics course,183.0,3920.0,235.79,20.0,7.0,0.038,1238.0,2024-11-17,hyderabad,mobile,data analytics training,2024-11-17,17,11,6,46,False,0.0383,0.04668367346938775,1.288469945355191,11.7895,0.35,0.0017857142857142857,0.1092896174863388,176.85714285714286,4.250434708851096,0.19046042003231017,0,0,1,3
A2503,data analytics course,154.0,4603.0,214.0,20.0,3.0,0.019,1709.0,2024-11-18,hyderabad,tablet,data analytics course,2024-11-18,18,11,0,47,False,0.0195,0.03345644145122746,1.3896103896103895,10.7,0.15,0.000651748859439496,0.12987012987012986,569.6666666666666,6.985981308411215,0.12521942656524282,0,0,2,1
A2504,data analytics course,95.0,4938.0,204.5,12.0,6.0,0.046,1494.0,2024/11/18,hyderabad,tablet,data analytics training,2024-11-18,18,11,0,47,True,0.0632,0.01923855812069664,2.1526315789473682,17.041666666666668,0.5,0.001215066828675577,0.12631578947368421,249.0,6.30562347188264,0.13688085676037484,0,0,2,3
A2505,data analytics course,173.0,5291.0,214.965,23.0,8.0,0.047,1557.0,2024/11/13,hyderabad,mobile,data analytics online,2024-11-13,13,11,2,46,True,0.0462,0.032697032697032696,1.2425722543352602,9.346304347826088,0.34782608695652173,0.001512001512001512,0.1329479768786127,194.625,6.243039564580281,0.1380635838150289,0,0,1,2
A2506,data analytics course,112.0,4072.0,211.56,17.0,10.0,0.089,1229.0,01-11-2024,hyderabad,desktop,analytics for data,2024-01-11,11,1,3,2,False,0.0893,0.0275049115913556,1.8889285714285715,12.444705882352942,0.5882352941176471,0.002455795677799607,0.15178571428571427,122.9,4.809226696918132,0.172139951179821,0,0,0,0
A2507,data analytics course,170.0,5953.0,186.11,25.0,8.0,0.047,1080.0,2024-11-26,hyderabad,mobile,data analytics online,2024-11-26,26,11,1,48,True,0.0471,0.02855703006887284,1.094764705882353,7.444400000000001,0.32,0.0013438602385351924,0.14705882352941177,135.0,4.803019719520713,0.17232407407407407,0,0,1,2
A2508,data analytics course,96.0,4520.0,232.87,20.0,10.0,0.053,1162.0,2024/11/14,hyderabad,mobile,learn data analytics,2024-11-14,14,11,3,46,True,0.1042,0.021238938053097345,2.4257291666666667,11.6435,0.5,0.0022123893805309734,0.20833333333333334,116.2,3.9899085326577057,0.20040447504302927,0,0,1,4
A2509,data analytics course,113.0,3104.0,230.92,28.0,9.0,0.08,1422.0,27-11-2024,hyderabad,tablet,data analytics course,2024-11-27,27,11,2,48,False,0.0796,0.036404639175257734,2.0435398230088495,8.247142857142856,0.32142857142857145,0.0028994845360824743,0.24778761061946902,158.0,5.157976788498181,0.16239099859353023,0,0,2,1
A2510,data analytics course,145.0,4882.0,217.25,22.0,3.0,0.021,1814.0,2024-11-19,hyderabad,mobile,analytics for data,2024-11-19,19,11,1,47,False,0.0207,0.0297009422367882,1.4982758620689656,9.875,0.13636363636363635,0.0006145022531749283,0.15172413793103448,604.6666666666666,7.349827387802072,0.11976295479603087,0,0,1,0
A2511,data analytics course,83.0,3212.0,243.86,25.0,4.0,0.048,1612.0,2024-11-19,hyderabad,mobile,data analytics course,2024-11-19,19,11,1,47,False,0.0482,0.025840597758405977,2.9380722891566267,9.7544,0.16,0.0012453300124533001,0.30120481927710846,403.0,5.6103502009349615,0.15127791563275436,0,0,1,1
A2512,data analytics course,90.0,4973.0,181.04,23.0,5.0,0.056,1039.0,03-11-2024,hyderabad,desktop,online data analytic,2024-03-11,11,3,0,11,False,0.0556,0.0180977277297406,2.0115555555555553,7.8713043478260865,0.21739130434782608,0.0010054293183189222,0.25555555555555554,207.8,4.739063190455148,0.17424446583253128,0,0,0,5
A2513,data analytics course,140.0,5227.0,222.57,27.0,3.0,0.021,1527.0,2024-11-18,hyderabad,desktop,learn data analytics,2024-11-18,18,11,0,47,False,0.0214,0.026784006122058543,1.5897857142857141,8.243333333333332,0.1111111111111111,0.0005739429883298259,0.19285714285714287,509.0,5.860762906052029,0.14575638506876226,0,0,0,4
A2514,data analytics course,111.0,5434.0,181.05,10.0,5.0,0.045,1627.0,23-11-2024,hyderabad,mobile,data analytics training,2024-11-23,23,11,5,47,False,0.045,0.02042694147957306,1.6310810810810812,18.105,0.5,0.0009201324990798675,0.09009009009009009,325.4,7.986467826567246,0.11127842655193608,0,0,1,3
A2515,data analytics course,105.0,3300.0,180.25,22.0,10.0,0.095,1640.0,2024-11-21,hyderabad,mobile,online data analytic,2024-11-21,21,11,3,47,False,0.0952,0.031818181818181815,1.7166666666666666,8.193181818181818,0.45454545454545453,0.0030303030303030303,0.20952380952380953,164.0,8.098474341192787,0.10990853658536585,0,0,1,5
A2516,data analytics course,181.0,4857.0,215.59,13.0,8.0,0.044,1883.0,2024-11-23,hyderabad,desktop,learn data analytics,2024-11-23,23,11,5,47,False,0.0442,0.03726580193535104,1.1911049723756906,16.583846153846153,0.6153846153846154,0.0016471072678608193,0.0718232044198895,235.375,7.7341713437543484,0.11449283058948487,0,0,0,4
A2517,data analytics course,189.0,4019.0,248.09,16.0,6.0,0.045,1378.0,2024/11/30,hyderabad,tablet,online data analytic,2024-11-30,30,11,5,48,True,0.0317,0.047026623538193583,1.3126455026455026,15.505625,0.375,0.001492908683752177,0.08465608465608465,229.66666666666666,4.554435890201137,0.18003628447024675,0,0,2,5
A2518,data analytics course,138.0,5495.0,220.69,19.0,5.0,0.036,1624.0,04-11-2024,hyderabad,tablet,online data analytic,2024-04-11,11,4,3,15,False,0.0362,0.02511373976342129,1.5992028985507247,11.615263157894736,0.2631578947368421,0.0009099181073703367,0.13768115942028986,324.8,6.35873850197109,0.13589285714285715,0,0,2,5
A2519,data analytics course,178.0,5218.0,208.92,20.0,7.0,0.039,1714.0,25-11-2024,hyderabad,mobile,analytics for data,2024-11-25,25,11,0,48,False,0.0393,0.03411268685320046,1.1737078651685393,10.446,0.35,0.0013415101571483327,0.11235955056179775,244.85714285714286,7.204097262109898,0.12189031505250875,0,0,1,0
A2520,data analytics course,155.0,5996.0,247.54,15.0,5.0,0.032,1883.0,2024/11/27,hyderabad,mobile,analytics for data,2024-11-27,27,11,2,48,False,0.0323,0.025850567044696463,1.597032258064516,16.502666666666666,0.3333333333333333,0.0008338892595063375,0.0967741935483871,376.6,6.6068514179526545,0.13146043547530536,0,0,1,0
A2521,data analytics course,168.0,4932.0,198.95,16.0,7.0,0.052,1301.0,19-11-2024,hyderabad,desktop,data analytics training,2024-11-19,19,11,1,47,True,0.0417,0.0340632603406326,1.1842261904761904,12.434375,0.4375,0.001419302514193025,0.09523809523809523,185.85714285714286,5.539331490324202,0.1529208301306687,0,0,0,3
A2522,data analytics course,152.0,4498.0,233.81,30.0,6.0,0.039,1090.0,25-11-2024,hyderabad,desktop,data analytics online,2024-11-25,25,11,0,48,False,0.0395,0.03379279679857715,1.5382236842105264,7.793666666666667,0.2,0.0013339261894175188,0.19736842105263158,181.66666666666666,3.661904965570335,0.2145045871559633,0,0,0,2
A2523,data analytics course,111.0,4164.0,191.04,18.0,9.0,0.047,1687.0,2024/11/21,hyderabad,tablet,data analytics training,2024-11-21,21,11,3,47,True,0.0811,0.026657060518731988,1.721081081081081,10.613333333333333,0.5,0.002161383285302594,0.16216216216216217,187.44444444444446,7.830611390284758,0.1132424422050978,0,0,2,3
A2524,data analytics course,141.0,4329.0,230.44,14.0,6.0,0.043,1610.0,07-11-2024,hyderabad,mobile,learn data analytics,2024-07-11,11,7,3,28,False,0.0426,0.03257103257103257,1.6343262411347517,16.46,0.42857142857142855,0.001386001386001386,0.09929078014184398,268.3333333333333,5.986634264884568,0.1431304347826087,0,0,1,4
A2525,data analytics course,97.0,5764.0,246.15,30.0,7.0,0.047,1345.0,18-11-2024,hyderabad,mobile,analytics for data,2024-11-18,18,11,0,47,True,0.0722,0.01682859125607217,2.5376288659793813,8.205,0.23333333333333334,0.0012144344205412907,0.30927835051546393,192.14285714285714,4.464147877310583,0.18301115241635688,0,0,1,0
A2526,data analytics course,82.0,5430.0,205.46,18.0,5.0,0.061,1435.0,2024-11-30,hyderabad,mobile,online data analytic,2024-11-30,30,11,5,48,False,0.061,0.015101289134438306,2.505609756097561,11.414444444444445,0.2777777777777778,0.0009208103130755065,0.21951219512195122,287.0,5.984327849703105,0.14317770034843205,0,0,1,5
A2527,data analytics course,164.0,5179.0,206.72,18.0,9.0,0.055,1213.0,2024-11-27,hyderabad,tablet,data analytics course,2024-11-27,27,11,2,48,False,0.0549,0.03166634485421896,1.2604878048780488,11.484444444444444,0.5,0.0017377872176095772,0.10975609756097561,134.77777777777777,4.867840557275541,0.1704204451772465,0,0,2,1
A2528,data analytics course,109.0,5707.0,246.86,22.0,4.0,0.034,1980.0,19-11-2024,hyderabad,tablet,data analytics online,2024-11-19,19,11,1,47,False,0.0367,0.019099351673383565,2.2647706422018348,11.22090909090909,0.18181818181818182,0.0007008936393902226,0.2018348623853211,495.0,7.020740500688649,0.12467676767676768,0,0,2,2
A2529,data analytics course,126.0,3263.0,237.54,20.0,9.0,0.047,1364.0,2024/11/17,hyderabad,mobile,data analytics online,2024-11-17,17,11,6,46,True,0.0714,0.03861477168250076,1.8852380952380952,11.876999999999999,0.45,0.0027581979773214833,0.15873015873015872,151.55555555555554,4.742190788919761,0.17414956011730204,0,0,1,2
A2530,data analytics course,175.0,5718.0,225.4,19.0,6.0,0.057,1001.0,12-11-2024,hyderabad,tablet,analytics for data,2024-12-11,11,12,2,50,True,0.0343,0.030605106680657572,1.288,11.863157894736842,0.3157894736842105,0.001049317943336831,0.10857142857142857,166.83333333333334,3.440993788819876,0.22517482517482518,0,0,2,0
A2531,data analytics course,96.0,5075.0,221.28,25.0,3.0,0.038,1937.0,23-11-2024,hyderabad,desktop,learn data analytics,2024-11-23,23,11,5,47,False,0.0312,0.018916256157635467,2.305,8.8512,0.12,0.0005911330049261083,0.2604166666666667,645.6666666666666,7.753615328994939,0.11423851316468767,0,0,0,4
A2532,data analytics course,113.0,4473.0,202.3,17.0,5.0,0.044,1049.0,2024/11/08,hyderabad,tablet,online data analytic,2024-11-08,8,11,4,45,False,0.0442,0.02526268723451822,1.7902654867256638,11.9,0.29411764705882354,0.0011178180192264698,0.1504424778761062,209.8,4.18536826495304,0.1928503336510963,0,0,2,5
A2533,data analytics course,96.0,3979.0,232.44,27.0,7.0,0.047,1140.0,30-11-2024,hyderabad,mobile,learn data analytics,2024-11-30,30,11,5,48,True,0.0729,0.02412666499120382,2.42125,8.608888888888888,0.25925925925925924,0.0017592359889419453,0.28125,162.85714285714286,3.9044914816726894,0.20389473684210527,0,0,1,4
A2534,data analytics course,162.0,5688.0,190.31,17.0,5.0,0.031,1556.0,25-11-2024,hyderabad,tablet,data analytics course,2024-11-25,25,11,0,48,False,0.0309,0.028481012658227847,1.174753086419753,11.194705882352942,0.29411764705882354,0.0008790436005625879,0.10493827160493827,311.2,7.176133676632863,0.12230719794344473,0,0,2,1
A2535,data analytics course,125.0,3546.0,234.02,23.0,10.0,0.047,1072.0,2024/11/27,hyderabad,desktop,analytics for data,2024-11-27,27,11,2,48,True,0.08,0.03525098702763677,1.87216,10.174782608695653,0.43478260869565216,0.0028200789622109417,0.184,107.2,3.5808050593966327,0.21830223880597016,0,0,0,0
A2536,data analytics course,89.0,4188.0,206.71,16.0,4.0,0.045,1382.0,2024/11/01,hyderabad,tablet,online data analytic,2024-11-01,1,11,4,44,False,0.0449,0.02125119388729704,2.3225842696629213,12.919375,0.25,0.0009551098376313276,0.1797752808988764,345.5,5.6856949349329975,0.14957308248914616,0,0,2,5
A2537,data analytics course,99.0,4134.0,234.04,18.0,3.0,0.03,1683.0,2024/11/30,hyderabad,desktop,learn data analytics,2024-11-30,30,11,5,48,False,0.0303,0.023947750362844702,2.364040404040404,13.002222222222223,0.16666666666666666,0.000725689404934688,0.18181818181818182,561.0,6.1910784481285255,0.13906120023767082,0,0,0,4
A2538,data analytics course,91.0,4710.0,199.18,21.0,9.0,0.099,1431.0,2024-11-10,hyderabad,tablet,data analytics course,2024-11-10,10,11,6,45,False,0.0989,0.019320594479830148,2.188791208791209,9.484761904761905,0.42857142857142855,0.001910828025477707,0.23076923076923078,159.0,6.18445627070991,0.13918937805730258,0,0,2,1
A2539,data analytics course,141.0,4654.0,192.19,21.0,6.0,0.043,1932.0,25-11-2024,hyderabad,mobile,analytics for data,2024-11-25,25,11,0,48,False,0.0426,0.030296519123334767,1.363049645390071,9.151904761904762,0.2857142857142857,0.001289213579716373,0.14893617021276595,322.0,9.052552161923098,0.09947722567287784,0,0,1,0
A2540,data analytics course,110.0,5509.0,245.38,13.0,8.0,0.048,1539.0,2024/11/10,hyderabad,mobile,learn data analytics,2024-11-10,10,11,6,45,True,0.0727,0.01996732619350154,2.2307272727272727,18.875384615384615,0.6153846153846154,0.0014521691777092032,0.11818181818181818,192.375,5.271904800717254,0.15944119558154646,0,0,1,4
A2541,data analytics course,96.0,3091.0,187.57,11.0,7.0,0.047,1737.0,10-11-2024,hyderabad,tablet,data analytics course,2024-10-11,11,10,4,41,True,0.04665,0.03105791006146878,1.9538541666666667,17.05181818181818,0.6363636363636364,0.002264639275315432,0.11458333333333333,248.14285714285714,8.260542730713867,0.10798503166378813,0,0,2,1
A2542,data analytics course,85.0,4653.0,196.73,23.0,6.0,0.071,1032.0,13-11-2024,hyderabad,mobile,data analytics course,2024-11-13,13,11,2,46,False,0.0706,0.018267784225231034,2.314470588235294,8.553478260869564,0.2608695652173913,0.0012894906511927789,0.27058823529411763,172.0,4.245768311899558,0.1906298449612403,0,0,1,1
A2543,data analytics course,151.0,5389.0,227.07,18.0,10.0,0.057,1318.0,2024-11-20,hyderabad,desktop,data analytics training,2024-11-20,20,11,2,47,False,0.0662,0.028020040823900538,1.503774834437086,12.615,0.5555555555555556,0.0018556318426424198,0.11920529801324503,131.8,4.804377504734223,0.17228376327769346,0,0,0,3
A2544,data analytics course,139.0,5290.0,208.43,28.0,4.0,0.051,1022.0,2024/11/20,hyderabad,tablet,data analytics online,2024-11-20,20,11,2,47,True,0.0288,0.026275992438563326,1.4994964028776978,7.443928571428572,0.14285714285714285,0.0007561436672967864,0.2014388489208633,255.5,3.9033248572662282,0.20394324853228962,0,0,2,2
A2545,data analytics course,120.0,3060.0,197.96,20.0,8.0,0.067,1679.0,2024-11-23,hyderabad,tablet,analytics for data,2024-11-23,23,11,5,47,False,0.0667,0.0392156862745098,1.6496666666666668,9.898,0.4,0.00261437908496732,0.16666666666666666,209.875,7.481511416447767,0.11790351399642644,0,0,2,0
A2546,data analytics course,109.0,4444.0,219.46,12.0,9.0,0.083,1159.0,2024/11/28,hyderabad,mobile,data analytics training,2024-11-28,28,11,3,48,False,0.0826,0.024527452745274528,2.013394495412844,18.288333333333334,0.75,0.0020252025202520253,0.11009174311926606,128.77777777777777,4.2811446277225915,0.18935289042277825,0,0,1,3
A2547,data analytics course,145.0,3509.0,181.11,19.0,10.0,0.048,1627.0,2024/11/22,hyderabad,mobile,online data analytic,2024-11-22,22,11,4,47,True,0.069,0.04132231404958678,1.2490344827586208,9.532105263157895,0.5263157894736842,0.002849814762040467,0.1310344827586207,162.7,7.9834906962619385,0.11131530424093425,0,0,1,5
A2548,data analytics course,151.0,4675.0,183.02,14.0,7.0,0.046,1000.0,2024-11-10,hyderabad,mobile,analytics for data,2024-11-10,10,11,6,45,False,0.0464,0.032299465240641714,1.2120529801324504,13.072857142857144,0.5,0.001497326203208556,0.09271523178807947,142.85714285714286,4.463883728554256,0.18302000000000002,0,0,1,0
A2549,data analytics course,108.0,5869.0,226.93,16.0,7.0,0.065,1633.0,03-11-2024,hyderabad,desktop,analytics for data,2024-03-11,11,3,0,11,False,0.0648,0.018401772022491054,2.1012037037037037,14.183125,0.4375,0.001192707445902198,0.14814814814814814,233.28571428571428,6.196051645881989,0.13896509491733008,0,0,0,0
A2550,data analytics course,166.0,3992.0,205.9,15.0,8.0,0.048,1899.0,2024/11/05,hyderabad,desktop,analytics for data,2024-11-05,5,11,1,45,False,0.0482,0.04158316633266533,1.2403614457831325,13.726666666666667,0.5333333333333333,0.002004008016032064,0.09036144578313253,237.375,8.222923749392908,0.10842548709847288,0,0,0,0
A2551,data analytics course,134.0,4172.0,191.8,26.0,5.0,0.037,1170.0,2024-11-18,hyderabad,tablet,online data analytic,2024-11-18,18,11,0,47,False,0.0373,0.03211888782358581,1.4313432835820896,7.376923076923077,0.19230769230769232,0.0011984659635666348,0.19402985074626866,234.0,5.100104275286757,0.16393162393162394,0,0,2,5
A2552,data analytics course,104.0,5926.0,224.63,17.0,8.0,0.047,1239.0,2024/11/24,hyderabad,mobile,learn data analytics,2024-11-24,24,11,6,47,True,0.0769,0.017549780627742154,2.159903846153846,13.213529411764705,0.47058823529411764,0.0013499831252109348,0.16346153846153846,154.875,4.515736989716423,0.18129943502824858,0,0,1,4
A2553,data analytics course,139.0,5785.0,195.39,15.0,10.0,0.047,1296.0,2024/11/25,hyderabad,tablet,analytics for data,2024-11-25,25,11,0,48,True,0.04665,0.024027657735522904,1.40568345323741,13.026,0.6666666666666666,0.001728608470181504,0.1079136690647482,129.6,5.63288807001382,0.1507638888888889,0,0,2,0
A2554,data analytics course,160.0,5664.0,210.58,16.0,9.0,0.047,1836.0,2024-11-07,hyderabad,mobile,data analytics training,2024-11-07,7,11,3,45,True,0.0563,0.02824858757062147,1.316125,13.16125,0.5625,0.0015889830508474577,0.1,204.0,7.718776711938456,0.11469498910675383,0,0,1,3
A2555,data analytics course,147.0,5930.0,248.18,22.0,10.0,0.068,1743.0,15-11-2024,hyderabad,desktop,analytics for data,2024-11-15,15,11,4,46,False,0.068,0.02478920741989882,1.6882993197278913,11.280909090909091,0.45454545454545453,0.0016863406408094434,0.14965986394557823,174.3,6.023128374566846,0.14238668961560527,0,0,0,0
A2556,data analytics course,196.0,3656.0,240.44,15.0,6.0,0.052,1894.0,03-11-2024,hyderabad,tablet,analytics for data,2024-03-11,11,3,0,11,True,0.0306,0.053610503282275714,1.226734693877551,16.029333333333334,0.4,0.0016411378555798686,0.07653061224489796,315.6666666666667,6.877225087339877,0.12694825765575501,0,0,2,0
A2557,data analytics course,159.0,5078.0,182.57,30.0,8.0,0.05,1541.0,2024-11-09,hyderabad,mobile,data analytics course,2024-11-09,9,11,5,45,False,0.0503,0.03131153997636865,1.1482389937106918,6.085666666666667,0.26666666666666666,0.0015754233950374162,0.18867924528301888,192.625,7.440598126745907,0.11847501622323166,0,0,1,1
A2558,data analytics course,104.0,5257.0,220.44,17.0,7.0,0.052,1462.0,2024-11-27,hyderabad,mobile,data analytics online,2024-11-27,27,11,2,48,True,0.0673,0.019783146281148946,2.1196153846153845,12.967058823529412,0.4117647058823529,0.0013315579227696406,0.16346153846153846,208.85714285714286,5.632190165124297,0.1507797537619699,0,0,1,2
